id,tweet,link,date,time
1058134614898810881,amanhã,https://twitter.com/99mersao/status/1058134614898810881,2018-11-01,20:12:06
1057711948689743875,chorar p q? hj o mundo deu voltas,https://twitter.com/99mersao/status/1057711948689743875,2018-10-31,16:12:34
1054066642823667714,"fé no primeiramente, no adl, no djonga e em toda a nova escola que tão fazendo acontecer",https://twitter.com/99mersao/status/1054066642823667714,2018-10-21,14:47:25
1053435746382725121,daqui p frente as coisas vai se revolucionando eu vou lançar um foguetão e vou passar cortano,https://twitter.com/99mersao/status/1053435746382725121,2018-10-19,21:00:28
1051951885282930688,se ver notas já abre o sorriso... nois eh pai das folha,https://twitter.com/99mersao/status/1051951885282930688,2018-10-15,18:44:08
1051924965627441157,hidratar essência é 1 dessas coisas,https://twitter.com/99mersao/status/1051924965627441157,2018-10-15,16:57:10
1051924897692340224,tipo eu,https://twitter.com/99mersao/status/1051924897692340224,2018-10-15,16:56:54
1051118203995344896,"me solta 1 tabaco, a chave da nave e eu sumo no mundo ahhh vocè não precisa disso tudo",https://twitter.com/99mersao/status/1051118203995344896,2018-10-13,11:31:23
1041527147507212288,mas eu queria memo é o bolso na presidência p ver a merda acontecer,https://twitter.com/99mersao/status/1041527147507212288,2018-09-17,00:19:57
1039181517543690240,pedrin me explanou um bagui e eu agora to triste,https://twitter.com/99mersao/status/1039181517543690240,2018-09-10,12:59:15
1033122029824876545,mc hariel é de outro mundo de fato,https://twitter.com/99mersao/status/1033122029824876545,2018-08-24,19:41:01
1026219859510743041,Eu tô no cu do mundo SOS,https://twitter.com/99mersao/status/1026219859510743041,2018-08-05,18:34:15
1016476534067159040,triste pós não-hexa,https://twitter.com/99mersao/status/1016476534067159040,2018-07-09,21:17:45
1014660121476108289,levanta a cabeça coroa se nao o princeso cai,https://twitter.com/99mersao/status/1014660121476108289,2018-07-04,20:59:59
1012551735079067648,encerro o dia triste,https://twitter.com/99mersao/status/1012551735079067648,2018-06-29,01:22:00
1008355918428475392,"-na hora do gol comemorar da seguinte forma: ""gol mano, raffa moreira bro yeah yeah yeah""  https://twitter.com/xlucvvs/status/1008354455157428231 …",https://twitter.com/99mersao/status/1008355918428475392,2018-06-17,11:29:19
1005978181134946311,isso é estar sofrendo por amor?,https://twitter.com/99mersao/status/1005978181134946311,2018-06-10,22:01:03
768143252797132800,"N esconde as coisas de mim, na moral",https://twitter.com/99mersao/status/768143252797132800,2016-08-23,14:49:57
768124214423552001,o teu sorriso é o paraiso,https://twitter.com/99mersao/status/768124214423552001,2016-08-23,13:34:18
768118287314063364,"erga sua cabeça, mete o pé e vai na fé",https://twitter.com/99mersao/status/768118287314063364,2016-08-23,13:10:45
768110531559522304,@jheinnycardoso acabei de lembrar d vc,https://twitter.com/99mersao/status/768110531559522304,2016-08-23,12:39:56
767741393943011330,"varias ideia errada cerca nois, tem q ser forte p manter a conduta",https://twitter.com/99mersao/status/767741393943011330,2016-08-22,12:13:06
767371011155234816,"mente blindada, coração gelado... o foco é no cash",https://twitter.com/99mersao/status/767371011155234816,2016-08-21,11:41:20
767366684403494917,foda essas coisas né mano,https://twitter.com/99mersao/status/767366684403494917,2016-08-21,11:24:09
767059853760204802,acho que se tinha que chegar em mim e falar td q se tem p falar,https://twitter.com/99mersao/status/767059853760204802,2016-08-20,15:04:55
767054999469821952,to ouvindo sorriso maroto mano,https://twitter.com/99mersao/status/767054999469821952,2016-08-20,14:45:37
767043487242002432,"Só de lembrar daquela cena, que vontade de me jogar desse mundo",https://twitter.com/99mersao/status/767043487242002432,2016-08-20,13:59:52
766946287673630721,"n quero te ver chorar, quero te ver feliz",https://twitter.com/99mersao/status/766946287673630721,2016-08-20,07:33:38
766825758710988800,"vou dormir, tem nd p fazer acordado",https://twitter.com/99mersao/status/766825758710988800,2016-08-19,23:34:42
766399856915120128,Fiz de td p isso n acontecer,https://twitter.com/99mersao/status/766399856915120128,2016-08-18,19:22:19
766398842858332160,C vai deixar eu me tornar um estranho na sua vida memo?,https://twitter.com/99mersao/status/766398842858332160,2016-08-18,19:18:17
766395848179802113,Amanhã eu vou fazer td que eu tenho que fazer e 20h eu vou trombar a Gabi p nois se ver,https://twitter.com/99mersao/status/766395848179802113,2016-08-18,19:06:23
766391964317220864,"Eu sei como c é, se deixa tudo p em cima da hora",https://twitter.com/99mersao/status/766391964317220864,2016-08-18,18:50:57
766328641651372032,tô sentindo que as coisas vai começar a fluir pra mim,https://twitter.com/99mersao/status/766328641651372032,2016-08-18,14:39:20
766325352562040832,"ela tava mó triste, fiz ela rir um monte",https://twitter.com/99mersao/status/766325352562040832,2016-08-18,14:26:16
766098882535260160,p me animar eh só lembrar que k mundao roda e logo menos to na melhora,https://twitter.com/99mersao/status/766098882535260160,2016-08-17,23:26:21
766094697286799360,"nem vou p aula amanha, ideia quente",https://twitter.com/99mersao/status/766094697286799360,2016-08-17,23:09:43
765934741237428224,"eu smp faço isso, n era p acontecer ue",https://twitter.com/99mersao/status/765934741237428224,2016-08-17,12:34:07
765716762973339648,"ai kelve, cuidado q sua mina descubriu seus role errado",https://twitter.com/99mersao/status/765716762973339648,2016-08-16,22:07:57
765713034983706624,amanhã respondo 🙄,https://twitter.com/99mersao/status/765713034983706624,2016-08-16,21:53:08
765701020454383616,tô mt feliz,https://twitter.com/99mersao/status/765701020454383616,2016-08-16,21:05:23
765677202428026881,"me amarro em ver geral sorrir, ideia",https://twitter.com/99mersao/status/765677202428026881,2016-08-16,19:30:45
765591170932244480,"eu entro com todo o meu amor, vc entra com toda a sua beleza",https://twitter.com/99mersao/status/765591170932244480,2016-08-16,13:48:53
765591063469953026,"juro eu te faço feliz, eu te faço mulher, eu te faço princesa",https://twitter.com/99mersao/status/765591063469953026,2016-08-16,13:48:28
765351060366061568,fiquei sabendo que vai chover na hora de ir p aula,https://twitter.com/99mersao/status/765351060366061568,2016-08-15,21:54:46
765211233234587648,nossa mano que forte,https://twitter.com/99mersao/status/765211233234587648,2016-08-15,12:39:09
764820436769181697,"erga essa cabeça, mete o pé e vai na fé... manda essa tristeza embora",https://twitter.com/99mersao/status/764820436769181697,2016-08-14,10:46:16
764818499550281728,"se vc pd me ligar mais tarde? dx cmg, eu vou te ligar",https://twitter.com/99mersao/status/764818499550281728,2016-08-14,10:38:34
764814010806071296,"Sem cao, que dor de cabeça ein fio",https://twitter.com/99mersao/status/764814010806071296,2016-08-14,10:20:44
764583228971814912,aconteceno uns bagui q nem era p acontecer ta ligado,https://twitter.com/99mersao/status/764583228971814912,2016-08-13,19:03:41
764459992992866304,oq falar desses pivete n eh msm,https://twitter.com/99mersao/status/764459992992866304,2016-08-13,10:53:59
764116778872176640,sabe duma parada?,https://twitter.com/99mersao/status/764116778872176640,2016-08-12,12:10:11
764039342650232832,eu vou p aula pq preciso copiar algumas coisas em sociologia,https://twitter.com/99mersao/status/764039342650232832,2016-08-12,07:02:29
763757302553903104,e aquele sentimento de: sou demais p vc,https://twitter.com/99mersao/status/763757302553903104,2016-08-11,12:21:45
762147277599338496,e amanhã eu vou colar na missa agradecer essas bençao ai certo,https://twitter.com/99mersao/status/762147277599338496,2016-08-07,01:44:05
758190015197372416,insonia essas hora é pa acabar c minhas esperanças de acordar cedo amanhã,https://twitter.com/99mersao/status/758190015197372416,2016-07-27,03:39:20
758189605011255297,EU NAO TO FELIZ NAO CHAPA,https://twitter.com/99mersao/status/758189605011255297,2016-07-27,03:37:42
1143972636504010752,de uns sinto orgulho  de outros  sinto muito,https://twitter.com/99mersao/status/1143972636504010752,2019-06-26,17:01:45
1125538253145243648,todo mundo sabe o certo e o errado  vacila qm qr,https://twitter.com/99mersao/status/1125538253145243648,2019-05-06,20:10:05
1115402837062758400,ae na moral ....  sem tempo irmão  to agilizando os corre p n deixar ngm na necessidade,https://twitter.com/99mersao/status/1115402837062758400,2019-04-08,20:55:34
1107802742867873799,tentando dar meu melhor na minja pior fase....,https://twitter.com/99mersao/status/1107802742867873799,2019-03-18,21:35:30
1107340382990409728,Que não te falte tesão em viver  já que o pior broxa  eh aquele q n quer fude,https://twitter.com/99mersao/status/1107340382990409728,2019-03-17,14:58:15
1107328180040421377,"Pessoas que sabem oq quer da vida é outra coisa, hoje em dia é difícil encontrar isso",https://twitter.com/99mersao/status/1107328180040421377,2019-03-17,14:09:45
1106929903453302784,Eu tô distante 600km da minha coroa  Mas eu vou voltar um dia pra deixar ela 600km longe do aluguel,https://twitter.com/99mersao/status/1106929903453302784,2019-03-16,11:47:09
1098374697866219526,bebi 1 breja to mei chapado ja desculpa os erro de ortografia,https://twitter.com/99mersao/status/1098374697866219526,2019-02-20,21:11:49
1097967191931187202,Tem que deixar o Gustavo Silva jogar mais,https://twitter.com/99mersao/status/1097967191931187202,2019-02-19,18:12:32
1097949381616193537,"Mano, hoje é o pior dia da minha vida mentalmente falando, fisicamente também",https://twitter.com/99mersao/status/1097949381616193537,2019-02-19,17:01:46
1095109352942432256,a ponto de explodir mas... tenho que dar o meu melhor na minha pior fase,https://twitter.com/99mersao/status/1095109352942432256,2019-02-11,21:56:30
1094740227418144769,sinto saudade da minha casa,https://twitter.com/99mersao/status/1094740227418144769,2019-02-10,21:29:44
1094740172305059846,fabricar dinheiro é difícil mano,https://twitter.com/99mersao/status/1094740172305059846,2019-02-10,21:29:31
1082286199790858241,indo ficar sozinho dnv,https://twitter.com/99mersao/status/1082286199790858241,2019-01-07,12:41:52
1082272012607856641,deixo londrina com muita dor no coração  dnv,https://twitter.com/99mersao/status/1082272012607856641,2019-01-07,11:45:30
1075167319360462848,nego o tempo passa e eu me sinto fracoooooo,https://twitter.com/99mersao/status/1075167319360462848,2018-12-18,21:13:59
1071872305796706305,Domingo é dia do meu coração apertar  eu sinto falta da presença da minha mãe,https://twitter.com/99mersao/status/1071872305796706305,2018-12-09,19:00:46
1066822459863764992,pia foi mal,https://twitter.com/99mersao/status/1066822459863764992,2018-11-25,20:34:29
1064524396595998720,quando o mundo me machucar tu ainda vai querer curar minha dor?,https://twitter.com/99mersao/status/1064524396595998720,2018-11-19,12:22:48
1064468120641961984,"toda negativa referente aos sonhos que sonhei, busquei sozinho e ela não me acompanhou",https://twitter.com/99mersao/status/1064468120641961984,2018-11-19,08:39:11
1061592965867552768,"nego o tempo passa e eu me sinto fraco, me sinto um pouco só",https://twitter.com/99mersao/status/1061592965867552768,2018-11-11,10:14:21
1054066642823667714,"fé no primeiramente, no adl, no djonga e em toda a nova escola que tão fazendo acontecer",https://twitter.com/99mersao/status/1054066642823667714,2018-10-21,14:47:25
1046937565947924480,era uma bagunça,https://twitter.com/99mersao/status/1046937565947924480,2018-10-01,22:39:01
1037385170612101121,"não curto esses assuntos, mal me envolvo mas a bruna marquezine deu aula, tá loco",https://twitter.com/99mersao/status/1037385170612101121,2018-09-05,14:01:13
1019386719559475207,sozinho qs sempre sou escravo da minha mente,https://twitter.com/99mersao/status/1019386719559475207,2018-07-17,22:01:47
767371011155234816,"mente blindada, coração gelado... o foco é no cash",https://twitter.com/99mersao/status/767371011155234816,2016-08-21,11:41:20
767055825881923584,"se for alguma coisa comigo, vamos conversar? eu n qr correr o perigo de um dia se me deixar",https://twitter.com/99mersao/status/767055825881923584,2016-08-20,14:48:54
766398842858332160,C vai deixar eu me tornar um estranho na sua vida memo?,https://twitter.com/99mersao/status/766398842858332160,2016-08-18,19:18:17
766374805906087936,Aquela sensaçao de: tenho mais nada p fazer,https://twitter.com/99mersao/status/766374805906087936,2016-08-18,17:42:46
765979069146079232,Vou deixar meu cabelo crescer p ver que merda vai dar,https://twitter.com/99mersao/status/765979069146079232,2016-08-17,15:30:15
765716762973339648,"ai kelve, cuidado q sua mina descubriu seus role errado",https://twitter.com/99mersao/status/765716762973339648,2016-08-16,22:07:57
765711254740733952,me sinto importante,https://twitter.com/99mersao/status/765711254740733952,2016-08-16,21:46:04
765688406441496577,"kkkkkkkk, o vizin pediu a senha do wifi e eu falei 10reais, mal sabe ele que eh a senha mesmo rsrsrs",https://twitter.com/99mersao/status/765688406441496577,2016-08-16,20:15:16
765214430858797056,"se eu exagerei, foi mal",https://twitter.com/99mersao/status/765214430858797056,2016-08-15,12:51:51
765162936692342784,o foco é no cash,https://twitter.com/99mersao/status/765162936692342784,2016-08-15,09:27:14
764814010806071296,"Sem cao, que dor de cabeça ein fio",https://twitter.com/99mersao/status/764814010806071296,2016-08-14,10:20:44
764685766165405697,tenho a meta de deixar os falador no veneno,https://twitter.com/99mersao/status/764685766165405697,2016-08-14,01:51:08
764685173921316864,eu queria deixar claro que,https://twitter.com/99mersao/status/764685173921316864,2016-08-14,01:48:47
764471194481483781,fiquei sabendo de uns role errado aí oh,https://twitter.com/99mersao/status/764471194481483781,2016-08-13,11:38:30
764257196532170753,meta da minha vida: deixar a minha coroa a pampa,https://twitter.com/99mersao/status/764257196532170753,2016-08-12,21:28:09
764200635793375232,só de pensar em perder eu ganho vontade p te encontrar,https://twitter.com/99mersao/status/764200635793375232,2016-08-12,17:43:24
