id,tweet,link,date,time
1143611760785678343,"hj em dia olho p minha correria, vejo td acontecendo",https://twitter.com/99mersao/status/1143611760785678343,2019-06-25,17:07:45
1143195167098380288,bom dia,https://twitter.com/99mersao/status/1143195167098380288,2019-06-24,13:32:22
1141804927423004679,"mano, entrei no ask  depois de sei la quanto tempo  na moral kkkkkkkkkkkk",https://twitter.com/99mersao/status/1141804927423004679,2019-06-20,17:28:03
1141368425362722817,tive um sonho mt do louco mano...  voltei em 2k14 e também em 2k15....  qq ta com te se no,https://twitter.com/99mersao/status/1141368425362722817,2019-06-19,12:33:32
1126818320731316225,bom dia...  pesadelo de quem não dorme há dias,https://twitter.com/99mersao/status/1126818320731316225,2019-05-10,08:56:37
1121192775179960320,"fui diagnosticado com depressão  é meus amigos, estou sentindo na pele aquilo que eu achava que era frescura",https://twitter.com/99mersao/status/1121192775179960320,2019-04-24,20:22:43
1119424405887705088,"eu odeio vender algo q é tão meu, mas se alguém vai ganhar dinheiro c essa porra... entao q seja eu",https://twitter.com/99mersao/status/1119424405887705088,2019-04-19,23:15:50
1115586122401374208,imagina q louco  ...  o andré luis eh escalado pelo pep carille,https://twitter.com/99mersao/status/1115586122401374208,2019-04-09,09:03:52
1115402984500924416,correno p caralho p tornar o sorriso permanente no rosto da pessoa  ...  e oq nois recebe?  nois recebe af falo eh nada,https://twitter.com/99mersao/status/1115402984500924416,2019-04-08,20:56:09
1115402837062758400,ae na moral ....  sem tempo irmão  to agilizando os corre p n deixar ngm na necessidade,https://twitter.com/99mersao/status/1115402837062758400,2019-04-08,20:55:34
1115294163090669568,vou terminar o dia ouvindo cinza chumbo do @Dalsiin_   p combinar c clima  fé aos demais,https://twitter.com/99mersao/status/1115294163090669568,2019-04-08,13:43:44
1114189717015285760,Rap te confundiram com um banheiro fizeram umas merda Não preocupa não que o pai veio limpar Ouviram: Fogo nos racista E não entenderam  a quem me referia  quando eu xingo militar,https://twitter.com/99mersao/status/1114189717015285760,2019-04-05,12:35:03
1113430326355873792,qualquer dia  Deus vai me abençoar  e eu vou ter condições  de ir ver o @Corinthians jogar,https://twitter.com/99mersao/status/1113430326355873792,2019-04-03,10:17:30
1113430075389677568,sérin moco  ..  semana merda,https://twitter.com/99mersao/status/1113430075389677568,2019-04-03,10:16:31
1113158240664215553,é fácil querer se pagar e crescer p cima d qm n sabe d qlq eh da sua  na mmoral  volta p dentro d casa,https://twitter.com/99mersao/status/1113158240664215553,2019-04-02,16:16:20
1111689798081748999,po to numa brisa alucinante  e nem usei droga,https://twitter.com/99mersao/status/1111689798081748999,2019-03-29,15:01:16
1108107784778928129,trabalhe até seu vizinho falar: caralho n foi despejado ainda pq? será se ta em dia o aluguel dele,https://twitter.com/99mersao/status/1108107784778928129,2019-03-19,17:47:38
1107328180040421377,"Pessoas que sabem oq quer da vida é outra coisa, hoje em dia é difícil encontrar isso",https://twitter.com/99mersao/status/1107328180040421377,2019-03-17,14:09:45
1107009118844448768,"Certas coisas eu abri mão por pessoas, n me arrependo  mas to ligado  que não vou ter nd em troca, nem o mesmo",https://twitter.com/99mersao/status/1107009118844448768,2019-03-16,17:01:55
1106929903453302784,Eu tô distante 600km da minha coroa  Mas eu vou voltar um dia pra deixar ela 600km longe do aluguel,https://twitter.com/99mersao/status/1106929903453302784,2019-03-16,11:47:09
1106571904385728512,sem tempo irmão,https://twitter.com/99mersao/status/1106571904385728512,2019-03-15,12:04:35
1106329925215232002,Que merda fez o STF?  PORRAAAAAAAA DE PAÍS,https://twitter.com/99mersao/status/1106329925215232002,2019-03-14,20:03:03
1106018944610193409,por algum momento eu vi o fenômeno ali,https://twitter.com/99mersao/status/1106018944610193409,2019-03-13,23:27:19
1103611776544006144,bom dia!,https://twitter.com/99mersao/status/1103611776544006144,2019-03-07,08:02:06
1098412717831012352,esse time é foda,https://twitter.com/99mersao/status/1098412717831012352,2019-02-20,23:42:54
1098374237423878144,puta merda eu odeio mega funk,https://twitter.com/99mersao/status/1098374237423878144,2019-02-20,21:09:59
1097956843970854914,"Uma palavra amiga, uma notícia boa... isso faz falta no dia a dia",https://twitter.com/99mersao/status/1097956843970854914,2019-02-19,17:31:25
1097949381616193537,"Mano, hoje é o pior dia da minha vida mentalmente falando, fisicamente também",https://twitter.com/99mersao/status/1097949381616193537,2019-02-19,17:01:46
1097949230319185921,"Mano, vida eterna pra minha mãe e só!!!",https://twitter.com/99mersao/status/1097949230319185921,2019-02-19,17:01:10
1096733709263360002,"se você nao recebe o que eh justo, n fica mendigando n vida é bela e tá ai p ser vivida pula p proxima",https://twitter.com/99mersao/status/1096733709263360002,2019-02-16,09:31:07
1096409471499358209,"meu Deus n tem como  eu amo esse time   @Corinthians minha história, minha vida, meu amor",https://twitter.com/99mersao/status/1096409471499358209,2019-02-15,12:02:42
1095732328704430080,seloco q ano d merda,https://twitter.com/99mersao/status/1095732328704430080,2019-02-13,15:11:59
1095491472525324288,Algumas pessoas da antiga (realmente antiga) vieram me chamar no messenger,https://twitter.com/99mersao/status/1095491472525324288,2019-02-12,23:14:54
1095283090921017344,bom dia ao som de @djongadorge,https://twitter.com/99mersao/status/1095283090921017344,2019-02-12,09:26:52
1088899437160812544,"hj é dia d operação, qro atividade dobrada  avisa geral p diminuir as cota, a quebrada tá moiada",https://twitter.com/99mersao/status/1088899437160812544,2019-01-25,18:40:31
1083463782184161280,tenho que aceitar que estou me doando muito pra algumas pessoas que no máximo são mínimas...,https://twitter.com/99mersao/status/1083463782184161280,2019-01-10,18:41:10
1083171124584812544,sempre fui cercado de pessoas  agora n tem 1 filha da puta p estender a mão,https://twitter.com/99mersao/status/1083171124584812544,2019-01-09,23:18:15
1083037935082049536,Perdi a única pessoa que olhava minha mãe pra mim  eu perdi mais que um irmao,https://twitter.com/99mersao/status/1083037935082049536,2019-01-09,14:29:00
1075314856583143424,"bom dia, tô no corre",https://twitter.com/99mersao/status/1075314856583143424,2018-12-19,07:00:14
1075167319360462848,nego o tempo passa e eu me sinto fracoooooo,https://twitter.com/99mersao/status/1075167319360462848,2018-12-18,21:13:59
1073975671968411650,e dia de eu trabalhar também  me fodi né pia  bahguá puta que lasqueira  https://twitter.com/99mersao/status/1071872305796706305 …,https://twitter.com/99mersao/status/1073975671968411650,2018-12-15,14:18:48
1073175132984786945,"bem calmo, porém, atento  bom dia",https://twitter.com/99mersao/status/1073175132984786945,2018-12-13,09:17:44
1071872305796706305,Domingo é dia do meu coração apertar  eu sinto falta da presença da minha mãe,https://twitter.com/99mersao/status/1071872305796706305,2018-12-09,19:00:46
1068868328092041217,tem umas pessoas que a missão delas na terra é chapar meu global,https://twitter.com/99mersao/status/1068868328092041217,2018-12-01,12:04:02
1068170405674917888,ó Deus agindo na minha vida,https://twitter.com/99mersao/status/1068170405674917888,2018-11-29,13:50:45
1067732272068075521,"bom dia, hj eu vou piar no culto",https://twitter.com/99mersao/status/1067732272068075521,2018-11-28,08:49:45
1067213484839055360,eu preciso guardar grana pro futuro e cumprir as parada que eu juro,https://twitter.com/99mersao/status/1067213484839055360,2018-11-26,22:28:17
1066704921490268160,hj o dia será mecmelt,https://twitter.com/99mersao/status/1066704921490268160,2018-11-25,12:47:26
1066197864232169472,"3 rolê numa noite, não fode",https://twitter.com/99mersao/status/1066197864232169472,2018-11-24,03:12:34
1062807274379452428,coé nmrl vou piar p londrina dia 23 mt fe,https://twitter.com/99mersao/status/1062807274379452428,2018-11-14,18:39:34
1062481303977816065,"Deus é mt bom na mh vida, tá loco",https://twitter.com/99mersao/status/1062481303977816065,2018-11-13,21:04:17
1062454124002926592,"fuzil na mão, droga na mesa... atmosfera foda",https://twitter.com/99mersao/status/1062454124002926592,2018-11-13,19:16:17
1062374790294654977,"Na minha vida aprendi várias paradas, prego que se destaca sempre leva martelada, infelizmente vc vale o que tem, e na busca pelas de cem eu sigo a minha caminhada",https://twitter.com/99mersao/status/1062374790294654977,2018-11-13,14:01:02
1062287213067677697,"bom dia, devagar e sempre!!! só b o a",https://twitter.com/99mersao/status/1062287213067677697,2018-11-13,08:13:02
1062056763170717696,é musica coisa linda da minha vida,https://twitter.com/99mersao/status/1062056763170717696,2018-11-12,16:57:19
1061751405210468353,hoje foi o melhor dia de uns tempos p cá,https://twitter.com/99mersao/status/1061751405210468353,2018-11-11,20:43:56
1061592965867552768,"nego o tempo passa e eu me sinto fraco, me sinto um pouco só",https://twitter.com/99mersao/status/1061592965867552768,2018-11-11,10:14:21
1055076363751866368,"dia 2 tô em londrina, saudade da coroa, saudade da quebrada",https://twitter.com/99mersao/status/1055076363751866368,2018-10-24,09:39:42
1052754408134639616,"Brigar pra não cair que estaremos no lucro, fodase a liberta",https://twitter.com/99mersao/status/1052754408134639616,2018-10-17,23:53:04
1051096256704118784,bom dia que dia,https://twitter.com/99mersao/status/1051096256704118784,2018-10-13,10:04:10
1047434690322255874,bom dia,https://twitter.com/99mersao/status/1047434690322255874,2018-10-03,07:34:25
1044674098125770752,nessa cidade só tem gente merda,https://twitter.com/99mersao/status/1044674098125770752,2018-09-25,16:44:48
1041826408702664710,meu sonho kk,https://twitter.com/99mersao/status/1041826408702664710,2018-09-17,20:09:06
1041527147507212288,mas eu queria memo é o bolso na presidência p ver a merda acontecer,https://twitter.com/99mersao/status/1041527147507212288,2018-09-17,00:19:57
1038401031682641920,"meu pai é a pessoa mais fria sentimentalmente falando que eu conheço, sério",https://twitter.com/99mersao/status/1038401031682641920,2018-09-08,09:17:53
1036626136384643072,bom dia no geral,https://twitter.com/99mersao/status/1036626136384643072,2018-09-03,11:45:05
1033131926901665793,eu só espero honestidade das pessoas e elas só fodem comigo,https://twitter.com/99mersao/status/1033131926901665793,2018-08-24,20:20:20
1027739699048329216,puta merda vai tomar no cu eu odeio terra branca,https://twitter.com/99mersao/status/1027739699048329216,2018-08-09,23:13:33
1024112574269476864,Vai ser ruim se adaptar aqui,https://twitter.com/99mersao/status/1024112574269476864,2018-07-30,23:00:39
1019386719559475207,sozinho qs sempre sou escravo da minha mente,https://twitter.com/99mersao/status/1019386719559475207,2018-07-17,22:01:47
1019382688728350720,estou no pc fazendo merda como sempre,https://twitter.com/99mersao/status/1019382688728350720,2018-07-17,21:45:46
1019377218487750657,bom dia,https://twitter.com/99mersao/status/1019377218487750657,2018-07-17,21:24:02
1014980369425330176,droga viu,https://twitter.com/99mersao/status/1014980369425330176,2018-07-05,18:12:32
1012551862472642560,ruim vê quem tu ama sofrendo,https://twitter.com/99mersao/status/1012551862472642560,2018-06-29,01:22:30
1012551735079067648,encerro o dia triste,https://twitter.com/99mersao/status/1012551735079067648,2018-06-29,01:22:00
1009916475304538112,fico indignado c essas pessoas,https://twitter.com/99mersao/status/1009916475304538112,2018-06-21,18:50:25
1009886278781997056,7x2 meus amigos,https://twitter.com/99mersao/status/1009886278781997056,2018-06-21,16:50:26
1008442021411946503,por um momento achei que o jogo tava acontecendo no rio de janeiro,https://twitter.com/99mersao/status/1008442021411946503,2018-06-17,17:11:28
1008355506333933569,td dia um 7x1 diferente,https://twitter.com/99mersao/status/1008355506333933569,2018-06-17,11:27:41
1005234606860324865,ó o frio merda,https://twitter.com/99mersao/status/1005234606860324865,2018-06-08,20:46:21
768105602853826561,me deu sono 💤,https://twitter.com/99mersao/status/768105602853826561,2016-08-23,12:20:21
767885950378733568,mente blindouuuuu,https://twitter.com/99mersao/status/767885950378733568,2016-08-22,21:47:31
767875656201936896,tô dizendo q as mina d hj em dia tao td loca,https://twitter.com/99mersao/status/767875656201936896,2016-08-22,21:06:37
767848442223886336,"Nego vive de buxixo, n deixa a vida de ngm suave",https://twitter.com/99mersao/status/767848442223886336,2016-08-22,19:18:29
767741804582232064,"Hj eu não to afim que o dia passe, que o mês passe... que 2017 chegue",https://twitter.com/99mersao/status/767741804582232064,2016-08-22,12:14:44
767660264833556480,Bom dia,https://twitter.com/99mersao/status/767660264833556480,2016-08-22,06:50:44
767400024301002753,"Nunca precisei fazer a mente de ninguém p conqusitar alguma fita, sempre fui eu mermo",https://twitter.com/99mersao/status/767400024301002753,2016-08-21,13:36:38
767371011155234816,"mente blindada, coração gelado... o foco é no cash",https://twitter.com/99mersao/status/767371011155234816,2016-08-21,11:41:20
767366684403494917,foda essas coisas né mano,https://twitter.com/99mersao/status/767366684403494917,2016-08-21,11:24:09
767333415725203456,Será q o tempo vai resolver td?,https://twitter.com/99mersao/status/767333415725203456,2016-08-21,09:11:57
767055825881923584,"se for alguma coisa comigo, vamos conversar? eu n qr correr o perigo de um dia se me deixar",https://twitter.com/99mersao/status/767055825881923584,2016-08-20,14:48:54
766824725855268864,"Nossa mano, que merda chapa",https://twitter.com/99mersao/status/766824725855268864,2016-08-19,23:30:36
766821497352617984,Que chuva ein amigos,https://twitter.com/99mersao/status/766821497352617984,2016-08-19,23:17:46
766718194283347968,"o tempo podia colaborar ne, to cheio d compromisso",https://twitter.com/99mersao/status/766718194283347968,2016-08-19,16:27:17
766651739932065793,só faço merda,https://twitter.com/99mersao/status/766651739932065793,2016-08-19,12:03:13
766575702548291584,"salve geral, bom dia rapa",https://twitter.com/99mersao/status/766575702548291584,2016-08-19,07:01:04
766398842858332160,C vai deixar eu me tornar um estranho na sua vida memo?,https://twitter.com/99mersao/status/766398842858332160,2016-08-18,19:18:17
766358205991624708,Um dia de cada vez.,https://twitter.com/99mersao/status/766358205991624708,2016-08-18,16:36:49
766354222245969922,CADE A ESSENCIA DAS PESSOAS,https://twitter.com/99mersao/status/766354222245969922,2016-08-18,16:20:59
766296626545786880,essa musica tá foda,https://twitter.com/99mersao/status/766296626545786880,2016-08-18,12:32:07
766289087485603841,que merda de cheiro mano,https://twitter.com/99mersao/status/766289087485603841,2016-08-18,12:02:10
765979120245309441,foda que eu n tenho paciencia,https://twitter.com/99mersao/status/765979120245309441,2016-08-17,15:30:28
765979069146079232,Vou deixar meu cabelo crescer p ver que merda vai dar,https://twitter.com/99mersao/status/765979069146079232,2016-08-17,15:30:15
765848708508508160,bom dia rapa,https://twitter.com/99mersao/status/765848708508508160,2016-08-17,06:52:15
765711184054067200,"""é quente pia, vc mudou a mh vida""",https://twitter.com/99mersao/status/765711184054067200,2016-08-16,21:45:47
765676949259841536,"qm me conhece sabe, pra mim a cada dia é uma chance de fazer historia, sem repetir nenhum ato",https://twitter.com/99mersao/status/765676949259841536,2016-08-16,19:29:44
765491970529787904,to achando que hj vai ser aquele dia que eu precisava,https://twitter.com/99mersao/status/765491970529787904,2016-08-16,07:14:42
765489983331430401,fui pegar no sono era 5h,https://twitter.com/99mersao/status/765489983331430401,2016-08-16,07:06:48
764862399937675264,só dx o tempo resolver,https://twitter.com/99mersao/status/764862399937675264,2016-08-14,13:33:01
764685621613002752,"1.8 chegando pivete, minha vida vai se fazendo",https://twitter.com/99mersao/status/764685621613002752,2016-08-14,01:50:34
764583079587504129,só p esquecer um pouco da vida,https://twitter.com/99mersao/status/764583079587504129,2016-08-13,19:03:06
764574308698062853,desde de manhã eu to escrevendo e até agora escrevi duas linhas vei,https://twitter.com/99mersao/status/764574308698062853,2016-08-13,18:28:14
764565741186248705,mas nois fuma p passar essa merda de stress,https://twitter.com/99mersao/status/764565741186248705,2016-08-13,17:54:12
764562858189398017,que dia merd,https://twitter.com/99mersao/status/764562858189398017,2016-08-13,17:42:44
764313533551091712,"o unico momento colorido que venho tendo, é c vc",https://twitter.com/99mersao/status/764313533551091712,2016-08-13,01:12:01
764257196532170753,meta da minha vida: deixar a minha coroa a pampa,https://twitter.com/99mersao/status/764257196532170753,2016-08-12,21:28:09
764125790585880576,só dx claro que eu pensaria em trocar td meus role por um dia todo com vc,https://twitter.com/99mersao/status/764125790585880576,2016-08-12,12:45:59
764125715944108032,"de noite o bagui já eh outro, nessa sintonia memo",https://twitter.com/99mersao/status/764125715944108032,2016-08-12,12:45:42
764117731935387648,"mas ai, vamo dá um tempo sem cao",https://twitter.com/99mersao/status/764117731935387648,2016-08-12,12:13:58
764039159174529025,bom dia,https://twitter.com/99mersao/status/764039159174529025,2016-08-12,07:01:45
763926034416672769,mente cansada dms,https://twitter.com/99mersao/status/763926034416672769,2016-08-11,23:32:14
763676926577897472,"dia, ne",https://twitter.com/99mersao/status/763676926577897472,2016-08-11,07:02:22
763446899114401792,"já que eu n posso ter ela do meu lado num dia com o clima assim, ouvido um rap",https://twitter.com/99mersao/status/763446899114401792,2016-08-10,15:48:19
763419155995488256,"tem uns pia mó troxa, n aproveita as oportunidade que a vida dá",https://twitter.com/99mersao/status/763419155995488256,2016-08-10,13:58:05
763418546462396416,"hj poderia ser um dia d promoções em essências, ja ia destrui adquirindo tdas",https://twitter.com/99mersao/status/763418546462396416,2016-08-10,13:55:39
763417161159278593,ou passar o dia bem calmo c esse clima ta ligado,https://twitter.com/99mersao/status/763417161159278593,2016-08-10,13:50:09
762426245262876672,"do dia p noite, me ganhou grandao",https://twitter.com/99mersao/status/762426245262876672,2016-08-07,20:12:36
762352976728031233,"street out house, quarto 100",https://twitter.com/99mersao/status/762352976728031233,2016-08-07,15:21:28
758405459057442816,que sono,https://twitter.com/99mersao/status/758405459057442816,2016-07-27,17:55:26
747147975248478208,tt antigo eh uma merda ne,https://twitter.com/99mersao/status/747147975248478208,2016-06-26,16:22:13
1143611858642972673,minha mae vive dizendo p eu toma cuidado  e meu pai... abre teu olho e cuidado cos falso,https://twitter.com/99mersao/status/1143611858642972673,2019-06-25,17:08:09
1143611760785678343,"hj em dia olho p minha correria, vejo td acontecendo",https://twitter.com/99mersao/status/1143611760785678343,2019-06-25,17:07:45
1141837744831963136,seja lá quem vc se tornou seja lá onde esteja no mundo  ..  estou te mandando amor,https://twitter.com/99mersao/status/1141837744831963136,2019-06-20,19:38:27
1125538253145243648,todo mundo sabe o certo e o errado  vacila qm qr,https://twitter.com/99mersao/status/1125538253145243648,2019-05-06,20:10:05
1125501682496962560,"você sangrou seu coração tentando agradar, e no fim disseram que poderia ter sido melhor, mas dá pro gasto",https://twitter.com/99mersao/status/1125501682496962560,2019-05-06,17:44:46
1119040019681947648,queria ser rico ter o 4g da Maraisa e simplesmente baixar filmes   como se n houvesse amanhã  https://twitter.com/Maraisa/status/1118851994314313728 …,https://twitter.com/99mersao/status/1119040019681947648,2019-04-18,21:48:26
1116076246960619521,toma aq o seu troféu   ...  campeã d falar bosta,https://twitter.com/99mersao/status/1116076246960619521,2019-04-10,17:31:27
1115791246503632896,na real tem hr q esse mundo virtual me causa stress...  eu sou + a gritaria o calor humano,https://twitter.com/99mersao/status/1115791246503632896,2019-04-09,22:38:58
1115402984500924416,correno p caralho p tornar o sorriso permanente no rosto da pessoa  ...  e oq nois recebe?  nois recebe af falo eh nada,https://twitter.com/99mersao/status/1115402984500924416,2019-04-08,20:56:09
1115328771475820544,qm ta na maldade sempre dá sinal  e eu sou tipo o motô do busão  até vejo mas n paro....,https://twitter.com/99mersao/status/1115328771475820544,2019-04-08,16:01:15
1115314934202687489,simbora  oh oh oh ôoooh  palma da mao  dmoro dmoro dmoro,https://twitter.com/99mersao/status/1115314934202687489,2019-04-08,15:06:16
1114679308918886401,sertanejada de gado ... tipo aquele da @MariliaMReal  ... cairia bem agra p arrastar o chifre,https://twitter.com/99mersao/status/1114679308918886401,2019-04-06,21:00:31
1114188925738864646,tá decidido... amanhã  vou grudar  numas itaipava latão,https://twitter.com/99mersao/status/1114188925738864646,2019-04-05,12:31:55
1114188517524033536,caralho to embrulhado no ódio,https://twitter.com/99mersao/status/1114188517524033536,2019-04-05,12:30:17
1108107784778928129,trabalhe até seu vizinho falar: caralho n foi despejado ainda pq? será se ta em dia o aluguel dele,https://twitter.com/99mersao/status/1108107784778928129,2019-03-19,17:47:38
1107106949311746048,é verdade cara  pergunta po pai,https://twitter.com/99mersao/status/1107106949311746048,2019-03-16,23:30:40
1107009118844448768,"Certas coisas eu abri mão por pessoas, n me arrependo  mas to ligado  que não vou ter nd em troca, nem o mesmo",https://twitter.com/99mersao/status/1107009118844448768,2019-03-16,17:01:55
1103629148596174848,"e nessas horas meu sorriso é passageiro, e é aí que eu percebo a falta que me faz você rs",https://twitter.com/99mersao/status/1103629148596174848,2019-03-07,09:11:08
1098419646829600768,meu pejo nunca me deixou na mão kkkkkk,https://twitter.com/99mersao/status/1098419646829600768,2019-02-21,00:10:26
1096734588737671173,"ter me afastado da mesmice, das mesmas coisas de sempre e viver novas experiências(novos perrengues) me fez amadurecer bastante",https://twitter.com/99mersao/status/1096734588737671173,2019-02-16,09:34:36
1096733105325592577,"só 1 visão: não force ngm a nd, não queira receber mais q aquilo q ela pode dar  você pode exigir o seu valor, mas não é todo mundo que vai conseguir te dar kkkk",https://twitter.com/99mersao/status/1096733105325592577,2019-02-16,09:28:43
1096409471499358209,"meu Deus n tem como  eu amo esse time   @Corinthians minha história, minha vida, meu amor",https://twitter.com/99mersao/status/1096409471499358209,2019-02-15,12:02:42
1096204224617168896,"Perdi a graça hoje, depois de ouvir certas coisas.  No mais, vai nascer um nenê e o nome dele vai ser o meu em minha honenagem. Cês entendem oq eu tô falando?",https://twitter.com/99mersao/status/1096204224617168896,2019-02-14,22:27:08
1095669695993335808,O MC V7 é muito engraçado mano kkkkk,https://twitter.com/99mersao/status/1095669695993335808,2019-02-13,11:03:06
1092488028453515267,"eu olhei p cara dela, ela disse: ou vc q eh o  mersao? eu disse sim eu sou ela disse entao me da uma prova eu disse  olha o tamanho da minha cabeça sua idiota",https://twitter.com/99mersao/status/1092488028453515267,2019-02-04,16:20:18
1083171124584812544,sempre fui cercado de pessoas  agora n tem 1 filha da puta p estender a mão,https://twitter.com/99mersao/status/1083171124584812544,2019-01-09,23:18:15
1082272012607856641,deixo londrina com muita dor no coração  dnv,https://twitter.com/99mersao/status/1082272012607856641,2019-01-07,11:45:30
1071872305796706305,Domingo é dia do meu coração apertar  eu sinto falta da presença da minha mãe,https://twitter.com/99mersao/status/1071872305796706305,2018-12-09,19:00:46
1071872115459190784,Ultimamente eu ando abrindo mão de tanta coisa  até da minha paz de espírito  tudo por um objetivo,https://twitter.com/99mersao/status/1071872115459190784,2018-12-09,19:00:01
1069549077724110852,"eu sou capaz de fazer vc feliz, do jeito que cê sempre quis",https://twitter.com/99mersao/status/1069549077724110852,2018-12-03,09:09:06
1068311862201192448,"meu whatsapp parou, o mundo vai acabar e eu não vou ficar sabendo",https://twitter.com/99mersao/status/1068311862201192448,2018-11-29,23:12:50
1068170495143620608,tem nem como ficar triste kkkkk,https://twitter.com/99mersao/status/1068170495143620608,2018-11-29,13:51:06
1067213484839055360,eu preciso guardar grana pro futuro e cumprir as parada que eu juro,https://twitter.com/99mersao/status/1067213484839055360,2018-11-26,22:28:17
1066402246836015104,de lokal na mão eu não quero arrumar mais confusão,https://twitter.com/99mersao/status/1066402246836015104,2018-11-24,16:44:43
1064524396595998720,quando o mundo me machucar tu ainda vai querer curar minha dor?,https://twitter.com/99mersao/status/1064524396595998720,2018-11-19,12:22:48
1062732532981080067,"Me jogaram no fundo do poço, lá trombei com a Samara, a famosa menina.. chorando ela me disse: ""cuidado, seu moço da última vez que subi tinha monstros lá em cima""",https://twitter.com/99mersao/status/1062732532981080067,2018-11-14,13:42:35
1062454124002926592,"fuzil na mão, droga na mesa... atmosfera foda",https://twitter.com/99mersao/status/1062454124002926592,2018-11-13,19:16:17
