id,tweet,link,date,time
835994580738850816,amanhã tenho que trabalhar e eu to bem triste,https://twitter.com/bot1nigga/status/835994580738850816,2017-02-26,20:26:54
835876974069436417,"Arrumei minhas coisas já, mais uma implicância tô vazando",https://twitter.com/bot1nigga/status/835876974069436417,2017-02-26,12:39:35
835223719404503041,Ano passado essa hora a gente tava detonando a mochila do Romio kkk,https://twitter.com/bot1nigga/status/835223719404503041,2017-02-24,17:23:47
835098795474038785,eu olho a line da Garden e tenho vontade chorar por n poder ir,https://twitter.com/bot1nigga/status/835098795474038785,2017-02-24,09:07:22
834574396715102208,Vou começar a me isolar e ser anti social de novo,https://twitter.com/bot1nigga/status/834574396715102208,2017-02-22,22:23:36
834573433468022785,Minha mãe me vê deprimido e vem falar sobre deus,https://twitter.com/bot1nigga/status/834573433468022785,2017-02-22,22:19:46
834538383473070080,GroundBass soltou a track e eu to bem feliz,https://twitter.com/bot1nigga/status/834538383473070080,2017-02-22,20:00:30
834186610627506176,ouvir Paraíso Paranoia da uma brisaaa,https://twitter.com/bot1nigga/status/834186610627506176,2017-02-21,20:42:41
834015004949151745,"segundo minha mãe não vou ir bem na vida até eu não arrumar meu quarto, eu fico tipo,KE",https://twitter.com/bot1nigga/status/834015004949151745,2017-02-21,09:20:47
833839525193347073,seu perfil foi visto por 2 pessoas na última hora  http://twcm.me/D59ir ,https://twitter.com/bot1nigga/status/833839525193347073,2017-02-20,21:43:29
833656410789576708,será que eu tava tão bêbado a ponto de colocar o cigarro em cima do muro e colocar a mão em cima?,https://twitter.com/bot1nigga/status/833656410789576708,2017-02-20,09:35:51
833628476020236292,"não sei quem é mais burro, quem colocou o crivo aonde eu ia sentar ou eu que coloquei a mão em cima",https://twitter.com/bot1nigga/status/833628476020236292,2017-02-20,07:44:51
833449574383644677,Amanhã começa as aulas e é tão bom saber que eu não preciso mais ir,https://twitter.com/bot1nigga/status/833449574383644677,2017-02-19,19:53:57
832239216960663554,Eu tô feliz pra crlh,https://twitter.com/bot1nigga/status/832239216960663554,2017-02-16,12:44:26
832153674168270848,Cada vez mais descassetado dá cabeça,https://twitter.com/bot1nigga/status/832153674168270848,2017-02-16,07:04:31
832140508063490048,Acordei bem feliz pensando que hoje era sábado,https://twitter.com/bot1nigga/status/832140508063490048,2017-02-16,06:12:12
831641943725731841,"VAI SE FODER, LARGA MÃO DE SER MOLEQUINHO PORA",https://twitter.com/bot1nigga/status/831641943725731841,2017-02-14,21:11:05
831206525247094785,to triste mas to feliz,https://twitter.com/bot1nigga/status/831206525247094785,2017-02-13,16:20:53
831114958406549504,quando parece que as coisas vão dar certo  chega a vida e opa trolei,https://twitter.com/bot1nigga/status/831114958406549504,2017-02-13,10:17:02
831050327638102016,Dia 22 podia ser amanhã né,https://twitter.com/bot1nigga/status/831050327638102016,2017-02-13,06:00:12
830589064403415040,bem triste isso,https://twitter.com/bot1nigga/status/830589064403415040,2017-02-11,23:27:19
828953702492930048,Essa hora n passa,https://twitter.com/bot1nigga/status/828953702492930048,2017-02-07,11:08:58
827463492315721729,"imagina se fosse um suicídio mais loko, tipo escutar latino por 3 dias",https://twitter.com/bot1nigga/status/827463492315721729,2017-02-03,08:27:24
826107188540219396,Não vejo a hora de chegar em casa e dormir,https://twitter.com/bot1nigga/status/826107188540219396,2017-01-30,14:37:56
825977612099055617,Eu n devia ter ficado acordado até tarde,https://twitter.com/bot1nigga/status/825977612099055617,2017-01-30,06:03:03
825521984654159873,"morre não, amanhã tem RR",https://twitter.com/bot1nigga/status/825521984654159873,2017-01-28,23:52:33
825378097352568833,"sob as leis de um mundo que conspira, sou andarilho minha casa é minha mochila",https://twitter.com/bot1nigga/status/825378097352568833,2017-01-28,14:20:47
825279769537368064,fiz um café aqui pra ficar 3 dias acordado,https://twitter.com/bot1nigga/status/825279769537368064,2017-01-28,07:50:04
825141675462950913,Tomara que eu trabalhe só até meio dia amanhã,https://twitter.com/bot1nigga/status/825141675462950913,2017-01-27,22:41:20
823670866147938305,cada vez mais descacetado da cabeça,https://twitter.com/bot1nigga/status/823670866147938305,2017-01-23,21:16:52
823642415634542595,hoje ela me trás as coisas e eu nem como,https://twitter.com/bot1nigga/status/823642415634542595,2017-01-23,19:23:49
823563863031500801,muito tarde,https://twitter.com/bot1nigga/status/823563863031500801,2017-01-23,14:11:40
823552609650900993,Porque tudo que eu pego na mão eu tento tirar um som?,https://twitter.com/bot1nigga/status/823552609650900993,2017-01-23,13:26:57
823327120617336832,Não quero ir trabalhar amanhã :v,https://twitter.com/bot1nigga/status/823327120617336832,2017-01-22,22:30:56
817569289842593793,seu perfil foi visto por 2 pessoas na última hora  http://twcm.me/D59ir ,https://twitter.com/bot1nigga/status/817569289842593793,2017-01-07,01:11:23
812618356184518656,seu perfil foi visto por 2 pessoas na última hora  http://twcm.me/D59ir ,https://twitter.com/bot1nigga/status/812618356184518656,2016-12-24,09:18:08
806852125204578304,essa hora que não passa,https://twitter.com/bot1nigga/status/806852125204578304,2016-12-08,11:25:11
806850327395831808,tenho vontade de ir pra Barão amanhã de tarde ainda,https://twitter.com/bot1nigga/status/806850327395831808,2016-12-08,11:18:03
806827512219258880,pnc de todo mundo,https://twitter.com/bot1nigga/status/806827512219258880,2016-12-08,09:47:23
806257200456957954,Coisa pra fazer antes de terminar a aula:  Xingar todo mundo ✔ Queimar os cadernos ✔ Tocar a classe no ventilador ✔,https://twitter.com/bot1nigga/status/806257200456957954,2016-12-06,20:01:10
802513997564149760,Vou ficar atirado na cama toda tarde,https://twitter.com/bot1nigga/status/802513997564149760,2016-11-26,12:07:01
801697478311612416,seu perfil foi visto por 2 pessoas na última hora  http://twcm.me/D59ir ,https://twitter.com/bot1nigga/status/801697478311612416,2016-11-24,06:02:28
800841715816996864,Tô bem triste,https://twitter.com/bot1nigga/status/800841715816996864,2016-11-21,21:21:58
799525196839485440,seu perfil foi visto por 2 pessoas na última hora  http://twcm.me/D59ir ,https://twitter.com/bot1nigga/status/799525196839485440,2016-11-18,06:10:36
779992817032568832,seu perfil foi visto por 2 pessoas na última hora  http://twcm.me/D59ir ,https://twitter.com/bot1nigga/status/779992817032568832,2016-09-25,07:35:53
776243407555440640,seu perfil foi visto por 2 pessoas na última hora  http://twcm.me/D59ir ,https://twitter.com/bot1nigga/status/776243407555440640,2016-09-14,23:17:04
774969134429777921,seu perfil foi visto por 2 pessoas na última hora  http://twcm.me/D59ir ,https://twitter.com/bot1nigga/status/774969134429777921,2016-09-11,10:53:34
772979971350495232,Hora de ouvir uns funk louco 😂,https://twitter.com/bot1nigga/status/772979971350495232,2016-09-05,23:09:21
772007307458654208,seu perfil foi visto por 2 pessoas na última hora  http://twcm.me/D59ir ,https://twitter.com/bot1nigga/status/772007307458654208,2016-09-03,06:44:19
770261438413672452,seu perfil foi visto por 2 pessoas na última hora  http://twcm.me/D59ir ,https://twitter.com/bot1nigga/status/770261438413672452,2016-08-29,11:06:52
767786215009497088,seu perfil foi visto por 2 pessoas na última hora  http://twcm.me/D59ir ,https://twitter.com/bot1nigga/status/767786215009497088,2016-08-22,15:11:13
759620164170244096,todo mundo foi dormir e eu vou ter que ficar conversando com aqueles retardado do grupo,https://twitter.com/bot1nigga/status/759620164170244096,2016-07-31,02:22:14
755441029860298752,seu perfil foi visto por 2 pessoas na última hora  http://twcm.me/D59ir ,https://twitter.com/bot1nigga/status/755441029860298752,2016-07-19,13:35:51
751011385786576896,seu perfil foi visto por 2 pessoas na última hora  http://twcm.me/D59ir ,https://twitter.com/bot1nigga/status/751011385786576896,2016-07-07,08:14:02
746752095181668352,seu perfil foi visto por 2 pessoas na última hora  http://twcm.me/D59ir ,https://twitter.com/bot1nigga/status/746752095181668352,2016-06-25,14:09:08
746599297056145408,Gostaria de saber porque diabos eu estou acordado,https://twitter.com/bot1nigga/status/746599297056145408,2016-06-25,04:01:58
739971412895649792,pensa que loko o brock no ufc perder a cabeça e dar um suplex no cara   :v,https://twitter.com/bot1nigga/status/739971412895649792,2016-06-06,21:05:07
737819693168349184,seu perfil foi visto por 2 pessoas na última hora  http://twcm.me/D59ir ,https://twitter.com/bot1nigga/status/737819693168349184,2016-05-31,22:34:57
730859672052305920,seu perfil foi visto por 2 pessoas na última hora  http://twcm.me/D59ir ,https://twitter.com/bot1nigga/status/730859672052305920,2016-05-12,17:38:19
728961464812359680,maldita hora pra ficar gripado '----',https://twitter.com/bot1nigga/status/728961464812359680,2016-05-07,11:55:31
720190401471234048,seu perfil foi visto por 2 pessoas na última hora  http://twcm.me/D59ir ,https://twitter.com/bot1nigga/status/720190401471234048,2016-04-13,07:02:26
719877449031540736,eu acordo cedo pra estudar e aparece 6282624 coisas legais para fazer,https://twitter.com/bot1nigga/status/719877449031540736,2016-04-12,10:18:53
717461598646976512,seu perfil foi visto por 2 pessoas na última hora  http://twcm.me/D59ir ,https://twitter.com/bot1nigga/status/717461598646976512,2016-04-05,18:19:09
716809783127498752,Cara eu não sei mais o que falar #WrestleMania,https://twitter.com/bot1nigga/status/716809783127498752,2016-04-03,23:09:04
716806928609984512,Pelo amor de Deus Shane sobeee #WrestleMania,https://twitter.com/bot1nigga/status/716806928609984512,2016-04-03,22:57:44
716783122667479040,CORAÇÃO NÃO VAI AGUENTAR ATÉ O FINAL #WrestleMania #BrazilWantsWWETour,https://twitter.com/bot1nigga/status/716783122667479040,2016-04-03,21:23:08
716749489143472130,assim meu coração num guenta Lana #WrestleMania #BrazilWantsWWETour,https://twitter.com/bot1nigga/status/716749489143472130,2016-04-03,19:09:29
714957213970915328,@PcPands ahahaha verdade,https://twitter.com/bot1nigga/status/714957213970915328,2016-03-29,20:27:37
713416059102052352,#BrasilWantsWWETour Pelo amor de Deus @TripleH @WWE vem pro Brasilllll,https://twitter.com/bot1nigga/status/713416059102052352,2016-03-25,14:23:37
711221874936713216,só porque eu queria passar a tarde jogando ;;;;;;-;,https://twitter.com/bot1nigga/status/711221874936713216,2016-03-19,13:04:43
701176960668594177,amanhã o Fastlane prometeeee,https://twitter.com/bot1nigga/status/701176960668594177,2016-02-20,20:49:49
698664511297994752,Amanhã vou dormir o dia inteiro,https://twitter.com/bot1nigga/status/698664511297994752,2016-02-13,22:26:14
698319054755532800,minha mãe quer que eu vá junto com ela amanhã na reunião '-',https://twitter.com/bot1nigga/status/698319054755532800,2016-02-12,23:33:31
694535709961617409,boa tarde (;-; ),https://twitter.com/bot1nigga/status/694535709961617409,2016-02-02,12:59:51
688174583631884290,preciso começar a ir dormir cedo,https://twitter.com/bot1nigga/status/688174583631884290,2016-01-15,23:43:01
687627365019697152,ou algo do tipo,https://twitter.com/bot1nigga/status/687627365019697152,2016-01-14,11:28:33
681885475615993856,seu perfil foi visto por 2 pessoas na última hora  http://twcm.me/HszWW ,https://twitter.com/bot1nigga/status/681885475615993856,2015-12-29,15:12:20
668573311216037888,"É só bandido pra eles e pra mim É o que o mundo faz, PA PA PA trick te joga pra trás",https://twitter.com/bot1nigga/status/668573311216037888,2015-11-22,21:34:33
668573115442700289,"Odeio os Pimp, Rap é rua não é escritório Suas correntes só te prendem ao seu mundo ilusório",https://twitter.com/bot1nigga/status/668573115442700289,2015-11-22,21:33:46
668572759526625281,Tenho sede por sangue e amor à literatura Gótico tuberculoso à procura de tortura,https://twitter.com/bot1nigga/status/668572759526625281,2015-11-22,21:32:22
668572605910278146,"É só bandido pra eles e pra mim É o que o mundo faz, PA PA PA trick te joga pra trás",https://twitter.com/bot1nigga/status/668572605910278146,2015-11-22,21:31:45
668572002601574401,"Quando o coração congela Landemberguer contrataca Se me ver na rua gela, porque vê a sombra da faca",https://twitter.com/bot1nigga/status/668572002601574401,2015-11-22,21:29:21
668571591249436674,"Enquanto meu time esquarteja, me diz qual membro deseja Tipo açougueiro humano fatiando sobre a mesa",https://twitter.com/bot1nigga/status/668571591249436674,2015-11-22,21:27:43
668342717546655744,seu perfil foi visto por 2 pessoas na última hora  http://twcm.me/HszWW ,https://twitter.com/bot1nigga/status/668342717546655744,2015-11-22,06:18:15
664057271442386944,valeu muito a pena ter ficado acordado até as 2h ontem,https://twitter.com/bot1nigga/status/664057271442386944,2015-11-10,10:29:25
662873467646320640,seu perfil foi visto por 2 pessoas na última hora  http://twcm.me/HszWW ,https://twitter.com/bot1nigga/status/662873467646320640,2015-11-07,04:05:24
661322701768912897,"Entender que as coisas, todas tem um porquê",https://twitter.com/bot1nigga/status/661322701768912897,2015-11-02,21:23:13
661322550509707268,Olho pro mundo de hoje é tanta confusão,https://twitter.com/bot1nigga/status/661322550509707268,2015-11-02,21:22:37
658790981479870464,"xinguei todo mundo mesmo, foda-se",https://twitter.com/bot1nigga/status/658790981479870464,2015-10-26,21:43:04
658410995401019392,tô machucado e sábado tem amistoso contra o Santos ;;;;;;;;-;,https://twitter.com/bot1nigga/status/658410995401019392,2015-10-25,20:33:08
654951331648684032,"Então vai, levante a mão",https://twitter.com/bot1nigga/status/654951331648684032,2015-10-16,06:25:40
653396164943945728,Tendo que enfrentar as filas pra pegar coisas pras namoradas,https://twitter.com/bot1nigga/status/653396164943945728,2015-10-11,23:25:59
653378531897024512,O homem macaco que não tem alma e nem coração,https://twitter.com/bot1nigga/status/653378531897024512,2015-10-11,22:15:55
653331179987468288,AMANHÃ NÃO PODE CHOVER,https://twitter.com/bot1nigga/status/653331179987468288,2015-10-11,19:07:46
653253120714252288,Amanhã se não chover vou sair com o Junior,https://twitter.com/bot1nigga/status/653253120714252288,2015-10-11,13:57:35
651773114548899840,"mata o mundo, mata gente",https://twitter.com/bot1nigga/status/651773114548899840,2015-10-07,11:56:34
649751903895728128,Amanhã pelo menos da pra dormir,https://twitter.com/bot1nigga/status/649751903895728128,2015-10-01,22:05:00
649751763575246848,"De manhã treino, de tarde ir fazer o trabalho de geografia e de noite talvez vou pra Barão",https://twitter.com/bot1nigga/status/649751763575246848,2015-10-01,22:04:26
645338188567941120,seu perfil foi visto por 2 pessoas na última hora  http://twcm.me/HszWW ,https://twitter.com/bot1nigga/status/645338188567941120,2015-09-19,17:46:28
642617352614494208,seu perfil foi visto por 2 pessoas na última hora  http://twcm.me/HszWW ,https://twitter.com/bot1nigga/status/642617352614494208,2015-09-12,05:34:50
641393028020748288,"Esqueci de pagar o boleto do jogo, amanhã vou ter que ir de novo pro centro",https://twitter.com/bot1nigga/status/641393028020748288,2015-09-08,20:29:49
639762184176840708,Que merda tô fazendo acordado essa hora,https://twitter.com/bot1nigga/status/639762184176840708,2015-09-04,08:29:25
639254327241142272,"Não vejo a hora de voltar para escola,  aquele lugar maravilhoso ;-;",https://twitter.com/bot1nigga/status/639254327241142272,2015-09-02,22:51:23
639248808644333568,nem é muito que preciso falar,https://twitter.com/bot1nigga/status/639248808644333568,2015-09-02,22:29:27
639248650850410496,já decorei as coisa pra amanhã,https://twitter.com/bot1nigga/status/639248650850410496,2015-09-02,22:28:49
638881072273596417,"@eaisoraia verdade :vv , uma semana :v",https://twitter.com/bot1nigga/status/638881072273596417,2015-09-01,22:08:12
638838445897555968,"@_kellenquadros nada de importante, só 27 dias pro aniversário do meu cachorro :)",https://twitter.com/bot1nigga/status/638838445897555968,2015-09-01,19:18:49
638837156144791552,"@_kellenquadros nada não, foi meu cachorro que Tweetou",https://twitter.com/bot1nigga/status/638837156144791552,2015-09-01,19:13:41
638482833279950848,"melhor minha mãe nem saber disso, se não vai me encher de coisas pra fazer em casa ¬¬",https://twitter.com/bot1nigga/status/638482833279950848,2015-08-31,19:45:44
633472914927566848,Amanhã tem jogoo,https://twitter.com/bot1nigga/status/633472914927566848,2015-08-17,23:58:06
633434563524567041,Amanhã não tem aula \o/,https://twitter.com/bot1nigga/status/633434563524567041,2015-08-17,21:25:43
633050676113895425,"domingo de tarde tem amistoso, ai mdsss",https://twitter.com/bot1nigga/status/633050676113895425,2015-08-16,20:00:17
632703484744347649,"@eaisoraia é lembrei,  mas não era pra ti ficar brava era pra ser engraçado e tu me manda solicitação de novo",https://twitter.com/bot1nigga/status/632703484744347649,2015-08-15,21:00:40
632700726494527488,"@eaisoraia verdade, puta coincidência sjzjjsjsns",https://twitter.com/bot1nigga/status/632700726494527488,2015-08-15,20:49:42
629808163060064260,Amanhã de manhã tenho que ir pro treino,https://twitter.com/bot1nigga/status/629808163060064260,2015-08-07,21:15:42
628277210638622721,Gostaram do cachorro no meu avatar?,https://twitter.com/bot1nigga/status/628277210638622721,2015-08-03,15:52:14
627990413731856384,@edudlz fica de boa ou eu viro um livro na tua cara amanhã,https://twitter.com/bot1nigga/status/627990413731856384,2015-08-02,20:52:36
627979709012422656,acho que vou esquecer de ir pra aula amanhã,https://twitter.com/bot1nigga/status/627979709012422656,2015-08-02,20:10:04
625466628814315522,"@edudlz hora de ir trabalhar, tchal",https://twitter.com/bot1nigga/status/625466628814315522,2015-07-26,21:43:59
625464393191587841,@edudlz  puta merda que engraçado,https://twitter.com/bot1nigga/status/625464393191587841,2015-07-26,21:35:06
624373531846017024,não tô afim de ir jogar amanhã de manhã,https://twitter.com/bot1nigga/status/624373531846017024,2015-07-23,21:20:24
624061262406754304,Fui jogar com os o pia da tarde hoje,https://twitter.com/bot1nigga/status/624061262406754304,2015-07-23,00:39:34
623679402845585408,Ta muito frio pra ficar acordado jogando,https://twitter.com/bot1nigga/status/623679402845585408,2015-07-21,23:22:11
623492276656971776,que diabos estou fazendo acordado essa hora?,https://twitter.com/bot1nigga/status/623492276656971776,2015-07-21,10:58:37
623307056582389760,QUERO UM CACHORRO NOVO,https://twitter.com/bot1nigga/status/623307056582389760,2015-07-20,22:42:37
621499863000334336,Quero um cachorro novo :((,https://twitter.com/bot1nigga/status/621499863000334336,2015-07-15,23:01:28
620025633876365312,oque te deixa feliz?? - 🎮👾⚽🎶🍔  http://kiw.im/1swwLy1atM ,https://twitter.com/bot1nigga/status/620025633876365312,2015-07-11,21:23:25
615128685016940544,Qual a cor do seu olho? 😹😹😹😹 Criatividade 0 aqui ~ Gii ⚓ - Verde    http://kiw.im/1iPUgzne2Q ,https://twitter.com/bot1nigga/status/615128685016940544,2015-06-28,09:04:41
612457503046135809,"Engraçado é como 1 minuto pode estragar 23 horas e 59 minutos... - Minha tv liga, eu não :)    http://kiw.im/1dB2rjy5PX ",https://twitter.com/bot1nigga/status/612457503046135809,2015-06-21,00:10:22
612409338154455041,Você acredita no amor? - Não    http://kiw.im/1d5aYsi9wK ,https://twitter.com/bot1nigga/status/612409338154455041,2015-06-20,20:58:58
612012825888849920,"Então para de cuidar da vida dos outros. Se é pra julgar ou falar coisas ""idiotas"" nem...    http://kiw.im/1cJgdQCMYs ",https://twitter.com/bot1nigga/status/612012825888849920,2015-06-19,18:43:22
612003134102183936,"Dica do dia: nunca se arrependa. Se foi bom, é maravilhoso. Se foi ruim, é experiência...    http://kiw.im/1cHayvvNTS ",https://twitter.com/bot1nigga/status/612003134102183936,2015-06-19,18:04:52
610613994915790848,"Nossa,  com essa eu vou dormir feliz",https://twitter.com/bot1nigga/status/610613994915790848,2015-06-15,22:04:55
610200878751051776,Domingo perfeito para?  - 🎮  http://kiw.im/1YmXSPAxnw ,https://twitter.com/bot1nigga/status/610200878751051776,2015-06-14,18:43:21
610156407682387968,Dormir a tarde é bom ?😴  ~Gus - É    http://kiw.im/1YgVPbE2yS ,https://twitter.com/bot1nigga/status/610156407682387968,2015-06-14,15:46:38
609877798090637312,O que é necessário pra ganhar seu coração ?  - 🍤🍗🍖🍟🍔🍕🍻🍺  http://kiw.im/1Y8wkXsu6M ,https://twitter.com/bot1nigga/status/609877798090637312,2015-06-13,21:19:32
609875617090281472,Qual foi a desculpa mas engraçado que você já deu pra não ficar com alguém ? ( me ; eu...    http://kiw.im/1Y8hRso3tj ,https://twitter.com/bot1nigga/status/609875617090281472,2015-06-13,21:10:52
609785624116264960,"Quem quer conversa cmg, pode manda pergunta aee que eu vou responder todo mundo/Mika - Não    http://kiw.im/1XxWSJUi3d ",https://twitter.com/bot1nigga/status/609785624116264960,2015-06-13,15:13:16
609782052574089218,Novo amor ou novas amizades ?  - Novos jogos 😘  http://kiw.im/1Xx6z2XHze ,https://twitter.com/bot1nigga/status/609782052574089218,2015-06-13,14:59:05
609764476271882240,boooa tarde,https://twitter.com/bot1nigga/status/609764476271882240,2015-06-13,13:49:14
609501635883200512,Você prefere estudar de manhã ou a tarde? 🌚/Raposa  - Tarde  http://kiw.im/1XQMU1mR2D ,https://twitter.com/bot1nigga/status/609501635883200512,2015-06-12,20:24:48
609172159915773953,amanhã levantar cedo 😠😠,https://twitter.com/bot1nigga/status/609172159915773953,2015-06-11,22:35:35
609149750273789952,Já aconteceu com vocês de estarem escutando uma música toda (todo) feliz ai do nada co...    http://kiw.im/1WiWc3c6n9 ,https://twitter.com/bot1nigga/status/609149750273789952,2015-06-11,21:06:32
608775090256384000,Amanhã tem a apresentação e eu tenho médico,https://twitter.com/bot1nigga/status/608775090256384000,2015-06-10,20:17:46
608756567387815939,"Você é feliz , com o que tem ?  - Sim    http://kiw.im/1VwzYLiXJo ",https://twitter.com/bot1nigga/status/608756567387815939,2015-06-10,19:04:10
608756485275983874,2 coisas que vc não dividiria de jeito nenhum? 🔥 - Celular e comida    http://kiw.im/1VwyzZYRCZ ,https://twitter.com/bot1nigga/status/608756485275983874,2015-06-10,19:03:50
608447538547576832,Como vou falar com meus amigos agora?  ;-;,https://twitter.com/bot1nigga/status/608447538547576832,2015-06-09,22:36:12
608439655223169026,"Eu tinha um cachorro que se chamava ""pradentro"" aí um dia eu disse: Pradentro, pra for...    http://kiw.im/1VL7MXBtY7 ",https://twitter.com/bot1nigga/status/608439655223169026,2015-06-09,22:04:52
608439457977610240,Já sentiu amor platônico ? / Jubs 🙈😘 - Não    http://kiw.im/1VL64dWvFH ,https://twitter.com/bot1nigga/status/608439457977610240,2015-06-09,22:04:05
608396339307757569,Qual a melhor sensação do mundo? - 😶  http://kiw.im/1VFCtmMB1J ,https://twitter.com/bot1nigga/status/608396339307757569,2015-06-09,19:12:45
608112785629814785,Na minha opinião acho que todo mundo tem que se valorizar e não sair pegando todo mund...    http://kiw.im/1Uh6nJeYNA ,https://twitter.com/bot1nigga/status/608112785629814785,2015-06-09,00:26:00
608112458415390720,Você costuma falar gírias ? - Não    http://kiw.im/1Uh4dq2LnL ,https://twitter.com/bot1nigga/status/608112458415390720,2015-06-09,00:24:42
608112285937233920,Booa Tarde amigoos...Defina sua segunda-feira em um emoji?/Mika - 😎  http://kiw.im/1Uh3VG1iRq ,https://twitter.com/bot1nigga/status/608112285937233920,2015-06-09,00:24:01
608101037547888640,Você tem aula amanhã?    - É    http://kiw.im/1UfmcBsRKi ,https://twitter.com/bot1nigga/status/608101037547888640,2015-06-08,23:39:19
608067319978434560,Como seria um dia perfeito? //Pelu  - Dormindo    http://kiw.im/1UbxCcZfcp ,https://twitter.com/bot1nigga/status/608067319978434560,2015-06-08,21:25:21
608063062499852288,Ai da pra ver as estrelas ? 😍 / Jubs 🙈😘 - Alta mão ir até a janela olhar    http://kiw.im/1UbUEDPMk5 ,https://twitter.com/bot1nigga/status/608063062499852288,2015-06-08,21:08:26
608032252950388736,"Vc lê?Se sim, Qe tipo de livro prefere ? 🔥 - Odeio ler    http://kiw.im/1UXyv3xWif ",https://twitter.com/bot1nigga/status/608032252950388736,2015-06-08,19:06:00
607743208030896129,Me recuso ir pra aula amanhã,https://twitter.com/bot1nigga/status/607743208030896129,2015-06-07,23:57:26
607683451039436801,_______ + _______ = Perfeito - Eu + comida    http://kiw.im/1TrVJqoysr ,https://twitter.com/bot1nigga/status/607683451039436801,2015-06-07,19:59:59
607669757802905602,Você usa alguma pulseira no braço ? / Jubs 🙈😘 - Tinha 7 😂😂  http://kiw.im/1TpwNs3Pyg ,https://twitter.com/bot1nigga/status/607669757802905602,2015-06-07,19:05:34
607571815960080384,Time de coração?  - INTERNACIONAL 🔴⚪  http://kiw.im/1TdrC94Fke ,https://twitter.com/bot1nigga/status/607571815960080384,2015-06-07,12:36:23
607423624082018304,Porque eu tô acordado se não tem nada pra fazer e ninguém pra conversar?,https://twitter.com/bot1nigga/status/607423624082018304,2015-06-07,02:47:32
607396322401001472,Vc ja preparou pra pensar em como as pessoas deram nomes as coisas?    - Sim     http://kiw.im/1THyiKew4d ,https://twitter.com/bot1nigga/status/607396322401001472,2015-06-07,00:59:02
607044333326503936,Cadê meus amiguinhos pra falar comigo?,https://twitter.com/bot1nigga/status/607044333326503936,2015-06-06,01:40:22
