id,tweet,link,date,time
98134349777608704,A verdade é que Pôneis Malditos é uma melodia composta e originalnalmente coreografada por @factorygirl__,https://twitter.com/francamentevini/status/98134349777608704,2011-08-01,17:53:46
98134100312997888,"@isasugahara a parte que eu não curto trabalhar é verdade, a que eu só fico no twitter não :/",https://twitter.com/francamentevini/status/98134100312997888,2011-08-01,17:52:47
98133191570894850,"Vai chegando 6 horas a minha barrinha de life aumenta, minha alegria triplica, meu sorriso flui, porém minha necessidade de masagem também",https://twitter.com/francamentevini/status/98133191570894850,2011-08-01,17:49:10
97862223518629888,Isso quer dizer que não luta por consquistar a chance de falar comigo?,https://twitter.com/francamentevini/status/97862223518629888,2011-07-31,23:52:26
97851510964236288,Fico feliz em contribuir do menor jeito possível no bem-estar das pessoas.,https://twitter.com/francamentevini/status/97851510964236288,2011-07-31,23:09:52
97732765373562880,"@fresnorock  http://twitpic.com/5yxnrj - Tipo, qual é a sensação de ficar atrás de Eduardo Costa e Alexandre Pires?",https://twitter.com/francamentevini/status/97732765373562880,2011-07-31,15:18:01
97729435888910337,"@raqueiroga Rola fazer um trending contra essa mania mesozóica e babaca de colocar Luan Santana nos TT's? Tipo um "" #ChegaDeLSnosTTs "" ?!",https://twitter.com/francamentevini/status/97729435888910337,2011-07-31,15:04:47
97701910143959040,"Na vida tudo tem que fazer sentido, tipo uma tattoo do pac man... VUSH",https://twitter.com/francamentevini/status/97701910143959040,2011-07-31,13:15:25
97701839851626496,"@__DX Porra, verdade. Então me explique você marcela, porque fábrica de garotas? @factorygirl__",https://twitter.com/francamentevini/status/97701839851626496,2011-07-31,13:15:08
97693391558680576,Boa tarde domingo!,https://twitter.com/francamentevini/status/97693391558680576,2011-07-31,12:41:34
97532502939414528,TANTAS COISAS MANO.,https://twitter.com/francamentevini/status/97532502939414528,2011-07-31,02:02:15
97530024789413888,"@pleasepartygirl O.C - um estranho no paraíso. SBT, 2004. Underground.",https://twitter.com/francamentevini/status/97530024789413888,2011-07-31,01:52:24
97505943876681730,"Elcio Coronato fez uma puta reportagem sobre traição. Taí um negócio pior que encoxar a vó no tanquinho e ela falar ""Ui, vem gato"".",https://twitter.com/francamentevini/status/97505943876681730,2011-07-31,00:16:43
97499955798867968,Acho engraçado isso: O que contamina a sociedade a maioria gosta. Isso sim é ironia.,https://twitter.com/francamentevini/status/97499955798867968,2011-07-30,23:52:55
97439923791069184,"Se vocês quiserem ver o CHARLIE BROWN JUNIOR de verdade! Das antigas mesmo, a história toda, é na Tv cultura agora!",https://twitter.com/francamentevini/status/97439923791069184,2011-07-30,19:54:22
97427021226983424,"Calma gente... Tem muita gente tensa por aqui?! Pô, qualé? Que isso? Hoje é sábado po, amanhã ngm estuda nem trabalha! Aproveitem aí.",https://twitter.com/francamentevini/status/97427021226983424,2011-07-30,19:03:06
97081765356773376,Todo fudido e dolorido eu vou andar de skate. Foda-se. Posso morrer amanhã sem ter feito isso.,https://twitter.com/francamentevini/status/97081765356773376,2011-07-29,20:11:11
97069642627022848,E essa história de que Wally é o cavaleiro metal? Verdade? Mentira? Talvez?  (@CPM22 live on  http://twitcam.com/5yhqk),https://twitter.com/francamentevini/status/97069642627022848,2011-07-29,19:23:00
97065810673147904,Eles só vão divulgar hora que tiver 1000 viewers. Assiste essa porra aí caralho!!! (@CPM22 live on  http://twitcam.com/5yhqk),https://twitter.com/francamentevini/status/97065810673147904,2011-07-29,19:07:47
97057738756063232,Tô com vontade de ouvir rock até estourar a cabeça na parede!,https://twitter.com/francamentevini/status/97057738756063232,2011-07-29,18:35:42
96965207632527360,Não consigo permanecer no orkut por mais de 2 minutos e meio. Sério. Boa tarde.,https://twitter.com/francamentevini/status/96965207632527360,2011-07-29,12:28:01
96705400082153472,"Isso me faz sorrir tanto, vocês nem imaginam...  http://www.youtube.com/watch?v=mESfvQEmpXQ&feature=fvst",https://twitter.com/francamentevini/status/96705400082153472,2011-07-28,19:15:38
96679289696681985,"Pros que morrem de vontade de me ver pra baixo, desanimado, triste e desacreditado PARABÉNS cês tão conseguindo. Mas eu não to sozinho.",https://twitter.com/francamentevini/status/96679289696681985,2011-07-28,17:31:53
96237769210347520,"Meu pai tá saindo pra ir pra Planura-mg. Hora que ele voltar eu quero boas notícias. Se eu não tiver, vou abandonar tudo, tudo.",https://twitter.com/francamentevini/status/96237769210347520,2011-07-27,12:17:26
96234862800928768,"Meu primo tá na U.T.I em estado grave, todo paralisado e quase sem vida. Só isso a dizer pra vocês hoje. Boa tarde, pra ele.",https://twitter.com/francamentevini/status/96234862800928768,2011-07-27,12:05:53
96063462492483586,"RECADO AO SERTANEJO UNIVERSITÁRIO 2:  http://www.youtube.com/watch?v=HChgo1cwWfk - Chega de fazer hora extra nesse mundo, porra!!!",https://twitter.com/francamentevini/status/96063462492483586,2011-07-27,00:44:48
96057257191673857,"E se o V da verdade, o V da vitória, for o mesmo V da vingança?",https://twitter.com/francamentevini/status/96057257191673857,2011-07-27,00:20:09
96056153863237632,Dúvida divina. Isso é música. Amanhã eu componho essa.,https://twitter.com/francamentevini/status/96056153863237632,2011-07-27,00:15:46
96055699292954625,"@__DX Tá na hora de entrar na facul mano. Mas seria um sonho muito loko ""estudar"" com você.",https://twitter.com/francamentevini/status/96055699292954625,2011-07-27,00:13:58
96052794020208640,"Admiro mesmo, afinal dá pra ver os calos dos dedos dos tiozinhos tocando viola com amor.",https://twitter.com/francamentevini/status/96052794020208640,2011-07-27,00:02:25
96047268683186176,@caroolinnac Cara eu dormi a noite toda :/ Prometo que vou tomar amanhã. Prometo.,https://twitter.com/francamentevini/status/96047268683186176,2011-07-26,23:40:27
96030560786460674,Porra. Quando estou acordado os inúteis me ligam. Quando eu durmo as pessoas importantes me ligam. Vida irônica.,https://twitter.com/francamentevini/status/96030560786460674,2011-07-26,22:34:04
95682278474264576,.. vai dizer que o amor chegou no final?,https://twitter.com/francamentevini/status/95682278474264576,2011-07-25,23:30:07
95682229266681857, http://www.youtube.com/watch?v=sx_vDxsd4yI essa é pra mim ir dormir pra variar com a cabeça focada em algo que não é meu descanço.,https://twitter.com/francamentevini/status/95682229266681857,2011-07-25,23:29:55
95673177639890944,Hoje o rolê foi curto devido ao amor que temos em nossas vidas.,https://twitter.com/francamentevini/status/95673177639890944,2011-07-25,22:53:57
95632750626869248,"Alguém pode falar pra @meninafuck_ que eu sou realmente magrelo, feio, pelancudo e chato, ao contrário (eu acho que ao contrário) das fotos?",https://twitter.com/francamentevini/status/95632750626869248,2011-07-25,20:13:19
95618819044814848,"a moça do jornal regional falou uma puta verdade agora: ""A vontade de ficar rico está deixando cada vez mais pessoas pobres""...",https://twitter.com/francamentevini/status/95618819044814848,2011-07-25,19:17:57
95495286134280192,"Ah, dane-se o futebol cara, na medida que eu estou crescendo e entendendo as coisas, mais eu tenho nojo do que há por dentro do futebol.",https://twitter.com/francamentevini/status/95495286134280192,2011-07-25,11:07:05
95494806540791808,O Ralf é o único jogador DE VERDADE da posição no Brasil. O resto dos volantes jogam bola arrumando a franja.,https://twitter.com/francamentevini/status/95494806540791808,2011-07-25,11:05:10
94843477589897216,OOOOOOOOOOOOOOHHHH MY GOOOODDDD essa foto do @MauricioRicardo é de verdade ???????????????????????????????????????????,https://twitter.com/francamentevini/status/94843477589897216,2011-07-23,15:57:01
94829524243595265,além disso sentar na igreja e ouvir o padre falar vai ser mó divertid ZzzzZzzZZzZZzzzZZzzZZzzZZz,https://twitter.com/francamentevini/status/94829524243595265,2011-07-23,15:01:35
94824787725135872,"Penso: Se eu gastasse uma grana pra comprar ingresso de um show, e na hora do pau, o artista não cantasse, eu iria me revoltar muito.",https://twitter.com/francamentevini/status/94824787725135872,2011-07-23,14:42:45
94819824554876929,Acabo de me lembrar que minha primeira tattoo foi feita ao som dela.,https://twitter.com/francamentevini/status/94819824554876929,2011-07-23,14:23:02
94818556566450176,"Ela somente fazia umas músicas legais, e tinha uma voz da hora.",https://twitter.com/francamentevini/status/94818556566450176,2011-07-23,14:18:00
94818264886153216,"""ELA ERA TALENTOSA"" Verdade! Ela tinha um talento pra acender uns baseados, e um jeitinho que só pra cheirar pó. E como bebia bonito, hein?",https://twitter.com/francamentevini/status/94818264886153216,2011-07-23,14:16:50
94809288660357120,O amor é tudo. Amy sua vida acima de tudo.,https://twitter.com/francamentevini/status/94809288660357120,2011-07-23,13:41:10
94793275298430976,"@__DX Cara, mas tipo, o que você queria com chá de bebe? o,o É uma benção enorme a gente não ter obrigação de ir nisso aí!",https://twitter.com/francamentevini/status/94793275298430976,2011-07-23,12:37:32
94792022908612608,"Porque o RESTO DE TODA casa é reservado pra bagunça, brinquedo jogado, coisas quebradas e etc. Um bebê de 5 anos manda aqui.",https://twitter.com/francamentevini/status/94792022908612608,2011-07-23,12:32:34
94791710386819072,"Tomou meu quarto, não posso ter mais cachorro, nem gatos. Não posso mais ouvir um som a noite, nem chamar os amigos pra vir em casa... pqp.",https://twitter.com/francamentevini/status/94791710386819072,2011-07-23,12:31:19
94790991126609920,Eu estou muito afim de mandar uma mensagem pro meu primo desejando uma feliz vida de casado e ficar em casa sozinho o dia todo.,https://twitter.com/francamentevini/status/94790991126609920,2011-07-23,12:28:28
94790829708808193,Meu sobrinho pode enfiar uma faca na minha cabeça que meus pais aplaudem e mandam repetir a cena.,https://twitter.com/francamentevini/status/94790829708808193,2011-07-23,12:27:49
94231010505523200,"""O amor é a única revolução verdadeira, a única revolução verdadeira é o amor"". Aprendam.",https://twitter.com/francamentevini/status/94231010505523200,2011-07-21,23:23:18
94227063975837696,"Aqui só não é Porto Alegre, mas o resto é tudo verdade... Essa fala por mim...  http://www.youtube.com/watch?v=QeyZvacNCx0&feature=share …",https://twitter.com/francamentevini/status/94227063975837696,2011-07-21,23:07:37
94223208781328384,"É como se fosse uma gestação de sentimento, só que é de fora pra dentro, e na medida que o tempo passa, o sentimento vai crescendo...",https://twitter.com/francamentevini/status/94223208781328384,2011-07-21,22:52:18
94172827766358016,"Eu tô saindo, tenho umas coisas muito importante pra fazer. Se cuidem.",https://twitter.com/francamentevini/status/94172827766358016,2011-07-21,19:32:06
94171937714081792,"@NataliaPaulique Porque as pessoas são vazias e só se satisfazem caso tenham um prato cheio pra degustar. Tipo uma vida bonita, como a sua..",https://twitter.com/francamentevini/status/94171937714081792,2011-07-21,19:28:34
94170540855656448,"@NataliaPaulique Desde que você não mate, não esquarteje, não estupre ou não jogue uma criança do 7º andar, você é uma pessoa normal.",https://twitter.com/francamentevini/status/94170540855656448,2011-07-21,19:23:01
94167629337591808,"@Kamau_ Pude sentir um tanto de intriga no RT. Relaxa mano, um tweet não é nem um décimo comparado a verdade.",https://twitter.com/francamentevini/status/94167629337591808,2011-07-21,19:11:27
93882152319582208,Voltei pra ver se os bebês tão na cama e olha só! Ainda estão por aqui (acho). Vou falar pra mamãe cortar a mamadeira de coca-cola.,https://twitter.com/francamentevini/status/93882152319582208,2011-07-21,00:17:04
93875657016213504,"O meu time me deixa muito feliz. Liderança e uma garra que me orgulham e me fazem querer fazer igual.Te amo, Corinthians.",https://twitter.com/francamentevini/status/93875657016213504,2011-07-20,23:51:15
93800441665695744,Feliz dia do amigo pra fulano. Aí fulano diz: Me empresta cinco conto? Nem vou continuar...,https://twitter.com/francamentevini/status/93800441665695744,2011-07-20,18:52:22
93697369396355072,"AmigosUnidosPorLS na avenida paulista, na parada gay.",https://twitter.com/francamentevini/status/93697369396355072,2011-07-20,12:02:48
93696515826139137,"Enfim, uma coisa a dizer. Uma amiga da minha irmã, que sempre vinha em casa antigamente, faleceu hoje. O sentimento é estranho demais.",https://twitter.com/francamentevini/status/93696515826139137,2011-07-20,11:59:24
93657138790019073,Ou fiquei sabendo que os caras do @mombojo são macumbeiros. Verdade será???,https://twitter.com/francamentevini/status/93657138790019073,2011-07-20,09:22:56
93654917633413120,"Feliz dia do amigo @BarackObama , cola em casa pra nóis tomá um tereré na laje depois, firmeza?",https://twitter.com/francamentevini/status/93654917633413120,2011-07-20,09:14:07
93453391749070848,"Acho que com 18 anos você tem que estar estudando, influenciando onde você passa e metendo sorriso na cara de alguém nem que for a Dercy.",https://twitter.com/francamentevini/status/93453391749070848,2011-07-19,19:53:19
93453017352896512,@thaisdiamonds Valeu querida! Verdade mesmo.,https://twitter.com/francamentevini/status/93453017352896512,2011-07-19,19:51:50
93345555190784000,@vaiIa vai la tuitar as coisas pela metade e,https://twitter.com/francamentevini/status/93345555190784000,2011-07-19,12:44:49
93083973261078528,"Vocês não imaginam o quanto eu dou risada quando o Professor Girafales fala SILÊNCIO e o chaves diz: ""Agora eu não falei nada"". Mó da hora.",https://twitter.com/francamentevini/status/93083973261078528,2011-07-18,19:25:23
92985046465654784,@FaeeLbalieiro Colar de lacre de latinha de cerveja no pescoço e crocs preto no pé. VAMO PRA GUERRA,https://twitter.com/francamentevini/status/92985046465654784,2011-07-18,12:52:17
92984515378675712,@FaeeLbalieiro Tattoo nem que for de henna no ante-braço DEUS É FIEL no esquerdo e o nome da vó no direito.,https://twitter.com/francamentevini/status/92984515378675712,2011-07-18,12:50:10
92984005342920705,"@FaeeLbalieiro Pode pá, chama eu que to sem um zóio e com papagaio faminto no ombro pra colar lá. Tipo os marujos do Piratas do Caribe.",https://twitter.com/francamentevini/status/92984005342920705,2011-07-18,12:48:09
92960591219662848,"Hoje eu estou tão feliz cara... A sensaçao de mandar um ollie meio ""bem feito"" ontem me fez ficar sentindo-me o Tony Hawk. Mas firmeza...",https://twitter.com/francamentevini/status/92960591219662848,2011-07-18,11:15:06
92959031219585024,"Muito futebol na Home hoje. Uma coisa a dizer, estou MUITO FELIZ pela eliminação do Brasil. Não sei exatamente porque, mas estou.",https://twitter.com/francamentevini/status/92959031219585024,2011-07-18,11:08:54
92635217759698944,"Vou tomar um bom banho, pra iniciar a tarde do domingo.",https://twitter.com/francamentevini/status/92635217759698944,2011-07-17,13:42:11
92617242721783809,[...] Eu tô muito feliz por mim e por ele. Mas o casamento dele é semana que vem...,https://twitter.com/francamentevini/status/92617242721783809,2011-07-17,12:30:46
92617071422214144,"Eu não ia compartilhar, mas é tipo uma obrigação. Meu primo do Canadá veio pra cá hoje e me trouxe uma camiseta do país das folhas secas *-*",https://twitter.com/francamentevini/status/92617071422214144,2011-07-17,12:30:05
92613654742179840,Existe coisa mais chata do que Maratona? É com essa questão difícil de responder que lhes desejo boa tarde.,https://twitter.com/francamentevini/status/92613654742179840,2011-07-17,12:16:30
92407269236539392,@meninafuck_ É o crack presente na vida de cada vez mais pessoas neste mundo.,https://twitter.com/francamentevini/status/92407269236539392,2011-07-16,22:36:24
92400332923092992,Unfollow na @laizaffaria pra caroline/a/o não usar do perfil dela pra falar comigo. Mas antes avisa ela que como sempre era só brincadeira.,https://twitter.com/francamentevini/status/92400332923092992,2011-07-16,22:08:50
92399995550044162,Como pode a Vanessa Camargo nos TT's no Muslera's Day. Começem a falar de Harry Potter gente! Tire essa fubanga daí.,https://twitter.com/francamentevini/status/92399995550044162,2011-07-16,22:07:30
92399341834207233,Unfollow na @pleasepartygirl enquanto ela não decidir que avatar deixar. Hora que escolher me avisa pra voltar a te seguir.,https://twitter.com/francamentevini/status/92399341834207233,2011-07-16,22:04:54
92398080544079872,"Futebol é isso, submete você a sentir emoções sem cobrar nada, além de um pouco de atenção dos olhos e do coração. #ChupaArgentina",https://twitter.com/francamentevini/status/92398080544079872,2011-07-16,21:59:53
92387975136165888,"Desculpa, amigo, mas você não sabe o quanto estou feliz em saber que você se livrou daquilo.",https://twitter.com/francamentevini/status/92387975136165888,2011-07-16,21:19:44
92373178365640705,"@Jv_morada Desculpe pela raiva aqui postada a tarde, eu já exclui os tweets mais imbecís. Se te surpreendi me desculpa irmão, eu amo você.",https://twitter.com/francamentevini/status/92373178365640705,2011-07-16,20:20:56
92296748323713025,Sabendo que a noite vou ver o @RodolfoAbrantes no #altashoras o meu dia fica mais feliz ainda. Gosto muito desse cara.,https://twitter.com/francamentevini/status/92296748323713025,2011-07-16,15:17:14
92296612646363136,"Que tarde calma, sem meu sobrinho chorando, silêncio, música, Sem pastores berrando na igreja ao lado, lindo sábado hoje.",https://twitter.com/francamentevini/status/92296612646363136,2011-07-16,15:16:41
92293337389867009,"@RodolfoAbrantes Eu respeito qualquer que for o asusnto que você for falar lá, Mas você vai lá tocar e cantar também, né?",https://twitter.com/francamentevini/status/92293337389867009,2011-07-16,15:03:41
92025412850434048,Dane-se se eu não sair agora. Eu não trabalho amanhã portanto até que o sol nasça o mundo é meu.,https://twitter.com/francamentevini/status/92025412850434048,2011-07-15,21:19:02
92012417692872705,"@__DX Mano eu fiz o bangue do óculos em outra hora, ele caiu no chão mesmo. Eu devia ter filmado, foi I N A C R E D I T Á V E L .",https://twitter.com/francamentevini/status/92012417692872705,2011-07-15,20:27:24
91930035199557633,"#aprendicomhp A falar ""Vingartsu Lavioça"".",https://twitter.com/francamentevini/status/91930035199557633,2011-07-15,15:00:03
91929454691106816,"@Na_Igreja ""O diabo veio para matar, roubar e passar Esquenta da Regina Casé no domingo a tarde""",https://twitter.com/francamentevini/status/91929454691106816,2011-07-15,14:57:44
91895271902031872,"A parada é quem pode ajudar, quem pode mudar, são os jovens, OS JOVENS! Mas, o que vejo hoje, é uma mulecada que concorda com TUDO fácil.",https://twitter.com/francamentevini/status/91895271902031872,2011-07-15,12:41:54
91895136153370624,"O Evandro Pelarin pode falar o que quiser, ele estudou pra estar onde está e não vai mudar nada em relação ao que já é.",https://twitter.com/francamentevini/status/91895136153370624,2011-07-15,12:41:22
91892563530887168,"Evandro Pelarin mete o pau nas drogas inclusive nas bebidas, jovens pagam pau! Mas, na hora de participar do abaixo assinado contra (+)",https://twitter.com/francamentevini/status/91892563530887168,2011-07-15,12:31:09
91891663424851969,"Mas enfim, eu tava um pouco afim de falar aqui sobre a palestra do Evandro Pelarin ontem. Posso, sociedade?",https://twitter.com/francamentevini/status/91891663424851969,2011-07-15,12:27:34
91891389536804864,"@bandjogoaberto #dancarenata FOI DA HORA, SURPREENDENTE.",https://twitter.com/francamentevini/status/91891389536804864,2011-07-15,12:26:29
91875757047025664,pac-man abelhudo foi o apelidinho mais fofo e que dá vontade de retribuir com carinho e voadora ao mesmo tempo que já recebi. É estranho.,https://twitter.com/francamentevini/status/91875757047025664,2011-07-15,11:24:22
91869995633623040,O Mundo é do contra. No dia mundial sem carro todo mundo anda nele. No dia da árvore alguém derruba uma. No dia do homem ouvem pagode.,https://twitter.com/francamentevini/status/91869995633623040,2011-07-15,11:01:28
91869575402110977,"Deixa acontecer naturalmente, eu não quero ver você chorar, [...] Nosso caso vai eternizZzZzZZzzzZZzZZzzzZZZzZZZz",https://twitter.com/francamentevini/status/91869575402110977,2011-07-15,10:59:48
91866280595947520,Zuera gente. Parabéns a quem tem um negócio duro e estranho no meio das pernas então. Parabéns pra quem tem joelho.,https://twitter.com/francamentevini/status/91866280595947520,2011-07-15,10:46:42
91862606842834945,Se a sexta feira fosse uma pessoa eu daria um abraço tão gostoso nela. Com beijinhos no pescoço ainda.,https://twitter.com/francamentevini/status/91862606842834945,2011-07-15,10:32:06
91627599335391232,O tweet abaixo foi a conjunção de um som do D2 com o que eu queria muito falar pro doutor hoje.,https://twitter.com/francamentevini/status/91627599335391232,2011-07-14,18:58:16
91627454254424065,"Tabaco ou maconha? O que te envergonha? Ninguém é menos digno porque fuma maconha. Tem coisa pior que isso, tipo sua hipocrisia.",https://twitter.com/francamentevini/status/91627454254424065,2011-07-14,18:57:42
91596251543506945,"@ApenasDihxxx Ouuu, quero colar lá no Tom pra mandar umas tattos muito viagem!!! Avisa lá, qualquer hora to colando.",https://twitter.com/francamentevini/status/91596251543506945,2011-07-14,16:53:42
91534298217324545,"E esses ""alguns de vocês"" me envergonham por coisas que eu prefiro não comentar aqui. As melhores piadas eu conto no jantar.",https://twitter.com/francamentevini/status/91534298217324545,2011-07-14,12:47:31
91296900837408769,#acceptCity POR UM MUNDO ONDE A HUMILDADE PREVALECE EM PRIMEIRO LUGAR.,https://twitter.com/francamentevini/status/91296900837408769,2011-07-13,21:04:12
91289689482469376,"OK, vamos fazer diferente. Eu vou entrar nessa parada de signo agora!!! E ADIVINHA, vou provar que é tudo mentira.",https://twitter.com/francamentevini/status/91289689482469376,2011-07-13,20:35:32
91287687260151809,#restartnaoerock - Eu sabia que um dia a verdade ia aparecer.,https://twitter.com/francamentevini/status/91287687260151809,2011-07-13,20:27:35
91284051356426240,"@SlGNO Como é enganar as pessoas do mundo inteiro? Você um adoslescente mal amado que desconta sua raiva em negatividade pro seu signo, né?",https://twitter.com/francamentevini/status/91284051356426240,2011-07-13,20:13:08
91167726550257664,@BarackObama ae chá de pilha vai mandar feliz do rock pra nóis aqui ou vou ter que tomar providencias porra??!,https://twitter.com/francamentevini/status/91167726550257664,2011-07-13,12:30:54
91164401805180928,"O Cachorro Grande vai oficializar o lançamento do novo disco hoje, é isso production? Melhor banda do país é isso aí.",https://twitter.com/francamentevini/status/91164401805180928,2011-07-13,12:17:41
91163867769618432,"Mas eu concordo, o dia tá legal hoje. Vou dar um role de skate a noite ouvindo aqueles som pra quebra a cabeça na parede!",https://twitter.com/francamentevini/status/91163867769618432,2011-07-13,12:15:34
91157900541698049,HOJE É O DIA DO GÊNERO E DA RELIGIÃO MAIS IMPORTANTE DO MUNDO.,https://twitter.com/francamentevini/status/91157900541698049,2011-07-13,11:51:51
90563566830227456,"Quase fui morto por intoxicação e uma virose muito forte hoje. Vômito, tontura, dores, muitas dores. Foi um dos dias mais dificeis da vida.",https://twitter.com/francamentevini/status/90563566830227456,2011-07-11,20:30:11
90169004064382976,"Ou, a cada vez que você digita #pelanzadeuocu você digita somente a verdade, nada mais que a verdade.",https://twitter.com/francamentevini/status/90169004064382976,2011-07-10,18:22:20
90105905705795584,@ApenasDihxxx Representa no bate-cabeça com os punk careca hein negão! hahaha prazer.,https://twitter.com/francamentevini/status/90105905705795584,2011-07-10,14:11:36
89830115604836352,"Não tenho o que fazer hoje. Alguém me convida pra alguma coisa? *Se alguém falar bartô, sbarco ou empório eu atiro*",https://twitter.com/francamentevini/status/89830115604836352,2011-07-09,19:55:43
89717960716988417,"@RafaelFucked Quando nóis ia na guardinha cê canta Lollypop toda hora. Hoje é eu ouvir e lembrar de você na certa. Vou lá ver vcs hj, fmz?",https://twitter.com/francamentevini/status/89717960716988417,2011-07-09,12:30:03
89711668883488768,Old: Essa me faz lembrar de tudo que passamos:  http://www.youtube.com/watch?v=gFGPO5xktY0&feature=share …,https://twitter.com/francamentevini/status/89711668883488768,2011-07-09,12:05:03
89561834083979264,Não gosto do meu sobrinho mas chegar em casa e ficar sabendo que ele não tá aqui é estranho. Ficar sabendo que ele tá na santa casa é pior.,https://twitter.com/francamentevini/status/89561834083979264,2011-07-09,02:09:39
89482257026392064,"EU ODEIO ESSE POVO, ESSA QUE É A VERDADE.",https://twitter.com/francamentevini/status/89482257026392064,2011-07-08,20:53:27
89459990280155137,Eu ficaria feliz se José Dirceu morresse. Sinceridade.,https://twitter.com/francamentevini/status/89459990280155137,2011-07-08,19:24:58
89459591250841602,Se tem alguém que explode de raiva quando escreve coisas idiotas e erradas (Com certeza não é a clarice lispector) sou eu.,https://twitter.com/francamentevini/status/89459591250841602,2011-07-08,19:23:23
