id,tweet,link,date,time
46261809635794945,O velho tedio de sexta a tarde num trampo. Foda viu.,https://twitter.com/francamentevini/status/46261809635794945,2011-03-11,14:30:49
45965418673864704,"Sabem aquela tempestade que caiu do céu(Aváh) hoje a tarde? Pois bem, eu tomei ela todinha, do início ao fim. Vou contar pra vocês...",https://twitter.com/francamentevini/status/45965418673864704,2011-03-10,18:53:04
45606992970125312,@familiacaveira Se você usar como twitter pessoal as pessoas vão começar a dar unfollow...,https://twitter.com/francamentevini/status/45606992970125312,2011-03-09,19:08:49
45606867136819200,"@familiacaveira Use esse twitter para falar sobre a família caveira, sobre o Gloria, sobre os integrantes, sobre os shows cara.",https://twitter.com/francamentevini/status/45606867136819200,2011-03-09,19:08:19
45189699966484480,"Comprar camiseta pela internet é pura dor de cabeça mano, você fica louco, quer levar todas.",https://twitter.com/francamentevini/status/45189699966484480,2011-03-08,15:30:38
45165354636419072,@ExpoFerpa2011 Vocês estão com a cabeça aonde? Existem pessoas nessa cidade que admiram ou desejam outros gêneros musicais.,https://twitter.com/francamentevini/status/45165354636419072,2011-03-08,13:53:54
44926814447091712,To jogando um CS no not. POrra. Vcs sabem o que tem pra mim fazer mais tarde? EU FAÇO O QUE EU QUISER CARALHO,https://twitter.com/francamentevini/status/44926814447091712,2011-03-07,22:06:01
44918880891707392,"@lah_ribeiroo verdade, vamos sim ! by : @isispaulino",https://twitter.com/francamentevini/status/44918880891707392,2011-03-07,21:34:30
44462857613606912,"Na boa mesmo, eu não consigo ouvir ""Detonautas Acústico 2009"". Eu começo a lembrar freneticamente do Leandro.",https://twitter.com/francamentevini/status/44462857613606912,2011-03-06,15:22:25
44441294247968768,Chuva de domingo a tarde é tão legal quanto trabalhar de pedreiro segunda de manhã.,https://twitter.com/francamentevini/status/44441294247968768,2011-03-06,13:56:44
44441002395701249,Boa tarde sobreviventes.,https://twitter.com/francamentevini/status/44441002395701249,2011-03-06,13:55:35
44107875680780288,"@renan_asmelo E aí mlk, que que vai rolar no Magnum mais tarde?",https://twitter.com/francamentevini/status/44107875680780288,2011-03-05,15:51:51
44084022757961728,Boa tarde suínos egipcios.,https://twitter.com/francamentevini/status/44084022757961728,2011-03-05,14:17:04
43429408056418304,É triste ver sua namorada adicionar pião vaganundo e aceitando depoimento de biscate no orkut.,https://twitter.com/francamentevini/status/43429408056418304,2011-03-03,18:55:52
42342465495236608,"@larissa_limma Boas compras, e um feliz aniversário, rs.",https://twitter.com/francamentevini/status/42342465495236608,2011-02-28,18:56:45
41988893100351488,"Isis, eu te amo tanto, não ouse tentar medir. Acima de todas as coisas, nosso amor ♥",https://twitter.com/francamentevini/status/41988893100351488,2011-02-27,19:31:46
41988524974669824,"Já jantei, banhei-me. Agora é só esperar ela ficar pronta. Vamos nos falar um pouco, mas quero amá-la como se não houvesse amanhã.",https://twitter.com/francamentevini/status/41988524974669824,2011-02-27,19:30:19
41716854988877824,"Preciso de positividade, o timão ganhou, o not chegou, a sogra também, cai uma leve chuva, e meu amor está logo ali, do meu lado.",https://twitter.com/francamentevini/status/41716854988877824,2011-02-27,01:30:47
41716112785809408,"Por outro lado tenho fé, não importa se é em Deus, na Justiça, ou em qualquer Pilar da vida, de que o amor tudo supera. Tudo.",https://twitter.com/francamentevini/status/41716112785809408,2011-02-27,01:27:50
41708132140978176,"Além disso, tem gente que precisa saber que quando fico chato, nervoso, a cura mais simples é passar a mão na minha cabeça e me abraçar.",https://twitter.com/francamentevini/status/41708132140978176,2011-02-27,00:56:08
41703874763038720,"Na boa, eu pareço ser tão durão. Mas na verdade não passo de um gay com sentimentos aflorados a péle.",https://twitter.com/francamentevini/status/41703874763038720,2011-02-27,00:39:13
41586327157743616,"E acho bem melhor falar sobre isso do quê ter a capacidade de não parar de dizer: ""Que tédio, que sono, quero sumir"" ou coisa do gênero.",https://twitter.com/francamentevini/status/41586327157743616,2011-02-26,16:52:07
41586111885082624,"É só começar falar de preconceito, que neguinho começa me chamar no msn feito louco.",https://twitter.com/francamentevini/status/41586111885082624,2011-02-26,16:51:16
41584394753945600,E pras pessoas que afirmam com toda falsidade que não tem NENHUM preconceito no mundo. Sem comentários.,https://twitter.com/francamentevini/status/41584394753945600,2011-02-26,16:44:26
41583487656001536,"Falar coisas inúteis no twitter é comum, eu também falo. MAS TEM GENTE QUE SÓ FALA COISA N A D A A V E R .",https://twitter.com/francamentevini/status/41583487656001536,2011-02-26,16:40:50
41570487825989632,"@2MAMILOS Salve xepa, fiquei 2 meses sem Pc. Triste.",https://twitter.com/francamentevini/status/41570487825989632,2011-02-26,15:49:11
41519197263499264,"Troquei a foto, o que muitos por aqui chamam de avatar. Mas na verdade é foto. Como ficou?",https://twitter.com/francamentevini/status/41519197263499264,2011-02-26,12:25:22
41514464104681472,@cachorrogrande Não tá na hora de vocês gravarem um DVD ?,https://twitter.com/francamentevini/status/41514464104681472,2011-02-26,12:06:34
41299179003183104,"Ok, deixa eu liberar meu sentimento. EU VOLTEEEEEEEEEEEEEEEEEEEEEEEEEEEEEEEEEEEEEEEEEEEEEEEEEEEEEEEEEEEEEEEEEEEEEEEEEEEE \OOOOO/",https://twitter.com/francamentevini/status/41299179003183104,2011-02-25,21:51:06
40532230543646720,"Mas so vou sentar na frente dele amanha ou dps ainda, pra cair a ficha.",https://twitter.com/francamentevini/status/40532230543646720,2011-02-23,19:03:31
36421537607188480,"@isispaulino Não quero te falar porque no twitter, até porque estou indo embora. Daqui a pouco chego em casa.",https://twitter.com/francamentevini/status/36421537607188480,2011-02-12,11:49:05
36415476783386624,"Isso Evandro, certinho. Traz clientes pra loja faltando meia hora pra fechar ¬¬",https://twitter.com/francamentevini/status/36415476783386624,2011-02-12,11:25:00
36410695020978176,Mais tarde vou no centro da metrópole comprar meu Pc.,https://twitter.com/francamentevini/status/36410695020978176,2011-02-12,11:06:00
36410024200773632,Como será que estão as coisas por aqui? Como estão meus amigos? Meus inimigos?,https://twitter.com/francamentevini/status/36410024200773632,2011-02-12,11:03:20
31810386927816704,Não tem coisa mais legal do que aquele cachorro no msn.,https://twitter.com/francamentevini/status/31810386927816704,2011-01-30,18:26:01
29970415644311552,"@FaeeLbalieiro KKKKKKKKKKKKKKKKKKKKKKKKKKKKKKKKKKKKKKKKKKKKKKKKKKKK PORRA AMPUTARAM MEU PESCOÇO... (calma, vou pegar o xarope)",https://twitter.com/francamentevini/status/29970415644311552,2011-01-25,16:34:38
29967520077185024,"As novidades são boas. Ontem a tarde fui atropelado por uma moto. E o cara, super cavalheiro, saiu correndo.",https://twitter.com/francamentevini/status/29967520077185024,2011-01-25,16:23:08
26056680450039808,"Firmão. Tô saindo agora. Mas amanhã eu volto pra serrar mais internet da minha querida, um abraço a todos. Ahh, a Isis mandou dizer: (+)",https://twitter.com/francamentevini/status/26056680450039808,2011-01-14,21:22:51
26055808919801857,"Consequências do amor. É, elas existem. *-*",https://twitter.com/francamentevini/status/26055808919801857,2011-01-14,21:19:23
23804560887779328,"[...] Mais do que sobrando aqui, e passando por despercebido, vou sair, enquanto isso as pessoas podem falar um monte de bobeira a vontade.",https://twitter.com/francamentevini/status/23804560887779328,2011-01-08,16:13:44
23804440028909568,"Nossa esse povinho no twitter, falando as mesmas coisas. Brincadeiras sem a mínima graça, indicações enjoativas, tudo. Já que estou (+)",https://twitter.com/francamentevini/status/23804440028909568,2011-01-08,16:13:15
23792006203441152,"Salve uma vida encontre um amor. <<< Vi essa legenda num jogo de violência, perfeita.",https://twitter.com/francamentevini/status/23792006203441152,2011-01-08,15:23:50
23753802951692288,Ouvir SEPULTURA pra extrair o ódio pelas ondas sonoras,https://twitter.com/francamentevini/status/23753802951692288,2011-01-08,12:52:02
23753535522869249,Minha mãe é a única pessoa no mundo que se arrisca aproximar de mim quando estou explodindo de raiva! A única.,https://twitter.com/francamentevini/status/23753535522869249,2011-01-08,12:50:58
23382617126600705,"Não quero ver você mal, não quero ver você magoada. Quero seu sorriso, seu amor, seu carinho, sua mão @isispaulino .",https://twitter.com/francamentevini/status/23382617126600705,2011-01-07,12:17:05
23382109435469824,Nossa tenho que deixar os meus problemas de lado pra apoiar quem na verdade não teria motivos pra se exaltar.,https://twitter.com/francamentevini/status/23382109435469824,2011-01-07,12:15:03
23025600407015424,"Eu preciso largar mão de ser inseguro, desconfiado.",https://twitter.com/francamentevini/status/23025600407015424,2011-01-06,12:38:25
23025100517285888,Que período estranho.,https://twitter.com/francamentevini/status/23025100517285888,2011-01-06,12:36:26
22825545448300545,"Minha vida foi se deitar. O dia foi um pouco tenso, mas tudo agora está em paz! Te amo muito amor.",https://twitter.com/francamentevini/status/22825545448300545,2011-01-05,23:23:28
22787435385585664,"Proibido de ver o meu amor, comprando produtos falsos, vendo raios estourando há 20 metros da minha frente, quase cair de bicicleta (+)",https://twitter.com/francamentevini/status/22787435385585664,2011-01-05,20:52:02
22786987844960256,"Eu não quero, não quero, não quero, não quero mais que as coisas dêem errado.",https://twitter.com/francamentevini/status/22786987844960256,2011-01-05,20:50:15
22786621782884352,Nossaaaaaaaaaa as coisas só estão dando erradooooooooooooooooo,https://twitter.com/francamentevini/status/22786621782884352,2011-01-05,20:48:48
22664142045319169,"Quantas coisas, caralho, quantas coisas acontecendo...",https://twitter.com/francamentevini/status/22664142045319169,2011-01-05,12:42:07
22664058519953408,Boa tarde a todos seres humanos.,https://twitter.com/francamentevini/status/22664058519953408,2011-01-05,12:41:47
22298401202769920,Tô saindo porque estou a ponto de explodir o planeta com tanta raiva e ódio escorrendo pelo sangue. Porraaaa,https://twitter.com/francamentevini/status/22298401202769920,2011-01-04,12:28:47
22038363884232704,"Nossa vocês já devem estar cansados de me ver reclamar da vida aqui. Vou dar um jeito de parar, ver meu amor, sei lá...",https://twitter.com/francamentevini/status/22038363884232704,2011-01-03,19:15:30
21936804986888192,"@isispaulino Amor seu adaptador está comigo viu?! Não esqueci de devolver, rsrs, só espera eu terminar de passar as músicas hoje a noite.",https://twitter.com/francamentevini/status/21936804986888192,2011-01-03,12:31:56
21936426379649024,Boa tarde. Como vão?,https://twitter.com/francamentevini/status/21936426379649024,2011-01-03,12:30:26
21294164796768256,"Fazia mó tempão que não via os vídeos do Felipe Neto. Ele continua me fazendo rir pra caralho... E tipo queria dizer uma coisa,",https://twitter.com/francamentevini/status/21294164796768256,2011-01-01,17:58:19
20908938077675521,@Kamau_ Eu e uma galera estávamos nos pergutando. Chamei eles pra cola aqui em casa e ver! Obrigado mano.. De verdade!,https://twitter.com/francamentevini/status/20908938077675521,2010-12-31,16:27:33
20895808656244736,"Vinho, champagne, amarula e brahma. Tô gostando das coisas por enquanto.",https://twitter.com/francamentevini/status/20895808656244736,2010-12-31,15:35:23
20869436609142786,@RafaelFucked  Preciso falar sobre umas paradas muito Van GROGS com você.,https://twitter.com/francamentevini/status/20869436609142786,2010-12-31,13:50:36
20858051657465856,@italocalanca O primeiro ser humano do mundo foi Adão. E do seu nariz veio Éva. Ah váááááá,https://twitter.com/francamentevini/status/20858051657465856,2010-12-31,13:05:21
20493034219118593,Desde o 12:05 estou colocando música no cartão. Caralho é música demais ;x Passei aqui pra desejar boa tarde!,https://twitter.com/francamentevini/status/20493034219118593,2010-12-30,12:54:54
20231661530644480,"Acabei a limpeza de disco. Vou na casa do meu amor, beijos.",https://twitter.com/francamentevini/status/20231661530644480,2010-12-29,19:36:18
20222295310073858,"@italocalanca Coisas sobre a nossa república, sobre as coisas que iremos fazer, me atende no msn!",https://twitter.com/francamentevini/status/20222295310073858,2010-12-29,18:59:05
20220818063622144,"@italocalanca Cara tenho MUITA NOVIDADE pra falar, MUITA coisa pra propor. Você vai gostar.",https://twitter.com/francamentevini/status/20220818063622144,2010-12-29,18:53:13
20124066182598656,Boa tarde. Como vão vocês?,https://twitter.com/francamentevini/status/20124066182598656,2010-12-29,12:28:45
19401601336737792,Boa tarde. Gritos de criança me irritam.,https://twitter.com/francamentevini/status/19401601336737792,2010-12-27,12:37:56
19142151849902080,"MInha mãe não pode ver aqueles programas de natureza, que é só ela ver leões, onças atacando zebras, antílopes, que ela começa a chorar ¬¬",https://twitter.com/francamentevini/status/19142151849902080,2010-12-26,19:26:59
19113468871311360,"Esse amiguinho da Isis já tá me fazendo explodir as veias de tanta raiva. Cara, quem joga de verdade não precisa fazer propaganda de si (+)",https://twitter.com/francamentevini/status/19113468871311360,2010-12-26,17:33:00
19111606470311936,"Boa tarde, acabei de chegar da casa do meu amor, bati um lanche brutálico pra matar a fome..",https://twitter.com/francamentevini/status/19111606470311936,2010-12-26,17:25:36
19052158334799872,@gaabrs almuça deve ser da hora hein véio o.O,https://twitter.com/francamentevini/status/19052158334799872,2010-12-26,13:29:23
19040878530138112,"Hoje acordei com dor de cabeça, vontade de vomitar, tontura, estômago revirado e tudo de negativo que você pode imaginar.",https://twitter.com/francamentevini/status/19040878530138112,2010-12-26,12:44:33
19040348168790016,Boa tarde a todos. Como vão vocês?,https://twitter.com/francamentevini/status/19040348168790016,2010-12-26,12:42:27
18768993569476610,Vou tomar um banho. Pois hoje já é sábado a noite e quero muito curtir com meu amor :) Até amanhã.,https://twitter.com/francamentevini/status/18768993569476610,2010-12-25,18:44:11
18755148083892224,"não paro de comer carne, em plena 17:49 da tarde.",https://twitter.com/francamentevini/status/18755148083892224,2010-12-25,17:49:10
18743605585776640,"Fui embora do meu amor, e não tem nada pra ver na tv, #tenso",https://twitter.com/francamentevini/status/18743605585776640,2010-12-25,17:03:18
18703320914857985,@mechanicalDX coração da ziz????? Porra que eu saiba é metade dela metade meu =///////,https://twitter.com/francamentevini/status/18703320914857985,2010-12-25,14:23:13
18464412989923329,"Aee galera, eu e a @isispaulino desejamos um puta natal a todos vocês, façam aquilo que proporcione sorriso a cara de vocês. LoveFor4 ♥",https://twitter.com/francamentevini/status/18464412989923329,2010-12-24,22:33:53
18460579924541440,@mylenamorim Feliz copa do brasil em 2011.,https://twitter.com/francamentevini/status/18460579924541440,2010-12-24,22:18:39
18446816722821120,"Oie *-* Tô aqui em casa de boa, com meu amor @isispaulino - Ela, minha mãe e a chiquinha estão vendo novela, o que me obriga a vir pro pc.",https://twitter.com/francamentevini/status/18446816722821120,2010-12-24,21:23:58
18349444613283840,"Agora estou mais calmo. Estou só eu e meu irmão em casa. Ouvindo meu som, falando com meu amor, etc, etc.",https://twitter.com/francamentevini/status/18349444613283840,2010-12-24,14:57:03
18348341037375488,"Agora sim, uma boa tarde a todos.",https://twitter.com/francamentevini/status/18348341037375488,2010-12-24,14:52:40
17949902738825216,"Ontem encontrei a @marcelabarbar curtindo mó rap na praça da matriz, tipo aquelas mina do complexo do alemão tá ligado? É NÓIS LONTRA !",https://twitter.com/francamentevini/status/17949902738825216,2010-12-23,12:29:24
17949653471334400,"Depois eu e meu amor deitamos na minha rede e relaxamos, hmm *-* Tudo bem, fora o fato dela ter me judiado muito :( kkkkkkkk",https://twitter.com/francamentevini/status/17949653471334400,2010-12-23,12:28:25
17949082345541633,@italocalanca Mano obrigado por me fazer sorrir na hora que eu mais preciso. Você é um parceiro inexplicavelmente inexplicável.,https://twitter.com/francamentevini/status/17949082345541633,2010-12-23,12:26:09
17948555956199424,Boa tarde a todos. Como vão vocês?,https://twitter.com/francamentevini/status/17948555956199424,2010-12-23,12:24:03
17593949367566336,Vou ouvir um reggae positivo cheio de boas vibrações pra aguentar essa tarde de serviço. Logo logo eu volto pra casa! (yn),https://twitter.com/francamentevini/status/17593949367566336,2010-12-22,12:54:59
17588691895586818,"Eu num tô nem aí se o objeto vale só 20R$, eu não vou trabalhar num ambiente onde roubam coisas das quais você rala pra comprar.",https://twitter.com/francamentevini/status/17588691895586818,2010-12-22,12:34:05
17329601294376960,@MeninoBipolar Você diz coisas tão boas que podia colocar um avatar mais comovente.,https://twitter.com/francamentevini/status/17329601294376960,2010-12-21,19:24:33
17323100584546304,"@isispaulino Ficou linda pra caralh amor *-* Parabéns, rsrs. E obrigado pela homenagem (LL)",https://twitter.com/francamentevini/status/17323100584546304,2010-12-21,18:58:43
17227638716243969,@isispaulino Amor boa sorte com a tatto. Nos vemos mais tarde ♥,https://twitter.com/francamentevini/status/17227638716243969,2010-12-21,12:39:23
17226655013539840,"@isispaulino Relaxa amor, deve ser a ansiedade.",https://twitter.com/francamentevini/status/17226655013539840,2010-12-21,12:35:29
17225133550731264,Eclipse Lunar = A coisa mais inútil que existe no mundo.,https://twitter.com/francamentevini/status/17225133550731264,2010-12-21,12:29:26
17224768344301568,Boa tarde!,https://twitter.com/francamentevini/status/17224768344301568,2010-12-21,12:27:59
16549900523151361,Vou jogar alguma coisa até dar a hora de ver o meu amor.,https://twitter.com/francamentevini/status/16549900523151361,2010-12-19,15:46:18
16549732746788864,"Caralho, voltei aqui pro Pc, ta tocando um sonzinho leve do Ls, me vem um sentimento estranho... Às vezes tenho pensamentos sem nexo algum.",https://twitter.com/francamentevini/status/16549732746788864,2010-12-19,15:45:38
16525932047106048,Boa tarde a todos!,https://twitter.com/francamentevini/status/16525932047106048,2010-12-19,14:11:03
16220894259060737,A dor de cabeça realmente: é desagradável.,https://twitter.com/francamentevini/status/16220894259060737,2010-12-18,17:58:57
16200332270903296,Hmnnnnaaaaghhh (isso é um bocejo) - Boa tarde! Acabei de chegar do meu amor. Lá eu comi e depois dormi. Tem coisa melhor?,https://twitter.com/francamentevini/status/16200332270903296,2010-12-18,16:37:14
16109772226961408,Troquei meu Avatar. Fiquei bonito tipo o Morgan Freeman ?,https://twitter.com/francamentevini/status/16109772226961408,2010-12-18,10:37:23
16100852452294657,Liberdade pra dentro da cabeça ♪,https://twitter.com/francamentevini/status/16100852452294657,2010-12-18,10:01:57
16100314226626560,Agora não adianta mais me lamentar. Tenho que erguer a cabeça e aproveitar o sábado que ainda tenho pela frente.,https://twitter.com/francamentevini/status/16100314226626560,2010-12-18,09:59:48
16099647823020032,"Hmmmmn, senti um climinha ... RT@glendakozlowski @Njr92 preciso falar com vc!",https://twitter.com/francamentevini/status/16099647823020032,2010-12-18,09:57:09
16089812985446401,Uma nova versão do msn está disponível ?! Vou baixar mais tarde. . .,https://twitter.com/francamentevini/status/16089812985446401,2010-12-18,09:18:05
15781216384983040,"Queria ficar a tarde, ou melhor, o dia todo juntinho com meu amor, mesmo contra a vontade dela [kkkk] nesse friozinho *-*",https://twitter.com/francamentevini/status/15781216384983040,2010-12-17,12:51:49
15780990563647488,"Tomara que a tarde passe rápido, não estou NEM UM POUCO afim de trabalhar",https://twitter.com/francamentevini/status/15780990563647488,2010-12-17,12:50:56
15780324558508033,"@TicostacruzRock Aí mano, deseja feliz aniversário pra minha noiva, to mandando !",https://twitter.com/francamentevini/status/15780324558508033,2010-12-17,12:48:17
15780075769167872,@isispaulino Nervosa porquê amor ?,https://twitter.com/francamentevini/status/15780075769167872,2010-12-17,12:47:17
15779750437982208,"Níver da minha jóia @isispaulino hoje *-* FELIZ ANIVERSÁRIO meu anjo, toda sorte e toda paz do mundo (LL) Te amo meu ""♥iluminado"".",https://twitter.com/francamentevini/status/15779750437982208,2010-12-17,12:46:00
15525242843697152,"To indo pra casa do meu amor, até mais.",https://twitter.com/francamentevini/status/15525242843697152,2010-12-16,19:54:40
15417775350616064,To vanzando. Boa tarde aê,https://twitter.com/francamentevini/status/15417775350616064,2010-12-16,12:47:38
15409227572977664,Amanhã ela completa 17 aninhos *-*,https://twitter.com/francamentevini/status/15409227572977664,2010-12-16,12:13:40
15407020907700224,É com essa linda poesia do meu pai que desejo uma boa tarde a todos vocês .,https://twitter.com/francamentevini/status/15407020907700224,2010-12-16,12:04:54
15406888397045760,"""O mundo vai girando cada vez mais veloz, a gente espera do mundo, e o mundo espera de nós, um pouco mais de paciência"".",https://twitter.com/francamentevini/status/15406888397045760,2010-12-16,12:04:23
15153790382505985,"Fim de tarde cheia de música e com o meu sobrinho muito longe de mim, MUITO BOM!",https://twitter.com/francamentevini/status/15153790382505985,2010-12-15,19:18:39
15152206806261761,Fim de tarde gostosa ! - ao contrário do meio do dia - .,https://twitter.com/francamentevini/status/15152206806261761,2010-12-15,19:12:22
15056778341392384,Vou cantando pelas ruas pra tornar minha tarde menos cansativa.,https://twitter.com/francamentevini/status/15056778341392384,2010-12-15,12:53:10
15056685584351233,Tenham uma boa tarde.,https://twitter.com/francamentevini/status/15056685584351233,2010-12-15,12:52:48
15055427762921472,Postei uma foto no orkut do cara que mais me falta no mundo. O cara que a qualquer custo me ajudava e me acalmava sempre.,https://twitter.com/francamentevini/status/15055427762921472,2010-12-15,12:47:48
15053292300140544,"As flores são bonitas em qualquer lugar do mundo, muita gente tem forma, MAS NÃO TEM CONTEÚDO.",https://twitter.com/francamentevini/status/15053292300140544,2010-12-15,12:39:19
15052882449534977,"Eu vou lutar ate sangrar minha alma até o fim pra conquistar tudo que eu quero, mesmo que seja sozinho, o que na verdade eu sempre estive.",https://twitter.com/francamentevini/status/15052882449534977,2010-12-15,12:37:41
15050525707862016,"@thaisdiamonds @isispaulino OBRIGADO, DE VERDADE",https://twitter.com/francamentevini/status/15050525707862016,2010-12-15,12:28:19
15050128213671936,"Por enquato eu não sei o que fazer, mas essa tarde vou matar o máximo de trampo possível pensando no que fazer.",https://twitter.com/francamentevini/status/15050128213671936,2010-12-15,12:26:44
15049694921105408,"Não tenho mais direito de ser feliz caralho, Nossa mano eu tô tão indignado...",https://twitter.com/francamentevini/status/15049694921105408,2010-12-15,12:25:01
14792104102330368,"Hoje quase eu e o #rodrigo fomos mandados embora por causa de erro dos outros, O PAU QUEBROU DE VERDADE na Valtra",https://twitter.com/francamentevini/status/14792104102330368,2010-12-14,19:21:27
14787519409291266,Acabei de falar pela primeira vez na minha vida com minha sogra. tenso ♥_♥,https://twitter.com/francamentevini/status/14787519409291266,2010-12-14,19:03:14
14331170858729472,"Caramba, meu amor saiu de casa, comecei a ouvir Charlie Brown das antigas.. Viajei tanto que nem percebi a hora.. É já é hora de vazar.",https://twitter.com/francamentevini/status/14331170858729472,2010-12-13,12:49:52
14330795879571456,"@isispaulino vai durmi , é melhor que fica na net amor .. (Y) ♥_♥",https://twitter.com/francamentevini/status/14330795879571456,2010-12-13,12:48:22
14059493558067201,@Rafaafranco Obrigado por me tirar um ENORME sorrizããããão a esta tediosa hora do domingo. É por isso que eu te amo muito prima ♥_♥,https://twitter.com/francamentevini/status/14059493558067201,2010-12-12,18:50:19
13992316515651584,Boa tarde a todos!!,https://twitter.com/francamentevini/status/13992316515651584,2010-12-12,14:23:22
13619178091053057,Espancar o Cachorro Grande nessas caixinhas aqui..,https://twitter.com/francamentevini/status/13619178091053057,2010-12-11,13:40:39
13616222734131200,Enquanto isso vou arrumar umas coisas e baixar uns cd's..,https://twitter.com/francamentevini/status/13616222734131200,2010-12-11,13:28:55
13614871602012160,"Nossa, todos vindo me parabenizar. Me sinto feliz",https://twitter.com/francamentevini/status/13614871602012160,2010-12-11,13:23:33
13244545017839616,"Amanhã acho que vou fazer uma twitcam no meu aniversário, e tocar uma música no violão, alguem assiste?",https://twitter.com/francamentevini/status/13244545017839616,2010-12-10,12:52:00
13243162931757057,"E amanhã vou completar 17 anos de vida. Caramba, to mó velho já :S",https://twitter.com/francamentevini/status/13243162931757057,2010-12-10,12:46:30
