id,tweet,link,date,time
1119608547535413253,A preguiça de estudar tá forte aqui,https://twitter.com/GabAndSil/status/1119608547535413253,2019-04-20,11:27:33
1119076032764452865,A Clara é a melhor cantora com o maior potencial que eu já ouvi (sem exagero) e merece todo reconhecimento do mundo,https://twitter.com/GabAndSil/status/1119076032764452865,2019-04-19,00:11:32
1118976727093477377,Passar na Cristiano Machado seis da tarde 🤙🏼,https://twitter.com/GabAndSil/status/1118976727093477377,2019-04-18,17:36:55
1118976402827677701,Feliz por ter decorado os nervos cranianos,https://twitter.com/GabAndSil/status/1118976402827677701,2019-04-18,17:35:38
1118005512568758272,Eu não consigo escrever pra todo mundo,https://twitter.com/GabAndSil/status/1118005512568758272,2019-04-16,01:17:40
1117876682684293121,Do nada bate aquele sentimento de rejeição,https://twitter.com/GabAndSil/status/1117876682684293121,2019-04-15,16:45:44
1116732696028504065,"não vai acontecer porque paula vai direto pra cadeia, ouvi um amém?  https://twitter.com/falarafha/status/1116527015824433153 …",https://twitter.com/GabAndSil/status/1116732696028504065,2019-04-12,12:59:57
1115944529239126017,"GENTE NÃO VOTA ERRADO NÃO, PELO AMOR DE DEUS",https://twitter.com/GabAndSil/status/1115944529239126017,2019-04-10,08:48:03
1115349989079830528,Eu sinto no meu coração que a Nina West voltará no all stars 6 e será winner,https://twitter.com/GabAndSil/status/1115349989079830528,2019-04-08,17:25:34
1115340489547497472,Terei mais de 50 páginas de sociologia pra ler pra prova de amanhã e nem ideia de como farei isso,https://twitter.com/GabAndSil/status/1115340489547497472,2019-04-08,16:47:49
1115032016288874502,"Véi, três coisas que eu quero muito podem vim se eu parar de beber:  Emagrecer Ser saudável Juntar dinheiro  POR QUE É TÃO DIFÍCIL",https://twitter.com/GabAndSil/status/1115032016288874502,2019-04-07,20:22:03
1114541987531649024,Não acredito que essa hora chegou,https://twitter.com/GabAndSil/status/1114541987531649024,2019-04-06,11:54:51
1114201971093909506,monte seu rebanho de corno com o primeiro @ q aparecer:  Corno desinformado: @electricslag  Corno vingativo: @a320__  Corno manso: @pipcaf  Corno triste: @clrmeirelles  Corno superado: @Le_Ubermensch  Corno que quer voltar: @MeerrBarbara,https://twitter.com/GabAndSil/status/1114201971093909506,2019-04-05,13:23:45
1114165199660093440,Tô com zero disposição pras coisas hoje,https://twitter.com/GabAndSil/status/1114165199660093440,2019-04-05,10:57:38
1114160783905239040,"quando eu fui, nenhum dos meus amigos foi pro Lolla quando eu não vou, vai todo mundo",https://twitter.com/GabAndSil/status/1114160783905239040,2019-04-05,10:40:05
1113938630886797313,"Meio que é, um lugar é do lado do outro e todo mundo se mistura e vai nos dois bares",https://twitter.com/GabAndSil/status/1113938630886797313,2019-04-04,19:57:20
1113787552979476480,"Claro, não vou condenar todo mundo por querer o melhor, até porque o certo seria que a universidade pública comportasse e desse oportunidade pra todos mesmo, e a escola pública, o mesmo. Mas existe uma parcela de alunos das federais que são de classe alta e +",https://twitter.com/GabAndSil/status/1113787552979476480,2019-04-04,09:57:00
1113774760150949889,"Mas eu nunca vou negar que eu sou extremamente privilegiado por ter estudado numa escola particular, mesmo que seja uma meia-boca. Certas coisas do convívio de escola pública que eu tive contato no meu terceiro ano nunca haviam me preocupado antes",https://twitter.com/GabAndSil/status/1113774760150949889,2019-04-04,09:06:10
1113411367200075776,"É engraçado né  Os viado, as sapatão e as bi falam que vão no Esquenta Os hétero falam que vão no John John",https://twitter.com/GabAndSil/status/1113411367200075776,2019-04-03,09:02:10
1113401504591962113,"Jade com a Nina, jesus meu coração não consegue lidar com tanto amor  https://twitter.com/lmbrmidia/status/1113375587199016960 …",https://twitter.com/GabAndSil/status/1113401504591962113,2019-04-03,08:22:59
1113051464472186881,cineart não faz isso com meu coração E LIBERA ESSES INGRESSOS LOGO,https://twitter.com/GabAndSil/status/1113051464472186881,2019-04-02,09:12:03
1112917371654684672,"Sei que isso é péssimo de se falar, mas eu queria real ficar doente pra não ter que ir fazer prova amanhã",https://twitter.com/GabAndSil/status/1112917371654684672,2019-04-02,00:19:13
1112896135704838146,quantos pontos vc tem cmg? Quem quiser responder na dm fique a vontade kkk  ja me beijou +150 é meu amigo +100 convive comigo +250 já te xinguei +100 tem meu número: +100 já recebeu áudio meu: +150 já conversou cmg triste: +200 já recebeu algo fofo meu: + 300 já bebeu cmg: +500,https://twitter.com/GabAndSil/status/1112896135704838146,2019-04-01,22:54:50
1112768325757607936,Esse sentimento é horrível,https://twitter.com/GabAndSil/status/1112768325757607936,2019-04-01,14:26:57
1112680676124446720,Mas não ia sair só mais a tarde?,https://twitter.com/GabAndSil/status/1112680676124446720,2019-04-01,08:38:40
1112529292825710593,Todo mundo comigo e com o @floorzete https://twitter.com/antisocializado/status/1112135329279025153 …,https://twitter.com/GabAndSil/status/1112529292825710593,2019-03-31,22:37:07
1112527107782033409,Verdade  Acho que tríade 2009-2010-2011 é muito poderosa,https://twitter.com/GabAndSil/status/1112527107782033409,2019-03-31,22:28:26
1112233748257484801,eu tô triste e tem mais de um ano que eu não vejo arrow mais  https://twitter.com/ArrowBR/status/1112218840157556736 …,https://twitter.com/GabAndSil/status/1112233748257484801,2019-03-31,03:02:44
1112141652175532032,Vou começar a arrumar só de ansiedade mesmo,https://twitter.com/GabAndSil/status/1112141652175532032,2019-03-30,20:56:47
1111945959225917442,"Bom dia, mundo",https://twitter.com/GabAndSil/status/1111945959225917442,2019-03-30,07:59:10
1111604879104135170,"Gente, aconteceu varias vezes essa noite de eu sonhar ainda sem estar dormindo completamente, e eu tinha consciência de que eu tava sonhando, e quando tudo começava a ficar ruim, eu me forçava a abrir o olho mas não conseguia mudar nada do sonho mesmo",https://twitter.com/GabAndSil/status/1111604879104135170,2019-03-29,09:23:50
1111603589280161792,"Então, tá na hora do boy aparecer já porque não quero ser a loca que casa com seis meses de namoro  Tirei 24!  https://www.buzzfeed.com/br/sarahaspler/doces-de-todas-as-cores-idade-casar?utm_source=dynamic&utm_campaign=bfsharetwitter&quiz_result=122509119_365987962#122509119&rid=365987962 …",https://twitter.com/GabAndSil/status/1111603589280161792,2019-03-29,09:18:42
1110924430321033216,"To parando pra pensar aqui, na faculdade ninguém chama ninguém por apelido  O mais perto que a gente tem disso é a Laura e Julia chamando todo mundo pelo nome que elas acham que as pessoas deveriam ter",https://twitter.com/GabAndSil/status/1110924430321033216,2019-03-27,12:19:58
1110763549461266432,A hora do sofrimento chegou  pic.twitter.com/BTRFtZw9pf,https://twitter.com/GabAndSil/status/1110763549461266432,2019-03-27,01:40:41
1110333306061631488,Gente alguém me recomenda um filme pra chorar que tenha no netflix?,https://twitter.com/GabAndSil/status/1110333306061631488,2019-03-25,21:11:03
1110165914870153216,o semestre nem começou direito e eu tô feliz porque já tenho 20 pontos em zoologia de graça,https://twitter.com/GabAndSil/status/1110165914870153216,2019-03-25,10:05:54
1109426678143639552,As pessoas que tem a coragem de falar que esse pinto é mixuruca nunca transaram na vida  https://twitter.com/tyIerocean/status/1108504861593796614 …,https://twitter.com/GabAndSil/status/1109426678143639552,2019-03-23,09:08:26
1109406314936127488,"Não u deveria ter acordado mais cedo, mas grazadeus que não acordei",https://twitter.com/GabAndSil/status/1109406314936127488,2019-03-23,07:47:31
1108911554936881154,"Eu não consigo falar mal nem de zueira, é muito hino mesmo",https://twitter.com/GabAndSil/status/1108911554936881154,2019-03-21,23:01:31
1108798105917550598,a hora hoje não tá passando por nada,https://twitter.com/GabAndSil/status/1108798105917550598,2019-03-21,15:30:43
1108546085646204932,meu deus como o Guilherme ficou lindo com a cabeça raspada,https://twitter.com/GabAndSil/status/1108546085646204932,2019-03-20,22:49:17
1108002511905001473,"e eu ainda não consegui ler nenhum dos textos, e, em vez de ir começar, eu tô aqui twittando as coisas",https://twitter.com/GabAndSil/status/1108002511905001473,2019-03-19,10:49:19
1108001535697534976,"não porque eu me importe com isso, mas é porque na hora que eu preciso, eu ODEIO ficar cobrando  nossa mas eu odeio MUITO",https://twitter.com/GabAndSil/status/1108001535697534976,2019-03-19,10:45:26
1107999090346991616,em meia hora eu tenho que ir arrumar já  meu deus o que eu fiz da minha vida pegando matéria a tarde e a noite,https://twitter.com/GabAndSil/status/1107999090346991616,2019-03-19,10:35:43
1107984335158853632,"Essas matérias que tem que ler 40 páginas pra aula me fodem demais  Eu mal tô conseguindo fazer as coisas depois da aula, quem dirá antes",https://twitter.com/GabAndSil/status/1107984335158853632,2019-03-19,09:37:05
1107961977236848640,"Posso colocar o despertador para a hora que for, eu só vou acordar 8h",https://twitter.com/GabAndSil/status/1107961977236848640,2019-03-19,08:08:14
1107600116364513280,"Se você estiver falando de quem eu tô pensando que é, questionando tudo, ao ponto de ser incoveniente, até ele perceber que todo mundo já duvida do que ele fala",https://twitter.com/GabAndSil/status/1107600116364513280,2019-03-18,08:10:20
1107413204118970368,"Todos eu não tenho, mas tenho até o 30, tipo  Falta a 9 e o 10 porque eu emprestei uma vez e sumiram com elas, e a 9 era minha favorita",https://twitter.com/GabAndSil/status/1107413204118970368,2019-03-17,19:47:37
1107340182351683586,Três da tarde e só fiz uma que todas os dois milhões de obrigações que eu tenho,https://twitter.com/GabAndSil/status/1107340182351683586,2019-03-17,14:57:27
1107281652127092736,"Tem cinco, na verdade",https://twitter.com/GabAndSil/status/1107281652127092736,2019-03-17,11:04:52
1107104857603870720,"TODO MUNDO faz aniversário em março, caralho",https://twitter.com/GabAndSil/status/1107104857603870720,2019-03-16,23:22:21
1106458142932697088,"Minha mãe é foda, acha que eu tô por conta das coisas dela. Ela sabia que eu ia precisar passar os negócios cedo, e as roupas ainda tão dentro da máquina",https://twitter.com/GabAndSil/status/1106458142932697088,2019-03-15,04:32:32
1106420160372662272,"Acho que vou fazer agora tudo que tenho que fazer pra amanhã, e durmo de manhã e a tarde",https://twitter.com/GabAndSil/status/1106420160372662272,2019-03-15,02:01:37
1106359659169042432,"Véi, se tem uma coisa que me irrita é ficar interrompendo os outros pra falar o que cê quer sem ligar pros outros",https://twitter.com/GabAndSil/status/1106359659169042432,2019-03-14,22:01:12
1105815899540467713,Que ódio,https://twitter.com/GabAndSil/status/1105815899540467713,2019-03-13,10:00:30
1104907428448124929,"Tem mais: - sou bom como dupla no truco - minha comida é até gostosa - cê vai ter o cunhado mais fofo do mundo - afinal de contas, eu sou um amor",https://twitter.com/GabAndSil/status/1104907428448124929,2019-03-10,21:50:33
1104719126445154304,É triste porque nenhuma quer me pegar também,https://twitter.com/GabAndSil/status/1104719126445154304,2019-03-10,09:22:19
1104102972944994310,Preciso continuar a ler mais tarde  https://twitter.com/firespyre/status/1103877181816496129 …,https://twitter.com/GabAndSil/status/1104102972944994310,2019-03-08,16:33:56
1104049304002531328,"Véi, o filme é melhor que a maioria das coisas que a Marvel já fez e parece que ninguém nunca fica satisfeito, puta que pariu",https://twitter.com/GabAndSil/status/1104049304002531328,2019-03-08,13:00:40
1104049106916388864,"Véi, o que eu vi muita gente falando é bem verdade  Quando um filme envolve qualquer tipo de representatividade, os fãs são extremamente mais exigentes e o filme tem que ser o melhor de todos",https://twitter.com/GabAndSil/status/1104049106916388864,2019-03-08,12:59:53
1103719381476040705,"Só prestam o cachorro quente e o buraco quente, o resto é caro, pequeno e não tão bom",https://twitter.com/GabAndSil/status/1103719381476040705,2019-03-07,15:09:41
1103709037546348545,"Tô morrendo de sono, sendo que dormi bastante, preocupado com tudo que tenho que fazer, com como vai ser o andamento das coisas agora, tá muito foda..",https://twitter.com/GabAndSil/status/1103709037546348545,2019-03-07,14:28:35
1102369294493589504,Essa conversa com os meninos ajudou mas também regassou muulito a minha cabeça,https://twitter.com/GabAndSil/status/1102369294493589504,2019-03-03,21:44:55
1101786205577007104,"Jesus o telefone não carregou durante a noite, e tenho uma hora e meia pra isso aaaaaaa",https://twitter.com/GabAndSil/status/1101786205577007104,2019-03-02,07:07:56
1101464654612705280,Estou fazendo planos de carnaval com todo mundo como se eu fosse conseguir ir kakdkkaksjss,https://twitter.com/GabAndSil/status/1101464654612705280,2019-03-01,09:50:12
1101441846637670401,"Se Shallow pegar #1, eu vou ser a poc mais feliz do mundo  Música com grammy, oscar, globo de ouro, #1 na billboard e bastante visualização no youtubr caralho",https://twitter.com/GabAndSil/status/1101441846637670401,2019-03-01,08:19:34
1101312969550499841,"Eu tava lá, mas na hora da confusão dei sorte que fui no banheiro da belas artes",https://twitter.com/GabAndSil/status/1101312969550499841,2019-02-28,23:47:28
1101307403600052225,"Gente, eu fico tão feliz de ver o pessoal reconhecendo a Gaga pelo talento que ela tem, é emocionante de ver isso",https://twitter.com/GabAndSil/status/1101307403600052225,2019-02-28,23:25:20
1099874487930155010,ESSA MULHER É A MAIS PRECISA DO MUNDO E SHALLOW É OFICIALMENTE A MÚSICA MAIS PREMIADA DA HISTÓRIA  SEGURA ESSA ACLAMAÇÃO CARALHOOOOOOO,https://twitter.com/GabAndSil/status/1099874487930155010,2019-02-25,00:31:27
1099867815119605760,"Aaaaaaa brigado, amor  Tô morrendo de saudade 💓💓",https://twitter.com/GabAndSil/status/1099867815119605760,2019-02-25,00:04:56
1099866149037182978,"Ela tá quase sempre com uma roupa ridícula, o meu amor",https://twitter.com/GabAndSil/status/1099866149037182978,2019-02-24,23:58:19
1099860394351443969,Ontem eu senti ciúmes a primeira vez e foi super estranho,https://twitter.com/GabAndSil/status/1099860394351443969,2019-02-24,23:35:27
1099859629750788097,Meia hora pra 19 aninhos,https://twitter.com/GabAndSil/status/1099859629750788097,2019-02-24,23:32:24
1099747068049006592,Vou pro sinal com os calouros 13h e vou pra lá depois  Tipo umas 15h,https://twitter.com/GabAndSil/status/1099747068049006592,2019-02-24,16:05:07
1099251319414480901,Ódio profundo de quem confirmou presença hoje e nào foi  Reservei 30 pessoas pra irem a metade  Contudo foi IN CRI VEL,https://twitter.com/GabAndSil/status/1099251319414480901,2019-02-23,07:15:12
1099033522822701062,Vamos começar a arrumação para a primeira comemoração do bday,https://twitter.com/GabAndSil/status/1099033522822701062,2019-02-22,16:49:45
1098060844187947008,Tudo que eu quero é que meu aniversário me deixe feliz igual os de 2016 e 2018 deixaram  Mas não sei né,https://twitter.com/GabAndSil/status/1098060844187947008,2019-02-20,00:24:40
1098059133763358721,"tô descobrindo pelos meus amigos que todo mundo faz aniversário perto de mim, sendo que eu nunca tinha visto alguém que fizesse aniversário perto de mim",https://twitter.com/GabAndSil/status/1098059133763358721,2019-02-20,00:17:53
1097998902329069569,"EU GOSTO ASSIM, COM ÓDIO",https://twitter.com/GabAndSil/status/1097998902329069569,2019-02-19,20:18:32
1097998454922641408,"SIM, VOCÊ E A @larissaguimars E A @Isabellacva E A @kaasoaress E O @bieelleao E A @Lagescarolinda E O @0Leon89 E MAIS TODO MUNDO QUE NÃO DISSE UM A",https://twitter.com/GabAndSil/status/1097998454922641408,2019-02-19,20:16:46
1097961631684968448,"Sei lá, eu tô puto com o ser humano, principalmente com os minions e grande parte dos LGBTs que tão sendo ridículos na internet com um monte de coisas",https://twitter.com/GabAndSil/status/1097961631684968448,2019-02-19,17:50:26
1097960466960273410,"Eu sei o quanto é péssimo isso tudo, porque o bostão lá quer a gente morto, mas uma coisa é verdade: nem todo mundo que votou nele é fascista, ou homofóbico, às vezes só é desinformado",https://twitter.com/GabAndSil/status/1097960466960273410,2019-02-19,17:45:49
1097959888351842304,"Uma coisa ela disse, e é verdade, muitas vezes a gente adora alguém, a pessoa faz algo que a gente discorda, mas ela não tem como controlar ninguém",https://twitter.com/GabAndSil/status/1097959888351842304,2019-02-19,17:43:31
1097860504318550016,Esqueci que tinha inglês ontem 👍  Que cabeça fudida,https://twitter.com/GabAndSil/status/1097860504318550016,2019-02-19,11:08:36
1097589469417533441,"Verdade, faltou",https://twitter.com/GabAndSil/status/1097589469417533441,2019-02-18,17:11:36
1097114554918670336,Avisei todo mundo sobre a mudança de lugar do bday e isso de encaminhar mensagem pra 130 pessoas cansa,https://twitter.com/GabAndSil/status/1097114554918670336,2019-02-17,09:44:27
1096251632034160643,Uma hora em casa e tanto tensão que nu,https://twitter.com/GabAndSil/status/1096251632034160643,2019-02-15,01:35:31
1095884431955554306,"Não, véi, o trabalho deles é julgar kkkkk e na primeira todo mundo é muito bonzinho ainda",https://twitter.com/GabAndSil/status/1095884431955554306,2019-02-14,01:16:23
1095883305256402945,"Gente façam a Lizzo acontecer, por favor, ela é incrível  https://twitter.com/lizzo/status/1081189488427057153 …",https://twitter.com/GabAndSil/status/1095883305256402945,2019-02-14,01:11:55
1095882858197995522,"Vai sim, é a coisa mais incrível do mundo",https://twitter.com/GabAndSil/status/1095882858197995522,2019-02-14,01:10:08
1095679240345931776,Menina tu vai começar a facul??,https://twitter.com/GabAndSil/status/1095679240345931776,2019-02-13,11:41:02
1095651900874260481,"Tô considerando pegar uma conta universitária no Spotify  O problema é que muitas músicas que eu ouço, tipo, a maioria do Glee, não tem no spotify",https://twitter.com/GabAndSil/status/1095651900874260481,2019-02-13,09:52:24
1095647692594782209,"Que é o maior evento do ano, é verdade  Cerveja grátis, nunca prometi 👀",https://twitter.com/GabAndSil/status/1095647692594782209,2019-02-13,09:35:40
1095523115508121603,"Meu deus que saudade de 2015, mesmo tendo sido extremamente sofrido e ter fudido com a minha cabeça kkkkkkk",https://twitter.com/GabAndSil/status/1095523115508121603,2019-02-13,01:20:39
1095517191791931393,Precisamos mesmo (mas rave não pelo amor de deus) Luv u 💜💜💜,https://twitter.com/GabAndSil/status/1095517191791931393,2019-02-13,00:57:06
1095516560658255872,"@kaasoaress cê é, com certeza, uma das pessoas mais engraçadas que eu conheço, não tem como não rir com você Cê fica linda de todo jeito, é aquele tipo de amiga que a gente sabe que tá lá com a gente em todos os momentos, é animadaaaassa  Te amo inclusive",https://twitter.com/GabAndSil/status/1095516560658255872,2019-02-13,00:54:36
1095515344058413056,"@claralunasb olha, cê é a pessoa mais carismática e amável que eu conheço, não existe ninguém que não goste do cê Cê é linda, forte pra caralho, uma das pessoas mais incríveis que eu já conheci, uma ouvinte incrível, super confiável Ai eu amo demais te ter na minha vida",https://twitter.com/GabAndSil/status/1095515344058413056,2019-02-13,00:49:46
1095514853052170242,"@jutzxl eu amo o quanto cê é aberta a conversar e conhecer as pessoas, cê rende qualquer papo e eu gostaria muito de conseguir fazer isso kkkk cê é uma amiga incrível, é linda, atenciosa, faz os melhores rolês do mundo, é inteligente pra caralho  Ai tem muita coisa",https://twitter.com/GabAndSil/status/1095514853052170242,2019-02-13,00:47:49
1095514048844783616,"@Ceci_pires vamos começar que cê tem o coração mais puro e bondoso que já passou nessa terra, cê tem zero de maldade no corpo real e isso é incrível Cê é uma das pessoas mais confiáveis que eu conheço e é tão dedicada às pessoas que cê gosta que nem parece real",https://twitter.com/GabAndSil/status/1095514048844783616,2019-02-13,00:44:37
1095513670292045824,"@_carneirobruna primeiramente sdds de tu Em segundo lugar, cê é linda demais, um amor de pessoa, é super animada e tá sempre com um sorriso incrível no rosto",https://twitter.com/GabAndSil/status/1095513670292045824,2019-02-13,00:43:07
1095513121651867648,"@emmerich_raissa cê é uma das pessoas mais fofas que eu já conheci, de verdade É um amorzão em um nível incrível",https://twitter.com/GabAndSil/status/1095513121651867648,2019-02-13,00:40:56
1095499674725826560,tem meia hora que eu saí do banho e eu já tô suando tanto,https://twitter.com/GabAndSil/status/1095499674725826560,2019-02-12,23:47:30
1095494623181574145,esse omelete foi uma das melhores coisas que eu já comi na minha vida,https://twitter.com/GabAndSil/status/1095494623181574145,2019-02-12,23:27:26
1095435359847174144,"@bieelleao cê é outro que é incrivelmente lindo, nem preciso falar nada Cê é bem mais mente aberta do que parece, e cê é calmo num nível que eu queria muito, acho que nunca vi cê ficar estressado  Pra ser perfeito falta só casar comigo, beijos",https://twitter.com/GabAndSil/status/1095435359847174144,2019-02-12,19:31:56
1095432419371614209,"@electricslag véi, cê é linda, vamos começar assim. Beleza de outro mundo, tipo. Cê é muito parecida comigo, quer elogio melhor? brinks Mas cê é um amor mesmo, tem uma animação e tá sempre bem disposta nos seus relacionamentos com as pessoas e eu amo isso",https://twitter.com/GabAndSil/status/1095432419371614209,2019-02-12,19:20:15
1095432017943191553,"@pqpfufu eu amo o quanto cê é forte e não tem noção disso, cê é engraçado pacas e eu te acho lindo num nível incrível  Além que cê também é muito inteligente e também não sabe disso",https://twitter.com/GabAndSil/status/1095432017943191553,2019-02-12,19:18:39
1095279839760781314,"parte pra diminuir o impacto ambiental porque acha que ""se só ele fizer, nada muda"".  A questão de falar sobre glitter e canudo é fazer o menos óbvio e conscientizar sobre coisas que as pessoas não sabem que tem o impacto que tem. Então vão tudo tomar no cu.",https://twitter.com/GabAndSil/status/1095279839760781314,2019-02-12,09:13:57
1095279837323976704,É visível que cês não entenderam NADA.  É óbvio que não é pra descartar nenhum tipo de lixo em qualquer lugar. Quem se preocupa em não usar canudo ou glitter pela conservação pensa nessas coisas óbvias em primeiro lugar. Quem não pensa é gente que não preocupa em fazer a sua  https://twitter.com/crausando/status/1094601344063819776 …,https://twitter.com/GabAndSil/status/1095279837323976704,2019-02-12,09:13:57
1095151691496869889,Ter cartão de crédito é comprar coisas na internet no impulso,https://twitter.com/GabAndSil/status/1095151691496869889,2019-02-12,00:44:44
1095151413066375168,Comprei 3 bermudas de viado por 100 reais agora e tô feliz,https://twitter.com/GabAndSil/status/1095151413066375168,2019-02-12,00:43:38
1095143692598431745,cê não humilhou ele falando em francês lá na hora e depois tacando-lhe um soco não?,https://twitter.com/GabAndSil/status/1095143692598431745,2019-02-12,00:12:57
1095059336370573312,"Isso foi muito real, a RuPaul tava querendo manter a Latrice a todo custo, só que agora os fãs tomaram ódio da Latrice por ter eliminado a Valentina e por não ter pedido pra sair no lugar da Manila (o que não faz o menor sentido)",https://twitter.com/GabAndSil/status/1095059336370573312,2019-02-11,18:37:45
1095059080660635648,Já tá na Internet a ordem de eliminação da season 11 e falta um mês pra começar,https://twitter.com/GabAndSil/status/1095059080660635648,2019-02-11,18:36:44
1095058183071166465,"Tem umas coisas que são reais, mas nos all stars, por exemplo, a RuPaul sabe quem pegou qual batom e vence o lipsync quem for eliminar quem a produção quer 🤷",https://twitter.com/GabAndSil/status/1095058183071166465,2019-02-11,18:33:10
1095057880246599682,"O ruim são só os spoilers, e tá impossível fugir deles  Eu já sei que é o top 2 da temporada antes mesmo dela começar",https://twitter.com/GabAndSil/status/1095057880246599682,2019-02-11,18:31:58
1094814002956455938,"Pra ficar perfeito, Shallow vem ganhar ROTY",https://twitter.com/GabAndSil/status/1094814002956455938,2019-02-11,02:22:53
1094811281184514048,"Tô pensando aqui, um monte de gente veio falar comigo ontem e eu não tenho a menor ideia de quem foi",https://twitter.com/GabAndSil/status/1094811281184514048,2019-02-11,02:12:04
1094776018437586945,Ah vai ter no Oscar  E vai ser perfeito de todo jeito Só que era pra ela ter levado song of the year,https://twitter.com/GabAndSil/status/1094776018437586945,2019-02-10,23:51:57
1094774802282434560,Triste,https://twitter.com/GabAndSil/status/1094774802282434560,2019-02-10,23:47:07
1094774471259508737,Tô bem triste  https://twitter.com/RDTLadyGaga/status/1094774328183455745 …,https://twitter.com/GabAndSil/status/1094774471259508737,2019-02-10,23:45:48
1094769265650122752,Cês não tem noção do quanto eu tô feliz  NOVE GRAMMYS AAAAAAAA,https://twitter.com/GabAndSil/status/1094769265650122752,2019-02-10,23:25:07
1094748249473339405,"vou parar de falar, imagina se ela não ganha",https://twitter.com/GabAndSil/status/1094748249473339405,2019-02-10,22:01:36
