id,tweet,link,date,time
824428631225225216,"eu deveria parar de ficar reclamando no tt, mas aqui é o único lugar que eu posso falar as coisas agora, então, não, eu não vou parar",https://twitter.com/GabAndSil/status/824428631225225216,2017-01-25,23:27:57
824428234825687041,"na verdade, o primeiro semestre de ano ímpar é sempre horrível, então eu ainda tenho muito o que apanhar até julho",https://twitter.com/GabAndSil/status/824428234825687041,2017-01-25,23:26:22
824427121980366848,sabe quando você começa a chorar de nervoso por causa das coisas que tão acontecendo?,https://twitter.com/GabAndSil/status/824427121980366848,2017-01-25,23:21:57
824053299951370240,"o quanto antes, pelo amor de deus",https://twitter.com/GabAndSil/status/824053299951370240,2017-01-24,22:36:31
824053117893410817,"eu to muito feliz porque eu finalmente encontrei no tt uma pessoa que eu estava procurando há anos, obrigado jesus",https://twitter.com/GabAndSil/status/824053117893410817,2017-01-24,22:35:48
823645274073612291,"GENTE ME PERGUNTEM COISAS, PELO AMOR DE DEUS  https://curiouscat.me/111467145 ",https://twitter.com/GabAndSil/status/823645274073612291,2017-01-23,19:35:10
823317841856360448,nossa que tipo de pergunta é essa todo mundo sabe das treta,https://twitter.com/GabAndSil/status/823317841856360448,2017-01-22,21:54:04
823300923363561473,"FICOU MUITO BOM, PELO AMOR DE DEUS",https://twitter.com/GabAndSil/status/823300923363561473,2017-01-22,20:46:50
822985715810238465,"minha mãe ficou tipo ""????"" quando eu falei pra ela dentro do avião que já tava falando sobre os crush com a giovanna",https://twitter.com/GabAndSil/status/822985715810238465,2017-01-21,23:54:19
822985245653946368,"to feliz porque meu anel do reverso chegou em curitiba ontem, ou seja, se a receita liberar logo, pode ser que chegue ainda nessa semana",https://twitter.com/GabAndSil/status/822985245653946368,2017-01-21,23:52:27
822970049145241601,"porque isso vai me lembrar que eu não sou bonito, eu não namoro, eu não estou mais viajando e eu não sou rico",https://twitter.com/GabAndSil/status/822970049145241601,2017-01-21,22:52:04
822969934317842436,"coisas que eu não posso ver na próxima semana: gente bonita, gente que namora, gente que tá viajandl, gente rica",https://twitter.com/GabAndSil/status/822969934317842436,2017-01-21,22:51:37
822877011110744068,tô indo embora e tô bem triste por isso,https://twitter.com/GabAndSil/status/822877011110744068,2017-01-21,16:42:22
822772977683091458,crushzão e boy da encarada foram embora e eu to bem triste,https://twitter.com/GabAndSil/status/822772977683091458,2017-01-21,09:48:58
822762119611424772,"a gente ia falar com o terceiro bot, que foi o qe rolou aquela encarada fudida, mas ele sumiu bem na hora",https://twitter.com/GabAndSil/status/822762119611424772,2017-01-21,09:05:50
822761798151577600,"obviamente, eu não fui, mas aí o Lucas e a Giovanna foram falar com ele e com o outro crushzinho",https://twitter.com/GabAndSil/status/822761798151577600,2017-01-21,09:04:33
822761655167840256,ontem eu bebi um pouquinho e prometi que ia falar com o boy que é o crushzão mesmo,https://twitter.com/GabAndSil/status/822761655167840256,2017-01-21,09:03:59
822254581631614976,"As pessoas deveriam ser mais altruístas, de gente egoísta o mundo tá cheio, né non",https://twitter.com/GabAndSil/status/822254581631614976,2017-01-19,23:29:03
822233864584253440,"não consigo, tem coisas que fodem com o emocional da gente pra valer",https://twitter.com/GabAndSil/status/822233864584253440,2017-01-19,22:06:44
822232866654396418,"as pessoas não entendem que algumas coisas que, pra elas, são besteiras, podem me machucar demais",https://twitter.com/GabAndSil/status/822232866654396418,2017-01-19,22:02:46
822232454119456768,"to muito triste porque, até então, eu não vou pra baladinha lá de hoje",https://twitter.com/GabAndSil/status/822232454119456768,2017-01-19,22:01:08
822218164989792260,"véi, ninguém tentou falar com o que a gente vih hoje, acho que ele tá na noite italiana lá, mas não sei",https://twitter.com/GabAndSil/status/822218164989792260,2017-01-19,21:04:21
820130200335904772,"QEM É ESSE @MARAVILHOSO QUE EU MARQUEI, hein",https://twitter.com/GabAndSil/status/820130200335904772,2017-01-14,02:47:31
818927592489230336,"véi, sabe como é ruim querer falar algumas coisas mas não ter pra quem falar e ter que recorrer ao twitter? Não é legal",https://twitter.com/GabAndSil/status/818927592489230336,2017-01-10,19:08:47
818623704590585857,"o meu acontecia toda hora, com o tempo volta",https://twitter.com/GabAndSil/status/818623704590585857,2017-01-09,23:01:15
818623572235218944,sabe quando você quir twittar alguma coisa e depois desiste pensando o quanto infantil seria falar isso aqui? Pois é,https://twitter.com/GabAndSil/status/818623572235218944,2017-01-09,23:00:43
817946392316571648,eu podia agorinha mesmo fuder mais ainda com as coisas e ser mais bosta do que já sou chamando essas pessoas pra conversar,https://twitter.com/GabAndSil/status/817946392316571648,2017-01-08,02:09:51
817945271485300736,acabei de apagar um tweet por achar que aquele @ não gostaria do que eu ia falar,https://twitter.com/GabAndSil/status/817945271485300736,2017-01-08,02:05:24
817938794250911744,"eu preciso desesperadamente que as aulas voltem, pelo amor de deus",https://twitter.com/GabAndSil/status/817938794250911744,2017-01-08,01:39:39
817928380087758849,só que a 1 da manhã de domingo eu não consigo ninguém pra falar,https://twitter.com/GabAndSil/status/817928380087758849,2017-01-08,00:58:16
817923752226910213,"e tipo: ""sera que é estranho eu ficar falando muito de álcool e fica parecendo que eu quero só aparecer?""",https://twitter.com/GabAndSil/status/817923752226910213,2017-01-08,00:39:53
817923630139056128,"to tipo: ""será que as pessoas vão achar muito dramático eu ficar falando como me sinto no tt?""",https://twitter.com/GabAndSil/status/817923630139056128,2017-01-08,00:39:24
817923499281027072,to naquela fase das férias que eu tento impressionar todo mundo pra me sentir menos sozinho,https://twitter.com/GabAndSil/status/817923499281027072,2017-01-08,00:38:53
817704557593694208,eu fiquei bem triste por lembrar que a Mari e a Karol não vão hoje,https://twitter.com/GabAndSil/status/817704557593694208,2017-01-07,10:08:53
817549241677737984,véi as meninas tem que fazer com que o dia de amanhã seja o melhor da vida,https://twitter.com/GabAndSil/status/817549241677737984,2017-01-06,23:51:43
817545305696731136,"tipo, eu tava vendo fotos do 2C e tipo, ""nossa eu amo demais esse pessoal, melhor turma""",https://twitter.com/GabAndSil/status/817545305696731136,2017-01-06,23:36:04
817544904092119040,eu notei agora o quanto eu costumo me inserir em coisas que eu não tenho NADA A VER,https://twitter.com/GabAndSil/status/817544904092119040,2017-01-06,23:34:29
817527592442064897,É muito ruim estar triste por causa de uma pessoa e essa pessoa também estar triste só que por outro motivo,https://twitter.com/GabAndSil/status/817527592442064897,2017-01-06,22:25:41
817471024941977600,"com isso, fica decretado eu só vou ver a Ciça quando as aulas voltarem mesmo, ou seja, tô triste",https://twitter.com/GabAndSil/status/817471024941977600,2017-01-06,18:40:54
816808915862228992,"é muito estranho ver um gay acreditanto na fragilidade da heterossexualidade igual aos héteros, como se umas coisinhas super bobas",https://twitter.com/GabAndSil/status/816808915862228992,2017-01-04,22:49:55
816806319734722561,"véi agora eu sei como é o sentimento de realmente odiar alguém, nunca tinha passado por isso",https://twitter.com/GabAndSil/status/816806319734722561,2017-01-04,22:39:36
816803092767313921,"véi que que esse menino tá fazendo to entendendo é nada, pelo amor de deus, pra que isso",https://twitter.com/GabAndSil/status/816803092767313921,2017-01-04,22:26:47
816797605854412800,"véi o andré e o caio são muito parecidos e eu quero de novo, pelo amor de deus, maravilhosos demais",https://twitter.com/GabAndSil/status/816797605854412800,2017-01-04,22:04:59
816432853772857345,"eu não quero ter que pensar em apresentação do senac agora, pelo amor de deus, POLIANA ME DEIXA EM PAZZZZZ",https://twitter.com/GabAndSil/status/816432853772857345,2017-01-03,21:55:35
816431191582765056,"esse foi meu momento draminha, as coisas não são assim não, nem a minha autoestima é tão baixa",https://twitter.com/GabAndSil/status/816431191582765056,2017-01-03,21:48:59
816430125604597765,"tô lá, sempre a disposição, o primeiro da fila, só que todo mundo escolhe simplesmente ignorar e ir comendo os outros",https://twitter.com/GabAndSil/status/816430125604597765,2017-01-03,21:44:45
813867104030035968,"véi, faz muito tempo que eu não choro por coisas ""distantes"" a mim",https://twitter.com/GabAndSil/status/813867104030035968,2016-12-27,20:00:13
813540925980999680,crush tá me ignorando no facebook e eu to muito triste,https://twitter.com/GabAndSil/status/813540925980999680,2016-12-26,22:24:06
813096394298916864,"tem momentos, tipo agora, que eu gostaria de chegar nas pessoas que eu amo e dizer um belo eu te amo, só que as pessoas acham isso estranho",https://twitter.com/GabAndSil/status/813096394298916864,2016-12-25,16:57:41
812913633466454016,aproveitem que eu tô levemente álcoolizado e me façam perguntas no curiouscat eu respondo tudo pelo amor de satã,https://twitter.com/GabAndSil/status/812913633466454016,2016-12-25,04:51:28
812839130291904512,"Os cuzão aqui deixa nem os meninos brincar, pelo amor de deus",https://twitter.com/GabAndSil/status/812839130291904512,2016-12-24,23:55:25
812838186913320962,QUE ODIO DE UM DESSES FILHOS DO DIABO QUE ME BATEU AQUI TOMAE NO CU,https://twitter.com/GabAndSil/status/812838186913320962,2016-12-24,23:51:40
812833495856844800,@taynamc quando for a hora de comer tu me chama?,https://twitter.com/GabAndSil/status/812833495856844800,2016-12-24,23:33:01
812755464542912513,"O q tem a dizer sobre pessoas q são gays ou bi poré... — tipo, eu entendo essas pessoas e tals, porque é mui...  https://curiouscat.me/111467145/post/60204622?t=1482610977 …",https://twitter.com/GabAndSil/status/812755464542912513,2016-12-24,18:22:57
812745867283275780,"gente vamos falar sobre o episódio de sense8, não comentei com ninguém ainda",https://twitter.com/GabAndSil/status/812745867283275780,2016-12-24,17:44:49
812470120207548416,"normal, sempre tá uma merda, foi bom tipo uma vez",https://twitter.com/GabAndSil/status/812470120207548416,2016-12-23,23:29:06
812396456334282758,"Eu odeio ele mas eu amo também. Extremamente imaturo e irresponsável, mas é um amor de pessoa. Meio volátil, mas é uma boa pessoa",https://twitter.com/GabAndSil/status/812396456334282758,2016-12-23,18:36:23
812092717689950208,Isso ficou na minha cabeça o dia inteiro  https://twitter.com/dragliciouz/status/812091579657834500 …,https://twitter.com/GabAndSil/status/812092717689950208,2016-12-22,22:29:26
812026562505740289,eu to bem ansioso pra esse negócio com o marcos amanhã mesmo sabendo que as chances de eu ir são quase nulas,https://twitter.com/GabAndSil/status/812026562505740289,2016-12-22,18:06:33
811919492708241408,Gente eu nào to bem é amanha ai meu deus  https://twitter.com/sense8dadepre/status/811908162110402561 …,https://twitter.com/GabAndSil/status/811919492708241408,2016-12-22,11:01:06
811755252722630656,gente pelo amor de deus me ajuda não pode c,https://twitter.com/GabAndSil/status/811755252722630656,2016-12-22,00:08:28
811749900941660160,"gente eu to aqui ouvindo 50 reais a essa hora da noite (pra mim é muito tarde, tá) e eu nem gosto de sertanejo",https://twitter.com/GabAndSil/status/811749900941660160,2016-12-21,23:47:12
811738345944600577,"Você se considera uma pessoa de bom coração e que v... — eu me considero uma pessoa boa, e odeio ser ruim em...  https://curiouscat.me/111467145/post/58910595?t=1482368477 …",https://twitter.com/GabAndSil/status/811738345944600577,2016-12-21,23:01:17
811736873077014528,aquele remix do vídeo da panificadora alfa não sai da minha cabeça,https://twitter.com/GabAndSil/status/811736873077014528,2016-12-21,22:55:26
811727339184865280,"oi amor, sdds — oi amor sdds  https://curiouscat.me/111467145/post/58888239?t=1482365853 …",https://twitter.com/GabAndSil/status/811727339184865280,2016-12-21,22:17:33
811173703073615873,"coração bom ele tem, mas ele não é capaz de se apaixonar por alguém",https://twitter.com/GabAndSil/status/811173703073615873,2016-12-20,09:37:36
810490491120877568,"somo dois, amor",https://twitter.com/GabAndSil/status/810490491120877568,2016-12-18,12:22:45
800324893770444800,Só queria expressar aqui meu amor pelo @AaronTveit e pelo @ryanmccartan,https://twitter.com/GabAndSil/status/800324893770444800,2016-11-20,11:08:18
794377350238654464,"Eu não aguento mais ver a Lily morrendo, pelo amor de deus",https://twitter.com/GabAndSil/status/794377350238654464,2016-11-04,01:14:53
794377262116327424,Todo mundo sabe que quem vai ficar viva no final vai ser a Audrey,https://twitter.com/GabAndSil/status/794377262116327424,2016-11-04,01:14:32
791411252245491712,eu sou a melhor pessoa do mundo,https://twitter.com/GabAndSil/status/791411252245491712,2016-10-26,20:48:40
791072809527238657,"Engraçado, em todos os álbuns da Gaga, com excessão do The Fame, minha música favorita é o 2º single",https://twitter.com/GabAndSil/status/791072809527238657,2016-10-25,22:23:49
790325539148038144,"É hipócrita falar isso, porque eu faço isso às vezes",https://twitter.com/GabAndSil/status/790325539148038144,2016-10-23,20:54:26
785631617419190272,Me ensinem a parar de me sentir um lixo por coisas que não são minha culpa,https://twitter.com/GabAndSil/status/785631617419190272,2016-10-10,21:02:28
785113018812264448,"Eu fico tão chateado de ler algumas coisas aqui, e tão feliz de ler outras...",https://twitter.com/GabAndSil/status/785113018812264448,2016-10-09,10:41:45
773328344075137024,"Gente, se o Senac misteriosamente pegar fogo com todo mundo dentro, fui eu",https://twitter.com/GabAndSil/status/773328344075137024,2016-09-06,22:13:39
772397222545747968,GAME OF THRONES É A MELHOR SÉRIE DESSE MUNDO,https://twitter.com/GabAndSil/status/772397222545747968,2016-09-04,08:33:42
770734363491307522,É estranho vir na psicóloga e não ter ideia do que falar,https://twitter.com/GabAndSil/status/770734363491307522,2016-08-30,18:26:06
764257844979961857,"Vou na loja pedir meu reembolso amanhã, afinal NÃO PAGUEI 580 REIAS POR UM TELEFONE COM TOUCH TRAVANDO E BATERIA QUE ACABA EM 1 HORA",https://twitter.com/GabAndSil/status/764257844979961857,2016-08-12,21:30:44
762810338282790912,migo me explica o que aconteceu com você pelo amor de deus,https://twitter.com/GabAndSil/status/762810338282790912,2016-08-08,21:38:51
762463208426700800,A vida fica tão mais fácil depois que a gente admite algumas coisas,https://twitter.com/GabAndSil/status/762463208426700800,2016-08-07,22:39:29
747910359600758785,Já faz meia hora que começou o horário de minha sessão,https://twitter.com/GabAndSil/status/747910359600758785,2016-06-28,18:51:39
746483031775584256,Vocês não têm noção do quanto eu to ansioso pra amanhã,https://twitter.com/GabAndSil/status/746483031775584256,2016-06-24,20:19:58
727299258194485248,vou dormir porque é capaz de ter mais desgraça se eu continuar acordado,https://twitter.com/GabAndSil/status/727299258194485248,2016-05-02,21:50:30
726934642230747138,@claralunasb imaginei que isso fosse acontecer,https://twitter.com/GabAndSil/status/726934642230747138,2016-05-01,21:41:39
726932174381961217,"@claralunasb tô bem, amor.J já ri bastante das coisas de ontem, inclusive.",https://twitter.com/GabAndSil/status/726932174381961217,2016-05-01,21:31:50
724286565447532545,Sobre a família do meu pai: todo mundo legal e educado até o momento em que tem comida de graça,https://twitter.com/GabAndSil/status/724286565447532545,2016-04-24,14:19:08
721820901159890944,"parem de falar em Deus, aí não é lugar pra isso, queridos",https://twitter.com/GabAndSil/status/721820901159890944,2016-04-17,19:01:28
721820344630296577,"gente, pelo amor de deus, assim não dá",https://twitter.com/GabAndSil/status/721820344630296577,2016-04-17,18:59:15
716224211111555072,"@bieelleao migo, eu, Lucas e Gi prometemos virar. Deu onze horas e já tava todo mundo apagado",https://twitter.com/GabAndSil/status/716224211111555072,2016-04-02,08:22:13
706290735700692992,Lembrar do gosto de Catuaba ou Skol Beats me dá vontade de vomitar,https://twitter.com/GabAndSil/status/706290735700692992,2016-03-05,22:30:08
701443897503956992,@pqpfulvius não fica triste,https://twitter.com/GabAndSil/status/701443897503956992,2016-02-21,13:30:32
697586325806047232,Eu só queria chorar muito agora,https://twitter.com/GabAndSil/status/697586325806047232,2016-02-10,23:01:55
697586187867918336,É aquele tipo de coisa que tem o poder de destruir o dia,https://twitter.com/GabAndSil/status/697586187867918336,2016-02-10,23:01:22
694367622322917376,E queria também entender o que se passa na cabeça de quem escreve autista com L,https://twitter.com/GabAndSil/status/694367622322917376,2016-02-02,01:51:56
694367532724125697,Eu queria entender o que se passa na cabeça de alguém que diz que outra pessoa é autista simplesmente pelo fato dessa pessoa estar distraída,https://twitter.com/GabAndSil/status/694367532724125697,2016-02-02,01:51:35
693388265915826176,"Mandaram a carta por engano, que triste",https://twitter.com/GabAndSil/status/693388265915826176,2016-01-30,09:00:19
692720936106225664,"Passou da hora, né amores  https://twitter.com/g1/status/692717266836852737 …",https://twitter.com/GabAndSil/status/692720936106225664,2016-01-28,12:48:35
692556322517209090,"Eu fico pensando, ficar alguns meses no CSA me trouxe algumas coisas boas",https://twitter.com/GabAndSil/status/692556322517209090,2016-01-28,01:54:29
692204333052620800,o erro começa no momento em@que você tem que ser corajoso pra ser quem você é e ser feliz,https://twitter.com/GabAndSil/status/692204333052620800,2016-01-27,02:35:48
692203968177573889,"Talvez, no mundo em que a gente vive, a vida seria mais fácil sendo hétero mesmo",https://twitter.com/GabAndSil/status/692203968177573889,2016-01-27,02:34:21
692203840662274048,mas ouvir gente dizendo que todo mundo tinha que ser hétero é demais,https://twitter.com/GabAndSil/status/692203840662274048,2016-01-27,02:33:50
692203751562711044,não que eu ache que todo mundo tem que ser bi (acho que seria legal caso isso fosse algo natural),https://twitter.com/GabAndSil/status/692203751562711044,2016-01-27,02:33:29
692203068788727814,eu queria viver em um mundo em que não fosse necessários os gays se assumirem e os héteros simplesmente serem,https://twitter.com/GabAndSil/status/692203068788727814,2016-01-27,02:30:46
692201847059288065,"quando eu paro pra pensar nisso, me dá muita vontade de chorar",https://twitter.com/GabAndSil/status/692201847059288065,2016-01-27,02:25:55
692200536452534272,eu fico encabulado com umas coisas tão óbvias que as pessoas não conseguem perceber,https://twitter.com/GabAndSil/status/692200536452534272,2016-01-27,02:20:43
692128871022510080,tem hora que eu não suporto a infantilidade do meu pai,https://twitter.com/GabAndSil/status/692128871022510080,2016-01-26,21:35:56
691828343981916160,"@pqpfulvius até eu beijei, pelo amor",https://twitter.com/GabAndSil/status/691828343981916160,2016-01-26,01:41:45
691824045264887809,definitivamente o Matt Bomer é a pessoa mais linda desse mundo,https://twitter.com/GabAndSil/status/691824045264887809,2016-01-26,01:24:40
691011965611827200,E olha que eu ainda não chamei todo mundo,https://twitter.com/GabAndSil/status/691011965611827200,2016-01-23,19:37:45
690141567651287041,"O homi tem 38 anos e dois filhos pra criar, pelo amor de deus",https://twitter.com/GabAndSil/status/690141567651287041,2016-01-21,09:59:06
688197487518040066,"@karol_soaress você tem seu homi, ele te ama, seja feliz com isso",https://twitter.com/GabAndSil/status/688197487518040066,2016-01-16,01:14:01
687428170933497859,Amo a karol tipo mt vei,https://twitter.com/GabAndSil/status/687428170933497859,2016-01-13,22:17:02
687115348118745088,@claralunasb sdds desse sentimento de não saber quem vai ser da minha sala,https://twitter.com/GabAndSil/status/687115348118745088,2016-01-13,01:33:59
686763183672029184,"eu queria muito saber se eu já fiz muito mal pra alguém, porque tipo eu gostaria que as pessoas que me fazem mal soubessem",https://twitter.com/GabAndSil/status/686763183672029184,2016-01-12,02:14:37
686710189563707392,Nomi meu amor ❤️  pic.twitter.com/qfrD7Z3Uj6,https://twitter.com/GabAndSil/status/686710189563707392,2016-01-11,22:44:02
686378608072495104,CARALHOOOOOOO GENTE EU TÔ MUITO FELIZ PELO AMOR DE DEUS EU TÔ PULANDO AQUI ME AJUDA SENHOR,https://twitter.com/GabAndSil/status/686378608072495104,2016-01-11,00:46:27
685285800146239488,"Tipo, no próximo episódio, vai ter a Billie Jean e tem a Sally, e são a mesma pessoa",https://twitter.com/GabAndSil/status/685285800146239488,2016-01-08,00:24:01
685281556861157377,"Eu queria que a Condessa ficasse viva, matasse todo mundo e ficasse com o Holden no final",https://twitter.com/GabAndSil/status/685281556861157377,2016-01-08,00:07:09
684945034081337344,"Meu deus, que dor de cabeça do capeta que é essa?",https://twitter.com/GabAndSil/status/684945034081337344,2016-01-07,01:49:56
683863541682728960,será que chegará o dia em que eu vou conseguir ouvir I Know Were I've Been sem entrar em desespero e chorar sem parar?,https://twitter.com/GabAndSil/status/683863541682728960,2016-01-04,02:12:28
683859939601809409,só a verdade  pic.twitter.com/eYZCkA9IbG,https://twitter.com/GabAndSil/status/683859939601809409,2016-01-04,01:58:09
683392880107479041,tô com muto ódio agora,https://twitter.com/GabAndSil/status/683392880107479041,2016-01-02,19:02:14
683353513171267586,"engraçado, a maioria das pessoas, no ano novo, promete ser uma pessoa melhor",https://twitter.com/GabAndSil/status/683353513171267586,2016-01-02,16:25:48
683330556680122369,"@bieelleao vai sim e me leva, pelo amor de deus",https://twitter.com/GabAndSil/status/683330556680122369,2016-01-02,14:54:35
683103983884496896,"Estou assistindo um parto de cachorro, que lindo",https://twitter.com/GabAndSil/status/683103983884496896,2016-01-01,23:54:15
682666440793690112,tô com muita vontade de conversar com minha mãe agora sobre as coisas da vida mas tá faltando coragem,https://twitter.com/GabAndSil/status/682666440793690112,2015-12-31,18:55:37
682383352230457344,"É estranho isso, mas esse ano foi tão ruim que eu espero e acredito que as coisas podem mudar de um dia pro outro na virada",https://twitter.com/GabAndSil/status/682383352230457344,2015-12-31,00:10:43
682275374798139392,Vou começar a ver OITNB agora,https://twitter.com/GabAndSil/status/682275374798139392,2015-12-30,17:01:40
681687232042942464,exceto pela tarde de sábado e quinta de 20 às 22,https://twitter.com/GabAndSil/status/681687232042942464,2015-12-29,02:04:35
681617996897497089,"hoje eu vou ver rocky horror e amanhã, funny girl",https://twitter.com/GabAndSil/status/681617996897497089,2015-12-28,21:29:28
681575444576100355,"@claralunasb vou começar ainda, sem spoiler",https://twitter.com/GabAndSil/status/681575444576100355,2015-12-28,18:40:23
681575271443656705,Sobre a tarde de hoje: recaída,https://twitter.com/GabAndSil/status/681575271443656705,2015-12-28,18:39:42
681288644477501440,eu queria muito conseguir ver esse filme sem chorar tanto,https://twitter.com/GabAndSil/status/681288644477501440,2015-12-27,23:40:45
681274024933113856,resolvi ver as vantagens de ser invisível pela milésima vez; meia hora de filme e eu já tô chorando af,https://twitter.com/GabAndSil/status/681274024933113856,2015-12-27,22:42:39
680951805359067136,"sobre hoje: a tarde, uma maravilha, a noite, uma merda",https://twitter.com/GabAndSil/status/680951805359067136,2015-12-27,01:22:16
680874731814424580,muitas coisas em comum queria conhecer melhor mas não rolou fiz merda que não deveria e deu um conselho muito bom só me fodo por não seguir,https://twitter.com/GabAndSil/status/680874731814424580,2015-12-26,20:16:00
680523489657360384,eu acho muito engraçado o fato de eu ter muitos amigos e não ter nada em comum com a grande maioria deles,https://twitter.com/GabAndSil/status/680523489657360384,2015-12-25,21:00:18
679507908401475584,"eu sinto que vou explodir com algumas coisas, igual quando eu pensei em matar a bianca, sorte que passou",https://twitter.com/GabAndSil/status/679507908401475584,2015-12-23,01:44:44
679481995190267905,eu estou desesperado chamando gente pra ir pra liba amanhã,https://twitter.com/GabAndSil/status/679481995190267905,2015-12-23,00:01:46
678538869055336451,@bia_rodriguesd @taynamc mas ainda vou ser amor,https://twitter.com/GabAndSil/status/678538869055336451,2015-12-20,09:34:07
677560107136376833,"agora, eu vou tentar falar tudo que eu quero e foda-se o resto",https://twitter.com/GabAndSil/status/677560107136376833,2015-12-17,16:44:52
676749490209103872,"@camillaconti tu bem que podia me encontrar hoje, fico mais de uma hora atoa no pátio",https://twitter.com/GabAndSil/status/676749490209103872,2015-12-15,11:03:46
674440011757002752,"O que eu tô fazendo acordado, meu deus? Tenho prova amanhã",https://twitter.com/GabAndSil/status/674440011757002752,2015-12-09,02:06:43
672614444661415936,"Eu queria estar dormindo, mas o amor por AHS é maior",https://twitter.com/GabAndSil/status/672614444661415936,2015-12-04,01:12:34
