id,tweet,link,date,time
934587722890665984,Queria ser uma pessoa mais legal,https://twitter.com/GabAndSil/status/934587722890665984,2017-11-25,23:00:51
934362864479100929,"Dia hoje começou bacana, acordei com a voz melhor e cheguei no ponto e o ônibus passou em menos de um minuto",https://twitter.com/GabAndSil/status/934362864479100929,2017-11-25,08:07:21
934184705267728384,PUTA MERDA NUNCA VOU ENTENDER ESSES DOIS QUE SE AMAM E SÓ SABEM XINGAR UM AO OUTRO,https://twitter.com/GabAndSil/status/934184705267728384,2017-11-24,20:19:24
934160197249101826,"amigos, comprem rifa comigo, R$2, o prêmio é um jantar pra dois no Baby Beef, vamo me ajudarrrr",https://twitter.com/GabAndSil/status/934160197249101826,2017-11-24,18:42:01
934140271440400386,"Amigos, se vocês quiserem ir no BK hoje por causa da promoção da Balck Friday, não percam seu tempo. Nenhuma loja de BH tá participando, viu.",https://twitter.com/GabAndSil/status/934140271440400386,2017-11-24,17:22:50
933854894376869890,"Tô muito puto com isso tudo que ta acontecendo, mas eu jamais vou deixar de valorizar as minhas amizades e as pessoas que eu gosto",https://twitter.com/GabAndSil/status/933854894376869890,2017-11-23,22:28:51
933411527696289798,"Minha ansiedade pro dia 10 não podia ser maior, viu",https://twitter.com/GabAndSil/status/933411527696289798,2017-11-22,17:07:04
933358039008194560,Quero ser a Luisa Pedrosa um dia,https://twitter.com/GabAndSil/status/933358039008194560,2017-11-22,13:34:32
932771792686669824,ALGUÉM TIRA ESSA MERDA DE TROPICÁLIA DA MINHA CABEÇ,https://twitter.com/GabAndSil/status/932771792686669824,2017-11-20,22:45:00
932699938223480833,"Tò na merda, tava contando com essa sala pra poder praticar, to na merda, viu",https://twitter.com/GabAndSil/status/932699938223480833,2017-11-20,17:59:28
932511614481436672,O céu tá num tom de vermelho que me faz sentir em Stranger Things,https://twitter.com/GabAndSil/status/932511614481436672,2017-11-20,05:31:08
932472855660564480,"Eu fiz muita merda mesmo, viu",https://twitter.com/GabAndSil/status/932472855660564480,2017-11-20,02:57:07
932472061729148930,"Puta merda, Matheus",https://twitter.com/GabAndSil/status/932472061729148930,2017-11-20,02:53:58
932401232408432640,É normal sentir saudade de gente que você viu ontem?,https://twitter.com/GabAndSil/status/932401232408432640,2017-11-19,22:12:31
932379135082721280,Odeio gente sem noçã que menospreza o trabalho do outro,https://twitter.com/GabAndSil/status/932379135082721280,2017-11-19,20:44:43
932373706546008065,"Não acredito que o meu almoço me fez mal, que inferno",https://twitter.com/GabAndSil/status/932373706546008065,2017-11-19,20:23:08
931915784531652609,Odeio vocês por me deixarem de fora de momentos assim,https://twitter.com/GabAndSil/status/931915784531652609,2017-11-18,14:03:31
931546753056243712,Meu sono nãocme deixa levantar da cadeira pra ir pagar a conta,https://twitter.com/GabAndSil/status/931546753056243712,2017-11-17,13:37:07
931312668832493568,Eu não aguento mais de sono,https://twitter.com/GabAndSil/status/931312668832493568,2017-11-16,22:06:57
930582672128331777,"Chamei 52 pessoas pra ir me ver no festival e cheguei a conclusão de que eu não sei a definição do termo ""alguns""",https://twitter.com/GabAndSil/status/930582672128331777,2017-11-14,21:46:13
929657568213065730,Eu juro pro cês que a única coisa de matemática que eu não sei é PA e PG e só me falta cair isso,https://twitter.com/GabAndSil/status/929657568213065730,2017-11-12,08:30:11
929564643475025920,Ssbe quando cê só pensa em uma pessoa 100% do seu tempo e sabe que isso vai dar merda?,https://twitter.com/GabAndSil/status/929564643475025920,2017-11-12,02:20:56
929564509269823489,Inferno,https://twitter.com/GabAndSil/status/929564509269823489,2017-11-12,02:20:24
928776259290746880,"Sidinei, eu te odeio muito por ter fudido com a minha vida",https://twitter.com/GabAndSil/status/928776259290746880,2017-11-09,22:08:10
928776196527149057,Tô na merda com química,https://twitter.com/GabAndSil/status/928776196527149057,2017-11-09,22:07:55
928361978619449345,"Queria estar com três pessoas agora, e elas, por ironia do destino, se encontraram e tão no mesmo lugar",https://twitter.com/GabAndSil/status/928361978619449345,2017-11-08,18:41:58
928051195587059718,jão salvou meu dia e a minha semana,https://twitter.com/GabAndSil/status/928051195587059718,2017-11-07,22:07:02
928049626283958273,tô vendo esse pessoal com uma vida amorosa ruim mas agitada e vejo o quanto eu to na merda,https://twitter.com/GabAndSil/status/928049626283958273,2017-11-07,22:00:47
928046537611075584,queria poder usar a #DateRuim mas só tive uma experiência péssima que não é do tipo que se posta,https://twitter.com/GabAndSil/status/928046537611075584,2017-11-07,21:48:31
928043432714625025,"eu to do lado do minha diversão, e isso tá bem divertido (expõe ela também)",https://twitter.com/GabAndSil/status/928043432714625025,2017-11-07,21:36:11
927334379856285696,"Eu só queria que as pessoas certas faalassem alguma coisa comigo, mas, pelo visto, preferem me deixar de lado mais uma vez",https://twitter.com/GabAndSil/status/927334379856285696,2017-11-05,22:38:39
927321027868332032,"Eu sou a pessoa mais hipócrita desse mundo, falei pra todo mundo o quanto essa prova não significa nada e to aqui na cama morrendo",https://twitter.com/GabAndSil/status/927321027868332032,2017-11-05,21:45:36
927320502607187973,De que adianta fazer um ensino médio bacana e não conseguir entrar nuna faculdade?,https://twitter.com/GabAndSil/status/927320502607187973,2017-11-05,21:43:31
927320333459378178,"algum produto bacana, mas só consigo ser mediano nessa merda dessa prova",https://twitter.com/GabAndSil/status/927320333459378178,2017-11-05,21:42:50
927320241394331653,"Eu tô com medo de ser uma decepção pros meus professores, que acreditaram tanto em mim e depositaram tanto esforço e tempo pra que eu desse+",https://twitter.com/GabAndSil/status/927320241394331653,2017-11-05,21:42:28
927128283023659009,"Bom dia pra quem vai arrasar hoje no Enem, ou seja, todos nós",https://twitter.com/GabAndSil/status/927128283023659009,2017-11-05,08:59:42
926980965536280576,"To tentando ser menos crítico mas quando a pessoa esfrega na sua cara a falta de maturidade e de inteligência, é foda",https://twitter.com/GabAndSil/status/926980965536280576,2017-11-04,23:14:19
926867847183327232,"Eu tinha que sair pra comprar umas coisas pra amanhã e esqueci, inferno",https://twitter.com/GabAndSil/status/926867847183327232,2017-11-04,15:44:49
926526624975245312,Cê fala que tá com saudade e as pessoas só: não,https://twitter.com/GabAndSil/status/926526624975245312,2017-11-03,17:08:56
926518608548810752,Odeio gente que nuncs tem tempo pra mim,https://twitter.com/GabAndSil/status/926518608548810752,2017-11-03,16:37:04
926484864840491008,Cansado de me sentir deixado de lado,https://twitter.com/GabAndSil/status/926484864840491008,2017-11-03,14:22:59
926483186456170498,"Coitado de mim, era tão ruim em física",https://twitter.com/GabAndSil/status/926483186456170498,2017-11-03,14:16:19
926460905776386048,"Um ano desse dia maravilhoso, sdds  pic.twitter.com/hZitL79qRr",https://twitter.com/GabAndSil/status/926460905776386048,2017-11-03,12:47:47
926226579260432384,Demorou o dia inteiro,https://twitter.com/GabAndSil/status/926226579260432384,2017-11-02,21:16:39
924775469689573379,"Eu to na duvida se deixo todas as séries em dia ou se vejo Stranger Things, porque já tá foda desviar dos spoilers",https://twitter.com/GabAndSil/status/924775469689573379,2017-10-29,21:10:28
924764128861974528,"Que merda, Matheus",https://twitter.com/GabAndSil/status/924764128861974528,2017-10-29,20:25:24
924646267128606721,Não foi um dia sozinho em casa,https://twitter.com/GabAndSil/status/924646267128606721,2017-10-29,12:37:03
924497102083903488,Eu me odeio,https://twitter.com/GabAndSil/status/924497102083903488,2017-10-29,02:44:20
924496329287569408,Tô pensandoem fazer merda,https://twitter.com/GabAndSil/status/924496329287569408,2017-10-29,02:41:15
924485660932759554,Espero ansiosamente pelo dia no qual eu não odiarei essa menina e não me sinta mal por causa deld,https://twitter.com/GabAndSil/status/924485660932759554,2017-10-29,01:58:52
924315043898036224,Hoje vai ser mais um dia em casa sozinho,https://twitter.com/GabAndSil/status/924315043898036224,2017-10-28,14:40:54
924215335355641856,"Essa merda de telefone deus as loca aqui, o botão do volume me para de funcionar do nada",https://twitter.com/GabAndSil/status/924215335355641856,2017-10-28,08:04:41
924076960308920320,Parem de me lembrar da melhor época da minha vida,https://twitter.com/GabAndSil/status/924076960308920320,2017-10-27,22:54:50
924076901492297728,Tá tocando sertanejo de 2016 aqui perto aaaaaaaa que inferno,https://twitter.com/GabAndSil/status/924076901492297728,2017-10-27,22:54:36
924072162948009984,"O ruim de ter sido relativamente popular na escola é que quando vai chegando no fim, cê vai notando as perdas",https://twitter.com/GabAndSil/status/924072162948009984,2017-10-27,22:35:46
923933200958787589,"Savassi tá muito quente, que inferno",https://twitter.com/GabAndSil/status/923933200958787589,2017-10-27,13:23:35
923325432090583040,"eu queria muito estar no Frederico de novo, que inferno",https://twitter.com/GabAndSil/status/923325432090583040,2017-10-25,21:08:32
923324838319706112,eu só queria a companhia das pessoas certas agora,https://twitter.com/GabAndSil/status/923324838319706112,2017-10-25,21:06:10
922950253262901248,Se tem uma coisa que me mata é não poder ajudar as pessoas,https://twitter.com/GabAndSil/status/922950253262901248,2017-10-24,20:17:42
922613533287821312,"A gente vê que tá muito mais na merda do que acha quando verbaliza, né",https://twitter.com/GabAndSil/status/922613533287821312,2017-10-23,21:59:42
922223314554191879,To na merda,https://twitter.com/GabAndSil/status/922223314554191879,2017-10-22,20:09:06
922189273981440000,Queria estar com o Lucas a Gi e a Ceci agora fazendo qualquer comida e falando merda,https://twitter.com/GabAndSil/status/922189273981440000,2017-10-22,17:53:51
922128876016427008,"Velho se isso realmente estiver acontecendo, esse é oficialmente o pior final de semana da vida",https://twitter.com/GabAndSil/status/922128876016427008,2017-10-22,13:53:51
920570485066354689,"Eu odeio quando o Lucas fica sem celular, a gente sem conversar direto",https://twitter.com/GabAndSil/status/920570485066354689,2017-10-18,06:41:21
920084142330728448,tô na merda,https://twitter.com/GabAndSil/status/920084142330728448,2017-10-16,22:28:48
919832894490775552,"Acordei muito animado, então é fato que meu dia na escola vai ser uma bosta",https://twitter.com/GabAndSil/status/919832894490775552,2017-10-16,05:50:26
919673495923187714,"Acabei de descobrir que duas pessoas que eu jurava que eram a mesma são, na verdade, diferentes",https://twitter.com/GabAndSil/status/919673495923187714,2017-10-15,19:17:02
919536495442169857,"Queria tanto que o horário de verão acabasse no dia do meu aniversário, seria uma hora a mais de festa",https://twitter.com/GabAndSil/status/919536495442169857,2017-10-15,10:12:39
919530522489040896,"Terminei ontem a noite, a espera do ep 2 depois daquele final",https://twitter.com/GabAndSil/status/919530522489040896,2017-10-15,09:48:55
919296708714082305,Maior merda que fizeram em Arrow foi não terem matado o Diggle e o Quentin na explosão,https://twitter.com/GabAndSil/status/919296708714082305,2017-10-14,17:19:49
918304014718111744,"A Liliam some na parte mais importante da conversa, é incrível",https://twitter.com/GabAndSil/status/918304014718111744,2017-10-11,23:35:13
917850957748342784,Ta foda achar um lugar que dê pra comprar un presente legal,https://twitter.com/GabAndSil/status/917850957748342784,2017-10-10,17:34:55
917774233937293313,To bem ansioso pra quinta pra poder ver as pessoas,https://twitter.com/GabAndSil/status/917774233937293313,2017-10-10,12:30:03
917557397731897344,Morrendo de saudade do mozão da minha vida,https://twitter.com/GabAndSil/status/917557397731897344,2017-10-09,22:08:25
917557087080771584,Sabe quando cê tá lotado de coisa pra fazer mas morrendo de sono?,https://twitter.com/GabAndSil/status/917557087080771584,2017-10-09,22:07:11
917485204461309953,É foda quando cê tá há 4 horas sem ver o ser e já tá com saudade,https://twitter.com/GabAndSil/status/917485204461309953,2017-10-09,17:21:33
917182595775057920,"miga, que dia vai ser?",https://twitter.com/GabAndSil/status/917182595775057920,2017-10-08,21:19:05
916468334459346945,crush me deu unfollow e meu dia só piora,https://twitter.com/GabAndSil/status/916468334459346945,2017-10-06,22:00:52
916465444583768065,Eu to muito ✨na merda✨,https://twitter.com/GabAndSil/status/916465444583768065,2017-10-06,21:49:23
916464948846514177,Meu dia hoje tá pessimo e só piora aaaaaaa,https://twitter.com/GabAndSil/status/916464948846514177,2017-10-06,21:47:25
916412122011226113,"minha mãe é foda, viu",https://twitter.com/GabAndSil/status/916412122011226113,2017-10-06,18:17:30
916388213023039488,"Meu sonho é ser a Ana Luiza, velho",https://twitter.com/GabAndSil/status/916388213023039488,2017-10-06,16:42:30
916337913272692736,"E eu ainda vou ficar uma semana sem ir na escola, e eu vou direto na Cris falar dessa merda de professor",https://twitter.com/GabAndSil/status/916337913272692736,2017-10-06,13:22:37
916336958783270912,O Jamaro é a pessoa que eu mais odeio nesse mundo,https://twitter.com/GabAndSil/status/916336958783270912,2017-10-06,13:18:50
915379941218414593,"Porque em pouquíssimo tempo, isso nã vai fazer diferença alguma na vida de ninguém",https://twitter.com/GabAndSil/status/915379941218414593,2017-10-03,21:55:59
915379524157804544,"Jamaro, Kelson e Cris não terminam de postar essas notas pra eu me sentir formado aaaaaaa",https://twitter.com/GabAndSil/status/915379524157804544,2017-10-03,21:54:20
915377017155198977,"Levei um spoiler aqui em casa, quem mandou eu nã maratonar a série em um dia  https://twitter.com/RiverdaleBRNews/status/915332172831232000 …",https://twitter.com/GabAndSil/status/915377017155198977,2017-10-03,21:44:22
915376720982704128,Acho que meus amigos me odeiam,https://twitter.com/GabAndSil/status/915376720982704128,2017-10-03,21:43:11
915304188384595968,"Velho, a Sasha Velour é muito incrível, não sei como eu consigo criticar só porque as pessoas saturaram",https://twitter.com/GabAndSil/status/915304188384595968,2017-10-03,16:54:58
914644250582757376,Eu sendo otário mais uma vez na vida,https://twitter.com/GabAndSil/status/914644250582757376,2017-10-01,21:12:37
914633363792809985,Só deus na minha vida agora,https://twitter.com/GabAndSil/status/914633363792809985,2017-10-01,20:29:21
913857485672501248,"E, ao mesmo tempo, uma felicidade fudida por ter vivido o que eu vivi",https://twitter.com/GabAndSil/status/913857485672501248,2017-09-29,17:06:17
913857347021414400,Bateu agora aquele arrependimento clássico do rumo que minha vida tomou,https://twitter.com/GabAndSil/status/913857347021414400,2017-09-29,17:05:44
913703671657050112,Nem 7 da manhã e eu já tô morrendo com o calor,https://twitter.com/GabAndSil/status/913703671657050112,2017-09-29,06:55:05
913566823479746561,Dez da noite e eu ainda não terminei meu trabalho pra amanhã,https://twitter.com/GabAndSil/status/913566823479746561,2017-09-28,21:51:18
912785051393421313,"Velho, eu faria de tudo pra poder voltar no tempo e nunca ter conhecido esse ser que só me fode",https://twitter.com/GabAndSil/status/912785051393421313,2017-09-26,18:04:49
912784936079327233,E com tudo isso quero dizer todas essas pessoas,https://twitter.com/GabAndSil/status/912784936079327233,2017-09-26,18:04:22
912784058299633673,Que inferno,https://twitter.com/GabAndSil/status/912784058299633673,2017-09-26,18:00:52
912784040071241728,E eu odeio todo mundo também,https://twitter.com/GabAndSil/status/912784040071241728,2017-09-26,18:00:48
912783983888535554,"Velho, eu me odeio muito, cacetão",https://twitter.com/GabAndSil/status/912783983888535554,2017-09-26,18:00:35
912771047799345152,Inferno de Taylor Swift,https://twitter.com/GabAndSil/status/912771047799345152,2017-09-26,17:09:10
912571137204326400,"E essa perturbação que cê causa na minha vida, @",https://twitter.com/GabAndSil/status/912571137204326400,2017-09-26,03:54:48
912109259999137795,"eu to tão triste com a verdade de que a gente perde todos e quase nada segue com a gente pra vida, não sei lidar",https://twitter.com/GabAndSil/status/912109259999137795,2017-09-24,21:19:28
912012492490121216,eu amo quando meus amigos se dão conta de que são inteligentes pra caralho e que podem fazer tudo que podem <3,https://twitter.com/GabAndSil/status/912012492490121216,2017-09-24,14:54:57
911967630440960001,E a cada dia tenho mais certeza de que humanas é difícil pra caralho,https://twitter.com/GabAndSil/status/911967630440960001,2017-09-24,11:56:41
911662760357974016,Ouvindo a Giovanna no banho e cada dia mais em choque com o fato de que ela não quer cantar profissionalmente,https://twitter.com/GabAndSil/status/911662760357974016,2017-09-23,15:45:14
911654962438049796,"Eu achei que tinha me livrado das pessoas no RiR mandando stories, mas não",https://twitter.com/GabAndSil/status/911654962438049796,2017-09-23,15:14:15
910238573714079744,Cansei de mudar de ideia a respeito do meu futuro,https://twitter.com/GabAndSil/status/910238573714079744,2017-09-19,17:26:02
909916913098215424,um dia que eu voltei e já não aguento maaaaaissss,https://twitter.com/GabAndSil/status/909916913098215424,2017-09-18,20:07:52
909871345592303616,"No momento, to achando que o Joanne é o melhor álbum da Gaga",https://twitter.com/GabAndSil/status/909871345592303616,2017-09-18,17:06:48
908608748180115456,"Sabe, o que eu queria mesmo é trocar o ingresso pro dia 16 pra ver Fergie, Shawn e Skank, mas é aquele ditado, né",https://twitter.com/GabAndSil/status/908608748180115456,2017-09-15,05:29:41
907879973154951168,Muito tempo que eu não me sinto tão tenso com AHS,https://twitter.com/GabAndSil/status/907879973154951168,2017-09-13,05:13:47
907272867510878208,"Velho, 6 pessoas conhecidas dentro do mesmo ônibus que eu agora",https://twitter.com/GabAndSil/status/907272867510878208,2017-09-11,13:01:22
907001229494157317,"Muito ruim, véi",https://twitter.com/GabAndSil/status/907001229494157317,2017-09-10,19:01:59
906973101262602240,"desisti na metade do segundo, é muito ruim mesmo",https://twitter.com/GabAndSil/status/906973101262602240,2017-09-10,17:10:12
906300957163704321,Sabe aquele momento da noitw que cé bebeu umas cinco cervejas e começa a pensar na sua vida?,https://twitter.com/GabAndSil/status/906300957163704321,2017-09-08,20:39:21
906289673328320512,Sabe quando você quer dizer pea alguém o quanto ama essa pessoa e o quanto ela te salva todos os dias e te deixa mais feliz?,https://twitter.com/GabAndSil/status/906289673328320512,2017-09-08,19:54:30
906192829474635776,"Dia útil e o ônibus demorando meia hora, que caralho",https://twitter.com/GabAndSil/status/906192829474635776,2017-09-08,13:29:41
906150679231827969,Adoro quando meus amigos twittam sobre mim -q  https://twitter.com/Ceci_pires/status/906007265630601217 …,https://twitter.com/GabAndSil/status/906150679231827969,2017-09-08,10:42:12
905352037482758144,Não sei como eu consigo estar tão sem sono tendo dormido só três horas e meia,https://twitter.com/GabAndSil/status/905352037482758144,2017-09-06,05:48:41
905270657713401856,"Eu to com zero sono por causa do café, quero acordar cedo pra revisar umas coisas pro simulado e esse barulho do John jogandoxbox não ajuda",https://twitter.com/GabAndSil/status/905270657713401856,2017-09-06,00:25:18
905263882561888257,"Ao mesmo tempo que eu to achando essa temporada leve, eu to perturbardo por causa dos palhaços",https://twitter.com/GabAndSil/status/905263882561888257,2017-09-05,23:58:23
905243482142408704,Eu tô twittando igual louco só pra passar o tempo mesmo QUERO MINHA AHS AGORAAAA,https://twitter.com/GabAndSil/status/905243482142408704,2017-09-05,22:37:19
905243246087086082,"Eu até que pareço bastante humanas, meu sonho de princesa conseguir guardar tanta informação complexa",https://twitter.com/GabAndSil/status/905243246087086082,2017-09-05,22:36:23
905242844771864577,Eu acho que as pessoas pensam que eu sou de humanas por causa do meu posicionamento político e também por ser pisciano,https://twitter.com/GabAndSil/status/905242844771864577,2017-09-05,22:34:47
905242475450814465,"Eu sei que eu de fato tô, mas é muito estranho sentir esses troços",https://twitter.com/GabAndSil/status/905242475450814465,2017-09-05,22:33:19
905213014546276357,"preciso de muito café hoje, vou dormir só depois de meia noite",https://twitter.com/GabAndSil/status/905213014546276357,2017-09-05,20:36:15
905209764514287616,puta merda errei,https://twitter.com/GabAndSil/status/905209764514287616,2017-09-05,20:23:20
905190774995857408,NAO TEM VISTO AMERICANO AINDA? O MOMENTO PARA TIRAR É AGORA! Deixe a burocracia do visto conosco e cuide do que é importante: a sua viagem!  pic.twitter.com/BQC22ZvNoV,https://twitter.com/GabAndSil/status/905190774995857408,2017-09-05,19:07:53
905124685116997636,Hoje é aquele dia abençoado que tem American Horror Story,https://twitter.com/GabAndSil/status/905124685116997636,2017-09-05,14:45:15
904121975961997312,"se eu soubesse que a minha noite ia acabar assim, eu teria ido dormir horas atrás",https://twitter.com/GabAndSil/status/904121975961997312,2017-09-02,20:20:51
904116856067379200,"quando acontecem essas coisas, dá vontade de ficar solteiro pelo resto da vida",https://twitter.com/GabAndSil/status/904116856067379200,2017-09-02,20:00:30
904115671855980544,Que merda de sábado,https://twitter.com/GabAndSil/status/904115671855980544,2017-09-02,19:55:48
903972637625516033,Essa merda de telefone rachou a tela dentro do meu bolso e com película e depois iPhone que quebra fácil,https://twitter.com/GabAndSil/status/903972637625516033,2017-09-02,10:27:26
903690673139965952,"As pessoas não ajudam no ego, véi",https://twitter.com/GabAndSil/status/903690673139965952,2017-09-01,15:47:00
903641810383372288,"Resumo do meu dia hoje: adedanha, primavera árabe, cpreografia do mc sapão e discussão sobre brigadeiro e tapioca",https://twitter.com/GabAndSil/status/903641810383372288,2017-09-01,12:32:51
903529666983682048,Eu odeio fazer merda porque passo dias me sentindo culpado e envergonhado,https://twitter.com/GabAndSil/status/903529666983682048,2017-09-01,05:07:14
903415327496830976,"As pessoas nunca vão entender que escola particular não é luxo, é investimento  https://twitter.com/BarbiedahFavela/status/903413493038239744 …",https://twitter.com/GabAndSil/status/903415327496830976,2017-08-31,21:32:53
903035980881563648,Quando as pessoas vão entender que Jesus também é uma figura histórica e não pertence somente ao cristianismo?,https://twitter.com/GabAndSil/status/903035980881563648,2017-08-30,20:25:30
902966552387092480,"Que dia de merda que hoje tá sendo, viu",https://twitter.com/GabAndSil/status/902966552387092480,2017-08-30,15:49:37
902930066962862080,Que dia de cu,https://twitter.com/GabAndSil/status/902930066962862080,2017-08-30,13:24:38
901863675832799237,Nem levantei da cama até agora,https://twitter.com/GabAndSil/status/901863675832799237,2017-08-27,14:47:10
901670725588848640,"Tanto tempo que eu não dançava assim, nu",https://twitter.com/GabAndSil/status/901670725588848640,2017-08-27,02:00:27
901659516198162433,É cada merda que eu faço,https://twitter.com/GabAndSil/status/901659516198162433,2017-08-27,01:15:55
901658839010992128,merda,https://twitter.com/GabAndSil/status/901658839010992128,2017-08-27,01:13:13
901167360425512960,Puta merda Tirei 9 de 12! Será que você consegue se dar melhor?  https://www.buzzfeed.com/davirocha/este-teste-sobre-farmacia-vai-revelar-a-idade-da-sua-alma?utm_term=.hqGLMZLQj#11690618&rid=354303706 … via @davirocha,https://twitter.com/GabAndSil/status/901167360425512960,2017-08-25,16:40:16
900533413739995138,Essa noite tá bem pesada,https://twitter.com/GabAndSil/status/900533413739995138,2017-08-23,22:41:11
900513789493293057,"ninguém nunca vai conseguir ver que eu tiro força dessas pessoas, e não de mim mesmo",https://twitter.com/GabAndSil/status/900513789493293057,2017-08-23,21:23:12
900513688666476545,as pessoas nunca vão entender a importancia que certas coisas tem na minha vida,https://twitter.com/GabAndSil/status/900513688666476545,2017-08-23,21:22:48
900147534571634688,"Ele é foda, mas cê que nunca viu a Leila",https://twitter.com/GabAndSil/status/900147534571634688,2017-08-22,21:07:50
900146435953500160,Queria muito um dia abrir uma escola com determinados ideias de educação que eu sei que esses professores acreditam,https://twitter.com/GabAndSil/status/900146435953500160,2017-08-22,21:03:28
900126235480784896,É tão bom chegar em casa e sentir que seu dia foi produtivo,https://twitter.com/GabAndSil/status/900126235480784896,2017-08-22,19:43:12
899793234699923456,Eu nã sabia que era possível desejar tantos homens ao mesmo tempo,https://twitter.com/GabAndSil/status/899793234699923456,2017-08-21,21:39:59
899566555893256192,Ainda não acredito que Detox e Claudia Raia são pessoas diferentes,https://twitter.com/GabAndSil/status/899566555893256192,2017-08-21,06:39:14
899046700953817088,Não acredito que eu to saindo com essa dor de cabeça do inferno,https://twitter.com/GabAndSil/status/899046700953817088,2017-08-19,20:13:31
898357491523883012,Ligar meu computador e ver essa foto do Underground faz meu dia  pic.twitter.com/ibDZyW6lUP,https://twitter.com/GabAndSil/status/898357491523883012,2017-08-17,22:34:51
