id,tweet,link,date,time
1099869700778004482,Que isso Renata vc vai falar que o filme com a Hermione empoderada não é o melhor??????????  Brinks,https://twitter.com/gbrl_mendes/status/1099869700778004482,2019-02-25,00:12:25
1099744708622995457,vou mandar msg pra lá amanhã,https://twitter.com/gbrl_mendes/status/1099744708622995457,2019-02-24,15:55:45
1099733748642385920,"Não recebi nenhum aviso de que a aula não começa amanhã, então eu assumi que tem",https://twitter.com/gbrl_mendes/status/1099733748642385920,2019-02-24,15:12:12
1099698566602334209,Como faço pra descobrir onde é a minha aula na FAE que começa às 7:30h amanhã,https://twitter.com/gbrl_mendes/status/1099698566602334209,2019-02-24,12:52:24
1099443173150068736,Pra ces verem a desgraça anunciada: carnaval de rua de BH vai ser uma das maiores festas do mundo.   Ces viram campanha de prevenção à IST's? Eu vi  um monte de coisa sobre a porra do busão de graça da Skol e nada sobre usar camisinha e etc,https://twitter.com/gbrl_mendes/status/1099443173150068736,2019-02-23,19:57:33
1098772671146397696,"Biólogo fala tudo do pensamento científico de maneira simplista, sem falar de determinantes históricas, econômicas como se tudo tivesse caído do céu",https://twitter.com/gbrl_mendes/status/1098772671146397696,2019-02-21,23:33:13
1098708252035084289,"vc não estava triste, estava enfezada",https://twitter.com/gbrl_mendes/status/1098708252035084289,2019-02-21,19:17:14
1098411269290426368,"Eu não aguento mais, de verdade",https://twitter.com/gbrl_mendes/status/1098411269290426368,2019-02-20,23:37:08
1097682390670106624,Desculpa gente foi só isso que eu consegui falar desde ontem kkkakaka,https://twitter.com/gbrl_mendes/status/1097682390670106624,2019-02-18,23:20:50
1097498463758098432,"o tilelê paz e amor tem que acabar, pelo amor de deus",https://twitter.com/gbrl_mendes/status/1097498463758098432,2019-02-18,11:09:58
1096499038898348037,que ódio puta merda,https://twitter.com/gbrl_mendes/status/1096499038898348037,2019-02-15,17:58:37
1096348124841422849,Essa é de cortar o coração msm,https://twitter.com/gbrl_mendes/status/1096348124841422849,2019-02-15,07:58:56
1096204795281620993,tá ficando muito triste,https://twitter.com/gbrl_mendes/status/1096204795281620993,2019-02-14,22:29:24
1096132612920393730,meu avô costumava falar do pé de jiló que dava muito chuchu,https://twitter.com/gbrl_mendes/status/1096132612920393730,2019-02-14,17:42:34
1095095884457611264,"Velho, é tipo tão incrível quanto. Vc vai adorar a trilha sonora. E tem o Ryan Gostoso Gosling",https://twitter.com/gbrl_mendes/status/1095095884457611264,2019-02-11,21:02:59
1094447618124595200,"O adolescente é o ser mais dramático do mundo, que porra",https://twitter.com/gbrl_mendes/status/1094447618124595200,2019-02-10,02:07:00
1094026869853298689,vontade de chorar,https://twitter.com/gbrl_mendes/status/1094026869853298689,2019-02-08,22:15:06
1093553350455513089,"O Carl Sagan fala desse livro no mundo assombrado pelos demônios, é assustador",https://twitter.com/gbrl_mendes/status/1093553350455513089,2019-02-07,14:53:30
1093320234302402561,Pq demorei tanto pra começar a ler sandman,https://twitter.com/gbrl_mendes/status/1093320234302402561,2019-02-06,23:27:11
1092821729154686976,depois de mais de 2 anos o algorítimo do google finalmente resolveu me indicar coisas relacionadas à bioinformática,https://twitter.com/gbrl_mendes/status/1092821729154686976,2019-02-05,14:26:18
1092808114380963840,Tem a cabeça boa demais. Por isso o meu medo. Mas se ele é tão inteligente quanto eu espero que seja ele vai lembrar duma pesquisa falando que fumar na adolescência prejudica o desenvolvimento do córtex pré frontal,https://twitter.com/gbrl_mendes/status/1092808114380963840,2019-02-05,13:32:12
1091511845112946691,Todo mundo,https://twitter.com/gbrl_mendes/status/1091511845112946691,2019-02-01,23:41:17
1091415206813724672,Percebendo que é difícil ser feliz enquanto vivo focando só nas coisas que eu poderia estar fazendo em vez de ver tudo que eu faço,https://twitter.com/gbrl_mendes/status/1091415206813724672,2019-02-01,17:17:17
1091393274747801600,dormir pouco me deixa entre a sensação de estar chapado e a vontade de sair gritando de ódio,https://twitter.com/gbrl_mendes/status/1091393274747801600,2019-02-01,15:50:08
1090956643498627074,O mais triste da nota do MEC é que a maioria vai levar ela a sério pq o jornalista lá realmente foi pra URSS aprender sobre marxismo com o suporte da KGB,https://twitter.com/gbrl_mendes/status/1090956643498627074,2019-01-31,10:55:07
1090593763024621568,Acho ainda utópico que ele vai convencer os rico na reunião deles que a taxação é a solução (não é) pra pobreza no mundo,https://twitter.com/gbrl_mendes/status/1090593763024621568,2019-01-30,10:53:10
1090403438133948416,Td mundo sabe que a culpa é dos pássaro,https://twitter.com/gbrl_mendes/status/1090403438133948416,2019-01-29,22:16:53
1090041536824426497,Eu tomei a porra de um café quatro da tarde e meu estômago tá doendo até agora o que aconteceuuuu,https://twitter.com/gbrl_mendes/status/1090041536824426497,2019-01-28,22:18:49
1090007634470682626,"Mas sei que nada é divino Nada, nada é maravilhoso Nada, nada é secreto Nada, nada é misterioso, não...",https://twitter.com/gbrl_mendes/status/1090007634470682626,2019-01-28,20:04:06
1089527517722091520,muito feliz de ter presenciado tal ícone em toda sua glória,https://twitter.com/gbrl_mendes/status/1089527517722091520,2019-01-27,12:16:17
1089525589344702466,hoje eu acordei me sentindo tão péssimo que não tenho nem o que falar,https://twitter.com/gbrl_mendes/status/1089525589344702466,2019-01-27,12:08:37
1089132736462442496,O Bolsonaro quer facilitar as licitações pra minerações e etc mas temos que lembrar que foi o governo do Pimentel que deixou acontecer de novo,https://twitter.com/gbrl_mendes/status/1089132736462442496,2019-01-26,10:07:34
1088910677115396098,"aliás, quando a Vale era Vale do Rio Doce e era do Brasil, uma empresa estatal, esse tipo de barbaridade não acontecia. PUTA QUE PARIU",https://twitter.com/gbrl_mendes/status/1088910677115396098,2019-01-25,19:25:11
1088765118811377664,A única coisa que me mantém vivo é lembrar que o carnaval está chegando  https://twitter.com/gioteo_/status/1088517608889040899 …,https://twitter.com/gbrl_mendes/status/1088765118811377664,2019-01-25,09:46:47
1088399589592453120,Muita gente tá careca de saber mas não custa lembrar  https://twitter.com/Estadao/status/1088393474280321024 …,https://twitter.com/gbrl_mendes/status/1088399589592453120,2019-01-24,09:34:18
1087843732106502145,"Eu fiz tenta coisa hoje e ainda vai dar tempo de ver série, estou feliz",https://twitter.com/gbrl_mendes/status/1087843732106502145,2019-01-22,20:45:31
1087696782019178496,"Depois alguns têm a cara de falar que o capitalismo é o motor do desenvolvimento científico, rs.  Ainda bem que temos a Alexandra que criou o @Sci_Hub",https://twitter.com/gbrl_mendes/status/1087696782019178496,2019-01-22,11:01:35
1087489643216556032,Gente esse mundo é minúsculo,https://twitter.com/gbrl_mendes/status/1087489643216556032,2019-01-21,21:18:30
1087460423010566146,"Vou discordar, acho que era educativo pq falava de temas tabus envolvendo adolescentes, mas sem a obrigatoriedade de ensinar as coisas. Não achei ruim não eu adorava tbm",https://twitter.com/gbrl_mendes/status/1087460423010566146,2019-01-21,19:22:23
1087345831550828544,porque não viver esse mundo se não há outro mundo,https://twitter.com/gbrl_mendes/status/1087345831550828544,2019-01-21,11:47:02
1086985156265738241,Minha professora de história do cefet mora em Portugal e dá rolê com o marido levando o bebê deles num carrinho de mão,https://twitter.com/gbrl_mendes/status/1086985156265738241,2019-01-20,11:53:51
1086798746829099013,"Ma verdade é na quarta, mas segunda devo ir lá",https://twitter.com/gbrl_mendes/status/1086798746829099013,2019-01-19,23:33:07
1086797397458591746,"Te falar que essa semana eu tbm fui lá apenas duas vezes, mesma coisa, tou evitando desconfortos. É foda quando vc percebe que o meio (físico e o social) não são saudáveis mais",https://twitter.com/gbrl_mendes/status/1086797397458591746,2019-01-19,23:27:45
1085267893334495233,A gente tá tão fodido que tem que esperar as empresas lançarem propagandas lacradoras pra poder começar a discutir um assunto. Elas só fazem isso pra não perder mercado né,https://twitter.com/gbrl_mendes/status/1085267893334495233,2019-01-15,18:10:03
1085144442342912000,Se você for embora não vai ter ninguém pra correr comigo na UFMG amanhã xuxu,https://twitter.com/gbrl_mendes/status/1085144442342912000,2019-01-15,09:59:30
1084985443786080257,"Twin peaks é bom pra caralho, saudades de ver uma série e gostar de verdade",https://twitter.com/gbrl_mendes/status/1084985443786080257,2019-01-14,23:27:42
1084913982715162624,Parece que meu coração vai explodir,https://twitter.com/gbrl_mendes/status/1084913982715162624,2019-01-14,18:43:44
1084595889992290309,Inferno tou morrendo de vontade de começar twin peaks e não consigo ver em nenhum lugarrr,https://twitter.com/gbrl_mendes/status/1084595889992290309,2019-01-13,21:39:45
1084256876542464000,A Sapucaí é o rolê mais democrático de BH vc acha TODO MUNDO lá,https://twitter.com/gbrl_mendes/status/1084256876542464000,2019-01-12,23:12:38
1084244062209802241,Sou tão carente que não posso nem conversar com alguém que me responde na hora que eu fico todo bobo,https://twitter.com/gbrl_mendes/status/1084244062209802241,2019-01-12,22:21:43
1084222989112168448,Na verdade a gente foi bem de boa ninguém passou mal nem nada,https://twitter.com/gbrl_mendes/status/1084222989112168448,2019-01-12,20:57:59
1084143056675397632,"Ces são louco tão afim de pegar doença, foder a cabeça, fazer merda. Vão dar um jeito na vida",https://twitter.com/gbrl_mendes/status/1084143056675397632,2019-01-12,15:40:21
1083367070019084289,o bizarro é que ele acaba parecendo um poço de clareza e bom senso pq defendeu a evolução darwiniana da vontade de chorar msm,https://twitter.com/gbrl_mendes/status/1083367070019084289,2019-01-10,12:16:52
1083197642543374336,Te falar que ficou show demais irmãozinho,https://twitter.com/gbrl_mendes/status/1083197642543374336,2019-01-10,01:03:37
1083163119185260544,mão do mendes + biel,https://twitter.com/gbrl_mendes/status/1083163119185260544,2019-01-09,22:46:26
1083142870645833728,é sempre bom lembrar que está vivo,https://twitter.com/gbrl_mendes/status/1083142870645833728,2019-01-09,21:25:58
1083142503103168514,lembrar que ainda está vivo é muito importante,https://twitter.com/gbrl_mendes/status/1083142503103168514,2019-01-09,21:24:31
1082798561329332225,"""Melhor até que o anarcocapitalismo""  O maluco acha que o mundo é  um jogo de minecraft",https://twitter.com/gbrl_mendes/status/1082798561329332225,2019-01-08,22:37:49
1082230887134232576,"Meus pais iam voltar amanhã de viagem e eu tinha varias planos pra hoje, foi só minha mãe avisar que chega hoje que eu não faço a minima ideia do que fazer do meu dia",https://twitter.com/gbrl_mendes/status/1082230887134232576,2019-01-07,09:02:05
1081337662030663681,Pelo amor de deus parem de culpar as pessoas por terem votado no bolsonaro cuceta,https://twitter.com/gbrl_mendes/status/1081337662030663681,2019-01-04,21:52:43
1081325007073091584,"Sem abrir a foto eu tinha achado que era a Magali que tinha feito o oral por causa da cara de hum que delícia essa xota mas na verdade foi a Mônica que fez e ficou bolada, sinceramente hauahauba",https://twitter.com/gbrl_mendes/status/1081325007073091584,2019-01-04,21:02:26
1081316999777738752,"Esse é um sentimento que vale a pena demais. Outro bom é o de conseguir acompanhar a mesma velocidade dos carros na via, no caiçara não é difícil",https://twitter.com/gbrl_mendes/status/1081316999777738752,2019-01-04,20:30:37
1081313381133570048,Fiz coisas agora e talvez eu tenha me arrependido mas foi por um bem maior,https://twitter.com/gbrl_mendes/status/1081313381133570048,2019-01-04,20:16:14
1080901377986084864,"No email eu me perguntava se em 2019 eu já teria conseguido conquistar algumas coisas, e eu acabei tomando um caminho melhor do que eu esperava kkk",https://twitter.com/gbrl_mendes/status/1080901377986084864,2019-01-03,16:59:05
1080885650554081282,não sei se aconteceram coisas demais na minha vida nos últimos 4 anos mas tanta coisa mudou que eu mal consigo me lembrar de tudo,https://twitter.com/gbrl_mendes/status/1080885650554081282,2019-01-03,15:56:35
1080875074700435457,Sabia que ia ter esse tipo de comentário caiu,https://twitter.com/gbrl_mendes/status/1080875074700435457,2019-01-03,15:14:34
1080854343828586497,Muitos processos na minha cabeça e ninguém disponível pra trocar uma palavrinha O GLORIA,https://twitter.com/gbrl_mendes/status/1080854343828586497,2019-01-03,13:52:11
1080651527512035331,Bem vindos ao terceiro mundo,https://twitter.com/gbrl_mendes/status/1080651527512035331,2019-01-03,00:26:16
1079931351518846977,"Tá tudo uma merda, mas eu desejo um ano novo com muita força e esperança pra todo mundo",https://twitter.com/gbrl_mendes/status/1079931351518846977,2019-01-01,00:44:33
1078847863067693056,"Sem graça, já ganhou antes de começar",https://twitter.com/gbrl_mendes/status/1078847863067693056,2018-12-29,00:59:09
1078713774415204353,Odeio jogar de escopeta eu fico igual àquele meme do cachorro que não faz ideia dos está fazendo,https://twitter.com/gbrl_mendes/status/1078713774415204353,2018-12-28,16:06:20
1077992667265597442,"Se vc tiver tutorial com o mate eu quero, rs",https://twitter.com/gbrl_mendes/status/1077992667265597442,2018-12-26,16:20:54
1077966519420768256,"Mas o Robespierre é autoritário art, Chomsky estaria triste com vc",https://twitter.com/gbrl_mendes/status/1077966519420768256,2018-12-26,14:37:00
1077963505993691136,"Isso não é empreendedor mano, é aquele cara que se diz herdeiro do trono brasileiro (a cabeça tá fazendo hora extra no pescoço)",https://twitter.com/gbrl_mendes/status/1077963505993691136,2018-12-26,14:25:02
1077747695299768326,Tá td mundo falando desse filme e tal,https://twitter.com/gbrl_mendes/status/1077747695299768326,2018-12-26,00:07:28
1077587737899925504,"Quando eu falo isso me olham como se eu fosse um ET ""Como assim o governo federal não usa o imposto pra fazer as coisas?""",https://twitter.com/gbrl_mendes/status/1077587737899925504,2018-12-25,13:31:51
1077290116161458177,parem de falar que jesus é comunista pelo amor de deuxx,https://twitter.com/gbrl_mendes/status/1077290116161458177,2018-12-24,17:49:13
1077035129720225793,A vilã é aquela burguesa que é gananciosa mas provê para as mulheres uma vida melhor que na cidade e dá a elas segurança e meios de se defenderem.   Achei maravilhoso representar as tribos de deus da floresta.  Fiquei imaginando que na vida real não temos um final assim,https://twitter.com/gbrl_mendes/status/1077035129720225793,2018-12-24,00:55:59
1076965252938588160,Na verdade o deepin é baseado no debian (alguma versão que esqueci) e os drivers costumam dar mts problemas. A maioria dos que saem do deepin é por causa disso,https://twitter.com/gbrl_mendes/status/1076965252938588160,2018-12-23,20:18:20
1076791072611860480,Mas é o bastião da moralidade esse art não é possível   PS: fiquei triste com com essa 15,https://twitter.com/gbrl_mendes/status/1076791072611860480,2018-12-23,08:46:12
1076446674145415168,KKKK na verdade vc sonhou comigo com o cabelo comprido msm tava um horror,https://twitter.com/gbrl_mendes/status/1076446674145415168,2018-12-22,09:57:41
1076150746658361345,Carne doce é maravilhoso mas ques música pesada tá doido,https://twitter.com/gbrl_mendes/status/1076150746658361345,2018-12-21,14:21:46
1075926051228921857,"@artaranha a informação mais importante desse vídeo é a última. A destruição do sistema econômico soviético levou ao fim de uma nação que patrocinou várias revoluções e lutas anti coloniais no mundo todo, além de servir como pressão política contra o neoliberalismo.",https://twitter.com/gbrl_mendes/status/1075926051228921857,2018-12-20,23:28:55
1075864242321088518,Nem pedalar curou o ódio que estou,https://twitter.com/gbrl_mendes/status/1075864242321088518,2018-12-20,19:23:18
1075860050906898432,Inferno de vizinho que tem cachorro que só sabe latir e chorar o dia inteiro,https://twitter.com/gbrl_mendes/status/1075860050906898432,2018-12-20,19:06:39
1075568842754220032,tem um casal novo aí que meu coração fica até quentinho de lembrar que existe,https://twitter.com/gbrl_mendes/status/1075568842754220032,2018-12-19,23:49:29
1074825643391635462,"Eu vou amanhã com o biel, se vc quiser colar lá",https://twitter.com/gbrl_mendes/status/1074825643391635462,2018-12-17,22:36:17
1074821839841579010,Quem ai anima ceu amanhã tomar aquele sol na raba,https://twitter.com/gbrl_mendes/status/1074821839841579010,2018-12-17,22:21:10
1073384186650734592,Ininterruptamente tocando baile da gaiola na minha cabeça,https://twitter.com/gbrl_mendes/status/1073384186650734592,2018-12-13,23:08:27
1073379148549246978,"Mt feliz com o dia do meu aniversário, nada como meus amigos e um rolêzim no ceu",https://twitter.com/gbrl_mendes/status/1073379148549246978,2018-12-13,22:48:26
1071751797109387266,sem falar que estou bebendo demais pita merda,https://twitter.com/gbrl_mendes/status/1071751797109387266,2018-12-09,11:01:55
1071751599247290368,"é normal se sentir confuso sobre e etc mas esses rolês têm confundido mt minha cabeça, eu não sei o que pensar :/",https://twitter.com/gbrl_mendes/status/1071751599247290368,2018-12-09,11:01:08
1071425092981264387,"Eu amo os videos do pirula, mas quando ele vai falar de política ou tangenciar qualquer coisa dessa área.........",https://twitter.com/gbrl_mendes/status/1071425092981264387,2018-12-08,13:23:42
1071194105856884736,Eu tenho esse sentimento paternalista fundido com mt gente que me faz ficar preocupado além do que eu precisaria,https://twitter.com/gbrl_mendes/status/1071194105856884736,2018-12-07,22:05:51
1070860464274501633,"Eu falei tanto mal de los hermanos, mas se eu for nesse show vou chorar igual quando tinha 15 anos",https://twitter.com/gbrl_mendes/status/1070860464274501633,2018-12-07,00:00:04
1070335190520741890,Que mato sem cachorro que eu fui me meter,https://twitter.com/gbrl_mendes/status/1070335190520741890,2018-12-05,13:12:49
1068323482008764417,Muito foda. Pesquisarei depois. Vou dormir agora pra ficar pronto pro mato amanhã 😋,https://twitter.com/gbrl_mendes/status/1068323482008764417,2018-11-29,23:59:01
1068273667321339910,AMANHÃ TEEEM AAAAAAAAAAA,https://twitter.com/gbrl_mendes/status/1068273667321339910,2018-11-29,20:41:04
1068083894090649600,Nossa que tipo de matéria só tem uma prova???,https://twitter.com/gbrl_mendes/status/1068083894090649600,2018-11-29,08:06:59
1067964157662769153,Tem gente que eu queria entrar na mente ou sei lá fazer um estudo pra descobrir o que é que se passa nesse cérebro debaixo desse lindo crânio,https://twitter.com/gbrl_mendes/status/1067964157662769153,2018-11-29,00:11:11
1067361489655398400,Estou do mesmo jeito tendo que fazer trabalho em grupo que a professora passou de última hora,https://twitter.com/gbrl_mendes/status/1067361489655398400,2018-11-27,08:16:24
1065289039874572288,"Muito triste, vai ter Kendrick e Arctic monkeys",https://twitter.com/gbrl_mendes/status/1065289039874572288,2018-11-21,15:01:13
1065014322328453126,"É muito útil, vc tá certissima. Sem falar que é ótimo pra saúde né. Eu perdi a pratica, toda vez que vou pro mato eu acabo não nadando nas melhores (mais perigosas) partes por falta de prática",https://twitter.com/gbrl_mendes/status/1065014322328453126,2018-11-20,20:49:36
1064267684588732417,A dara tava cuidado do filho do djonga?¿?¿????,https://twitter.com/gbrl_mendes/status/1064267684588732417,2018-11-18,19:22:43
1064233004824965127,Na verdade isso foi bem inteligente,https://twitter.com/gbrl_mendes/status/1064233004824965127,2018-11-18,17:04:55
1064013235538534402,"Não acredito em karma, mas dessa vez chegou na hora",https://twitter.com/gbrl_mendes/status/1064013235538534402,2018-11-18,02:31:38
1063258311695437826,Aceito indicações de músicas triste,https://twitter.com/gbrl_mendes/status/1063258311695437826,2018-11-16,00:31:50
1062650068640194561,Coisas que eu me orgulho: não passar pano pra velho rico que tava fazendo hora extra na terra,https://twitter.com/gbrl_mendes/status/1062650068640194561,2018-11-14,08:14:54
1061805731916201984,Não fala assim que qualquer um falar que tem a solução pra minha vida eu acredito,https://twitter.com/gbrl_mendes/status/1061805731916201984,2018-11-12,00:19:48
1061066315165786112,"Te falar, quando eu estou deitado com muito sono e não quero levantar de manhã, a primeira coisa que faço é pegar o celular e ir pro tuiter. Em questão de segundo vai embora, é mt eficiente. No mais, boa sorte cara",https://twitter.com/gbrl_mendes/status/1061066315165786112,2018-11-09,23:21:37
1059980892955987969,Não dá pra confiar em uma pessoa plenamente feliz em tempos assim não é mesmo,https://twitter.com/gbrl_mendes/status/1059980892955987969,2018-11-06,23:28:33
1059845688400506881,Se eu tivesse uma máquina do tempo tenha certeza que eu não estaria nessa timeline. Eu estaria naquela do mundo inteiro internacionalista proletário,https://twitter.com/gbrl_mendes/status/1059845688400506881,2018-11-06,14:31:17
1059271964144082944,"HAUHSU não Caio, o Neil Armstrong sobrevive uai, todo mundo sabe essa história",https://twitter.com/gbrl_mendes/status/1059271964144082944,2018-11-05,00:31:31
1058486838422331394,Não tenho nem o que falar sobre esse rolê que entrei. Que vergonha viu,https://twitter.com/gbrl_mendes/status/1058486838422331394,2018-11-02,19:31:42
1058088174096916480,Que mulher tbm tem é a primeira vez que ouço falar,https://twitter.com/gbrl_mendes/status/1058088174096916480,2018-11-01,17:07:33
1057764213454749696,Tudo que a gente precisava era de um Felipe Neto esquerdista pra doutrinação infantil dar certo de verdade,https://twitter.com/gbrl_mendes/status/1057764213454749696,2018-10-31,19:40:15
1056741362492760064,Não sai da minha cabeca o holocausto ambiental que vai rolar. Ninguém liga pra natureza,https://twitter.com/gbrl_mendes/status/1056741362492760064,2018-10-28,23:55:48
1056739698083880961,"É aquela que comentou na sua foto? Encontrei uma mulher na sexta feira na panfletagem que me disse as mesmas coisas. Falou que a Dilma foi tirada por intercessão divina, e Bolsonaro é o escolhido por deus para colocar o Brasil de volta no lugar",https://twitter.com/gbrl_mendes/status/1056739698083880961,2018-10-28,23:49:11
1056064443682045952,Amanhã meus erros serão injustificáveis,https://twitter.com/gbrl_mendes/status/1056064443682045952,2018-10-27,03:05:58
1055985371333476352,Muito triste.  https://twitter.com/DudaSalabert/status/1055964306225938432 …,https://twitter.com/gbrl_mendes/status/1055985371333476352,2018-10-26,21:51:46
1055619973400457216,"E que eu por ti, se torturado for, possa feliz, indiferente à dor, morrer sorrindo a murmurar teu nome.",https://twitter.com/gbrl_mendes/status/1055619973400457216,2018-10-25,21:39:48
1055157182319210497,"É um trecho de um programa pra record que mostram médicos fazendo exames no colostomito na casa dele. Durante a narração do repórter dá pra ouvir alguém falar ""câncer no intestino"" de maneira bem clara",https://twitter.com/gbrl_mendes/status/1055157182319210497,2018-10-24,15:00:50
1055151368405684226,E a teoria da conspiração que tá parecendo verdade?  https://twitter.com/JefinhoMenes/status/1055120985144344582 …,https://twitter.com/gbrl_mendes/status/1055151368405684226,2018-10-24,14:37:44
1054152041122148352,que triste vcs não terem aula com o xico lobo,https://twitter.com/gbrl_mendes/status/1054152041122148352,2018-10-21,20:26:46
1054151942308536321,leva amanhã que a gente come,https://twitter.com/gbrl_mendes/status/1054151942308536321,2018-10-21,20:26:22
1050577620037980162,Na hora que toca Primavera todo mundo é corno,https://twitter.com/gbrl_mendes/status/1050577620037980162,2018-10-11,23:43:18
1049605181594394626,"Tá tudo uma merda, mas não é hora de sair correndo caralho",https://twitter.com/gbrl_mendes/status/1049605181594394626,2018-10-09,07:19:10
1049605042372792320,Eu não aguento mais gente desesperada que só é alarmista mas não tem um pingo de coragem de tentar mudar as coisas pra melhor,https://twitter.com/gbrl_mendes/status/1049605042372792320,2018-10-09,07:18:37
1049426338946387968,"Exatamente. Ele injetou silicone industrial no braço, sem base",https://twitter.com/gbrl_mendes/status/1049426338946387968,2018-10-08,19:28:31
1048909420619554821,Ah nem Gaia a essa hora,https://twitter.com/gbrl_mendes/status/1048909420619554821,2018-10-07,09:14:28
1048908453492736001,Hora de votar. Que deus me elimine,https://twitter.com/gbrl_mendes/status/1048908453492736001,2018-10-07,09:10:37
1048561385062457346,Meu deus bubu ainda bem que fizeram ele chorar hahahrbah,https://twitter.com/gbrl_mendes/status/1048561385062457346,2018-10-06,10:11:30
1048038562632032257,Eu falo coisas pro @joaovitor_me que doem,https://twitter.com/gbrl_mendes/status/1048038562632032257,2018-10-04,23:33:59
1048025934085992448,Tou vendo o povo falar isso queria ver aaaaaaa mas estou preso na UFMG ainda,https://twitter.com/gbrl_mendes/status/1048025934085992448,2018-10-04,22:43:48
1048024963993755649,"Estou perdendo o debate do candidato que ocupou meu coração, muito triste",https://twitter.com/gbrl_mendes/status/1048024963993755649,2018-10-04,22:39:57
