id,tweet,link,date,time
1063808819246129152,"Ela me perseguiu pela loja, ai teve uma hora q eu vi q ela não tava mais lá e enfiei a tinta no bolso, só que ela tava desconfiada e chamou o gerente falando q eu tinha roubado, mas eu consegui tirar sem ela perceber e ficou na minha mão (tipo escolhendo), ai eu fiz uma de sonso",https://twitter.com/jjiyongxx/status/1063808819246129152,2018-11-17,12:59:21
1063804282137468928,kjkkj fui roubar tinta e a moça quase me pegou  eu preciso parar de fugir meus problemas fazendo coisas ruins,https://twitter.com/jjiyongxx/status/1063804282137468928,2018-11-17,12:41:20
1063464913539133441,"Desculpa a demora, a minha mãe toda feliz pq eu passei maquiagem e a minha prima que ignora meu gênero e ainda se finge de boa amiga",https://twitter.com/jjiyongxx/status/1063464913539133441,2018-11-16,14:12:48
1063460977407086592,"QUERO QUE TODO MUNDO VÁ TOMAR NO CU TAMBÉM AQUELES QUE ACHAM QUE MAQUIAGEM DEFINE ALGO, EU SOU A PORRA DE UM HOMEM E EU USO MAQUIAGEM SIM PQ EU GOSTO E QUERO QUE VOCÊ SE FODA",https://twitter.com/jjiyongxx/status/1063460977407086592,2018-11-16,13:57:09
1063460511449341952,MANO VÃO TOMAR NO CU VOCÊS QUE FAZEM QUESTÃO DE IGNORAR AS COISAS QUE UMA PESSOA TRANS SENTE E PEDE PRA PELO MENOS SE SENTIR MAIS CONFORTÁVEL CONSIGO,https://twitter.com/jjiyongxx/status/1063460511449341952,2018-11-16,13:55:18
1063460335624118272,QUE ÓDIO,https://twitter.com/jjiyongxx/status/1063460335624118272,2018-11-16,13:54:36
1063212141610770434,"só lembro de você se inspirando em mim nessa parte, com as coisas que eu te conto, quem sabe nosso beijo vem",https://twitter.com/jjiyongxx/status/1063212141610770434,2018-11-15,21:28:22
1062830789065367552,"Demais, da até ódio",https://twitter.com/jjiyongxx/status/1062830789065367552,2018-11-14,20:13:01
1062383184665608192,"Eu te amo tanto, fico tão feliz em saber que você está bem e tá engordando, lembro da minha frustração do seu tórax marcado com seus ossos, eu me assustava tanto, fico realmente feliz em saber que está bem e saudável, eu te amo demais  pic.twitter.com/GNMQ6RkNPc",https://twitter.com/jjiyongxx/status/1062383184665608192,2018-11-13,14:34:24
1062197161746722817,"AI EU TO TAO FELIZ, LEMBRO DE COMO EU FICAVA AFLITO COM AS APRESENTAÇÕES E COMO DAVA PRA VER O OSSO MARCANDO O TÓRAX DELE, AI QUE ANJO MEUDEUS EU QUERO MORDER ESSA BOCHECHA LINDA E GOTOSA  https://twitter.com/18081988KJY/status/1062196532324196352 …",https://twitter.com/jjiyongxx/status/1062197161746722817,2018-11-13,02:15:12
1062182950735880197,"anjos se até o jiyong que é o jiyong já d*safinou e todo mundo entende, não sei pq você fazem tanto alarde por causa do j*min, todos os artistas são humanos, lembre-se disso, o seu fav pode vir a acontecer o mesmo e você vai o defender da mesma maneira que nós estamos fazendo",https://twitter.com/jjiyongxx/status/1062182950735880197,2018-11-13,01:18:44
1061978435839578112,Vocês não sabem o quão quebrado o meu coração tá  https://twitter.com/gcfkooks_/status/1061813311967293441 …,https://twitter.com/jjiyongxx/status/1061978435839578112,2018-11-12,11:46:04
1061043978454351872,"Seus olhos são lindos, verdadeiros espelhos da alma, eu encontro algo tão bonito neles Jin, você é tão precioso que me dói o peito saber das coisas que te acontecem e que você aguenta fortemente, eu te amo Jin, você é incrível #jingostosoetalentoso pic.twitter.com/7huRD6p2n0",https://twitter.com/jjiyongxx/status/1061043978454351872,2018-11-09,21:52:52
1061043172791513088,"Espero que saiba que tem muitas pessoas que te amam de verdade, desculpa pelas fãs decepcionantes desses dias, você é incrível seokjin, INCRÍVEL. #jingostosoetalentoso pic.twitter.com/NSFg9bhu0k",https://twitter.com/jjiyongxx/status/1061043172791513088,2018-11-09,21:49:40
1061038333055459330,"Você é um anjo precioso Jimin @BTS_twt  você cura com as suas mãozinhas e com o seu jeito adorável, você é perfeito de todas as maneiras  pic.twitter.com/myqHQn44qh",https://twitter.com/jjiyongxx/status/1061038333055459330,2018-11-09,21:30:26
1061038117266841600,"Você meu pitico e lindo Jimin, você é especial, não entendo como um ser tão precioso recebe tanto ódio assim, você merece amor, você é amor, a personificação do adorável, eu te amo meu anjo, você é incrível de todos os jeitos, aguente firme, estou contigo  #JIMIN pic.twitter.com/2sWUp15fQf",https://twitter.com/jjiyongxx/status/1061038117266841600,2018-11-09,21:29:34
1060317369023844352,"Eu tinha acabado de falar pros meus anjos que eu estava feliz e que por causa do que aconteceu eu tinha perdido a vontade de me machucar.  pois é, voltou",https://twitter.com/jjiyongxx/status/1060317369023844352,2018-11-07,21:45:35
1060314958091730944,"que otimo, minha mãe conseguiu estragar o raro momento que eu me sinto feliz",https://twitter.com/jjiyongxx/status/1060314958091730944,2018-11-07,21:36:00
1060113768812855296,"Eu tenho tanto medo de como ele deve se sentir quando ele vê essas coisas, ele já se cobra o bastante e ainda tem gente que faz isso",https://twitter.com/jjiyongxx/status/1060113768812855296,2018-11-07,08:16:33
1058765958754549760,"Você é tão maravilhoso, eu não consigo nem expressar o quão bonito você é, obrigada por existir e nos abençoar com sua música, mesmo não merecendo isso. Vai ser curto, mas saiba que eu te amo muito e que nem cabe direito no meu peito. #HappyTOPday pic.twitter.com/w5VzqjhK1G",https://twitter.com/jjiyongxx/status/1058765958754549760,2018-11-03,14:00:50
1058765948428140545,"Desculpa por todas as coisas que você já teve que passar por conta da maldade humana, você nunca mereceu isso e espero de coração que você não se afete mais, porque infelizmente eu não posso tirar a maldade das pessoas, me perdoa por isso, eu te amo tanto seunghyun. #HappyTOPday pic.twitter.com/yJeBWec8N2",https://twitter.com/jjiyongxx/status/1058765948428140545,2018-11-03,14:00:47
1058765936260513792,"Nem comecei a escrever e já tô chorando, eu não sei como começar, mas parabéns, parabéns não só por estar fazendo aniversário, mas parabéns por ter aguentado mais um ano, você é tão forte meu anjo. #HappyTOPday pic.twitter.com/DDRU6K6gMl",https://twitter.com/jjiyongxx/status/1058765936260513792,2018-11-03,14:00:44
1058434447077502976,Fiquei feliz pelo sehun ter conseguido uma linha boa,https://twitter.com/jjiyongxx/status/1058434447077502976,2018-11-02,16:03:31
1058434281532547073,Gente como tira isso da minha cabeça...DONT MESS UP MY TEMPO,https://twitter.com/jjiyongxx/status/1058434281532547073,2018-11-02,16:02:52
1058432567718961152,"ai debs o ruim/bom eh que o sentimento só aumenta MEUDEUS, não aguento mais sofrer",https://twitter.com/jjiyongxx/status/1058432567718961152,2018-11-02,15:56:03
1058338952271282177,Meu coração não aguenta uma revelação dessas 🤧,https://twitter.com/jjiyongxx/status/1058338952271282177,2018-11-02,09:44:03
1057405111243284480,A DESCULPA SE EU NÃO SOU INTELIGENTE O BASTANTE ORA ENTENDER AS COISAS SEM VIRGULAS 👺👺👺👺,https://twitter.com/jjiyongxx/status/1057405111243284480,2018-10-30,19:53:18
1057404825061732354,Eh verdade 👺👺👺👺👺👺👺👺,https://twitter.com/jjiyongxx/status/1057404825061732354,2018-10-30,19:52:10
1057403480892162057,"Eh fofinho do mesmo jeito, eu entendo na verdade",https://twitter.com/jjiyongxx/status/1057403480892162057,2018-10-30,19:46:50
1057397281492795393,"Espero que seja verdade, isso seria muito bom da parte dele, apesar de não ser mais que a obrigação né, mas uma mudança dessas me faz me sentir um pouco mais aliviado  https://twitter.com/gaybrasil/status/1057081444001083392 …",https://twitter.com/jjiyongxx/status/1057397281492795393,2018-10-30,19:22:12
1057271261020282881,"Te entendo perfeitamente, muito triste acordar depois de sonhar com gente bonita",https://twitter.com/jjiyongxx/status/1057271261020282881,2018-10-30,11:01:26
1056567466053246976,"Meudeus a Naomi e o André tão me fazendo assistir lazy town versão japonesa e francesa, que tipo de amigos eu tenho",https://twitter.com/jjiyongxx/status/1056567466053246976,2018-10-28,12:24:48
1056565841813217280,"Não se desculpa, você não tem pelo o que se desculpar, você é incrível, aguenta tanto dentro de si, né? Tá tão difícil, eu te entendo, mas meu anjo, tenho certeza que eles se orgulham demais de ti, por você ser tão forte, até eu que não te conheço me orgulho, você é incrível",https://twitter.com/jjiyongxx/status/1056565841813217280,2018-10-28,12:18:21
1056557950494498816,"ai minha nossa, as várias versões da Ariane que destroem meu coração por causa da beleza dessa mulher",https://twitter.com/jjiyongxx/status/1056557950494498816,2018-10-28,11:46:59
1056553202374590465,gente vocês não tão entendendo o meu amor pelas mãozinhas do Jimin  https://twitter.com/AESTA3THIQQ/status/1055404934361841665 …,https://twitter.com/jjiyongxx/status/1056553202374590465,2018-10-28,11:28:07
1055827244583661573,GENTE PELO AMOR DE DEUS O QUE TA ACONTECENDO O QUE SÃO ESSAS MÚSICAS NOVAS O QUE É ESSA DO JK JM E NJ ?????? ALGUÉM ME EXPLICA O QUE ACONTECEU ESSES DIAS QUE EU TAVA SEM INTERNET E O QUE ESSAS COISAS DE CHILD TAMBEM VO CHORA NAO TO ENTENDENDO NADA,https://twitter.com/jjiyongxx/status/1055827244583661573,2018-10-26,11:23:26
1053464638707453952,"SIM PELO AMOR DE DEUS, EU DEVIA ESTAR DORMINDO, MAS SIM POR FAVOR",https://twitter.com/jjiyongxx/status/1053464638707453952,2018-10-19,22:55:16
1053425836072861697,"É sim, não quero que isso aconteça, você merece tudo de melhor, você é um anjo que sempre se esforça pelos amigos, sempre os trata com carinho, mas esquece de se tratar com um pouco mais de carinho, você merece isso tanto quanto seus amigos, você é um garoto maravilhoso",https://twitter.com/jjiyongxx/status/1053425836072861697,2018-10-19,20:21:05
1053349080670310401,"[...] Eu te amo E não consigo me ver sem ser o teu amor por anos Não é acaso, é só amor Não existe engano Que me carreg… — Eu não tô sabendo reagir a essas declarações gente, socorro meu coração é frágil  https://curiouscat.me/jjiyongxx/post/682360650?1539972965 …",https://twitter.com/jjiyongxx/status/1053349080670310401,2018-10-19,15:16:05
1053072554372534272,"Te amo demais, as vezes nem cabe no coração 👺💕❤️❤️🤧  https://twitter.com/baratheonnx/status/1053067165987995648 …",https://twitter.com/jjiyongxx/status/1053072554372534272,2018-10-18,20:57:16
1053063595431546880,"@hawkstormm parabéns meu amor, você é um anjo que merece tudo de melhor desse mundo, sério! Você é incrível e com certeza vai ser uma escritora maravilhosa (já é, mas quando você publicar seu livro teu trabalho vai ser reconhecido por todos)+  pic.twitter.com/SQBJ7B5bPC",https://twitter.com/jjiyongxx/status/1053063595431546880,2018-10-18,20:21:40
1052931042003378176,JSXJXKDKDJD MEU AMOR É UMGENIO  https://twitter.com/baratheonnx/status/1052744240730660864 …,https://twitter.com/jjiyongxx/status/1052931042003378176,2018-10-18,11:34:57
1052930925191983104,Tô muito triste eu paguei o dramafever Premium e ele vai lá e desativa,https://twitter.com/jjiyongxx/status/1052930925191983104,2018-10-18,11:34:29
1052919489619218433,"Se o final for matar alguém, vou dropar a au, eu não tenho psicológico o suficiente pra ler coisa triste no momento",https://twitter.com/jjiyongxx/status/1052919489619218433,2018-10-18,10:49:03
1052916943240486913,"a minha nossa, pera que meu coração não aguenta tanto impacto, ai meudeus você é tão maravilhoso",https://twitter.com/jjiyongxx/status/1052916943240486913,2018-10-18,10:38:56
1052340939958702080,"a oi, só passei pra lembrar que eu amo você, tá? você é incrível meu nenê  não esqueça disso te amo demais boa noite 💗 — Eu te amo demais também meu anjo, você é muito especial pra mim 🤧💕  https://curiouscat.me/jjiyongxx/post/677908067?1539732606 …",https://twitter.com/jjiyongxx/status/1052340939958702080,2018-10-16,20:30:06
1051985596456026112,Alguém coloca o namjoon como imperador do mundo?  https://twitter.com/jimironic/status/1051982478020362240 …,https://twitter.com/jjiyongxx/status/1051985596456026112,2018-10-15,20:58:05
1051981102422904833,"gente socorro o meu gaydar só não apita pro namjoon e pro hoseok, tipo eles tem os momentos super poc deles, mas penso que é só dá personalidade e como pessoas muito liberais sabe? sla, já o resto meudeus",https://twitter.com/jjiyongxx/status/1051981102422904833,2018-10-15,20:40:14
1051220377450532869,"eu vo falar com você como, telepatia?",https://twitter.com/jjiyongxx/status/1051220377450532869,2018-10-13,18:17:23
1051197982790610944,Ai é o amor da minha vida mesmo  https://twitter.com/paletloona/status/1051113647760642048 …,https://twitter.com/jjiyongxx/status/1051197982790610944,2018-10-13,16:48:24
1050789836364423168,"ai vo lembrar, ou melhor o calendário vai me lembrar dmxkxld desculp",https://twitter.com/jjiyongxx/status/1050789836364423168,2018-10-12,13:46:34
1050787266661109761,"Você é meu príncipe encantado Jimin, eu te amo tanto, nem cabe no coração. #HappyJiminDay pic.twitter.com/9d6DkBv6kQ",https://twitter.com/jjiyongxx/status/1050787266661109761,2018-10-12,13:36:21
1050787244196458496,"Jimin, você pode não estar lendo isso, mas vou continuar dizendo sempre que posso, seu talento para todas as coisas são notáveis e lindas, você é lindo, por inteiro, sua essência, sua estética, sua alma. #HappyJiminDay pic.twitter.com/Grv3CelPj4",https://twitter.com/jjiyongxx/status/1050787244196458496,2018-10-12,13:36:16
1050787235556143104,"Momentos mais turbulentos da minha vida, seu sorriso, teu riso, tua forma de demonstrar carinho, tudo sobre você alivia meu coração e eu sinto que vale a pena continuar acordado, assim eu posso ver mais das suas ações, posso ver mais de você. #HappyJiminDay pic.twitter.com/UOWswKoZEr",https://twitter.com/jjiyongxx/status/1050787235556143104,2018-10-12,13:36:14
1050787144502046721,"#HappyJiminDay Oi meu amor, quero te dizer que eu te amo demais, acho que real nunca senti algo tão forte por alguém, não é atoa que eu tô chorando aqui só de escrever isso, você é perfeito meu amor, tudo em você é magnífico e toda sua aura é incrível, você me traz paz nos +  pic.twitter.com/tMsbOamRgF",https://twitter.com/jjiyongxx/status/1050787144502046721,2018-10-12,13:35:52
1050784372641751040,AI MEUDEUS EU TAVA ESQUECENDO Q HJ/AMANHÃ JÁ É ANIVERSÁRIO DO JIMIN,https://twitter.com/jjiyongxx/status/1050784372641751040,2018-10-12,13:24:51
1050108250589470722,"eu sou muito trouxa, se eu vejo um twt de ""rts pra eu conseguir conseguir tal coisa"" eu vou lá e ajudo e isso nunca vai acontecer comigo a",https://twitter.com/jjiyongxx/status/1050108250589470722,2018-10-10,16:38:11
1049824439934873601,"Tá repreendido, só apoio se ele virar o CEO mas continuando c o mesmo coração de hoje  https://twitter.com/gaaabgon/status/1049527573011664896 …",https://twitter.com/jjiyongxx/status/1049824439934873601,2018-10-09,21:50:25
1049049382203654145,"Eu fico muito feliz por você meu anjo, deve ser uma sensação única poder ser você mesma com a sua família, sério fico muito feliz aaaAAAAAA",https://twitter.com/jjiyongxx/status/1049049382203654145,2018-10-07,18:30:37
1049046456672370702,"Eu que sou o cúmulo da lerdeza não faço umas coisas dessas mano, eu fico real sem entender",https://twitter.com/jjiyongxx/status/1049046456672370702,2018-10-07,18:19:00
1049045894954405889,Meu olho tá dando espasmo,https://twitter.com/jjiyongxx/status/1049045894954405889,2018-10-07,18:16:46
1049045486374666241,"quero, mas não quero te usar sempre só como uma distração, eu não te chamo e você tá sempre se preocupando comigo, eu não quero te usar assim, eu sei que eu não chamo e muitas vezes não cumpro as coisas que falo, eu só não consigo cvs pelo wpp mas ainda acho errado",https://twitter.com/jjiyongxx/status/1049045486374666241,2018-10-07,18:15:08
1049044572913979392,"Sim, é isso o que ele não tá entendendo, eu sei que a gente vai precisar se defender, mais do que já tentamos, mas cARALHO é fácil falar, mas ver pessoas como a gente morrendo por estar tentando redimir o direito delas de serem do jeito que elas nasceram é horrível",https://twitter.com/jjiyongxx/status/1049044572913979392,2018-10-07,18:11:31
1049042962305482755,"Que estranho, ela dizia me amar, mas a minha existência é falta de porrada",https://twitter.com/jjiyongxx/status/1049042962305482755,2018-10-07,18:05:07
1048919981596057601,"Eu te amo tanto, me orgulho tanto, sério não sei como cabe tanto sentimento em um coração só, obrigado por existir e por me alegrar todos os dias com sua voz, com seu sorriso e por simplesmente ser você",https://twitter.com/jjiyongxx/status/1048919981596057601,2018-10-07,09:56:26
1048918194168258561,O homem mais bonito do mundo e nem tô falando só da estética  https://twitter.com/pjmins95/status/1048743567664005121 …,https://twitter.com/jjiyongxx/status/1048918194168258561,2018-10-07,09:49:20
1048916667361841152,"eu te amo tanto que as vezes eu nem entendo e me assusto um pouco, não posso te ver assim que meu coração aperta, sei que provavelmente suas lágrimas são de alívio, alegria, mas eu não consigo deixar de me preocupar, eu te amo tanto tanto tanto, nunca amei alguém nessa escala  https://twitter.com/stigmabrasil/status/1048751609138880512 …",https://twitter.com/jjiyongxx/status/1048916667361841152,2018-10-07,09:43:16
1048402354494685185,"Tipo parece que é efeito por causa das manchas, mas é pq eu não usei creme pra proteger ai eu tô com a cara amarela também socoro",https://twitter.com/jjiyongxx/status/1048402354494685185,2018-10-05,23:39:34
1048401995504209921,Se cuida meu amor :(,https://twitter.com/jjiyongxx/status/1048401995504209921,2018-10-05,23:38:08
1048024968213221378,"triste, ele não absorveu o significado de love yourself O problema não são as cirurgias, até pq se você sabe que isso vai te fazer feliz (claro que fazendo por você e não pela sociedade) tá tudo bem, mas ele quer virar uma pessoa que ele não é :(  https://twitter.com/loveintae/status/1048000521003446272 …",https://twitter.com/jjiyongxx/status/1048024968213221378,2018-10-04,22:39:58
1047589629434769409,"ai eu acho que sou um switcher, mas brat conta? pq real submissão não é pra mim, mais dom e brat msm   entendo nada direito dessas coisas",https://twitter.com/jjiyongxx/status/1047589629434769409,2018-10-03,17:50:05
1047584351708479495,"As vezes eu penso que eu só vou conseguir transar quando eu já tiver minha mastectomia, pq só de pensar que uma pessoa vai usar meus seios pra estímulos também, eu fico triste e com náuseas af",https://twitter.com/jjiyongxx/status/1047584351708479495,2018-10-03,17:29:07
1046811684072030209,não acredito que tô triste por algo q eu já tinha previsto KJJKK ai que decadência,https://twitter.com/jjiyongxx/status/1046811684072030209,2018-10-01,14:18:48
1046506157672726528,Eu e o meu amor 💕💕💕🤧 @naomichimchim pic.twitter.com/6WxNa24zcn,https://twitter.com/jjiyongxx/status/1046506157672726528,2018-09-30,18:04:45
1046466154506715136,"posso não ter ido na parada, mas tô recebendo pérolas da Ariane",https://twitter.com/jjiyongxx/status/1046466154506715136,2018-09-30,15:25:48
1046278962194911232,"Socorro anjo tenta se manter em pé pelo menos dkdkdkd amanhã vai ser foda, te desejo melhoras antecipadas",https://twitter.com/jjiyongxx/status/1046278962194911232,2018-09-30,03:01:58
1046137151124099073,"Oi meu mano, se eu vou pro inferno, então a gente se vê lá, ódio também te leva",https://twitter.com/jjiyongxx/status/1046137151124099073,2018-09-29,17:38:27
1046081457930817536,tô triste  https://twitter.com/Iammoremylrds/status/1045983492595699712 …,https://twitter.com/jjiyongxx/status/1046081457930817536,2018-09-29,13:57:09
1045757805557428224,"gente o sorriso do Jin no final de euphoria me deixa triste, pq?",https://twitter.com/jjiyongxx/status/1045757805557428224,2018-09-28,16:31:04
1043654395781636096,Gente ai eu tô morrendo de amor  https://twitter.com/baratheonnx/status/1043640412177612800 …,https://twitter.com/jjiyongxx/status/1043654395781636096,2018-09-22,21:12:52
1043277817272848384,meu coração tá muito soft,https://twitter.com/jjiyongxx/status/1043277817272848384,2018-09-21,20:16:29
1042946973060554752,"tá chega de discutir sobre política na internet, até pq eu nem gosto de falar sobre isso, espero que não venha ninguém encher o saco",https://twitter.com/jjiyongxx/status/1042946973060554752,2018-09-20,22:21:50
1042727065244626945,"kjkk Deve ser muito chato sair comigo, não é atoa q todo mundo sempre evita",https://twitter.com/jjiyongxx/status/1042727065244626945,2018-09-20,07:47:59
1041324791960162305,puta merda tô duro  https://twitter.com/Igbtsyoon/status/1041060483879632897 …,https://twitter.com/jjiyongxx/status/1041324791960162305,2018-09-16,10:55:51
1041072393350012928,"É tão ruim se afastar de alguém por causa dessa merda de doença, minhas paranóias me impedem de ser feliz, eu já estava com saudade de conversar com você, eu te amo demais ari",https://twitter.com/jjiyongxx/status/1041072393350012928,2018-09-15,18:12:55
1041038801727094784,"Eh q teve um tempo atrás que ameaçaram matar o j*min e o show que ia acontecer o ataque eh o de amanhã (ou hoje, não lembro)",https://twitter.com/jjiyongxx/status/1041038801727094784,2018-09-15,15:59:26
1041037835342688257,"Deuses, protejam os meus amores, protejam o meu amor Park Jimin, por favor ele é o meu mundo eu preciso da risada dele para me manter em pé, eu preciso da sua voz pra conseguir me manter firme, não deixe nada de mal acontecer com ele, por favor eu só quero que ele seja feliz  pic.twitter.com/QakezLYEjF",https://twitter.com/jjiyongxx/status/1041037835342688257,2018-09-15,15:55:36
1040709807416770560,"Eu consigo ver o filme sem me importar tanto com o enredo, porque só a arte feita é prazerosa, não sei se é por um gosto pessoal meu de gostar de coisas coloridas e brilhantes, mas eu me apaixonei pelos detalhes que tornaram o desenho ÚNICO, eu fico muito orgulhoso+",https://twitter.com/jjiyongxx/status/1040709807416770560,2018-09-14,18:12:08
1040709804682035200,"Next Gen é um filme incrivelmente estético, nunca me surpreendi tanto com um filme quanto estou agora, apesar da história ser meio meh, ele é muito bonito, apesar do traço lembrar minimamente os da Disney, a coloração, o brilho, a saturação das cores, tudo! tudo é muito bonito+  pic.twitter.com/oVbZFKxZjV",https://twitter.com/jjiyongxx/status/1040709804682035200,2018-09-14,18:12:07
1040547634090528768,"Eu nunca falaria algo se fosse mentira, eu até fiquei triste por você ser hetero :(",https://twitter.com/jjiyongxx/status/1040547634090528768,2018-09-14,07:27:43
1040390701203238912,"gente meu amigo eh muito lindo velho, o foco era pra ser na crianca dando de comer pela ele, mas mano olha esse maxilar velho puta que me pariu, olha esse pescoço, olja esses olhos, caralho que tesao  https://twitter.com/Gabrielzxy_/status/1040373632508350464 …",https://twitter.com/jjiyongxx/status/1040390701203238912,2018-09-13,21:04:07
1040239313122992128,"Ai vou até sair do tt, não aguento esse tipo de merda",https://twitter.com/jjiyongxx/status/1040239313122992128,2018-09-13,11:02:33
1039988711201693698,eu tô com medo de ir amanhã ver elas,https://twitter.com/jjiyongxx/status/1039988711201693698,2018-09-12,18:26:45
1039988201144889344,"E hoje foi oficializado, fui diagnosticado com depressão e já recebi os remédios pra começar o tratamento",https://twitter.com/jjiyongxx/status/1039988201144889344,2018-09-12,18:24:43
1039674805354725377,"Espero de coração que hoje seja um ótimo dia pra ti e que todos os outros dias sejam também, te amo meu príncipe. 💜💜💜 #RMGalaxyDay pic.twitter.com/h2FeRqn1hC",https://twitter.com/jjiyongxx/status/1039674805354725377,2018-09-11,21:39:24
1039674781812105217,"#RMGalaxyDay Oi meu nenê, desculpa não ter aparecido,eu sou ruim com datas, mas parabéns! Você é uma pessoa incrível, lindo, gostoso e aaaaa não sei nem expressar, tenho tanta vontade de sentar com você e começar a refletir sobre a vida, teu jeito, teu coração me encanta+  pic.twitter.com/cH1i6Lc7Xz",https://twitter.com/jjiyongxx/status/1039674781812105217,2018-09-11,21:39:18
1038916823549390851,"agr chega de reclamar da professora de matemática e vamos enaltecer o sorriso do jungkook, olha isso minha gente, é um anjo, eu nem sei como expressar o amor que eu tenho por esse sorriso de coelho fofo, todos os dias eu morro de amores  pic.twitter.com/2YByCxMt66",https://twitter.com/jjiyongxx/status/1038916823549390851,2018-09-09,19:27:27
1038584340777783296,"pois é até eu fiquei na hora, grazas a deus minha intuição foi mais rápida e perguntei a coisa mais importante pra pessoa envolvida.",https://twitter.com/jjiyongxx/status/1038584340777783296,2018-09-08,21:26:17
1038583670171463680,infelizmente algo muito forte para ser exposto na internet,https://twitter.com/jjiyongxx/status/1038583670171463680,2018-09-08,21:23:37
1038491021917741057,"muito triste não ter nosso potencial levado a sério, muito triste",https://twitter.com/jjiyongxx/status/1038491021917741057,2018-09-08,15:15:28
1038488569801846784,"Eu espero de verdade que um dia eu comece a ter confiança em mim mesmo e me descubra ainda mais, sem ter medo do que as pessoas achariam.",https://twitter.com/jjiyongxx/status/1038488569801846784,2018-09-08,15:05:43
