id,tweet,link,date,time
970843671745703936,"7 dias. Um anjo desses bixo, olha esse sorriso, sem contar a voz que nos abençoa sempre que sai um a. Te amo 🌹❤️  pic.twitter.com/ye5GMc5bRD",https://twitter.com/jjiyongxx/status/970843671745703936,2018-03-05,23:09:03
970835330931789826,Gente tô muito triste pq vou ter q apagar minha coisa aq,https://twitter.com/jjiyongxx/status/970835330931789826,2018-03-05,22:35:54
970287821423554560,"9 dias. Um homem tão especial como você não deveria estar em um mundo como esse, mas mesmo assim obrigado por me dar forças, te amo 🌹❤️  pic.twitter.com/6rm2DaNs89",https://twitter.com/jjiyongxx/status/970287821423554560,2018-03-04,10:20:18
970091133350154240,"Foi muito incrível e aconchegante, ela sempre acalma meu coração e é tão natural passar a tarde com ela sabe? Ahj",https://twitter.com/jjiyongxx/status/970091133350154240,2018-03-03,21:18:44
970086066677002240,"Aí eu lembrei da minha professora do 1 ano, ela tinha retrucado o famoso ""pipipipopo saco de cimento"" e disse macho só carrega saco de cimento pq quer mostrar a força q mal tem, mesmo que do lado dele tenha um fucking carrinho de mão",https://twitter.com/jjiyongxx/status/970086066677002240,2018-03-03,20:58:36
970084696565612544,"""na hora de carregar um saco de cimento ninguém eh feminista""  pic.twitter.com/WgF5irMNYk",https://twitter.com/jjiyongxx/status/970084696565612544,2018-03-03,20:53:09
969570849484365824,"10 dias. Meu solzinho, fica bem meu amor, esperaremos te esperando, você ilumina nossos dias com o teu sorriso e sua aura maravilhosa, sua voz é como a de um anjo, obrigada por existir, te amo. ❤️🌄  pic.twitter.com/qP4yU07CxG",https://twitter.com/jjiyongxx/status/969570849484365824,2018-03-02,10:51:18
969243339953528834,"Tô com dor de cabeça, Hoseok me perdoa, mas mais tarde eu ouço as músicas, se eu tentar agora sinto que vou acabar me estressando e não quero tornar um momento tão especial em estresse.",https://twitter.com/jjiyongxx/status/969243339953528834,2018-03-01,13:09:54
968892840066666498,"A Yeri é namorada da Joy, não sei da onde tiram essas coisas durr",https://twitter.com/jjiyongxx/status/968892840066666498,2018-02-28,13:57:08
968233712113602561,"Ai gente o Taeyong meu deus que tesão de homem, que tesão de voz, que tesão de dança. Como alguém consegue ser tão perfeito?",https://twitter.com/jjiyongxx/status/968233712113602561,2018-02-26,18:18:00
968215287249166336,"SOCORRO MEU ANJO EU TO MUITO TRISTE, MAS SEI QUE ELE VAI VOLTAR TÃO FORTE QUANTO UM VERDADEIRO DRAGÃO  pic.twitter.com/wgHqlJYppe",https://twitter.com/jjiyongxx/status/968215287249166336,2018-02-26,17:04:47
968214329819586561,"Eu tô muito triste, socorro",https://twitter.com/jjiyongxx/status/968214329819586561,2018-02-26,17:00:59
968140922365075457,"Hj. Hoje é o dia que você irá, mas saiba que você meu amor, recebe muito amor e que eu, as V.I.P's e os membros estaremos te esperando ansiosamente, você é nosso orgulho até na hora de ir para o exército, olha a escalação que você foi! Te amo demais meu grande prodígio ❤️🌹  pic.twitter.com/NIPD7EH0yk",https://twitter.com/jjiyongxx/status/968140922365075457,2018-02-26,12:09:17
968074526788644864,Olha falta algumas horas pra eu chorar,https://twitter.com/jjiyongxx/status/968074526788644864,2018-02-26,07:45:27
968074412388945920,"1 dia. Ahj amores da minha vida, juntos desde pequenos, fiquem saudáveis e felizes, vocês merecem o mundo mas o mundo não merece vocês. ❤️🌹  pic.twitter.com/4pLZrGIvh9",https://twitter.com/jjiyongxx/status/968074412388945920,2018-02-26,07:45:00
967940562157481984,Eu não sei fazer conta e acabei de me tocar q amanhã 13:00 já é dia 27 na Coreia eu vou me matar,https://twitter.com/jjiyongxx/status/967940562157481984,2018-02-25,22:53:08
967933386043006976,"2 dias. Você não foi ainda, mas já sinto muito sua falta, vou rezar para todos os deuses para que tudo dê certo pra ti é que você possa voltar sem nenhum machucado, eu te amo demais 🌹❤️  pic.twitter.com/lPqy5yd96i",https://twitter.com/jjiyongxx/status/967933386043006976,2018-02-25,22:24:37
967879646057508864,"Aq é o contrário, eles não iam e agr resolveram começar a frequentar",https://twitter.com/jjiyongxx/status/967879646057508864,2018-02-25,18:51:04
967862998114144256,É o ser mais fofo desse mundo,https://twitter.com/jjiyongxx/status/967862998114144256,2018-02-25,17:44:55
967551678168879104,"Seu sorriso ilumina meu dia, obrigada por compartilhar sua alegria e suas tristezas conosco, espero que consiga sorrir até o final, você é precioso, aguente firme, mas não precisa se esforçar ao ponto de se machucar, está tudo bem não se sentir bem o tempo todo, te amo. 🌹❤️  pic.twitter.com/g5bM4VjIEk",https://twitter.com/jjiyongxx/status/967551678168879104,2018-02-24,21:07:50
967550743342452736,"3 dias. Seu sorriso brilhante ilumina meu dia,espero que continue sorrindo até o fim dos tempos, você é a pessoa que mais merece felicidade nesse mundo, obrigada por compartilhar suas alegrias e tristezas conosco, aguente firme, mas não se esforce ao ponte de se desgastar. 🌹❤️  pic.twitter.com/Z43Uz3OjmM",https://twitter.com/jjiyongxx/status/967550743342452736,2018-02-24,21:04:08
967038477945704448,"Verdade, eu tava lá",https://twitter.com/jjiyongxx/status/967038477945704448,2018-02-23,11:08:34
967019974412918784,"4 dias. Suas fotos com animais são sempre tão softs que meu coração não aguenta tanta doçura, não consigo ver diferença entre você e o gatinho, te amo. 🌹❤️  pic.twitter.com/RVwO4UrToG",https://twitter.com/jjiyongxx/status/967019974412918784,2018-02-23,09:55:02
966789075339530240,"5 dias. É o meu anjo, nunca vi uma pessoa tão brilhante quanto você, tudo em ti é cintilante, desde seu olhar, sorriso, até a sua alma e inteligência, adoro como você tem uma visão profunda de muitas coisas, é o maior orgulho da minha vida.  pic.twitter.com/TzcvIAFECf",https://twitter.com/jjiyongxx/status/966789075339530240,2018-02-22,18:37:32
966433285395177474,"6 dias. É um nenê incurável pro meu coração, sempre vai ter aquela hora que vou olhar pra você pensando o quanto que você precisa ser protegido, te amo demais socoro 🌹❤️  pic.twitter.com/G5BJzQmMwG",https://twitter.com/jjiyongxx/status/966433285395177474,2018-02-21,19:03:45
965697637180731392,"8 dias. Socoro Kwon Ji-yong, você é o ser mais perfeito desse mundo, a combinação e harmonia do fofo e do sexy, seu olhar chega no meu coração mesmo que em fotos, obrigada por todos seus tiros, não tô reclamando. 🌹  pic.twitter.com/q8LKEYIXWb",https://twitter.com/jjiyongxx/status/965697637180731392,2018-02-19,18:20:33
965696964930260993,"9 dias. Seu sorriso é tão doce, é extraordinário o jeito que ele me aquece, cada vez que eu te olho me sinto bem, obrigada por existir, não sei o que seria de mim sem você. 🌹  pic.twitter.com/kQQgLf3EYm",https://twitter.com/jjiyongxx/status/965696964930260993,2018-02-19,18:17:52
964910615205687297,"Hoje é o seu dia nenê, nosso sol, nossa esperança ❤️🌹   Seu sorriso é o que nos faz feliz e espero que tenha toda a felicidade do mundo, obrigada por existir ❤️🌹 #GoldenHobiDay pic.twitter.com/nfgpvnUzuV",https://twitter.com/jjiyongxx/status/964910615205687297,2018-02-17,15:13:12
964909940006621184,"10 dias. Te amo demais meu príncipe, espero que você fique bem, sei que se sente solitário a maioria das vezes, mas você não está... Eu te amo demais meu grande amor 🌹❤️ Seu sorriso é a minha luz.  pic.twitter.com/za3p06dA5G",https://twitter.com/jjiyongxx/status/964909940006621184,2018-02-17,15:10:31
964129591513231361,Ai meu coração  https://twitter.com/BBProjectBrazil/status/964087717066870784 …,https://twitter.com/jjiyongxx/status/964129591513231361,2018-02-15,11:29:41
963081263656599552,Os seres mais lindos desse mundo  https://twitter.com/MOSNTEXOS/status/963068774533525505 …,https://twitter.com/jjiyongxx/status/963081263656599552,2018-02-12,14:04:01
962132418269515777,"Isso nenê, vc merece o mundo inteiro, mas o mundo não te merece, c é a pessoa mais amável desse planeta todinho",https://twitter.com/jjiyongxx/status/962132418269515777,2018-02-09,23:13:38
962124166207102977,"Eu sei q é, o Gabs é o ser mais fofinho desse mundo",https://twitter.com/jjiyongxx/status/962124166207102977,2018-02-09,22:40:51
962121401011527682,"nunca mais viria, sendo q eu nem convidei ela 🤷🏻‍♀ meus tios e ela foram só pra dar uma de guarda costas, demorou séculos para conseguirmos encontrar o povo, só pudemos dar um oi e fomos embora, todo mundo de mal humor e eu querendo cometer um crime... Eu só queria tentar me +",https://twitter.com/jjiyongxx/status/962121401011527682,2018-02-09,22:29:52
962121286410539008,"tivemos q nos separar, ficou eu, a fravia, minhas duas primas e minha mãe, não pudemos ir lá pular o carnaval até encontrarmos com eles, demorou 1hr e meia, teve uma hora q eu pedi pra minha mãe ligar para meus tios e ela surtou na rua dizendo q estava de saco cheio e que  +",https://twitter.com/jjiyongxx/status/962121286410539008,2018-02-09,22:29:24
962121104298053632,"Bom, o plano começou dando errado na hora de sair de casa, era para eu encontrar a Ari na saída pq não fui na escola e eu tinha combinado da gente se ver, mas aí minha tia resolveu ir comer às 16:20 ou seja chegamos atrasadas, ai teve o problema de achar um estacionamento +",https://twitter.com/jjiyongxx/status/962121104298053632,2018-02-09,22:28:41
961342349459841024,Finalmente Jimin está com o amor de sua vida djdkdkd  https://twitter.com/BTS_twt/status/960906676525195265 …,https://twitter.com/jjiyongxx/status/961342349459841024,2018-02-07,18:54:11
959117459335843840,"SM conhece a Rússia, mas o Brasil não endjxjxjx q triste vo chora  https://twitter.com/bhbrazil/status/958781208393142273 …",https://twitter.com/jjiyongxx/status/959117459335843840,2018-02-01,15:33:16
959071162990059520,"Mal se alistou e meu coração tá doendo, GD artista sendo o amor da minha vida, espero que fique bem e que volte logo, com toda aquela força, te amo meu nenê ❣️💕❤️  https://twitter.com/xxgdragonbrazil/status/958820883174391808 …",https://twitter.com/jjiyongxx/status/959071162990059520,2018-02-01,12:29:18
958316660640964613,Mas sua cabeça tá ruim como? Tipo dor de cabeça ou n sei?,https://twitter.com/jjiyongxx/status/958316660640964613,2018-01-30,10:31:11
957625062240215040,"Gente, eu esqueço e o Facebook ainda acontece coisas boas NSNSNS Q nenes  https://twitter.com/Mfect_Brasil/status/957507655559471104 …",https://twitter.com/jjiyongxx/status/957625062240215040,2018-01-28,12:43:01
957406857567653890,"Você que é a flor de amendoeira mais preciosa desse mundo todinho, te amo demais ariririri 💕❤️",https://twitter.com/jjiyongxx/status/957406857567653890,2018-01-27,22:15:57
957398974754848769,"MAS É O NENE MAIS NENE DESSES MUNDO DELS, EU Q ESXOLHI ESSA FOTO AHJ É O AMOR DA MINHA VIDA MESMO DELS",https://twitter.com/jjiyongxx/status/957398974754848769,2018-01-27,21:44:37
956287510858039296,"mano, esse hino eu sempre ouço pra começar o dia me sentindo foda, GD é capaz de me tirar da lama tão facilmente que eu fico até impressionada.  https://twitter.com/GDACTIII/status/955843053234761728 …",https://twitter.com/jjiyongxx/status/956287510858039296,2018-01-24,20:08:04
956191325447221250,"KSKDMDMD MELHOR DECLARAÇÃO DO MUNDO, TE AMO PRA UMA PORRA, CACETE!",https://twitter.com/jjiyongxx/status/956191325447221250,2018-01-24,13:45:51
956023430494777350,"Uma carta vale mais que diversos objetos, expressar seu amor por eles sem precisar ser algo material é a coisa mais gostosa do mundo  https://twitter.com/AlinneSammy/status/956018162281189378 …",https://twitter.com/jjiyongxx/status/956023430494777350,2018-01-24,02:38:42
955991279019741185,"Obrigada, mas acho que conversar sobre isso passaria uma imagem mais patética minha do que eu já mostro jsjddjdjj te amo demais, obrigada de verdade ❤️",https://twitter.com/jjiyongxx/status/955991279019741185,2018-01-24,00:30:57
955989830558679040,"Aish q vergonha dels, para Gabriel eu te amo sim fdp, vou até comprar uma fantasia de maid pra você, vai ser maravilhoso.",https://twitter.com/jjiyongxx/status/955989830558679040,2018-01-24,00:25:11
955982026418675713,"Aquele vídeo enviado em um momento q vc tá triste por uma pessoa especial que te faz ficar feliz jsdkdk ai gente, eu não mereço tanto amor, te amo Naomi sz   https://youtu.be/_WT-SK9hTeI ",https://twitter.com/jjiyongxx/status/955982026418675713,2018-01-23,23:54:11
955976506366418949,"Eu entro meu quarto e dou até risada, é tudo tão nojento, roupas espalhadas, escrivaninha bagunçada e quase quebrando e eu nunca faço nada, deito na cama também imunda e durmo, durmo de tarde e fico no celular de madrugada.",https://twitter.com/jjiyongxx/status/955976506366418949,2018-01-23,23:32:14
955975609167024129,Eu não me aguento mais e eu sei q mesmo assim eu vou ter que me aturar amanhã e depois.,https://twitter.com/jjiyongxx/status/955975609167024129,2018-01-23,23:28:41
955975255671083009,"Mas não sirvo nem pra acabar com isso logo, eu tenho tanto medo do que eu causaria na família e para meus amigos, sabe? Apesar de eu sempre desconfiar do amor deles, esse é um dos maiores motivos do meu ódio, não consigo mais acreditar que alguém gosta de mim.",https://twitter.com/jjiyongxx/status/955975255671083009,2018-01-23,23:27:16
955974722331738113,"Sempre que me olho no espelho um  sentimento de desgosto se espalha por todo meu corpo, não consigo fazer nada além de me odiar.",https://twitter.com/jjiyongxx/status/955974722331738113,2018-01-23,23:25:09
955974138111373312,"Eu tenho tudo na vida e sempre reclamo, digo que gostaria de morrer. O sentimento do vazio tá tão grande ultimamente, apesar de ter tudo, eu não me aguento mais.",https://twitter.com/jjiyongxx/status/955974138111373312,2018-01-23,23:22:50
955973829490302977,"Eu sempre digo pras pessoas que gosto muito de mim e que se  encontrasse um clone meu, eu a beijaria, mas no fundo eu sei que me odeio bastante e que se isso acontecesse, eu sla iria matar a clone de tanto ódio.",https://twitter.com/jjiyongxx/status/955973829490302977,2018-01-23,23:21:36
955973403852398592,É tão ruim quando você tá triste e tem tudo na vida né?,https://twitter.com/jjiyongxx/status/955973403852398592,2018-01-23,23:19:55
955463636134367232,"Gente olha esse sorriso dels, Jimin de cabelo preto é um demônio só pode, aqueles q vem pra acabar com seu coração e tirar sua inocência, sua mente fica impura e ele te leva pro hell. Não posso com isso dels, é muita perfeição. #iHeartAwards #BestFanArmy #BestBoyBand @BTS_twt pic.twitter.com/Jq1rqc0rJc",https://twitter.com/jjiyongxx/status/955463636134367232,2018-01-22,13:34:17
955112291955068931,"#HollandDebutDay já é a vigésima quarta vez que eu escuto, a voz dele é tão gostosa deus, aquele tom rouco e aquelas cores no MV, tô até chorando de tão soft, é tudo tão perfeito que sinto que estou flutuando.  #NEVERLAND",https://twitter.com/jjiyongxx/status/955112291955068931,2018-01-21,14:18:10
955110313455693825,"Essa música traz um sentimento tão gostoso de inclusão social, espero que agora os LGBT's+ da Coreia se sintam mais acolhidos, que saibam q não estão sozinhos e que agora vai ter alguém que vai crescer e mostrar a todos sua voz.  #HollandDebutDay #NEVERLAND @HOLLAND_vvv",https://twitter.com/jjiyongxx/status/955110313455693825,2018-01-21,14:10:18
955099293354020864,"Eu tô fazendo um textinho em inglês, espero q ele leia, tá sendo feito com todo meu amor #HollandDebutDay",https://twitter.com/jjiyongxx/status/955099293354020864,2018-01-21,13:26:31
955087718765252608,AI DELS MEU CORAÇÃO NAO TA AGUENTANDO #HollandDebut,https://twitter.com/jjiyongxx/status/955087718765252608,2018-01-21,12:40:31
954901955188490240,Você não é o BigBang mas tem espaço V.I.P no meu coração 🌹❤️ te amo,https://twitter.com/jjiyongxx/status/954901955188490240,2018-01-21,00:22:21
954900887478177792,"Tá, já tenho o tweet fixado pra fazer várias coisas legais, agora preciso de ideias",https://twitter.com/jjiyongxx/status/954900887478177792,2018-01-21,00:18:07
954900180545015808,"Eu fico tão triste por ele se desculpar tanto, alguém o diz q não é culpa dele dels  https://twitter.com/HooMonstaXBR/status/954830914554613761 …",https://twitter.com/jjiyongxx/status/954900180545015808,2018-01-21,00:15:18
954899693145935872,"Vish, precisa conseguir aguentar, pq amor por você é o que não falta em mim",https://twitter.com/jjiyongxx/status/954899693145935872,2018-01-21,00:13:22
954897204136890370,"EU TAVA ME REPRIMINDO AQ PQ SEMPRE Q FSLO DE BIGBANG EU FICO TRISTE E COM SAUDADE, VOU PARAR COM ESSA PORRA E VOU DAR MAIS AMOR PRA ELES PQ SEM ELES NAO SEI O Q EU SERIA DA MINHA VIDA.",https://twitter.com/jjiyongxx/status/954897204136890370,2018-01-21,00:03:29
954894175685705728,"E eu achando q VIP era o fandom perfeito, que não cria alarde com coisas tão esdrúxulas meudeus, alguém me mata",https://twitter.com/jjiyongxx/status/954894175685705728,2018-01-20,23:51:27
954850548599095296,"E eu q fui fazer biscoito em formato de boneco e na verdade eu fiz um monstro, fui tentar decorar ele com um coiso vermelho e ficou parecendo q ele tinha cometido um assassinato",https://twitter.com/jjiyongxx/status/954850548599095296,2018-01-20,20:58:05
954846566929633280,É muito amor acumulado,https://twitter.com/jjiyongxx/status/954846566929633280,2018-01-20,20:42:16
954806930521935872,"Vai no médico bb, não deixe isso piorar, faça as coisas que você gosta mesmo se ela estiver te impedindo, você é forte e eu acredito em você! Fighting",https://twitter.com/jjiyongxx/status/954806930521935872,2018-01-20,18:04:46
954806711977734144,"Vc já parou pra sentir o olhar penetrante de Kwon Ji-yong hj?  Gente, esse homem tem tantos lados que meu coração não aguenta, como eu o amo dels, G-Dragon sempre será meu amor maior aaaaa obrigada por existir e fique bem meu anjo, te amo demais.  pic.twitter.com/WsgMBRBCUG",https://twitter.com/jjiyongxx/status/954806711977734144,2018-01-20,18:03:54
954804452606775297,"Respondesse ""NOSSA, NEM PASSOU ISSO PELA MINHA CABEÇA, QUE IDEIA GENIAL A SUA HEIN""",https://twitter.com/jjiyongxx/status/954804452606775297,2018-01-20,17:54:55
954803342571724801,BDJDJD AAAA E ESSE CARINHO COM O DEDO DELS?  https://twitter.com/apreciandoKM/status/954633377059098624 …,https://twitter.com/jjiyongxx/status/954803342571724801,2018-01-20,17:50:30
954801526798680065,"Pena q depois de um tempo o povo esquece deles, tipo as fadas do H.U.B cadê o pessoal planfetando ainda?",https://twitter.com/jjiyongxx/status/954801526798680065,2018-01-20,17:43:18
954773179762991104,"Ai dels, eu só coloquei um coração no meu ""te amo ❤️"",  pera ❤️💕❤️💓💕💗💙💚💛💜🖤💝💞💟❣️",https://twitter.com/jjiyongxx/status/954773179762991104,2018-01-20,15:50:39
952183713684770816,"VIXX já é perfeito, mas fica melhor ainda quando eles fizeram a performance de Shangri-la no mbc. Asiático enaltecendo a cultura asiática é a melhor coisa do mundo.   https://m.youtube.com/watch?v=XtzyyVoBz3w … 🎥 VIXX - Shangri-La(Remix ver), 빅스 - 도원경(리믹스ver) @2017 MBC ... pic.twitter.com/hSenF7JpxP",https://twitter.com/jjiyongxx/status/952183713684770816,2018-01-13,12:21:02
952161884983255040,"E todos merecem tudo nesse mundo, por terem aguentado tanta coisa na vida. Obg dnd",https://twitter.com/jjiyongxx/status/952161884983255040,2018-01-13,10:54:18
950032228989456384,"Eu tô com tanta saudade deles que meu coração aperta só de ver aquelas compilações de vídeos engraçados. Sinto tanta saudade desse sorriso doce, tanta falta do olhar doce que ele dirige as fãs e do jeitinho afrontoso dele, espero que esteja bem, eu o amo amo demais mesmo.  pic.twitter.com/46V1jE5dsj",https://twitter.com/jjiyongxx/status/950032228989456384,2018-01-07,13:51:48
950025305078599680,"AAAAAAAAAAAAAAAA COMO EU AMO ESSES NENÊ LINDO, OLHA ESSA VOZINHA FOFA E MARAVILHOSA, ESPERO Q ESSE ANJINHO ESTEJA BEM, ELE PRECISA SER PROTEGIDO DO MUNDO.  https://twitter.com/naomichimchim/status/950024720593899520 …",https://twitter.com/jjiyongxx/status/950025305078599680,2018-01-07,13:24:18
950021724405411840,"GENTE, COMO SEGURAR O CORAÇÃO? EU JÁ TO PERDIDAMENTE APX PELA HEEJIN E PELA CHUU, O Q EU FAÇO AGR QUANFP VEJO UM CONCEITO DESSE BIXO?  pic.twitter.com/HfZZz4fQ6O",https://twitter.com/jjiyongxx/status/950021724405411840,2018-01-07,13:10:04
947709914440437761,"Espero que nesse ano as pessoas comecem a reconhecer o trabalho de todos os k-groups, que haja mais amor entre os fandoms e que possamos curtir nossas músicas igualmente, sem que nossos ídolos sofram hate ou algo assim. #BTSxRockinEve",https://twitter.com/jjiyongxx/status/947709914440437761,2018-01-01,04:03:45
947690499833548800,"Jimin sendo a pessoa mais preciosa desse mundo não é novidade, como eu amo esse homem. Espero que tudo dê bom aconteça com ele, esse serzinho maravilhoso merece de tudo. @BTS_twt #Jimin",https://twitter.com/jjiyongxx/status/947690499833548800,2018-01-01,02:46:37
947488616393175040,"Isso parece maravilhoso mesmo,  de nada.",https://twitter.com/jjiyongxx/status/947488616393175040,2017-12-31,13:24:24
947486491248418816,"JKJJK esse tipo de coisa acontece, já me acostumei, te amo",https://twitter.com/jjiyongxx/status/947486491248418816,2017-12-31,13:15:57
947180345639698433,"Da caixa que elas criaram, para elas, só os brancos ocidentais baseados no padrão delas pode ser valorizado, saca? Ninguém aplaude por finalmente outras partes do mundo estar sendo revelada, por finalmente não só os americanos estarem recebendo a atenção.",https://twitter.com/jjiyongxx/status/947180345639698433,2017-12-30,16:59:26
947180335317639168,"Mano, sabe o que é engraçado? É que a gente sabe q o hate q o V levou, foi baseado sim na xenofobia e no ""preconceito"" que os antis tem com idols asiáticos. Não dá pra quantidade de hate ter sido só questão de opinião, afinal essas pessoas são do tipo que não tem vontade de sair",https://twitter.com/jjiyongxx/status/947180335317639168,2017-12-30,16:59:24
946799814343319552,"Não dá pra explicar o amor que sentimos por você, você é um anjo. Seus sorrisos são contagiantes e cada gesto de amor que você nos dirige é guardado no nosso coração. We love you. Eu te amo. 너 는 나의 천사   #WePurpleUTaehyung #VeautifulDay #HappyTaehyungDay pic.twitter.com/VY9sES7Wqz",https://twitter.com/jjiyongxx/status/946799814343319552,2017-12-29,15:47:21
946041333017440256,"Peitos grandes e durinhos são falsos, não acredite nas mentiras dele.  Vc acha uma roupa top e fica parecendo um balão, dói e cai depois de um tempo, você é obrigada a usar sutiã, não dá pra deitar de bruços na carteira da escola e atrapalha na hora de se transvestir.",https://twitter.com/jjiyongxx/status/946041333017440256,2017-12-27,13:33:25
945760773288144896,ALGUÉM PELO AMOR DE TAEMIN SABE O NOME DESSE ESTILO DE BLUSA?  pic.twitter.com/NZeH0zjVYV,https://twitter.com/jjiyongxx/status/945760773288144896,2017-12-26,18:58:34
945019724605394944,"#Lastdancetour os deuses da minha vida merecem tudo nesse universo,melhor grupo de todos, os amo com todo o meu coração, felizmente Stan neles, não consigo descrever o quanto os amo.",https://twitter.com/jjiyongxx/status/945019724605394944,2017-12-24,17:53:54
945017861482991618,"AIII FEBTE EU SOU A PESSOA MAIS APAIXONADA DESSE MUNDO ALGUÉM ME AJUDA, GDRAGAO NAO TEM KIMITES ELE GOSTA DE ME FAZET SOFRER SOCORP XOMO EU AMO ESSE HOMI NALLAAJDJD AAAAAAAAAAA  https://twitter.com/always_gd/status/944865922778513409 …",https://twitter.com/jjiyongxx/status/945017861482991618,2017-12-24,17:46:30
945017462944354306,"Normalmente eu fico super chorosa quando vejo vídeos deles, sério mesmo, coisa q era pra  me fazer rir me faz chorar, eu os amo tanto e sinto tanta falta dos 5 juntinhos aaaa #Lastdancetour",https://twitter.com/jjiyongxx/status/945017462944354306,2017-12-24,17:44:55
945016000776425472,"Meu coração é todo organizado e distribui amor para todos os meus anjos, mas não faço ideia de como faz isso no twitter...",https://twitter.com/jjiyongxx/status/945016000776425472,2017-12-24,17:39:06
945002917072900099,Ele merece todo o amor desse mundo socoro.,https://twitter.com/jjiyongxx/status/945002917072900099,2017-12-24,16:47:07
942925312563740675,"Você pode ser um diferencial só perguntando para a caixa emburrada se ela está bem! Essas pequenas coisas nos salvam e elas podem salvar os outros também, esteja aqui para cuidar de nós e ser cuidada por nós.",https://twitter.com/jjiyongxx/status/942925312563740675,2017-12-18,23:11:27
942925298634559488,"Precisamos de você, precisamos de pessoas com bom coração como você! Esteja aqui também para mostrar para o mundo as coisas que ele gostaria de ter nos ensinado, mostre para todos que todos nós somos especiais e lindos com nossas diferenças +",https://twitter.com/jjiyongxx/status/942925298634559488,2017-12-18,23:11:24
942925290904354816,"Se você sente a dor dele e sabe o que ele quis transmitir, tire forças para ser uma pessoa que também trará o diferencial, se todas as boas pessoas do mundo se forem o que seria de nós? Você é especial, saiba disso, JongHyun te ama demais, eu te amo demais +",https://twitter.com/jjiyongxx/status/942925290904354816,2017-12-18,23:11:22
