id,tweet,link,date,time
1016096666137628672,"Dêem muito amor pra eles, as músicas são maravilhosas, eu não conheço e já tô considerando a melhor coisa q ouvi na vida mano, foi um passo dado pras coisas q eu tô procurando  https://twitter.com/matheuswho_/status/1016060221314273286 …",https://twitter.com/jjiyongxx/status/1016096666137628672,2018-07-08,20:08:18
1014483524769013760,"Tem certeza q é fake? Pq sla, raramente as pessoas usam contas pessoais aa as vezes fan account, as vezes pessoa q n tão afim de usar foto de perfil 🤷",https://twitter.com/jjiyongxx/status/1014483524769013760,2018-07-04,09:18:15
1014342854414667776,"ai gente, eu amo o JK mas comparar ele com uma pessoa totalmente diferente COMPARSR ELE COM KWON JI-YONG eh algo que leva a gente a repensar sobre a existência dos seres humanos",https://twitter.com/jjiyongxx/status/1014342854414667776,2018-07-03,23:59:16
1014342490646876160,ai eu não consigo sentir raiva pq eh um nível do ridículo que só dá pra interpretar como piada,https://twitter.com/jjiyongxx/status/1014342490646876160,2018-07-03,23:57:49
1013026478500601856,"caralho falta 5 meses pra eu acabe o ensino médio, AI ALGUÉM REDUZ O TEMPO EU N AGUTENO MAIS",https://twitter.com/jjiyongxx/status/1013026478500601856,2018-06-30,08:48:28
1013025517489049600,"A coisa q mais me irrita de manhã é ouvir a voz da minha mãe  Serio, não dá",https://twitter.com/jjiyongxx/status/1013025517489049600,2018-06-30,08:44:39
1013016183107391489,"O melhor dia da minha vida foi quando a gente assistiu juntas e ficamos filosofando sobre a felicidade, caralho vou até ler a carta q vc me deu pq tô emocionada  https://twitter.com/MOSNTEXOS/status/1012801498743484427 …",https://twitter.com/jjiyongxx/status/1013016183107391489,2018-06-30,08:07:33
1012843886400671744,"esse aqui é o meu pintinho ciclope, ele quase foi rejeitado pela minha mãe por ser diferente e fora do padrão, mAS sÓ fOI cHAMAR dE mINION que ela aceitou, eh assim q a gente percebe como as pessoas precisam deixar de serem si mesmas para a sociedade grr #forcaspintociclope pic.twitter.com/LV9w6rmCLo",https://twitter.com/jjiyongxx/status/1012843886400671744,2018-06-29,20:42:54
1012482761834270720,vai dar merda  https://twitter.com/edavidaniel/status/1012479692203536384 …,https://twitter.com/jjiyongxx/status/1012482761834270720,2018-06-28,20:47:56
1012048944615055360,"Gabriel não diga isso :( você é uma pessoa extremamente importante para mim, queria fazer você se sentir bem, mas mesmo que eu não consiga no momento, ao menos saiba que eu te amo muito",https://twitter.com/jjiyongxx/status/1012048944615055360,2018-06-27,16:04:06
1011817131405729793,ai GEACAS AO DEUS DAVI Q NAO É SONHO OBRIGADA A,https://twitter.com/jjiyongxx/status/1011817131405729793,2018-06-27,00:42:57
1011812575082876928,ai mano tá tão bom isso q tô achando q é sonho e q vc vai destruir meu coração  https://twitter.com/edavidaniel/status/1011811136688226304 …,https://twitter.com/jjiyongxx/status/1011812575082876928,2018-06-27,00:24:51
1011806954216415232,KJJKKJ Q RELÍQUIA MANO PUTA MERDA  https://twitter.com/jjiyongxx/status/692774230950285313 …,https://twitter.com/jjiyongxx/status/1011806954216415232,2018-06-27,00:02:31
1011748735934754817,"PARA DE ME FAZER SOFRER VIADO, mentira continua q eu gosto e fica bem amor da minha vida inteira te amo  https://twitter.com/xxgdragonbrazil/status/1011636197507129344 …",https://twitter.com/jjiyongxx/status/1011748735934754817,2018-06-26,20:11:10
1011290130651459584,"O quadro representa como a sociedade mostra a mulher de uma forma estereotipada, como apenas algo sexual (orquídea) sem ver a essência que ela tem dentro de si.  Tem umas histórias criadas a partir do meu quadro, que foram escritas por uma pessoa maravilhosa vulgo Mili  pic.twitter.com/06Vn2VLtMo",https://twitter.com/jjiyongxx/status/1011290130651459584,2018-06-25,13:48:50
1011286362585255936,"sei que vou flopar mas vou postar, eu a adoro demais mano, é uma das minhas poucas fontes de orgulho. acho que se eu não tivesse a pintura e o desenho na minha vida, não sei mais o que seria de mim",https://twitter.com/jjiyongxx/status/1011286362585255936,2018-06-25,13:33:52
1011267496081584130,se cuida bem amor da minha vida  https://twitter.com/BigBangBrazil/status/1011265069366370304 …,https://twitter.com/jjiyongxx/status/1011267496081584130,2018-06-25,12:18:54
1010972649630175237,"Vem amor da minha vida, só vc me ama e eu aceitei isso  https://twitter.com/Bigbang_Looks/status/1010960153678680064 …",https://twitter.com/jjiyongxx/status/1010972649630175237,2018-06-24,16:47:17
1010971514395676674,EU QUERO ME AFOGAR NO ALCOOL ME PERDOEM AMIGOS,https://twitter.com/jjiyongxx/status/1010971514395676674,2018-06-24,16:42:46
1010970883798765573,eu sou um lixo triste e solitario,https://twitter.com/jjiyongxx/status/1010970883798765573,2018-06-24,16:40:16
1010969727768907779,vo ouvir musica triste e quando penso na @ que qualquer dia desses vai me abandonar,https://twitter.com/jjiyongxx/status/1010969727768907779,2018-06-24,16:35:40
1010968222517080064,"caralho eu odeio quando eu fico de tpm, fico chato pra um caralho",https://twitter.com/jjiyongxx/status/1010968222517080064,2018-06-24,16:29:41
1010968140870807552,serasi eu vou achar o meu eu que tá perdido por aí algum dia? talvez alguém se apaixone por mim desse jeito,https://twitter.com/jjiyongxx/status/1010968140870807552,2018-06-24,16:29:22
1010949993350488065,"eu gosto da sensação de borboletas no estômago e os pensamentos amorosos que surgem do nada  mas se isso virar motivo pra uma amizade se desfazer, prefiria ter virado aquela pessoa rude e fechada pros outros",https://twitter.com/jjiyongxx/status/1010949993350488065,2018-06-24,15:17:15
1010946959698513920,"ai eu imagino, primeiramente desculpa ter pedido por mais ontem aaaa você é ótimo nisso, mas vai no seu tempo  C é um amor e eu tô apx  https://twitter.com/edavidaniel/status/1010405594078109696 …",https://twitter.com/jjiyongxx/status/1010946959698513920,2018-06-24,15:05:12
1010676580337750016,"Ah vai se fude, vc é a pessoa mais amorosa desse mundo",https://twitter.com/jjiyongxx/status/1010676580337750016,2018-06-23,21:10:48
1010640405753364481,"Pera q eu li tudo errado, agr q eu entendi  Eu so um lixo retardado",https://twitter.com/jjiyongxx/status/1010640405753364481,2018-06-23,18:47:04
1010617694679388162,"ai caralho, não acredito q vai ter mais hoje, eu sou a pessoa mais feliz desse mundo  pic.twitter.com/CSAuyujSW3",https://twitter.com/jjiyongxx/status/1010617694679388162,2018-06-23,17:16:49
1010148098071584768,UM MOMENTO HISTÓRICO  https://twitter.com/armxwings/status/1010147080034312197 …,https://twitter.com/jjiyongxx/status/1010148098071584768,2018-06-22,10:10:48
1009598463762411520,"mANO meu dia foi muito estranho, começou comigo batendo mó papo com o Denis e dps fazendo uma recuperação de física muito ridícula",https://twitter.com/jjiyongxx/status/1009598463762411520,2018-06-20,21:46:45
1009424848836288512,"Você me ajuda demais gabs, a gente conversa mais tarde, tô voltando pra casa",https://twitter.com/jjiyongxx/status/1009424848836288512,2018-06-20,10:16:52
1009259667443339266,acho que nunca me senti tão sozinha na minha vida quanto tô sentindo agr,https://twitter.com/jjiyongxx/status/1009259667443339266,2018-06-19,23:20:30
1009259351335415808,"Caraio mano, tu é foda",https://twitter.com/jjiyongxx/status/1009259351335415808,2018-06-19,23:19:15
1009231819114467329,sera q vai chegar um dia que eu vou simplesmente tacar um fodase pra minha vida? começar a me importar com literalmente ninguem?,https://twitter.com/jjiyongxx/status/1009231819114467329,2018-06-19,21:29:50
1009230700141260806,teria sido um dia incrível  Se eu não fosse uma paranóica,https://twitter.com/jjiyongxx/status/1009230700141260806,2018-06-19,21:25:24
1009158470208192512,E mano eu sou muito ruim em jogos KJKJJ enquanto o gabs e Arthur ficaram em 1 e 2 lugar eu fiquei em 30 JDNDNDDK,https://twitter.com/jjiyongxx/status/1009158470208192512,2018-06-19,16:38:23
1009158128867438597,"mas foi divertido, eu e meus amigos que ficaram comigo a gente foi nos brinquedos do shops e ficamos jogando bastante",https://twitter.com/jjiyongxx/status/1009158128867438597,2018-06-19,16:37:01
1009157915419271169,Meu dia foi meio mé por causa disso e por não ter conseguido andar com todo mundo junto,https://twitter.com/jjiyongxx/status/1009157915419271169,2018-06-19,16:36:10
1009156923986513921,eu corri fora do tempo e fiz a música atrasar,https://twitter.com/jjiyongxx/status/1009156923986513921,2018-06-19,16:32:14
1007728386679197702,"mais do que crianças contando segredo uma para outra na sua frente e depois rindo, eu odeio mais ainda quando são adolescentes fazendo isso",https://twitter.com/jjiyongxx/status/1007728386679197702,2018-06-15,17:55:44
1007031618635227144,"preciso de férias logo, se eu ficar mais tempo na escola as meninas não vão mais me aguentar e eu só vou continuar machucando e preocupando elas meudeus",https://twitter.com/jjiyongxx/status/1007031618635227144,2018-06-13,19:47:02
1007017249352376320,"Vocês cresceram tanto desde o dia que eu os conheci, seja emocionalmente, na maturidade ou em talento, nunca falharam com a gnt, sempre se superando e nos trazendo muito orgulho. Espero que estejam felizes e aproveitando os dias o máximo que podem, amo vocês 🌹 #5YearsWithBTS pic.twitter.com/XfpOqRstjz",https://twitter.com/jjiyongxx/status/1007017249352376320,2018-06-13,18:49:56
1005963590849957895,"TA ESTÁVEL, MAS VAI COMECAR A CAIR SE VC NÃO FALAR LOGO A",https://twitter.com/jjiyongxx/status/1005963590849957895,2018-06-10,21:03:04
1005863041014161408,"eh complicado aceitar a possibilidade do meu fav ser hetero, isso sim é complicado",https://twitter.com/jjiyongxx/status/1005863041014161408,2018-06-10,14:23:31
1005809739870162944,"ai jin, espero que esteja bem :( estaremos te esperando, tome o tempo que precisar para poder acalmar seu coração, te amamos",https://twitter.com/jjiyongxx/status/1005809739870162944,2018-06-10,10:51:43
1005797111072477184,eu queria saber expressar e demonstrar em ações todo o amor que eu tenho pelos meus amigos,https://twitter.com/jjiyongxx/status/1005797111072477184,2018-06-10,10:01:32
1005796992700895234,"é sempre assim que as pessoas se afastam, elas vêem que eu não tenho nada demais ou acham que elas me incomodam ou que elas são irrelevantes para mim, mas nunca é isso",https://twitter.com/jjiyongxx/status/1005796992700895234,2018-06-10,10:01:04
1005796770855751681,"sempre que eu vou falar com alguém, eu preciso que a pessoa consiga continuar o assunto, eu fico quieta muito rápida e nem sei se isso faz parte da minha personalidade, mas é só o que acontece e eu me odeio por isso",https://twitter.com/jjiyongxx/status/1005796770855751681,2018-06-10,10:00:11
1005796489552191488,"mas o problema maior é que EU não chamo e isso faz parecer como se eu não quisesse conversar, mas muito pelo contrário, eu tenho muito o que falar, mas eu sempre me travo e magoo as pessoas",https://twitter.com/jjiyongxx/status/1005796489552191488,2018-06-10,09:59:04
1005796105865564160,queria não ter tanto medo de conversar com meus amigos e acabar apertando um gatilho de como seu estivesse se afastando,https://twitter.com/jjiyongxx/status/1005796105865564160,2018-06-10,09:57:33
1005263542046609408,"Ela tá loca, eu sempre sinto que você se importa quando vai conversar com as pessoas ou as ajudar",https://twitter.com/jjiyongxx/status/1005263542046609408,2018-06-08,22:41:19
1004912890107834368,"O Jimin ama o Tae é vocês sabem disso  Quem nunca esqueceu o aniversário do amigo, do parente ou sla meados de 2012 esquecia de marcar um amigo próximo nas publicações tipo ""best friend forevis você + 23 pessoas""?  Eles tão na correria, com um monte de coisa na cabeça, suas fdp",https://twitter.com/jjiyongxx/status/1004912890107834368,2018-06-07,23:27:58
1003466116654620672,"Gente vocês sabiam q o CEO da YG fez parte do grupo que revolucionou o kpop? Pena q é um merda, mas foi um merda importante",https://twitter.com/jjiyongxx/status/1003466116654620672,2018-06-03,23:39:00
1002390942425415680,Neste momento estávamos conversando sobre punheta,https://twitter.com/jjiyongxx/status/1002390942425415680,2018-06-01,00:26:38
1001094537400541185,Não acredito que eu entrei na live no momento certo KKJJKKJ porra taehyung,https://twitter.com/jjiyongxx/status/1001094537400541185,2018-05-28,10:35:11
1000380296682975233,"dizer pra mim que nem sempre vai estar do meu lado pra ajudar, ok, eu sei. Mas naquele momento você estava, não é?🤷",https://twitter.com/jjiyongxx/status/1000380296682975233,2018-05-26,11:17:03
1000200630013751297,"Ai a Jana é o amor da minha vida também, tá me consolando aqui",https://twitter.com/jjiyongxx/status/1000200630013751297,2018-05-25,23:23:07
1000020051897053185,"Um dia você acha, deve ter alguns tops por aí AAA já pensou? Realmente é a sua cara mano",https://twitter.com/jjiyongxx/status/1000020051897053185,2018-05-25,11:25:34
1000019424093630465,"ATA, EU TINHA ENTENDIDO ""SENHORES"" KSKFKD Ari seria seu sonho?",https://twitter.com/jjiyongxx/status/1000019424093630465,2018-05-25,11:23:04
999398958899265537,Eu sou a pessoa mais apaixonada desse mundo,https://twitter.com/jjiyongxx/status/999398958899265537,2018-05-23,18:17:34
999066914138808326,"Ex: eu uso mto lindissmos quando eu falo do BTS, ent se eu pesquisar lindissmos na barra e ir em pessoas, el vai aparecer. Quando teve aquela treta do BTS ter comprado palavras chave ""EXO"" e realmente aparecia eles, é por causa da frequência que vcs usam os dois nos mesmos tweets",https://twitter.com/jjiyongxx/status/999066914138808326,2018-05-22,20:18:08
999040893314322434,"Ai gente eu amo park jimin demais, acho q nunca amei um homem tanto na vida.  Lembrando q Kwon Ji-yong é um deus.",https://twitter.com/jjiyongxx/status/999040893314322434,2018-05-22,18:34:44
998691968367685632,"Depois a gente conversa, pode ser? eu tô tentando entender física",https://twitter.com/jjiyongxx/status/998691968367685632,2018-05-21,19:28:14
998691703279247360,Sendo que a pessoa tava certa e eu só deveria fazer cair a ficha,https://twitter.com/jjiyongxx/status/998691703279247360,2018-05-21,19:27:11
998691523674992647,"Não, é pq eu fiquei brava com uma coisa que eu li, ai eu fiquei irritada por a pessoa estar certa e eu não, depois eu fiquei irritada comigo por estar brava com uma coisa daquela",https://twitter.com/jjiyongxx/status/998691523674992647,2018-05-21,19:26:28
998683806239461376,caralho ainda existe pessoas que mandam indireta?,https://twitter.com/jjiyongxx/status/998683806239461376,2018-05-21,18:55:48
998485684133482496,"Gente o BTS é tão foda que mesmo com aquela organização bosta, eles tornaram a apresentação incrível. Estou orgulhosa, mas não surpresa. #BBMAs",https://twitter.com/jjiyongxx/status/998485684133482496,2018-05-21,05:48:32
997623583672324096,"Voce só precisa saber desapegar das coisas que antes você associava como as coisas que te fazia feliz, tudo precisa mudar, tudo tem um ciclo, comparar seu passado com o presente não vai fazer você mudar o futuro, então saia desse fake love e mude tudo, transforme-se.",https://twitter.com/jjiyongxx/status/997623583672324096,2018-05-18,20:42:51
997623581231255552,"First Love, o fogo e o piano de fake love, o fogo representando as transformações e o amor que o Suga teve pelo piano, ele precisou de tudo aquilo, da dor, para se tornar o que é hoje, ou seja, todos seus dias ruins foram necessários para seu presente e futuro te fazerem crescer+",https://twitter.com/jjiyongxx/status/997623581231255552,2018-05-18,20:42:51
997597675917922304,Gente eu não sei o que dizer apenas sentir #IVoteBTSBBMAs #FakeLoveFriday,https://twitter.com/jjiyongxx/status/997597675917922304,2018-05-18,18:59:55
996866740775784451,Cada dia mais cansada,https://twitter.com/jjiyongxx/status/996866740775784451,2018-05-16,18:35:26
995787813403676672,"eu não sei o que tá acontecendo comigo, mas ultimamente a última coisa que eu quero é ficar perto de pessoas",https://twitter.com/jjiyongxx/status/995787813403676672,2018-05-13,19:08:10
995787655131664387,As vezes eu quero me afastar de todo mundo só por pensar na possibilidade de eles me abandonando ??? Pq assim eu teria tempo de me recuperar mais rápido ????,https://twitter.com/jjiyongxx/status/995787655131664387,2018-05-13,19:07:32
995786154724286465,Obrigada por terem entrando na minha vida ❤️💕💕🍑  E obrigada Ari por ter me apresentado esses anjos.  pic.twitter.com/fYEYRKjboC,https://twitter.com/jjiyongxx/status/995786154724286465,2018-05-13,19:01:34
995783119499415553,"Ai obrigada, então da tempo de parabenizar né? Kskxxk ai eu sou um lixo",https://twitter.com/jjiyongxx/status/995783119499415553,2018-05-13,18:49:31
995782293649281029,"Eu me odeio, esqueci do aniversário da minha mãe, quase esqueci do meu amigo, não lembro quando é o do BB e esqueci do Monsta X",https://twitter.com/jjiyongxx/status/995782293649281029,2018-05-13,18:46:14
993483145361219584,@: algum dia vc vai deixar de amar o BigBang?  eu: no no       no              nono no   no     no        no             no no    no    no     no                  no no     no   no     no                  no no      no  no        no            no no       no no             nono  https://twitter.com/snowyugbam/status/993304208253358081 …,https://twitter.com/jjiyongxx/status/993483145361219584,2018-05-07,10:30:14
992922371769225216,"NÃO COMEÇA GAROTA, OLHA AQUI, SE VOCÊ NÃO TIVESSE ENTRADO NA KINHA VIDA EU NÃO SEI O QUE SERIA DE MIM",https://twitter.com/jjiyongxx/status/992922371769225216,2018-05-05,21:21:55
992867487191584773,"Você é perfeito meu anjinho, então por favor se cuide e fique saudável, espero que esteja tendo um dia maravilhoso, você merece 💕🌹🍑  pic.twitter.com/2u6iaJsB2J",https://twitter.com/jjiyongxx/status/992867487191584773,2018-05-05,17:43:50
992866040458698752,"já faz bastante tempo que eu ando deprimida, mas eu tinha melhorado um pouco, tinha parado de chorar na escola, até pq né",https://twitter.com/jjiyongxx/status/992866040458698752,2018-05-05,17:38:05
992811254304690181,"Mais do que comprovado a alegria que você nos traz, cada sorriso ou cada momento que você é mencionado nos traz um sorriso e uma grande paz dentro de nós.  pic.twitter.com/XDnP9fs0P8",https://twitter.com/jjiyongxx/status/992811254304690181,2018-05-05,14:00:23
992810814892662786,"lembro como se fosse ontem do dia que me apaixonei por um ator tão doce e magnífico como você, a cada fala, sorriso ou e mesmo as ""tragédias"" me emocionavam, foi a partir daí que comecei a sentir algo maior, algo em ti iluminava o meu dia, hj eu sei que era e é você simplesmente.  pic.twitter.com/NxfZLvXHGo",https://twitter.com/jjiyongxx/status/992810814892662786,2018-05-05,13:58:38
992588711807287298,"O problema não é a ilusão e sim que ninguém tá fazendo nada dentro de si pra mudar, porque como eu disse e você tem que admitir que as Armys não são santas e se quiser te mando provas... Os dois fandoms não precisam nem se unir, mas precisam crescer e ter maturidade",https://twitter.com/jjiyongxx/status/992588711807287298,2018-05-04,23:16:04
992587463217557504,"Aquelas pessoas não deviam nem ser consideradas fãs, aliás, muitas ""armes"" já fizeram isso também e olha que não foi só uma vez, essas pocs que precisam entender e aprender, então por favor, tenta compreender a proposta da tag, nós queremos que não haja mais esse tipo de coisa.",https://twitter.com/jjiyongxx/status/992587463217557504,2018-05-04,23:11:07
992558960497582081,"Jiyong eu te amo demais você sempre será o grande amor da minha vida, espero que esteja saudável e feliz, não só você mas como todos os membros, eu simplesmente te amo demais, por isso, se cuida",https://twitter.com/jjiyongxx/status/992558960497582081,2018-05-04,21:17:51
992558300993671168,minha vida estará incompleta se eu nunca conhecer o jiyong,https://twitter.com/jjiyongxx/status/992558300993671168,2018-05-04,21:15:14
992481335464857600,Você já é uma pessoa incrível ok,https://twitter.com/jjiyongxx/status/992481335464857600,2018-05-04,16:09:24
992471269349130241,"Awn meudeus te amo demais também viu, me sinto até honrada de ser a única pessoa que consegue te deixar brava :') quer dizer q você consegue me aguentar kkjk vamos pro show sim e jogaremos o sutiã no palco, Obrigada por existir  https://twitter.com/MOSNTEXOS/status/992196276908449792 …",https://twitter.com/jjiyongxx/status/992471269349130241,2018-05-04,15:29:24
991861503233052672,"GENTE EU AMO A ARI MAIS QUE TUDO NESSA VIDA, FADINHA DA MINHA VIDA INTEIRA",https://twitter.com/jjiyongxx/status/991861503233052672,2018-05-02,23:06:24
991850003697201152,AQUI ESTÁ NOSSO CARIOCA PREFERIDO SENDO UMA DAS PESSOAS QUE MAIS TE AMAM NESSA VIDA.  pic.twitter.com/bZIA4OUGQz,https://twitter.com/jjiyongxx/status/991850003697201152,2018-05-02,22:20:43
991039316032917506,"Mano eu queria participar do selcaday mas tô um lixo e tô sem foto pra postar, desculp bts",https://twitter.com/jjiyongxx/status/991039316032917506,2018-04-30,16:39:20
991038983474962433,"Vou ser uma boa pessoa então pelo amor dos deuses, que dê tudo certo pra mim e pra Ari  pic.twitter.com/XvoJtAqhTe",https://twitter.com/jjiyongxx/status/991038983474962433,2018-04-30,16:38:00
988261938089033734,"Gente minha vida nesse twitter eh difícil, uma hora eu entro e ta tendo treta, agora entrei e teve nude do Justin Bieber. Mas o q eh isso",https://twitter.com/jjiyongxx/status/988261938089033734,2018-04-23,00:43:01
985642444028104705,"Fazia tempo q não entrava aqui e já aparece treta na TL, as redes sociais se tornaram tóxicas. Facebook com gente ignorante. Instagram com gente fingindo sua vida. WhatsApp com gente que exige atenção. Twitter com gente que só sabe brigar.",https://twitter.com/jjiyongxx/status/985642444028104705,2018-04-15,19:14:05
984561008210563072,Ta acesa? Até um tempo atrás tava,https://twitter.com/jjiyongxx/status/984561008210563072,2018-04-12,19:36:51
982968904518684672,"Oe amor da minha vida, feliz aniversário, eu tô um pouco atrasada, mas eu te amo, você é o homem mais talentoso que eu conheço nesse mundo, obrigada por ser a inspiração que você é pra mim, te amo ❤️🌹  pic.twitter.com/WBOVv27mzd",https://twitter.com/jjiyongxx/status/982968904518684672,2018-04-08,10:10:24
981693281326305280,"O Dutch falando ""vem me matar"" pro predador sou eu todos os dias falando pra vida",https://twitter.com/jjiyongxx/status/981693281326305280,2018-04-04,21:41:31
981330783356014597,"#TaehyungArmyLovesYou   não consigo acreditar que existe pessoas que jogam hate em um outro ser humano, um ser humano atencioso e que tem uma das melhores energias do mundo, um ser humano que passa felicidade para muitas pessoas, não consigo...  pic.twitter.com/83rOlYRx8O",https://twitter.com/jjiyongxx/status/981330783356014597,2018-04-03,21:41:05
981285762917388288,"Gente o q fazer quando vc não quer nada sério, mas a outra pessoa quer e ela não avisou isso antecipadamente?",https://twitter.com/jjiyongxx/status/981285762917388288,2018-04-03,18:42:11
980958858737864704,"Só queria dizer q o próximo conceito do BTS vai ser MUITO FODA, TO ANSIOSISSIMA ALGUÉM ME SEGURA Q EU QUERO GRITAR",https://twitter.com/jjiyongxx/status/980958858737864704,2018-04-02,21:03:11
980139438050304000,"Ai gente como eu amo esses garotos, tô muito chorosa com eles mandando mensagens pra eles mesmos do futuro",https://twitter.com/jjiyongxx/status/980139438050304000,2018-03-31,14:47:06
978050222210338817,"Eu sou um lixo, como pude esquecer da pinta dele?",https://twitter.com/jjiyongxx/status/978050222210338817,2018-03-25,20:25:18
978047377234898944,"Eu tenho prova essa semana de novo e tô deixando tudo pra amanhã, não tô afim de fazer merda nenhuma, só de deitar na minha cama e chorar",https://twitter.com/jjiyongxx/status/978047377234898944,2018-03-25,20:14:00
978027965547151360,"eu sei q vou flopar, mas tá aí um jungkapet.... desculpa, eu sou um lixo  pic.twitter.com/WL1531lnqZ",https://twitter.com/jjiyongxx/status/978027965547151360,2018-03-25,18:56:52
974409336872226817,"Será q não é só o jeitinho da pessoa? Mas enfim, se ela não estiver dando o devido valor que você merece, vc não deve conversar por achar que atrapalha, mas sim pq vc merece mais grr",https://twitter.com/jjiyongxx/status/974409336872226817,2018-03-15,19:17:44
974407888297975808,E se a pessoa estiver pensando o mesmo?,https://twitter.com/jjiyongxx/status/974407888297975808,2018-03-15,19:11:58
974405725932879872,"#FLOWERROAD  ""Se você sentir minha falta, volte para mim. Então você poderá me amar novamente."" Eu nunca vou deixar de amar vocês, vocês são a criação do meu universo particular, o meu BigBang amado.  Esperarei cada um de vocês. 🌹  pic.twitter.com/Ht6fQeW6ZV",https://twitter.com/jjiyongxx/status/974405725932879872,2018-03-15,19:03:23
973487199814594560,Mano queria dizer que nada me fez tão feliz na vida quanto essa música #FLOWER_ROAD,https://twitter.com/jjiyongxx/status/973487199814594560,2018-03-13,06:13:29
973375430249115648,"Vai tomar no seu cu, inferno, eu tenho que ir dormir GRRRRRRR",https://twitter.com/jjiyongxx/status/973375430249115648,2018-03-12,22:49:21
972560173280710656,"Como eu tive q pular vários dias, vou fazer só uma homenagem no dia, me desculpa Youngbae e Daesung :(",https://twitter.com/jjiyongxx/status/972560173280710656,2018-03-10,16:49:49
