id,tweet,link,date,time
543220859696328704,Boa Noite !,https://twitter.com/leogreque/status/543220859696328704,2014-12-11,23:48:40
543219739162849280,veremos se hoje consigo dormir antes das 2 horas da manhã!,https://twitter.com/leogreque/status/543219739162849280,2014-12-11,23:44:13
543179862056632321,"A pessoa fala que precisa desabafar e, tu te disponibiliza para ouvir, ai ela não fala. #decida-se",https://twitter.com/leogreque/status/543179862056632321,2014-12-11,21:05:45
543169956222083073,Quero panvel papai noel.... kkkkk odeio essa música,https://twitter.com/leogreque/status/543169956222083073,2014-12-11,20:26:23
543159318716354561,Desejo que existam mais pessoas que deixem papelzinho de desconto no #burgerking @relax_luan,https://twitter.com/leogreque/status/543159318716354561,2014-12-11,19:44:07
498094233845514240,Bom dia! A rinite ta me matando :(,https://twitter.com/leogreque/status/498094233845514240,2014-08-09,10:11:34
495706748733644800,Boa noite!,https://twitter.com/leogreque/status/495706748733644800,2014-08-02,20:04:33
488868977696059392,"Que sono,  Só foi dormir.",https://twitter.com/leogreque/status/488868977696059392,2014-07-14,23:13:41
488492746211336192,Boa noite!!!,https://twitter.com/leogreque/status/488492746211336192,2014-07-13,22:18:41
488492674996264960,As vezes acho que tenho uma espécie de Sono eterno!  Existe???,https://twitter.com/leogreque/status/488492674996264960,2014-07-13,22:18:24
488488834276282368,"Família nem sempre é só aquela de sangue e sobrenome. Bolado com minha ""família"", tendo essas pessoas como família quem precisa de inimigos?",https://twitter.com/leogreque/status/488488834276282368,2014-07-13,22:03:08
487782703354613760,"Tudo nessa vida tem um lado chato, e a parti chata dos livros é que eles tem fimm",https://twitter.com/leogreque/status/487782703354613760,2014-07-11,23:17:13
486680571188637697,Stephen Chbosky é muito foda!,https://twitter.com/leogreque/status/486680571188637697,2014-07-08,22:17:44
486457767025467392,Bom dia!,https://twitter.com/leogreque/status/486457767025467392,2014-07-08,07:32:24
485989270545788928,boa noite..... fui.,https://twitter.com/leogreque/status/485989270545788928,2014-07-07,00:30:46
481916345932873729,Não vou limpar meu quarto!,https://twitter.com/leogreque/status/481916345932873729,2014-06-25,18:46:25
481900611387285505,"Tenho q arrumar o  meu quarto, só falta a coragem. Kkkkkkk",https://twitter.com/leogreque/status/481900611387285505,2014-06-25,17:43:53
481899123827040259,Como foi bom o dia para assistir uma bom filme #Harrypotter,https://twitter.com/leogreque/status/481899123827040259,2014-06-25,17:37:59
481610891927244800,Boa Noite !,https://twitter.com/leogreque/status/481610891927244800,2014-06-24,22:32:39
480898938606985216,Boa noite!,https://twitter.com/leogreque/status/480898938606985216,2014-06-22,23:23:36
480879620498411520,"se hoje estou bem, é porque eu já não espero grandes coisas da vida.",https://twitter.com/leogreque/status/480879620498411520,2014-06-22,22:06:50
480840837958762496,"hoje espero dormir a noite, pocha amanhã tenho q acordar cedo.",https://twitter.com/leogreque/status/480840837958762496,2014-06-22,19:32:44
480798100664373248,"Aproveite cada dia como se fosse o último, siga o fluxo.",https://twitter.com/leogreque/status/480798100664373248,2014-06-22,16:42:54
480698960496316418,Bom dia!,https://twitter.com/leogreque/status/480698960496316418,2014-06-22,10:08:57
480639582137225216,O Sono se perdeu no meio do caminho .,https://twitter.com/leogreque/status/480639582137225216,2014-06-22,06:13:00
480625125214392320,"Uma pessoa feliz não tem o melhor de tudo,  ela torna tudo melhor.",https://twitter.com/leogreque/status/480625125214392320,2014-06-22,05:15:34
480622929542406144,"Algumas pessoas deveriam ser igual a cigarro, vir com a foto do mal que fazem!",https://twitter.com/leogreque/status/480622929542406144,2014-06-22,05:06:50
480592314256343040,E cade o sono???,https://twitter.com/leogreque/status/480592314256343040,2014-06-22,03:05:11
480542001545625600,"AFFF. As pessoas se acham muito importantes para pensar q ando falando delas, querida só falo de coisas boas não de merdas .  #vãoproinferno",https://twitter.com/leogreque/status/480542001545625600,2014-06-21,23:45:15
480350140306567169,Bom dia!!!,https://twitter.com/leogreque/status/480350140306567169,2014-06-21,11:02:52
480181566480846848,pessoas desaparecem do what toda hora!  aff,https://twitter.com/leogreque/status/480181566480846848,2014-06-20,23:53:01
480180576285368321,sono de tédio chegando!,https://twitter.com/leogreque/status/480180576285368321,2014-06-20,23:49:05
480160290009780224,"nossa, essa semana estou comendo muito!!!!  me odeio :(",https://twitter.com/leogreque/status/480160290009780224,2014-06-20,22:28:28
480118510346313729,serio algumas pessoas me assustam! #credo,https://twitter.com/leogreque/status/480118510346313729,2014-06-20,19:42:27
480112293230166016,"140 caracteres é pouco para falar o quanto eu odeio pessoas falsas, interesseiras e mentirosas. #ficaadica",https://twitter.com/leogreque/status/480112293230166016,2014-06-20,19:17:45
480109835149934592,"Me disseram que quanto maior o sonho, maior o tombo. Mas quem disse que eu tenho medo de cair?",https://twitter.com/leogreque/status/480109835149934592,2014-06-20,19:07:59
480093141505433600,"Troco pessoas falsas por... Ah, leva de graça mesmo.",https://twitter.com/leogreque/status/480093141505433600,2014-06-20,18:01:39
480090246336745472,"Realmente são nas coisas mais simples da vida, que estão os momentos mais importantes.",https://twitter.com/leogreque/status/480090246336745472,2014-06-20,17:50:09
480079247315595264,Porra! Odeio essa balanças :(,https://twitter.com/leogreque/status/480079247315595264,2014-06-20,17:06:26
480078716895526912,"Sabe quando o seu dia esta ótimo e só uma pessoa pode estragalo, então do nada ela.",https://twitter.com/leogreque/status/480078716895526912,2014-06-20,17:04:20
480040014529970177,Nossa são 2:30 e eu não almocei. Tipo nem percebi o tempo passando.,https://twitter.com/leogreque/status/480040014529970177,2014-06-20,14:30:32
480036841979383808,Chateado com algumas rasteiras da vida .,https://twitter.com/leogreque/status/480036841979383808,2014-06-20,14:17:56
480006337624276992,"Aprenda uma coisa, e nunca mais esqueça: quem te ama de verdade, nunca te abandona #ficaadica",https://twitter.com/leogreque/status/480006337624276992,2014-06-20,12:16:43
479974711989129216,Não valorize a quantidade e sim a qualidade. Bom dia!,https://twitter.com/leogreque/status/479974711989129216,2014-06-20,10:11:03
479814226534739968,hoje em dia tenho medo de sentir saudade do presente. :(,https://twitter.com/leogreque/status/479814226534739968,2014-06-19,23:33:20
1144091941442936832,"As vezes não, tipo hoje que eu fui grosso sem querer com o meu professor... mano mas eu não tenho paciência ele é muito cuzão disfarçado de boa paz... enrola enrola e não sai do lugar...",https://twitter.com/leogreque/status/1144091941442936832,2019-06-27,00:55:49
1143523066129068032,"Nunca façam nenhum tipo de contrato com a @oi_oficial, é o mesmo que fazer o contrato com o diabo! pic.twitter.com/zkhPy36yZZ",https://twitter.com/leogreque/status/1143523066129068032,2019-06-25,11:15:19
1142804981503971329,"É... Mas ela tem licença poética para falar isso, pq ela é muito foda, o dia que eu for metade do profissional que ela é eu to satisfeito... mas vou seguindo com uma mão na consciência e com a outra na bunda",https://twitter.com/leogreque/status/1142804981503971329,2019-06-23,11:41:54
1142798335834767360,Aí nas festas acontecem coisas como eu estar dançando e lembrar que tenho que estudar geologia e lembranças da minha tutora falando que se tu tá solteiro tem que usar as madrugadas para escrever artigos,https://twitter.com/leogreque/status/1142798335834767360,2019-06-23,11:15:30
1142439842141356032,"Vai te fude! Fui ver o significado do meu sonho e era algo muito positivo, aí fui ver mais específico, e é perigo eminente... meu amor eu rio na cara do perigo. Mas a sacanagem é que alegria de pobre dura pouco",https://twitter.com/leogreque/status/1142439842141356032,2019-06-22,11:30:58
1141705739486076929,"Amiga, eu uso a tua foto no WhatsApp, pq é uma foto que me deixa feliz!",https://twitter.com/leogreque/status/1141705739486076929,2019-06-20,10:53:54
1140813296985149440,"Minha mãe fez uma janta que pqp, como é depois fui chorar de tão bom",https://twitter.com/leogreque/status/1140813296985149440,2019-06-17,23:47:39
1140798290331623427,Terminar esse resumo de falhas e dobramentos para amanhã só sentar e escrever sobre o LeME que eu nunca vi mas já conheço pacas!,https://twitter.com/leogreque/status/1140798290331623427,2019-06-17,22:48:02
1140707993648029698,Em amor com uma sapatão! 💙  https://twitter.com/quebrandootabu/status/1140672958102417409 …,https://twitter.com/leogreque/status/1140707993648029698,2019-06-17,16:49:13
1140450667905069056,"Dedo podre é o crlh, não tenho culpa que as pessoas são cagadas!",https://twitter.com/leogreque/status/1140450667905069056,2019-06-16,23:46:42
1138546955758575616,"Meu Deus eu to todo estranho, a tv tava ligada, aí do nada eu paro para olhar e tem um senhor na novela dando 4 maçãs como presente para duas pessoas em uma embalagem bem humildade, depois disso eu não consigo parar de chorar... Oh céus",https://twitter.com/leogreque/status/1138546955758575616,2019-06-11,17:42:02
1138479787486457857,"Faz hoje, pra não ser urgente amanhã!",https://twitter.com/leogreque/status/1138479787486457857,2019-06-11,13:15:07
1138051991656157185,"Acordando para ser cientista e produzir conhecimento, balbúrdia só no mundo das ideias...",https://twitter.com/leogreque/status/1138051991656157185,2019-06-10,08:55:13
1137570665001865217,"O Bob conhece todo mundo, até a bisorão",https://twitter.com/leogreque/status/1137570665001865217,2019-06-09,01:02:36
1137505333788717057,"Pelo amor de Deus, nunca, nunca fale com a vitória por meio de mensagens essa guria só se retarda... orra que inferno, não escreve uma palavra corretamente...",https://twitter.com/leogreque/status/1137505333788717057,2019-06-08,20:43:00
1136853689090551808,"Ah pronto, era só o que me faltava ter vontade de chorar pq alguém foi grosso...  EU ERA A PESSOA QUE ERA GROSSA SEM MOTIVO APARENTE...",https://twitter.com/leogreque/status/1136853689090551808,2019-06-07,01:33:35
1136076235392671745,Amiga eu não preciso nem falar nada,https://twitter.com/leogreque/status/1136076235392671745,2019-06-04,22:04:16
1135520397611491328,"Tava tomando café e começou uma matéria sobre feminicídio com vídeos de agressões troquei de canal pq não consigo assistir sem me revirar o estômago, no outro canal começou um cara super machista a falar da mina do Neymar... Deus, que sociedade machista de merda",https://twitter.com/leogreque/status/1135520397611491328,2019-06-03,09:15:34
1133747803337953280,"Outra coisa que me irrita, pq a graduação tu pode até fazer forçado pq tu queres ter uma formação, só que se tu vai entrar em algum grupo ou atividade extra graduação que faça com vontade ou nem faça... sempre as mesmas pessoas fazendo as mesmas coisas...",https://twitter.com/leogreque/status/1133747803337953280,2019-05-29,11:51:54
1132732021686640648,"Feitiço não mora mais no meu quarto, passei a tutela dele para a casa. Quem não ficou feliz foi a baunilha que era a felina única da casa",https://twitter.com/leogreque/status/1132732021686640648,2019-05-26,16:35:33
1132646261721579521,Todo mundo postando 38 stories do mesmo palco...,https://twitter.com/leogreque/status/1132646261721579521,2019-05-26,10:54:47
1132462199409119235,"Desculpa, mas não dá para salvar o contato de todo mundo...",https://twitter.com/leogreque/status/1132462199409119235,2019-05-25,22:43:23
1131252731610447873,"Queria tuitar um monte de coisas, mas só tenho tempo para tuitar “oi”   Então   Oi",https://twitter.com/leogreque/status/1131252731610447873,2019-05-22,14:37:23
1130889229964316672,Meu Deus que gato infernal acabou de me tirar um pedaço da mão fora os vários arranhões,https://twitter.com/leogreque/status/1130889229964316672,2019-05-21,14:32:57
1130793311491563520,Eu estou a 10 minutos acordado e ignorando o fato de que preciso levantar,https://twitter.com/leogreque/status/1130793311491563520,2019-05-21,08:11:49
1130110427126476800,A gente precisa entender as limitações da nossa cidadoca e do tipo de pessoa que é natural daqui...,https://twitter.com/leogreque/status/1130110427126476800,2019-05-19,10:58:16
1129781514504474624,"Tô sofrendo e tô fazendo você sofrer O que a gente tá vivendo não tem nada a ver É melhor cada um seguir o seu caminho Toda hora a gente briga sem explicação Não tem amor, não tem respeito, não tem paixão E por isso que eu prefiro é ficar sozinha",https://twitter.com/leogreque/status/1129781514504474624,2019-05-18,13:11:18
1129724022252556288,"Ontem foi um role super desprendido, ninguém tinha celular, todo mundo sem bateria, inclusive eu!",https://twitter.com/leogreque/status/1129724022252556288,2019-05-18,09:22:50
1129722615944437760,Minha psicóloga falou umas coisas que eu comecei a perceber em mim e to tentando parar de fazer... Estou me sentindo a melhor pessoa do mundo!,https://twitter.com/leogreque/status/1129722615944437760,2019-05-18,09:17:15
1129469999423336448,Amiga ela saiu do curso e a amiga mudou de turno. Foi muito engraçado,https://twitter.com/leogreque/status/1129469999423336448,2019-05-17,16:33:27
1129444111092727808,É engraçado,https://twitter.com/leogreque/status/1129444111092727808,2019-05-17,14:50:34
1129253032988958720,"Eu to chocado que que consigo me ver e ver minhas amigas, e na época desse vídeo parecia muito surreal... como as coisas mudam  https://twitter.com/barrbiegirll/status/1129038486797979649 …",https://twitter.com/leogreque/status/1129253032988958720,2019-05-17,02:11:18
1129204224674418688,"2014 Acho que Adm ou ⚖️ 2015 Engenharia civil, MEU SONHO TOP 2016 Entrei em engenharia de alimentos (uhuuuul) 2017 Engenharia de alimentos, será? Mas e geografia? 2018 Meu sonho sempre foi geografia  2019 Entrei em Geografia Licenciatura e vou mudar o mundo através da educação 💙  https://twitter.com/anagimenescomg/status/1127491393683959808 …",https://twitter.com/leogreque/status/1129204224674418688,2019-05-16,22:57:21
1128057459535437831,"Não deu para ficar na aula hoje, muita dor de cabeça... se fuder, tomei um remédio mas não deu",https://twitter.com/leogreque/status/1128057459535437831,2019-05-13,19:00:31
1128057318963318785,"Acho que sou uma planta, não posso ficar muito tempo sem ver o sol que fico todo triste e doente",https://twitter.com/leogreque/status/1128057318963318785,2019-05-13,18:59:57
1127768922592305152,"Estou enchendo os meus amigos com vídeos do meu gato é isto, virei o velho dos gatos... triste constatação",https://twitter.com/leogreque/status/1127768922592305152,2019-05-12,23:53:58
1124992434679820288,Feliz por ti! Parabéns! 🍾,https://twitter.com/leogreque/status/1124992434679820288,2019-05-05,08:01:12
1124990749874040832,"Meu gato estava com saudades minha, ouviu minha voz ficou miando e não são de cima de mim... já minha irmã tá triste pq eu voltei",https://twitter.com/leogreque/status/1124990749874040832,2019-05-05,07:54:30
1123976774680027139,"Mano se não ficar de olho na fatura da @oi_oficial eles te cobram um monte de coisa, em 3 meses cobraram 300 reais a mais da mãe... se fude! Mas eu to de olho 👁",https://twitter.com/leogreque/status/1123976774680027139,2019-05-02,12:45:20
1123210320170950661,E minha irmã se enchendo de arrogância dizendo que 14:00 não é hora de ir no cinema... Oh idade de merda!,https://twitter.com/leogreque/status/1123210320170950661,2019-04-30,09:59:43
1122681876093837312,"É um fenômeno óptico que faz certo tipo de superfícies refletirem as cores do arco-íris 🌈, o famoso fruta cor",https://twitter.com/leogreque/status/1122681876093837312,2019-04-28,22:59:52
1122225333854507008,"O Carlinhos escolheu a maneira dele de viver e precisamos respeitar, como já respeitamos. Mas o movimento LGBTQ não deixa heterossexuais que têm nas suas falas o preconceito, não vai ser o Carlinhos que a gente vai deixar passar! Que ele tenha um bom casamento e seja feliz!",https://twitter.com/leogreque/status/1122225333854507008,2019-04-27,16:45:44
1121831752656478210,Era meu amor... era...,https://twitter.com/leogreque/status/1121831752656478210,2019-04-26,14:41:47
1121781686944055296,"Ontem eu fiz a prova de cartografia né, aí no meio da prova me deu uma crise de ansiedade e eu comecei a me balançar na cadeira pra frente e pra trás, tipo um cosplay de Maria do embalo",https://twitter.com/leogreque/status/1121781686944055296,2019-04-26,11:22:50
1121501007190593536,"1 hora antes da prova não é estudar, é relembrar anota aí",https://twitter.com/leogreque/status/1121501007190593536,2019-04-25,16:47:31
1121148698501820416,Minha garganta está fodida fodida e tive que falar horror na terapia...,https://twitter.com/leogreque/status/1121148698501820416,2019-04-24,17:27:34
1120720566162481152,Tá fofa ficar feliz com essa dor de garganta...,https://twitter.com/leogreque/status/1120720566162481152,2019-04-23,13:06:19
1120638496115429376,Acordei às 7:00 horas da manhã sem conseguir falar e nem deglutir água... to mal 🤒,https://twitter.com/leogreque/status/1120638496115429376,2019-04-23,07:40:12
1120638113901096961,É muito engraçado algumas coisas sério!,https://twitter.com/leogreque/status/1120638113901096961,2019-04-23,07:38:41
1119362041695932416,E um cadeira mais confortável,https://twitter.com/leogreque/status/1119362041695932416,2019-04-19,19:08:02
1119359568721608704,"Minha irmã e a miga dela querendo fazer as tradições da morte de Cristo mas não sabiam os motivos, Ahhh pera aí que vou tirar meus óculos de bicha católica para ensinar algumas coisas",https://twitter.com/leogreque/status/1119359568721608704,2019-04-19,18:58:12
1119356482200514561,"Tirei Você é um unicórnio, boa demais para os plebeus do mundo!   https://www.buzzfeed.com/br/lyapalater/descubra-por-que-voce-esta-solteira?utm_source=dynamic&utm_campaign=bfsharetwitter&quiz_result=122605420_366632359#122605420&rid=366632359 …",https://twitter.com/leogreque/status/1119356482200514561,2019-04-19,18:45:56
1119027504700903424,"Não costumava esquecer as coisas que aconteciam, e sempre tinha muita história vergonhosa",https://twitter.com/leogreque/status/1119027504700903424,2019-04-18,20:58:42
1119011308844793856,Não entra na minha cabeça que o afélio e o periélio não influenciam nas estações do ano... não aceito,https://twitter.com/leogreque/status/1119011308844793856,2019-04-18,19:54:20
1118736176188403712,Isso é toc.  Eu tenho um grupo para lembrar de falar as coisas com a minha psicóloga,https://twitter.com/leogreque/status/1118736176188403712,2019-04-18,01:41:04
1117975604132024321,Apavorado como as coisas estão acontecendo exatamente como o previsto...,https://twitter.com/leogreque/status/1117975604132024321,2019-04-15,23:18:49
1117451220984246273,Já estou sofrendo pela aula infernal de amanhã,https://twitter.com/leogreque/status/1117451220984246273,2019-04-14,12:35:06
1116894254285164544,"Estou reclamando pelos 4 cantos que eu estou muito cansado e cheio de coisas para fazer... Mas isso é tão bom, tu fica tão vivo...",https://twitter.com/leogreque/status/1116894254285164544,2019-04-12,23:41:55
1116551356729315330,"Mano acho q a gente ñ precisa te falar q tu é perfeito exatamente assim como tu é, né?  E que tu ñ precisa ficar desconfortável de maneira nenhuma com qualquer característica tua, pq elas são tuas e portanto perfeitas!  Tem gente de mais falando de mais!  Pãozinho tu é incrível!",https://twitter.com/leogreque/status/1116551356729315330,2019-04-12,00:59:22
1115448626719932416,To me sentindo estranho...,https://twitter.com/leogreque/status/1115448626719932416,2019-04-08,23:57:31
1114016939163123712,Cara eu sou a pessoa mais sem noção da vida... fico incomodado com coisas super desnecessárias,https://twitter.com/leogreque/status/1114016939163123712,2019-04-05,01:08:30
1114015474558304257,Todo mundo está dizendo que eu estou soltando as patas... mas é super sem querer,https://twitter.com/leogreque/status/1114015474558304257,2019-04-05,01:02:41
1112122986134425602,Podendo apoiar pro role acontecer tamo aí!,https://twitter.com/leogreque/status/1112122986134425602,2019-03-30,19:42:36
1112056028777119744,Que dor no meu pescoço...,https://twitter.com/leogreque/status/1112056028777119744,2019-03-30,15:16:32
1112055335970316288,Fiquei feliz de saber que a tamires tem uma banca nos camelo,https://twitter.com/leogreque/status/1112055335970316288,2019-03-30,15:13:47
1108572622122610688,"Aiiii to bem, tipo muito felizzzz  To tão bem que quero chorar",https://twitter.com/leogreque/status/1108572622122610688,2019-03-21,00:34:44
1108355124727025664,"Horochi foi preso com uma bucha de maconha e destaca...   De verdade eu não esperava isso dele, só uma bucha... cai no meu conceito...",https://twitter.com/leogreque/status/1108355124727025664,2019-03-20,10:10:28
1108155591959236616,"Aiiii vou adotar um gatinho...  Ele é todo pretinho (não gente ele não dá azar, ele vai me dar amor(quando quiser)), mas não tenho ideia de nome...",https://twitter.com/leogreque/status/1108155591959236616,2019-03-19,20:57:36
1107625907341144064,Coisas que eu estou assistindo antes de um processo seletivo  https://twitter.com/cassioblancoatr/status/1107382326944825344 …,https://twitter.com/leogreque/status/1107625907341144064,2019-03-18,09:52:49
1107118343356600322,Realização é o nome do sentimento que estou sentindo... muita gratidão!,https://twitter.com/leogreque/status/1107118343356600322,2019-03-17,00:15:56
1106620357899939848,"Calma, vai dar tempoooooooooooooo  Queria mais umas 3 horas hoje....  Tudo vai acontecer hoje... SOCORROOOOO",https://twitter.com/leogreque/status/1106620357899939848,2019-03-15,15:17:07
1106382997362827265,"Não, é sério eu tem laudo da minha bipolaridade... Então eu tava bem, aí por uma micro coisa fiquei puto e com muita raiva, a maior parte das vezes eu não percebo quando isso acontece, mas hoje eu percebi e achei muito engraçado e voltei a ficar bem... minha vida é esse looping..",https://twitter.com/leogreque/status/1106382997362827265,2019-03-14,23:33:56
1106381014463639560,Aiiiiiiiii estou tão feliz,https://twitter.com/leogreque/status/1106381014463639560,2019-03-14,23:26:04
1105344456222359552,"Hoje eu estava analisando minha professora e ela  tem uma baita didática. Aquela mulher é a personificação do professor perfeito... E EU ACHO A AULA DELA UMA CHATICE, o que me deixou um pouco preocupado pq eu estou estudando para ser professor, medo de ser um merda sem didática..",https://twitter.com/leogreque/status/1105344456222359552,2019-03-12,02:47:09
1105340029159817216,"Se analisarmos um pouco mais as coisas a uns tempos atrás o pessoal tacava o pau na Anitta pq ela fazia preenchimento nos lábios, hoje todo mundo quer fazer...",https://twitter.com/leogreque/status/1105340029159817216,2019-03-12,02:29:33
1104808910953869312,"Acabei de ouvir minha vó falando a seguinte frase: “O macaco nunca olha pro próprio rabo”  Cara, puta que pariu, essa frase é muito verdade... apenas essa reflexão aí...",https://twitter.com/leogreque/status/1104808910953869312,2019-03-10,15:19:05
1104807877427032070,"Tem gente que vive num eterno filme adolescente onde tu sempre tem que ter um inimigo... Tá na hora de amadurecer, tá na hora de ser adulto!   PAZ! ✌🏻",https://twitter.com/leogreque/status/1104807877427032070,2019-03-10,15:14:58
1104807298784989185,"Tu sabe que eu gosto de uma ramperagem, pra lembrar das minhas raizes...  Mas já foi muito melhor frequentado, hoje em dia tá foda...  Na real que eu não intimido nem por dragão e nem por chinelão, só é foda quando o dragão é chinelão...",https://twitter.com/leogreque/status/1104807298784989185,2019-03-10,15:12:41
1104189508399054848,"Vou fazer o processo seletivo pro PET mais aleatório do mundo... Mas né, tudo é experiência...",https://twitter.com/leogreque/status/1104189508399054848,2019-03-08,22:17:48
1103420317383491587,Cara nunca mais usarei nenhum tóxico! É verdade esse bilhete!,https://twitter.com/leogreque/status/1103420317383491587,2019-03-06,19:21:18
1101856621779714055,Se fantasiar de mulher não é engraçado a muito tempo...,https://twitter.com/leogreque/status/1101856621779714055,2019-03-02,11:47:44
1101316827462938624,"Vai lá amor, critica mais e faz igual, continua criticando que vamos saber que é só inveja...",https://twitter.com/leogreque/status/1101316827462938624,2019-03-01,00:02:47
1101314361967239168,Se dói não é amor,https://twitter.com/leogreque/status/1101314361967239168,2019-02-28,23:52:59
1098843400827211776,"Eu sou a pessoa mais retardada do mundo:   Eu tava olhando um perfil, aqui no tt mesmo, e na bio tava “futuro geógrafo”, li isso e gritei mentalmente “eu também!”",https://twitter.com/leogreque/status/1098843400827211776,2019-02-22,04:14:16
1098806469082972160,"Sim mano, até imaginava na minha cabeça a cena de uma mulher na areia movediça...  https://twitter.com/Thelorddoug/status/1098693500315619328 …",https://twitter.com/leogreque/status/1098806469082972160,2019-02-22,01:47:31
1098190774930415617,"Só ouço música se for assim, sentindo de verdade!  https://twitter.com/ultravagabinda/status/1097860167138508801 …",https://twitter.com/leogreque/status/1098190774930415617,2019-02-20,09:00:58
