id,tweet,link,date,time
818825779924660225,"É tão engraçado essas relações entre humanos, as pessoas ainda acham que ""ter coisas"" ainda impressionam alguém...",https://twitter.com/leogreque/status/818825779924660225,2017-01-10,12:24:13
815599844924555264,Feliz ano novo!!!,https://twitter.com/leogreque/status/815599844924555264,2017-01-01,14:45:30
813364133685067776,Tipo isso @emellygasso ? Hahahah https://twitter.com/namorou/status/813161907825672192 …,https://twitter.com/leogreque/status/813364133685067776,2016-12-26,10:41:35
813363170765053952,"Rede social é uma eterna disputa de quem está mais feliz, seja ex casal ou não...  https://twitter.com/namorou/status/813177006301003777 …",https://twitter.com/leogreque/status/813363170765053952,2016-12-26,10:37:46
811317492266205184,"Acha a coisa mais engraçada do meu dia, isso porque apareceu uma ""amiga"" bem na hora que eu estava lendo...  pic.twitter.com/eebnZnlz1J",https://twitter.com/leogreque/status/811317492266205184,2016-12-20,19:08:58
811039365455560704,"O assunto era que minha equipe é incrível, como eu amo essas coisas! 😍😍😍",https://twitter.com/leogreque/status/811039365455560704,2016-12-20,00:43:47
811039146609377280,"Gente é tão diverrr chegar 00:40 falando com a professora mais fofa do curso, quando eu imaginei que isso ia acontecer? Detalhe no assunto..",https://twitter.com/leogreque/status/811039146609377280,2016-12-20,00:42:55
810285993454665729,"Outra coisa q é foda são as pessoas te julgando pelo aspecto financeiro, do tipo: se tens dinheiro tua vida é perfeita e não tens problemas",https://twitter.com/leogreque/status/810285993454665729,2016-12-17,22:50:09
809349549290586113,"A vida tem uma coisa chamada ""falta de tempo"", eu nunca tinha presenciado só ouvido falar",https://twitter.com/leogreque/status/809349549290586113,2016-12-15,08:49:04
804868677153734656,"Aí fudeu, pq tivemos que ir a pé até a malharia, não estamos perto, estavas a 3Km, eram 14:00 da tarde, fomos cozidos pelo sol, mas amo eles",https://twitter.com/leogreque/status/804868677153734656,2016-12-03,00:03:41
804867202126139393,"Tipo o inglês é tão presente e tu ñ saber é foda, hoje tive minha última aula do ano e descobri isso: amo o inglês, mesmo que eu saiba pouco",https://twitter.com/leogreque/status/804867202126139393,2016-12-02,23:57:49
804865922183917568,O que está acontecendo? Muitas coisas senhor Twitter muitas coisas,https://twitter.com/leogreque/status/804865922183917568,2016-12-02,23:52:44
802616122361061376,Muito verdade!  https://twitter.com/librafala/status/662805680185806848 …,https://twitter.com/leogreque/status/802616122361061376,2016-11-26,18:52:50
801160198744223744,"Hoje foi muito engraçado, eu estava conversando com a rosa aí eu disse que queria ir em uma festa...",https://twitter.com/leogreque/status/801160198744223744,2016-11-22,18:27:30
801157728991318018,"Do fundo do meu coração , eu queria ⭐️morta!",https://twitter.com/leogreque/status/801157728991318018,2016-11-22,18:17:42
800691737169694720,"Dica(não que alguém em sã consciência fosse fazer isso): se você virar água na sua cama, não deite sobre, assim só vai piorar as coisas  pic.twitter.com/tZSRVlUzUA",https://twitter.com/leogreque/status/800691737169694720,2016-11-21,11:26:00
800688398528696320,"Preciso falar dessa minha ""experiência"" ... hahaha",https://twitter.com/leogreque/status/800688398528696320,2016-11-21,11:12:44
800319541024690176,"Sim, estou comemorando as pequenas coisas da vida!  pic.twitter.com/o1TfDzprDC",https://twitter.com/leogreque/status/800319541024690176,2016-11-20,10:47:02
800316552893571072,Eu estou em processo de adaptação com o IOS. No início eu juro que as coisas não fazem muito sentido 😳😔🤔,https://twitter.com/leogreque/status/800316552893571072,2016-11-20,10:35:10
799995302342053888,Acho a coisa mais brega do mundo esses gif mas eu estou amando!,https://twitter.com/leogreque/status/799995302342053888,2016-11-19,13:18:37
799995143340298240,"Mas eu estou resolvendo algumas coisas da minha ""aparência""  pic.twitter.com/jNy1yg3B6j",https://twitter.com/leogreque/status/799995143340298240,2016-11-19,13:18:00
798012669064192000,"Esse mês, percebi que estou viciado em sertanejo,começou em Marília Mendonça e agora sei todas as músicas do Luan Santana, ele é muito amor",https://twitter.com/leogreque/status/798012669064192000,2016-11-14,02:00:21
797841231795654657,"Mas ele parou de funcionar, não chorei... fui forte! hahhaah  pic.twitter.com/CI7KFgSEYc",https://twitter.com/leogreque/status/797841231795654657,2016-11-13,14:39:07
797840461545308160,"A vida é muito triste! eu estava bem de boas, aí do nada meu cel parou de funcionar! tipo era um celular muito bom na teoria e caro também!",https://twitter.com/leogreque/status/797840461545308160,2016-11-13,14:36:03
793433983409356800,"""O que está acontecendo?"" Muitas coisas seu Twitter...",https://twitter.com/leogreque/status/793433983409356800,2016-11-01,10:46:17
791630449403625472,"Cheguei na furg 10:09, eu achava que minha aula era as 9:45, mas NÃO, minha aula é as 10:35. Não fiquei feliz!",https://twitter.com/leogreque/status/791630449403625472,2016-10-27,11:19:41
790604598998335489,"... Deixa, deixa mesmo de ser importante, vai deixando a gente para outra hora...",https://twitter.com/leogreque/status/790604598998335489,2016-10-24,15:23:19
784232457893715968,"Mais uma coisa! eu sou do tipo que acha graça de tudo, então se eu estiver rindo de alguma coisa quando vc passa não necessariamente é de vc",https://twitter.com/leogreque/status/784232457893715968,2016-10-07,00:22:42
784231717741727744,"Eu não sei o porquê mas eu, uma hora ou outra acabo perdendo o interesse nas pessoas, e quando ele acaba não tem mais volta... 😳😞😥",https://twitter.com/leogreque/status/784231717741727744,2016-10-07,00:19:46
783862912771301376,Vamos falar de outra coisa! Passei em álgebra linear!,https://twitter.com/leogreque/status/783862912771301376,2016-10-05,23:54:16
783862807272054784,"Ahhhh tem outra coisa que eu acho muito importante falar, esqueci!",https://twitter.com/leogreque/status/783862807272054784,2016-10-05,23:53:51
783862542795960320,"Desabafei minha história, esse tipo de coisa só acontece na minha família...",https://twitter.com/leogreque/status/783862542795960320,2016-10-05,23:52:48
783860898293288960,"Na vdd eu fiquei feliz por ela... Enfim minha mãe não estava em casa, só estava eu. Ela ligou para minha mãe para dizer que eu adorei",https://twitter.com/leogreque/status/783860898293288960,2016-10-05,23:46:16
783860176692666368,Amanhã tenho uma provinha super de boa de Química geral 1... De boa se tu estudou... Para variar não é meu caso...,https://twitter.com/leogreque/status/783860176692666368,2016-10-05,23:43:24
783859396023549952,Amanhã tenho que ir no quartel para jurar a bandeira e NUNCA mais voltar lá 🙏🙏🙏,https://twitter.com/leogreque/status/783859396023549952,2016-10-05,23:40:18
782902870400172032,Como saber meu humor? Veja que tipo de música estou ouvindo!,https://twitter.com/leogreque/status/782902870400172032,2016-10-03,08:19:24
782799538381791232,"Mas quando se  trata de um primeiro contato ""virtualmente"" sou igual à uma adolescente de 14 anos! Essa vida é triste! Hahaha",https://twitter.com/leogreque/status/782799538381791232,2016-10-03,01:28:48
782798772732592128,"De vdd, não sei lidar com crush é muito sério o meu problema. Sim isso é um problema, tipo eu não tenho problema nenhum em chegar em ninguém",https://twitter.com/leogreque/status/782798772732592128,2016-10-03,01:25:45
782560426555039744,"Na semana 3 depois da festa você já superou toda essa bad, e não vê a hora da próxima chegar, você está super numa vibe festa...",https://twitter.com/leogreque/status/782560426555039744,2016-10-02,09:38:39
782404419761602560,"Mas falando de coisa boa, hj eu fui ""trabalhar"" e bebi todos os drinks imaginados da Life. Sim fiquei bêbado na hora do ""expediente""... MAC",https://twitter.com/leogreque/status/782404419761602560,2016-10-01,23:18:44
782403866444914688,"É muito triste, mas eu tenho que superar que a vida tem dessas e que nem sempre vou conseguir usar a psicologia a meu favor.. #nãoqueromais",https://twitter.com/leogreque/status/782403866444914688,2016-10-01,23:16:32
779514038267047936,É engraçado a necessidade das pessoas sempre quererem parecer que estão sempre bens...,https://twitter.com/leogreque/status/779514038267047936,2016-09-23,23:53:24
777609490531254272,"A outra coisa, eu não vou servir ao quartel! (ou qualquer outra coisa do tipo)",https://twitter.com/leogreque/status/777609490531254272,2016-09-18,17:45:24
777607860071067648,"Mais algumas atualizações sobre mim: estou bem feliz com as amizades que estou fazendo esse ano, as pitus são as melhores!",https://twitter.com/leogreque/status/777607860071067648,2016-09-18,17:38:55
777606538114506752,"Quem olha acha que eu uso o tt sempre, mas não! Só uso quando estou desculpado... Ou procrastinando no modo hard... Hahahha TIPO AGORA!",https://twitter.com/leogreque/status/777606538114506752,2016-09-18,17:33:40
777605577144930304,"Eu realmente não sei porque eu fico sendo ""educado"" dando Boa tarde, bom dia e Boa noite... Até parece que eu sou educado...",https://twitter.com/leogreque/status/777605577144930304,2016-09-18,17:29:51
777605358223237120,Boa tarde!,https://twitter.com/leogreque/status/777605358223237120,2016-09-18,17:28:59
772667286633275393,Tive cada sonho ontem... queria que alguns fossem verdade... Mas nem tudo é perfeito... Bora tentar realizar alguns!,https://twitter.com/leogreque/status/772667286633275393,2016-09-05,02:26:51
771958115742932996,"Eu nem sei o que eu fiz, tipo eu ando meio sem tempo, não estou suprindo minhas amigas na real, mas poxa eu sou bem legal as vezes...",https://twitter.com/leogreque/status/771958115742932996,2016-09-03,03:28:51
771957279130255361,Eu nunca imaginei que eu fosse ser abandonado pelas minhas amigas.... Tipo o pior é que eu só descubri isso no meio de uma festa... 😢😑😞,https://twitter.com/leogreque/status/771957279130255361,2016-09-03,03:25:32
770088118691196928,Pessoa que vai ter prova amanhã e está com muito medo: eu mesmo!,https://twitter.com/leogreque/status/770088118691196928,2016-08-28,23:38:09
741990098233888768,"#RIPChristina Fiquei chocado com a notícia, eu me orgulhava de ter descoberto ela antes das outras pessoas... Triste perca...",https://twitter.com/leogreque/status/741990098233888768,2016-06-12,10:46:39
738676340510035968,"Eu achei muito engraçado, mas escrito não teve graça, talvez seja porque são 7 horas da manhã e eu esteja com sono, não sei!",https://twitter.com/leogreque/status/738676340510035968,2016-06-03,07:18:58
735482774853849088,"Sério, eu quero gritar para o mundo todo o quão feliz eu estou!",https://twitter.com/leogreque/status/735482774853849088,2016-05-25,11:48:52
735482650190716928,"Imagina uma pessoa feliz por ter recebido uma coisa boa ""de presente"", imagina quando ela descobre que essa coisa era melhor ainda... 💓😃😍😂😱😀",https://twitter.com/leogreque/status/735482650190716928,2016-05-25,11:48:23
735482650069176322,Aí meu Deus! Eu estou/sou a pessoa mais feliz do mundo 😃😃😃😃,https://twitter.com/leogreque/status/735482650069176322,2016-05-25,11:48:23
730362259529187328,"Isso tudo é muito estranho... Pareço livre, acho que realmente estou livre, acho que nunca fui tão ""eu mesmo"" quanto estou sendo...",https://twitter.com/leogreque/status/730362259529187328,2016-05-11,08:41:46
730362251656450048,"Agora quando eu me olho no ""espelho"" me reconheço... Isso é estranho mas é um estranho do bem, é um estranho bom. Eu gosto disso!",https://twitter.com/leogreque/status/730362251656450048,2016-05-11,08:41:44
728668098904076288,Não que creio que amanhã vou ter que ficar na ONG das 14 às 16 horas....,https://twitter.com/leogreque/status/728668098904076288,2016-05-06,16:29:47
727501517150937090,"Eu me esqueço que o piercing não está concretizado e toco no nariz, isso é a pior coisa do mundo! Sério dói muito! #chorando",https://twitter.com/leogreque/status/727501517150937090,2016-05-03,11:14:12
727274603555524608,"3 coisas sobre o piercing: 1) dói muito 2) está torto, tem que esperar desinchar para arrumar 3) dói muito mesmo",https://twitter.com/leogreque/status/727274603555524608,2016-05-02,20:12:32
710603475151933441,"Ah e na Furg tu pode ser quem tu quiser, tipo lá as pessoas são livres para serem quem quiser, como quiser e se quiser... 👏👏👏 #melhorlugar",https://twitter.com/leogreque/status/710603475151933441,2016-03-17,20:07:25
705566908825870336,"Amanhã vai ter uma festa de ""recepção"" no cassino para os calouros que será organizada pelos veteranos #promete #esperoNÃOdarPT",https://twitter.com/leogreque/status/705566908825870336,2016-03-03,22:33:54
705506162494607360,"A faculdade mal começou e já deu de perceber alguns grupinhos, tipo os festeiros😄 e as patricinhas😒😴...",https://twitter.com/leogreque/status/705506162494607360,2016-03-03,18:32:31
705494781321994242,Essa foi a minha reação ao lembrar que tenho um Twitter... Kkk  pic.twitter.com/m7B9pjj86K,https://twitter.com/leogreque/status/705494781321994242,2016-03-03,17:47:17
695281191176531968,"Não sei se estou feliz ou frustado, sou suplente na engenharia de alimentos, com a minha nota eu poderia se suplente na engenharia civil...",https://twitter.com/leogreque/status/695281191176531968,2016-02-04,14:22:08
692797648642936832,"Eu PRECISO comprar muitos CDs tipo tem o da Selena; o da Sia; o do Justin; o do 1d e o da Jessie, fora os nacionais...",https://twitter.com/leogreque/status/692797648642936832,2016-01-28,17:53:25
692097038574555136,"Eu estou me sentindo muito excluído, todas as pessoas que eu estou a fim de falar não estão me respondendo, obrigado mundo por me excluir...",https://twitter.com/leogreque/status/692097038574555136,2016-01-26,19:29:27
690487280553844737,"Ontem estava me testando p/ saber como anda o funcionamento dos meus neurônios, descobri que vou sofrer MUITO quando começar a ter aula...",https://twitter.com/leogreque/status/690487280553844737,2016-01-22,08:52:50
690484937233952768,"Cheguei na Furg meia hora antes, do horário que começa as matrículas, e já tem uma fila quilométrica... #táCALOR #SOLtáFORTE",https://twitter.com/leogreque/status/690484937233952768,2016-01-22,08:43:32
690304094410559489,Amanhã vou lá na FURG fazer minha matrícula!,https://twitter.com/leogreque/status/690304094410559489,2016-01-21,20:44:55
685877286906769409,"Fiquei super empolgado/feliz pelos resultados que eu vi, mas quando eu consegui ver a nota da redação veio a decepção...",https://twitter.com/leogreque/status/685877286906769409,2016-01-09,15:34:22
685267181857337344,"Amanhã sai o resultado do enem, mas eu estou MUITO nervoso...",https://twitter.com/leogreque/status/685267181857337344,2016-01-07,23:10:02
679367887937777664,Eu estou super feliz escutando música quando vê a próxima música começa a tocar e a bad a bater... Aff,https://twitter.com/leogreque/status/679367887937777664,2015-12-22,16:28:21
679314201396035584,Boa tarde!,https://twitter.com/leogreque/status/679314201396035584,2015-12-22,12:55:01
677995256902770694,Pq as pessoas ñ usam o ponto de interrogação?  Não sou obrigado a  adivinhar se a frase se trata de uma pergunta ou uma afirmação...,https://twitter.com/leogreque/status/677995256902770694,2015-12-18,21:34:00
677506966076399617,Tipo isso...  https://twitter.com/MeuMundoOficial/status/677147702606626816 …,https://twitter.com/leogreque/status/677506966076399617,2015-12-17,13:13:42
676944934369435649,Eu fiquei pensando em fazer uma indireta bem direta para a @why_nathi para ela começar a me responder + rápido mas fiquei sem criatividade..,https://twitter.com/leogreque/status/676944934369435649,2015-12-16,00:00:24
676932071328206849,Eu estou muito apaixonado pela letra da música da dupla Jorge e Mateus - coisas de quem ama... 😍😍😍,https://twitter.com/leogreque/status/676932071328206849,2015-12-15,23:09:17
676600187918417920,"n sei pq mas eu fico extremamente feliz e emocionado em apoiar os meus amigos a seguir em busca de seus sonhos, eu tenho mt orgulho deles☺😀😃",https://twitter.com/leogreque/status/676600187918417920,2015-12-15,01:10:30
676599233194102784,Eu nem sei explicar o quanto me toca ver que alguns dos meus amigos estão toca suas vidas do modo mais digno e feliz possível😀👏👏👏,https://twitter.com/leogreque/status/676599233194102784,2015-12-15,01:06:42
676598643873464320,Eu fico muito feliz em ver os amigos que eu construí ao longo da minha curta vida.😀,https://twitter.com/leogreque/status/676598643873464320,2015-12-15,01:04:21
675013303249301504,"Na real eu adoro falar com pessoas idosas, adoro ouvir histórias de como eram as coisas no tempo delas...",https://twitter.com/leogreque/status/675013303249301504,2015-12-10,16:04:47
675012676112773120,A minha bisa mandou eu tomar cuidado com os pés descalços porque ontem caiu uma bolinha da árvore de natal no chão...,https://twitter.com/leogreque/status/675012676112773120,2015-12-10,16:02:17
673811071120056320,"Caraca, eu tive o sonho mais bizarro do mundo, o problema é que eu quase acreditei... Huahaha 😂😂😂",https://twitter.com/leogreque/status/673811071120056320,2015-12-07,08:27:32
673295649216061441,"Eu estava super feliz, aí me colocaram dentro do carro ficaram andando 2horas agora estou com fome e sono aí me dizem sempre com essa cara?",https://twitter.com/leogreque/status/673295649216061441,2015-12-05,22:19:26
672194711713632257,"O MUNDO TODO está em recessão econômica, e o Brasil não está fora dessa...",https://twitter.com/leogreque/status/672194711713632257,2015-12-02,21:24:42
671499084323266560,"Minha vida esta tomando um rumo muito legal, então vou começar a ficar preocupado...",https://twitter.com/leogreque/status/671499084323266560,2015-11-30,23:20:32
671338988372930560,"Eu estou morrendo de fome, mas hoje vou começar minha dieta então nada de comida...",https://twitter.com/leogreque/status/671338988372930560,2015-11-30,12:44:22
671066632177995777,"Amanhã eu tenho uma prova para fazer, mas eu sei tão pouco que estou a fim de só colocar meu nome...",https://twitter.com/leogreque/status/671066632177995777,2015-11-29,18:42:07
670634441312702464,Quem tem a pior internet do mundo?🙋 Eu...,https://twitter.com/leogreque/status/670634441312702464,2015-11-28,14:04:45
670315692634324992,Caraca todo o mundo resolveu desligar o telefone na minha cara... 😒😡😤,https://twitter.com/leogreque/status/670315692634324992,2015-11-27,16:58:09
670267479478943744,"""Existem 3 tipo de amigos: os que tu gosta, os que tu ama e os que tu ama e não vive sem."" Eu tenho amigos nas 3 classificações ❤",https://twitter.com/leogreque/status/670267479478943744,2015-11-27,13:46:34
670256628638351360,Será que é coisa da minha cabeça?,https://twitter.com/leogreque/status/670256628638351360,2015-11-27,13:03:27
669142176996175872,"Sobre meu rosto: eu já chorei, vou chorar mais e que Deus tenha piedade...",https://twitter.com/leogreque/status/669142176996175872,2015-11-24,11:15:01
668977272880238592,"Como nada é simples, as coisas para mim SEMPRE são muito complicadas kkk",https://twitter.com/leogreque/status/668977272880238592,2015-11-24,00:19:45
668579283925864449,Todos queremos ser feliz...,https://twitter.com/leogreque/status/668579283925864449,2015-11-22,21:58:17
668579186139877377,"Mas agora eu me liguei que ela nunca quis ser importante, ela sempre quis era ser feliz...",https://twitter.com/leogreque/status/668579186139877377,2015-11-22,21:57:54
668578952655540224,"A princípio eu n gostei muito da Katniss ter se isolado do mundo com o Peeta, eu queria que ela se tornasse a presidente ou algo importante",https://twitter.com/leogreque/status/668578952655540224,2015-11-22,21:56:58
667502586304532484,"É óbvio que eu choro, tipo quando eu fico ""triste"" por exemplo",https://twitter.com/leogreque/status/667502586304532484,2015-11-19,22:39:52
667502119113633792,"Eu acho que estímulos falsos nunca me fizeram chorar, tipo filmes não me lembro de nenhum que tenha me feito chorar...",https://twitter.com/leogreque/status/667502119113633792,2015-11-19,22:38:01
667151094104121346,Eu sou a pessoa mais preguiço do mundo... Deixei o trabalha da escola para a última hora...,https://twitter.com/leogreque/status/667151094104121346,2015-11-18,23:23:10
667046537277677568,Eu já sabia que as coisas nao não estavam do mesmo jeito a tempos mas NUNCA imaginei esse fim. 😥,https://twitter.com/leogreque/status/667046537277677568,2015-11-18,16:27:42
666351113025753088,"Meu Deus, 70% das pessoas que eu conheço estão raspando a cabeça, estou bem a fim de fazer também....",https://twitter.com/leogreque/status/666351113025753088,2015-11-16,18:24:20
666271112079257601,Como me irrita quando alguém que eu não gosto fique pegando minhas coisas.,https://twitter.com/leogreque/status/666271112079257601,2015-11-16,13:06:26
665911468118974464,Bom dia/tarde,https://twitter.com/leogreque/status/665911468118974464,2015-11-15,13:17:20
665570174637076482,"Qnd se guarda um sentimento e se segura as palavras, vc está retendo 1 bomba relógio, por isso é melhor escrever/expor antes q vc exploda...",https://twitter.com/leogreque/status/665570174637076482,2015-11-14,14:41:09
665560912414285824,A pior sensação/sentimento do mundo é ter que aturar uma pessoa que tu odeia...,https://twitter.com/leogreque/status/665560912414285824,2015-11-14,14:04:21
665201095501873153,Há pessoas tristes mas não infeliz. Há pessoas alegres mas não feliz.,https://twitter.com/leogreque/status/665201095501873153,2015-11-13,14:14:34
664834808867127297,"Sou como a Inês Brasil, trato todo o mundo com carinho mas também quero ser tratado com carinho por todo o mundo...",https://twitter.com/leogreque/status/664834808867127297,2015-11-12,13:59:05
664548125466476544,"Modéstia aparte eu sou um ótimo motorista, aí vem um menino e diz cuidado que ele atropela todo o mundo.... Como assim, alguém me explica?",https://twitter.com/leogreque/status/664548125466476544,2015-11-11,18:59:54
664489891263328256,Odeio quando eu faço um diálogo com uma pessoa na minha cabeça e ela n responde o q eu tinha imaginado...,https://twitter.com/leogreque/status/664489891263328256,2015-11-11,15:08:30
664120750874447872,Aceitamos o amor que achamos que merecemos - As vantagens de ser invisível,https://twitter.com/leogreque/status/664120750874447872,2015-11-10,14:41:40
663874356913786882,Acho que vou pegar uma cadeira e um saco de pipoca para assistir onde minha vida vai me levar...,https://twitter.com/leogreque/status/663874356913786882,2015-11-09,22:22:35
663475437566337028,"minha vida tá meio assim: uma hora tá dando certo, aí do nada não tá mais, aí de repente tá, depois não tá, aí tá e passa 10 min não tá mais",https://twitter.com/leogreque/status/663475437566337028,2015-11-08,19:57:25
663167014912045056,Acho que vou viajar amanhã...,https://twitter.com/leogreque/status/663167014912045056,2015-11-07,23:31:52
662952449188225024,"Talvez eu não comece a dieta hoje, mas o projeto #léodelícia2017 vai começar esse mês... kkkkk",https://twitter.com/leogreque/status/662952449188225024,2015-11-07,09:19:15
662947968434204672,"Eu estava com vontade de começar a minha dieta hoje, mas está difícil...",https://twitter.com/leogreque/status/662947968434204672,2015-11-07,09:01:27
662282542792482816,Para que tanto ódio no core?,https://twitter.com/leogreque/status/662282542792482816,2015-11-05,12:57:17
661968487133421568,Por que quando eu era criança eu adorava ir no super mercado e agora é tipo um sacrifício?,https://twitter.com/leogreque/status/661968487133421568,2015-11-04,16:09:20
661715245849837568,"Hj eu presenciei 1 cena que partiu meu problem em 2, tipo eu tinha um pqno problem aí surgiram 2 mega problems, não foi legal, não curti...",https://twitter.com/leogreque/status/661715245849837568,2015-11-03,23:23:03
661711593777045505,"Acabei de perceber que a estrelinha virou um coração, acabou a emoção😞 #RIPEstrelinha",https://twitter.com/leogreque/status/661711593777045505,2015-11-03,23:08:32
661571433521352704,Eu não estou mais acostumado a ter aula de tarde. Odeio essa vida de cursinho... Aff,https://twitter.com/leogreque/status/661571433521352704,2015-11-03,13:51:35
661347656439078912,"@why_nathi ai, eu não sei nem o q falar kkk",https://twitter.com/leogreque/status/661347656439078912,2015-11-02,23:02:23
661346178659966976,"As vezes acho que eu sou ""feliz"" de mais",https://twitter.com/leogreque/status/661346178659966976,2015-11-02,22:56:30
660223993597796352,Mas uma hora tudo vai passar e talvez ter estado sozinho tenha sido melhor.,https://twitter.com/leogreque/status/660223993597796352,2015-10-30,20:37:21
660220645624651776,"Eu só espero encontrar-me logo, n pq dói ou algo do tipo, não vou mentir dizendo que os sentimentos doem, mas eles provocam coisas piores.",https://twitter.com/leogreque/status/660220645624651776,2015-10-30,20:24:02
660219927660535808,"Eu sei q uma hora eu vou encontrar a ""luz"", mas nesse momento eu qria mil vezes ser um barco, sem sentimentos, sem emoções, sem curiosidade.",https://twitter.com/leogreque/status/660219927660535808,2015-10-30,20:21:11
660219516367056896,"Eu já nem sei mais quem sou ou o que eu quero, o que eu sei é que eu me encontro perdido, sozinho, tipo um barco a deriva.",https://twitter.com/leogreque/status/660219516367056896,2015-10-30,20:19:33
