id,tweet,link,date,time
945049997103587328,"A pior parte de organizar tudo antes, é que não existe a emoção de se estar atrasado, parente chegando e tu não tou banho, não fez o arroz à grega, não tirou o Peru do forno... bendita seja a organização...",https://twitter.com/leogreque/status/945049997103587328,2017-12-24,19:54:12
945036059498426368,"Sempre soube que esse dia ia chegar, o dia em que os celulares seriam maiores que as televisões... @submarino pic.twitter.com/IKXrEGK0ED",https://twitter.com/leogreque/status/945036059498426368,2017-12-24,18:58:49
943875345182273536,"A vontade que me dá é pegar as pessoas envolvidas, fazer uma círculo e falar como aconteceu de fato",https://twitter.com/leogreque/status/943875345182273536,2017-12-21,14:06:33
943875079242436608,Eu sempre fico muito puto quando alguém fala que eu fiz uma coisa que eu não fiz ou quando as pessoas supõe uma história e contam como se fosse vdd...,https://twitter.com/leogreque/status/943875079242436608,2017-12-21,14:05:29
943674227487584256,Uma cartinha amorzinho de um amorzinho de pessoa ❤️🧚🏻‍♀️🌈 @Kathapora pic.twitter.com/3DyBybXHbC,https://twitter.com/leogreque/status/943674227487584256,2017-12-21,00:47:23
941125515381018624,Da seleção de coisas boas que têm acontecido na minha vida❤️  pic.twitter.com/YW21nvd1p3,https://twitter.com/leogreque/status/941125515381018624,2017-12-13,23:59:42
941124906997243904,Nunca achei que essa porcaria de música fosse fazer tanto sentido... aí que merda,https://twitter.com/leogreque/status/941124906997243904,2017-12-13,23:57:17
941124704114528256,"Seu amor me pegou Cê bateu tão forte com o teu amor Nocauteou, me tonteou Veio à tona, fui à lona, foi K.O. Sempre fui guerreira, mas foi de primeira Me vi indefesa, coração perdeu a luta, sim Adeus bebedeira, vida de solteira, quero 6 Estar contigo na minha cama, juntos, coladin",https://twitter.com/leogreque/status/941124704114528256,2017-12-13,23:56:29
941123100380401664,Quando tá tudo feliz na minha vida vem quem puxar meu tapete? Isso mesmo o filho da puta do meu pai. Valeu pai por ser um grande bostão!,https://twitter.com/leogreque/status/941123100380401664,2017-12-13,23:50:07
937765153868845059,"Só merda, a inflação e o juros caíram porque NÃOOOOOOO TEM ECONÔMICA, a economia está no chão!",https://twitter.com/leogreque/status/937765153868845059,2017-12-04,17:26:50
933527755035152384,"Queria ser frio no WhatsApp, só que dessa vez de propósito, mas é impossível que as pessoas percebam alguma diferença...",https://twitter.com/leogreque/status/933527755035152384,2017-11-23,00:48:55
930838901660573696,Odeio pessoas que estão rum role em grupo e tiram foto sozinhas... @GabrielaGasso_ @,https://twitter.com/leogreque/status/930838901660573696,2017-11-15,14:44:22
930171907743387648,"Nunca vi o cinema tão vazio, um total de 4 pessoas...",https://twitter.com/leogreque/status/930171907743387648,2017-11-13,18:33:59
929554697337425921,Quem tem o namorado mais bonitinho da vida? Eu mesmo!  pic.twitter.com/4ton3cJQEl,https://twitter.com/leogreque/status/929554697337425921,2017-11-12,01:41:24
929551932913569792,"@emellygss eu te odeio por tu ter esquecido meu aniversário!  Com amor, Greque Leonardo",https://twitter.com/leogreque/status/929551932913569792,2017-11-12,01:30:25
929550700744462336,"Ontem eu fiz um jantar para apresentar o Cesar pros meus amigos, mas não deu muito certo... eles não interagiram...",https://twitter.com/leogreque/status/929550700744462336,2017-11-12,01:25:31
926309881493229568,"Mano, Dinastia é a série da minha vida, parece que juntaram tudo que eu gosto em uma série só",https://twitter.com/leogreque/status/926309881493229568,2017-11-03,02:47:40
926151817859338240,Não misture vinho com cachaça com vodka com cerveja... talvez no outro dia tu te sintas como um peso de papel,https://twitter.com/leogreque/status/926151817859338240,2017-11-02,16:19:35
925898861104771072,dia lixo,https://twitter.com/leogreque/status/925898861104771072,2017-11-01,23:34:25
925150195570049025,"@anaamelialemos Oi querida, se a política pode melhorar a vida dos Brasileiros vote não para a PLC28/2017 Queremos escolher nosso transporte",https://twitter.com/leogreque/status/925150195570049025,2017-10-30,21:59:29
924295548332634113,Aí essas pessoas egoistas....,https://twitter.com/leogreque/status/924295548332634113,2017-10-28,13:23:25
919786777979875329,Da até medo... quanto maior o “sonho” maior a “queda”,https://twitter.com/leogreque/status/919786777979875329,2017-10-16,02:47:11
917709111751577600,Tu tem alguma gaveta de manhã?  Obs: A vontade em clicar no calcinha é grande...  Hahahah  pic.twitter.com/jIedQ9Gddy,https://twitter.com/leogreque/status/917709111751577600,2017-10-10,08:11:17
917414217816395777,"Acho que vou trabalhar no INPS, adorei entregar ficha para as pessoas... Hahahah",https://twitter.com/leogreque/status/917414217816395777,2017-10-09,12:39:28
916136925446230016,"“Telespectador da minha vida” vira e volta eu me sinto assim, mas ultimamente tá foda!",https://twitter.com/leogreque/status/916136925446230016,2017-10-06,00:03:58
916134478422200320,Tanta coisa acontecendo... e onde eu estou? Parece que sou apenas um telespectador da minha própria vida... Acho que não tá certo não...,https://twitter.com/leogreque/status/916134478422200320,2017-10-05,23:54:15
913741867291938816,"Eu realmente não consigo olhar os aniversariantes do dia e dar parabéns, sério prefiro muito mais chamar no PV e falar... mas né...",https://twitter.com/leogreque/status/913741867291938816,2017-09-29,09:26:52
913741392568029184,"Deixa eu falar uma coisa aqui, acho muito engraçado essas felicitações que as pessoas fazem pelo Facebook, tipo é muito engraçado!",https://twitter.com/leogreque/status/913741392568029184,2017-09-29,09:24:59
913739485518729216,Começar a comemoração do aniversário fazendo uma retrospectiva das musicas da beyoncé já faz o dia valer a pena! 👌🏻✌🏻👏🏻  pic.twitter.com/3rnGo1PB9L,https://twitter.com/leogreque/status/913739485518729216,2017-09-29,09:17:24
913240347572162560,Sair de um projeto em que tu acredita não é nem de longe uma tarefa fácil... mas vida que segue,https://twitter.com/leogreque/status/913240347572162560,2017-09-28,00:14:00
912774693756825600,Quem disse que a mãe da pessoa é puta? Quem disse que uma puta não pode criar um filho de forma “correta”? Qual o problema de se ser puta?,https://twitter.com/leogreque/status/912774693756825600,2017-09-26,17:23:40
912774183205113858,Reflexão do dia: A maior parte dos xingamentos contra as pessoas são sempre muito preconceituosos... ex: filho da puta,https://twitter.com/leogreque/status/912774183205113858,2017-09-26,17:21:38
912535811215720449,Cazuza é o cantor da minha vida,https://twitter.com/leogreque/status/912535811215720449,2017-09-26,01:34:26
912534829706743808,Todos os dias é um vai-e-vem A vida se repete na estação Tem gente que chega pra ficar Tem gente que vai pra nunca mais,https://twitter.com/leogreque/status/912534829706743808,2017-09-26,01:30:32
912532169964294144,"Eu adoro o fato de que quando as pessoas que me seguem vão ver o tt delas, só vai dar eu... aí sou estranho mesmo",https://twitter.com/leogreque/status/912532169964294144,2017-09-26,01:19:58
912531606568685568,Mas não sei se vai dar tempo,https://twitter.com/leogreque/status/912531606568685568,2017-09-26,01:17:43
912531298924793856,Preciso dormir mas o sono não vem,https://twitter.com/leogreque/status/912531298924793856,2017-09-26,01:16:30
912531127553937408,"Mano eu sou apenas ridículo, qual o meu problema? Existem coisas na vida dos outros que me irritam...  LEONARDO TÁ TUDO ERRADO!",https://twitter.com/leogreque/status/912531127553937408,2017-09-26,01:15:49
911952779559800832,Bom dia para quem devia ter acordado a slá... umas 3 horas,https://twitter.com/leogreque/status/911952779559800832,2017-09-24,10:57:40
911692731797340160,Sabe qual é o meu sonho hoje? Acabar cálculo!,https://twitter.com/leogreque/status/911692731797340160,2017-09-23,17:44:20
910657441972531200,"Cada dia tenho uma música gruda na minha mente, ontem foi “oh nana”, hoje é “param pra escutar, estão ouvindo esse som” em versão eletrônica",https://twitter.com/leogreque/status/910657441972531200,2017-09-20,21:10:28
910607743903559687,"O IOS atualizou e tá bonitinho, tipo eu não gosto muito de mudança",https://twitter.com/leogreque/status/910607743903559687,2017-09-20,17:52:59
909637994021376001,Apenas aceitem que não sou uma pessoa constante...  https://twitter.com/csaadl/status/909633920085479424 …,https://twitter.com/leogreque/status/909637994021376001,2017-09-18,01:39:32
909637103138557954,"Sim, vai do ponto de vista! Tipo até tu pode ter duas verdades mas por conveniência escolhe uma... esse lance de vdd é muito louco, amo!!!💕",https://twitter.com/leogreque/status/909637103138557954,2017-09-18,01:36:00
909587316943007744,"O problema não é eu expor minha vida no tt( ou slá), o problema é que as pessoas não conseguem se controlar...",https://twitter.com/leogreque/status/909587316943007744,2017-09-17,22:18:10
909586853254303744,"[Outro assunto] Eu não entendo porque as pessoas não cultivam a ""paz"", sério seria tão fácil se cada um cuidasse da sua própria vida...",https://twitter.com/leogreque/status/909586853254303744,2017-09-17,22:16:19
909586044353380352,"Lidar com Geminiano é tipo a tarefa mais difícil da vida de todos, sério não é nada fácil! Breve ilustração (🌸🔜👹).",https://twitter.com/leogreque/status/909586044353380352,2017-09-17,22:13:06
909498130076508161,Sério tá muito difícil a vida no trânsito!,https://twitter.com/leogreque/status/909498130076508161,2017-09-17,16:23:46
909295952053325824,A trilha empreendedora tá muito foda!,https://twitter.com/leogreque/status/909295952053325824,2017-09-17,03:00:23
909295148189798401,"Tava no aniver da Lu, mano todas as pessoas que eu quero levar para vida estavam lá 💕",https://twitter.com/leogreque/status/909295148189798401,2017-09-17,02:57:11
909291540090167301,Mano tô no tt com às luzes do quarto apagadas e a lanterna do celular acesa... medo?,https://twitter.com/leogreque/status/909291540090167301,2017-09-17,02:42:51
908677755713224704,"Bom dia para quem teve aula as 7:45, acordou as 6:30 e agora está no lado de fora de casa!",https://twitter.com/leogreque/status/908677755713224704,2017-09-15,10:03:54
908533891996180486,"Do nada uma vontade de ouvir Adryana e a Rapaziada "" no fim da noite eu queria te ver, e nos teus braços dormir e sonhar""",https://twitter.com/leogreque/status/908533891996180486,2017-09-15,00:32:14
908443791803211781,Imagina uma criança assistir ele e achar que tratar as pessoas do jeito que ele trata é normal... Deus me dibre!,https://twitter.com/leogreque/status/908443791803211781,2017-09-14,18:34:12
908443351321628674,Mano como o lixo do Marcos Harter voltou para a televisão aberta? Sério programas com ele devia ser censurado para maiores de 18...,https://twitter.com/leogreque/status/908443351321628674,2017-09-14,18:32:27
908427174906093568,Todos os dias da minha vida!  https://twitter.com/smokeebuds/status/907969495498665991 …,https://twitter.com/leogreque/status/908427174906093568,2017-09-14,17:28:10
907309398397276160,"Que vídeo foda, conceito da minha vida...",https://twitter.com/leogreque/status/907309398397276160,2017-09-11,15:26:32
906945199443771392,"Já falei que tô eu uma tocha? Então roubei, eu e meus amigos... agora a questão é o que fazer com ela...",https://twitter.com/leogreque/status/906945199443771392,2017-09-10,15:19:20
906895430339919872,"Aí minha mãe falando para minha irmã ""levanta, acorda para vida..."" e eu bem quietinho, fazendo a linha pêssega...",https://twitter.com/leogreque/status/906895430339919872,2017-09-10,12:01:34
906893377131745280,Acredito que tá foda!,https://twitter.com/leogreque/status/906893377131745280,2017-09-10,11:53:25
906892322578857985,"Eu sai de um lugar por conta da pessoa x, aí eu chegava em outro lugar e queria sair por conta da pessoa c.... o que tenho que fazer?",https://twitter.com/leogreque/status/906892322578857985,2017-09-10,11:49:13
906891833447460864,Aí é tão foda esses embustes que a vida traz...,https://twitter.com/leogreque/status/906891833447460864,2017-09-10,11:47:16
906307082785361921,Ah mano que merda... move lotada amanhã...,https://twitter.com/leogreque/status/906307082785361921,2017-09-08,21:03:41
906283099872481281,"O banco Itaú é um lixo, sério! Muito ruim as pessoas fazem onda para trabalhar... afff odeio o Itaú... Banco do Brasil 10x melhor",https://twitter.com/leogreque/status/906283099872481281,2017-09-08,19:28:23
906212143527276544,"Mano eu odeio essa gente estupida que não sabe dirigir, sério eu estou com muita raiva desses estupidos que ficam atrapalhando o trânsito...",https://twitter.com/leogreque/status/906212143527276544,2017-09-08,14:46:26
905942932355764225,Amanhã eu vou fazer a sobrancelha e cortar o cabelo... foda-se... pode ser que eu morra amanhã... aí não tô preparado para isso... da vida..,https://twitter.com/leogreque/status/905942932355764225,2017-09-07,20:56:41
905939754671362048,"Mano eu odeio velórios, eles me deixam extremamente vulneráveis...",https://twitter.com/leogreque/status/905939754671362048,2017-09-07,20:44:03
905868940219473924,Tem coisas na vida que a gente não perde...,https://twitter.com/leogreque/status/905868940219473924,2017-09-07,16:02:40
904532815156563968,"O dia em que a Karina Rangel me notou, talvez ela não goste de mim ou da minha opinião, mas ela me notou...  pic.twitter.com/NQ1wU6F0Fv",https://twitter.com/leogreque/status/904532815156563968,2017-09-03,23:33:23
904506739663437828,Tá de sacanagem né? Xalassa e Gina de Halloween no mesmo dia? Quem organiza essas festas? Com quem eu falo?,https://twitter.com/leogreque/status/904506739663437828,2017-09-03,21:49:46
903604911933411328,Justo no dia que eu não vou a aula tem um trabalho... 🙄🙄🙄,https://twitter.com/leogreque/status/903604911933411328,2017-09-01,10:06:13
903604802382417920,Minha cama estava tão boa... Minha cama estava tão quentinha... Que eu não acordei para ir a aula... afff,https://twitter.com/leogreque/status/903604802382417920,2017-09-01,10:05:47
903460978787983361,Eu odeio cada pedacinho do ser da @emellygss,https://twitter.com/leogreque/status/903460978787983361,2017-09-01,00:34:17
903454728117477380,Arquivei por tanto tempo que nem lembrava mais... 💁🏻‍♂️,https://twitter.com/leogreque/status/903454728117477380,2017-09-01,00:09:27
903368828310171648,Sempre é tempo de mudar! ❤️❤️❤️,https://twitter.com/leogreque/status/903368828310171648,2017-08-31,18:28:07
903355922382249985,Esperei muito tempo... emoção me define...,https://twitter.com/leogreque/status/903355922382249985,2017-08-31,17:36:50
903077403479724034,Boa noite?,https://twitter.com/leogreque/status/903077403479724034,2017-08-30,23:10:06
903077132959715328,Droga!,https://twitter.com/leogreque/status/903077132959715328,2017-08-30,23:09:01
903076319516352512,O mercado fonográfico é meio injusto e tem que estar sempre se atualizando... é foda ser cantor...,https://twitter.com/leogreque/status/903076319516352512,2017-08-30,23:05:47
902727741572775937,Eu sou o tipo de pessoa que quando tem um pensamento não esquece nunca mais ou esquece amanhã...,https://twitter.com/leogreque/status/902727741572775937,2017-08-30,00:00:40
902667024203223040,"A música ""Bom de cama"" é muito engraçada, ainda não entendi direito... mas é muito engraçada!",https://twitter.com/leogreque/status/902667024203223040,2017-08-29,19:59:23
902401394275229696,"Bom de cama da Naiara Azevedo é a música mais engraçada da vida, até agora eu não entendi...",https://twitter.com/leogreque/status/902401394275229696,2017-08-29,02:23:52
901916774957973505,Os horários do laboratório estão batendo e não dá para trocar... e a comunicação com o tatuador continua péssima... 1 mensagem a cada dia...,https://twitter.com/leogreque/status/901916774957973505,2017-08-27,18:18:10
901508863509356548,A gabriela fechou o dia literalmente...,https://twitter.com/leogreque/status/901508863509356548,2017-08-26,15:17:16
901503624194424832,Esse dia maravilhoso e eu enfurnado em casa...,https://twitter.com/leogreque/status/901503624194424832,2017-08-26,14:56:27
901219675056504832,"Não tô mais fingindo nada, não gostou paciência, ou tira satisfação ou não é problema meu. Muito me anulei por pessoas que estão nem aí...",https://twitter.com/leogreque/status/901219675056504832,2017-08-25,20:08:09
901218780935835655,Egoísmo é foda viu!,https://twitter.com/leogreque/status/901218780935835655,2017-08-25,20:04:35
901218380803436544,"É feeling, algumas pessoas nunca saberão...",https://twitter.com/leogreque/status/901218380803436544,2017-08-25,20:03:00
900830882054983681,"Minha vontade é mandar todo mundo a merda, mas do que adianta? Esses cópias de porcos continuarão... não tem mais jeito...",https://twitter.com/leogreque/status/900830882054983681,2017-08-24,18:23:13
900828692594798597,"Não tá dando mais, sinto que já fui mais forte que maioria das pessoas conseguiram ser... Já tô cansado... Resistência é resiliência...",https://twitter.com/leogreque/status/900828692594798597,2017-08-24,18:14:31
900828192667258880,"Aí mano eu estou bem sem forças para resistir, vou para faculdade como meio de escapatória e a aula me destrói... chego em casa e não...",https://twitter.com/leogreque/status/900828192667258880,2017-08-24,18:12:32
900558525470040064,"Aí cansei, boa noite! 😘  pic.twitter.com/1Anc2pmmWH",https://twitter.com/leogreque/status/900558525470040064,2017-08-24,00:20:58
900558420713119744,Meu sonho de princeso 🤴🏻  pic.twitter.com/QKK1q5yXWi,https://twitter.com/leogreque/status/900558420713119744,2017-08-24,00:20:33
900558179355983872,"Estou no meu inferno astral, não duvide... imagina se desse no meu inferno astral, eu não te deixo, te passo por cima... hahaha  pic.twitter.com/0M1MZSvLSg",https://twitter.com/leogreque/status/900558179355983872,2017-08-24,00:19:36
900556410257371138,Um dia eu ainda te deixo para trás... EU TÔ FALANDO SÉRIO!,https://twitter.com/leogreque/status/900556410257371138,2017-08-24,00:12:34
900556106291970048,Tudo bom? Então vocês são amigos agora é?  Vai lá fera!  Tranquilo! Super de boas!,https://twitter.com/leogreque/status/900556106291970048,2017-08-24,00:11:21
900555093384343552,Hoje tive que ficar na furg o dia todo... 🙄,https://twitter.com/leogreque/status/900555093384343552,2017-08-24,00:07:20
900554985234194436,Amanhã tenho aula o dia todo!,https://twitter.com/leogreque/status/900554985234194436,2017-08-24,00:06:54
900554715401998337,"Eu tô pensando que eu sou louco e às vezes eu não entendo muito bem o que as pessoas falam mas continua respondendo, aí sai um papo de loko🤣",https://twitter.com/leogreque/status/900554715401998337,2017-08-24,00:05:50
900530714466242564,"Se todo mundo começar a se conhecer + vamos todos ser pessoas com menos problemas emocionais...vamos fazer um trato, geral se autoconhecendo",https://twitter.com/leogreque/status/900530714466242564,2017-08-23,22:30:28
900529758492119040,Aí que dia produtivo mas ou mesmo tempo improdutivel... vai entender,https://twitter.com/leogreque/status/900529758492119040,2017-08-23,22:26:40
900529073205784577,Que foda!,https://twitter.com/leogreque/status/900529073205784577,2017-08-23,22:23:56
900528449651175425,Planos de um trip foda!,https://twitter.com/leogreque/status/900528449651175425,2017-08-23,22:21:28
900315942600749056,"Ahh agora eu entendi a coisa de um mês antes do teu aniversário ser um período ruim, é o mês do teu inferno astral!",https://twitter.com/leogreque/status/900315942600749056,2017-08-23,08:17:02
900135317625286657,"""Crying in the club"" é meu lema de vida",https://twitter.com/leogreque/status/900135317625286657,2017-08-22,20:19:18
900028811630260226,"EU SÓ POSSO ME ENVOLVER EM UMA DISCUSSÃO POR DIA, agora repita isso mil vezes para garantir o máximo aprendizado",https://twitter.com/leogreque/status/900028811630260226,2017-08-22,13:16:05
900001477535596545,"Sério ou eu amadureci ou estou alienado... mas estou cada dia mais amando o ""encontro com Fátima""",https://twitter.com/leogreque/status/900001477535596545,2017-08-22,11:27:28
899963792200806401,"Mano dedução de fórmula é desperdício do meu tempo... Alguém já descobriu ela, não preciso saber fazer de novo, só precisa saber aplicar...",https://twitter.com/leogreque/status/899963792200806401,2017-08-22,08:57:43
899774963355451395,Já estou me arrependendo... aí medo... é semana que vem... demorou de mais... eu sou do impulso... aí não... DROGA,https://twitter.com/leogreque/status/899774963355451395,2017-08-21,20:27:22
899489309006364672,"@emellygss tá em uma vibe de valorizar o próprio ""passe"", aí ela não tá falando com os amigos, acho que ela tá esperando a gente ir atrás...",https://twitter.com/leogreque/status/899489309006364672,2017-08-21,01:32:17
899488113331929088,É de um egoísmo muito grande só julgar as pessoas... Como se as atitudes dos outros fossem erradas ou ruins...,https://twitter.com/leogreque/status/899488113331929088,2017-08-21,01:27:32
899486875873943552,Tô bem cansado de ser julgado o tempo todo...,https://twitter.com/leogreque/status/899486875873943552,2017-08-21,01:22:37
898754742431629312,Mano é tão foda quando tua amiga tá carente mas ela não consegue perceber... tipo o foda é ela não perceber...,https://twitter.com/leogreque/status/898754742431629312,2017-08-19,00:53:23
898349946067271680,E é um dia depois do meu aniversário e um dia depois da prova de cálculo,https://twitter.com/leogreque/status/898349946067271680,2017-08-17,22:04:52
898320075475701760,Na vdd o álbum Joanne tá foda!,https://twitter.com/leogreque/status/898320075475701760,2017-08-17,20:06:10
897923144421433345,"Aí hoje tive aula com uma professora bem legal, ela tentou motivar a turma mas eu estava com muito sono... Hahahah",https://twitter.com/leogreque/status/897923144421433345,2017-08-16,17:48:54
897632403405012992,"Será que eu sou a única pessoa que no Facebook, da um like e depois troca por outra reação, tipo um amei?",https://twitter.com/leogreque/status/897632403405012992,2017-08-15,22:33:36
897259433931177984,As vezes coisas ruins acontecem com pessoas boas... cry,https://twitter.com/leogreque/status/897259433931177984,2017-08-14,21:51:33
897198741379272704,"Hoje eu recebi, aí eu comecei a comprar presentes para as pessoas, aí eu lembrei que eu tenho uma conta com o mesmo preço do meu ""salário""",https://twitter.com/leogreque/status/897198741379272704,2017-08-14,17:50:23
896844233621032960,Mano olha as merda que eu faço meio bêbado,https://twitter.com/leogreque/status/896844233621032960,2017-08-13,18:21:42
896758180801388544,"É dia dos pais e eu deixo ele no lado de fora de casa, fica na rua que é o teu lugar!",https://twitter.com/leogreque/status/896758180801388544,2017-08-13,12:39:45
896753501153505309,A gente imagina uma coisa e é outra completamente diferente... mas o importante é sempre estar aceitando... bjs e boa noite,https://twitter.com/leogreque/status/896753501153505309,2017-08-13,12:21:10
896130324739932160,"Sério eu estou sem paciência para gente chata, ninguém se importa com o que a pessoa fala e ela continua falando, até quando?",https://twitter.com/leogreque/status/896130324739932160,2017-08-11,19:04:53
895112491935690752,Eu tô muito triste com essa história de todos meus amigos mandar eu tirar Simone e Simaria dos shows que temos que ir...só porque já fui...,https://twitter.com/leogreque/status/895112491935690752,2017-08-08,23:40:23
894655904334966784,"Sim, mas tem do contrário também, tipo no início achar a pessoa feia e depois ela se mostrar bonita... acho que vai além da coisa física msm",https://twitter.com/leogreque/status/894655904334966784,2017-08-07,17:26:04
894647807612780548,Tava olhando aqui e como eu achava uma pessoa bonita as 5 meses atrás e hoje já não acho mais?!,https://twitter.com/leogreque/status/894647807612780548,2017-08-07,16:53:53
894340059394179072,"Aí a pessoa atraente mostra que é uma cuzona, aí ela se arrepende e pede desculpas, aí eles vivem felizes para sempre",https://twitter.com/leogreque/status/894340059394179072,2017-08-06,20:31:00
894339416390500352,Romances LGBTQ são tão clichês... um pessoa atraente que se interessa em outra pessoa não atraente...,https://twitter.com/leogreque/status/894339416390500352,2017-08-06,20:28:27
894335161252360192,"Eu odeio ter intolerância a lactose, mas eu odeio tanta coisa...",https://twitter.com/leogreque/status/894335161252360192,2017-08-06,20:11:33
893657643792949251,As pessoas estão fazendo fila para abastecer... socorro,https://twitter.com/leogreque/status/893657643792949251,2017-08-04,23:19:20
893628856044847105,"Meu quarto está uma bagunça, eu vou arrumar...",https://twitter.com/leogreque/status/893628856044847105,2017-08-04,21:24:56
892969455768281088,Eu tava louco para usar essa música...,https://twitter.com/leogreque/status/892969455768281088,2017-08-03,01:44:43
892964049973063682,Cê foi o homem da minha vida no passado Hoje não passa de um contato bloqueado,https://twitter.com/leogreque/status/892964049973063682,2017-08-03,01:23:14
892876683656785920,Será que as pessoas é que estão desinteressantes?,https://twitter.com/leogreque/status/892876683656785920,2017-08-02,19:36:04
