id,tweet,link,date,time
1143453792282845184,"É foda ter amigdalite sensível, esse tempo tá uma loucura... faz frio e calor tudo no mesmo dia, passei um pouquinho de frio e agora já estou com placa na garganta!",https://twitter.com/leogreque/status/1143453792282845184,2019-06-25,06:40:03
1143451366867767296,"Eu sou ela todinho, a pessoa que se atrapalha toda  https://twitter.com/gaypixar/status/1143209821665189894 …",https://twitter.com/leogreque/status/1143451366867767296,2019-06-25,06:30:24
1143324785713340416,Eu não sei o que leva uma pessoa a seguir defendendo quem sempre teve o apoio incondicional da sociedade... é uma falta de consciência...,https://twitter.com/leogreque/status/1143324785713340416,2019-06-24,22:07:25
1143318873275555840,"Bah eu não sei como pode, as pessoas viver numa realidade aleatória, sério mano eu tenho até vergonha... mas como diria Raquel, é muito de mim sobre a vida dos outros... mas bah",https://twitter.com/leogreque/status/1143318873275555840,2019-06-24,21:43:55
1143198665160441856,Acho que o expoente de aperfeiçoamento da tua vida fui eu... 💁🏻‍♂️,https://twitter.com/leogreque/status/1143198665160441856,2019-06-24,13:46:16
1142804981503971329,"É... Mas ela tem licença poética para falar isso, pq ela é muito foda, o dia que eu for metade do profissional que ela é eu to satisfeito... mas vou seguindo com uma mão na consciência e com a outra na bunda",https://twitter.com/leogreque/status/1142804981503971329,2019-06-23,11:41:54
1142439842141356032,"Vai te fude! Fui ver o significado do meu sonho e era algo muito positivo, aí fui ver mais específico, e é perigo eminente... meu amor eu rio na cara do perigo. Mas a sacanagem é que alegria de pobre dura pouco",https://twitter.com/leogreque/status/1142439842141356032,2019-06-22,11:30:58
1142082428313509888,"As gay tão se juntando para fazer a ditadura gay, confio em vocês pra um futuro melhor!  O cão tá muito articulado!  https://twitter.com/nunesluiz16/status/1141540257990696960 …",https://twitter.com/leogreque/status/1142082428313509888,2019-06-21,11:50:44
1141752464053608450,Que dia lindo pqp!,https://twitter.com/leogreque/status/1141752464053608450,2019-06-20,13:59:34
1141446845023100929,"Mano, eu mal conheço mas já sou apaixonado pela Carolina, mulher foda!",https://twitter.com/leogreque/status/1141446845023100929,2019-06-19,17:45:09
1140816550922002433,Pq 00:00 da noite me deu um pico de energia,https://twitter.com/leogreque/status/1140816550922002433,2019-06-18,00:00:35
1140800092036878336,Da pra pular pro momento pós defesa de doutorado?,https://twitter.com/leogreque/status/1140800092036878336,2019-06-17,22:55:11
1140794388542578688,Gratidão eterna pelas pessoas que estão na minha vida...,https://twitter.com/leogreque/status/1140794388542578688,2019-06-17,22:32:31
1140677194034946048,Privilégio mesmo é ter a @AmaliaFranco17 na minha vida!,https://twitter.com/leogreque/status/1140677194034946048,2019-06-17,14:46:50
1140450667905069056,"Dedo podre é o crlh, não tenho culpa que as pessoas são cagadas!",https://twitter.com/leogreque/status/1140450667905069056,2019-06-16,23:46:42
1139008224466808833,É pra comemorar que eu não por onde se usa essa droga... hahahah,https://twitter.com/leogreque/status/1139008224466808833,2019-06-13,00:14:57
1138874051680788480,A foto da Dandara salvou meu dia!,https://twitter.com/leogreque/status/1138874051680788480,2019-06-12,15:21:47
1138546955758575616,"Meu Deus eu to todo estranho, a tv tava ligada, aí do nada eu paro para olhar e tem um senhor na novela dando 4 maçãs como presente para duas pessoas em uma embalagem bem humildade, depois disso eu não consigo parar de chorar... Oh céus",https://twitter.com/leogreque/status/1138546955758575616,2019-06-11,17:42:02
1138481115537248256,Sonho seria a Gloria Groove,https://twitter.com/leogreque/status/1138481115537248256,2019-06-11,13:20:24
1138285254056316929,"12 horas de furg não é pra qualquer um, passo mais tempo na furg que em casa...",https://twitter.com/leogreque/status/1138285254056316929,2019-06-11,00:22:07
1138265036206616576,"Passei o dia com a Raquel hoje, o dia todo!",https://twitter.com/leogreque/status/1138265036206616576,2019-06-10,23:01:47
1137717913698340864,"Esse é meu último fim de semana com vida social, já to até me passando, mas é isso...",https://twitter.com/leogreque/status/1137717913698340864,2019-06-09,10:47:43
1137505333788717057,"Pelo amor de Deus, nunca, nunca fale com a vitória por meio de mensagens essa guria só se retarda... orra que inferno, não escreve uma palavra corretamente...",https://twitter.com/leogreque/status/1137505333788717057,2019-06-08,20:43:00
1137490738000924672,O único problema da casa da vó é sinal ruim e falta de internet... Vamos ter que fazer uma vaquinha pra por um Wi-Fi aqui,https://twitter.com/leogreque/status/1137490738000924672,2019-06-08,19:45:00
1136853689090551808,"Ah pronto, era só o que me faltava ter vontade de chorar pq alguém foi grosso...  EU ERA A PESSOA QUE ERA GROSSA SEM MOTIVO APARENTE...",https://twitter.com/leogreque/status/1136853689090551808,2019-06-07,01:33:35
1136853070183186432,Pqp eu não me reconheço mais Desde quando eu me tornei uma pessoa sensível?,https://twitter.com/leogreque/status/1136853070183186432,2019-06-07,01:31:08
1136826829111775232,"Odeio decepcionar as pessoas... mas não posso mais sacrificar minha saúde mental, demorei para chegar onde cheguei...",https://twitter.com/leogreque/status/1136826829111775232,2019-06-06,23:46:51
1136478359590973441,"Meu Deus eu tenho horror a Joice Halssemann, pessoa assustadora!",https://twitter.com/leogreque/status/1136478359590973441,2019-06-06,00:42:10
1135520397611491328,"Tava tomando café e começou uma matéria sobre feminicídio com vídeos de agressões troquei de canal pq não consigo assistir sem me revirar o estômago, no outro canal começou um cara super machista a falar da mina do Neymar... Deus, que sociedade machista de merda",https://twitter.com/leogreque/status/1135520397611491328,2019-06-03,09:15:34
1135368542382186498,"Ontem foi uma vibe incrível, com as pessoas que eu mais amooo",https://twitter.com/leogreque/status/1135368542382186498,2019-06-02,23:12:09
1134158798032179206,"Bah mano, são uns empata foda...",https://twitter.com/leogreque/status/1134158798032179206,2019-05-30,15:05:03
1133943625329664000,"Quando eu falo que a pessoa não cresceu/amadureceu estou coberto de razão... A pessoa faz exatamente as mesmas piadas que eu quando estava no ensino médio, exatamente a mesma!",https://twitter.com/leogreque/status/1133943625329664000,2019-05-30,00:50:02
1133747803337953280,"Outra coisa que me irrita, pq a graduação tu pode até fazer forçado pq tu queres ter uma formação, só que se tu vai entrar em algum grupo ou atividade extra graduação que faça com vontade ou nem faça... sempre as mesmas pessoas fazendo as mesmas coisas...",https://twitter.com/leogreque/status/1133747803337953280,2019-05-29,11:51:54
1133746198790266882,"Não entendi, amo meu curso tenho maior orgulho de estar cursando Geografia, mas eu sei, baseado nas minhas experiências com outros cursos da Furg, que Geografia é muito desvalorizado dentro da Furg. Nos dão os espaços e se nós não ocuparmos vão vir outras pessoas para ocupar!",https://twitter.com/leogreque/status/1133746198790266882,2019-05-29,11:45:32
1133550302395867137,"O pessoal se esforçando pra fazer um evento legal e as pessoas não fazem o mínimo que é ir no evento... Na moral, VERGONHA DOS MEUS COLEGAS!",https://twitter.com/leogreque/status/1133550302395867137,2019-05-28,22:47:07
1133547646176645120,"Gente acomodada é foda... Lá na geografia ñ temos eventos, pq o pessoal não se interessa, não comparece e não questiona se não tem... Cara eu tenho é uma tristeza, uma desvalorização do curso em todas as esferas: População, alunos, docentes e pela Furg.. VERGONHA DOS MEUS COLEGAS",https://twitter.com/leogreque/status/1133547646176645120,2019-05-28,22:36:33
1133196570437070848,Aí eu já me senti um mero espectador da minha própria vida... era depressão!,https://twitter.com/leogreque/status/1133196570437070848,2019-05-27,23:21:30
1132732555592122368,Vou lá na vó e depois vou estudar faz tempo que não vejo a véia,https://twitter.com/leogreque/status/1132732555592122368,2019-05-26,16:37:41
1132732021686640648,"Feitiço não mora mais no meu quarto, passei a tutela dele para a casa. Quem não ficou feliz foi a baunilha que era a felina única da casa",https://twitter.com/leogreque/status/1132732021686640648,2019-05-26,16:35:33
1132723470180261888,"Terça começo minha vida saudável mais uma vez, acho que é a terceira vez esse ano",https://twitter.com/leogreque/status/1132723470180261888,2019-05-26,16:01:34
1132644657278717952,Já percebi que meu quarto vai ser bem frio... no inverno,https://twitter.com/leogreque/status/1132644657278717952,2019-05-26,10:48:24
1131743826492702720,"Não estar em um dia bom é super compreensível, mas vamos ter noção e não ficar nos expondo a situações de mais estresse e até mesmo de lidar com pessoas, pq são PESSOAS e o mínimo de respeito e compreensão precisa prevalecer",https://twitter.com/leogreque/status/1131743826492702720,2019-05-23,23:08:49
1131743823611224065,Hoje pela primeira vez na vida fiquei tão desconfortável em um ambiente que tive vontade de sair daquela sala e nunca mais voltar,https://twitter.com/leogreque/status/1131743823611224065,2019-05-23,23:08:48
1131252731610447873,"Queria tuitar um monte de coisas, mas só tenho tempo para tuitar “oi”   Então   Oi",https://twitter.com/leogreque/status/1131252731610447873,2019-05-22,14:37:23
1130110427126476800,A gente precisa entender as limitações da nossa cidadoca e do tipo de pessoa que é natural daqui...,https://twitter.com/leogreque/status/1130110427126476800,2019-05-19,10:58:16
1129781194323910656,"Não sei o que aconteceu no meu quarto que em uma semana, desde que eu limpei, parecia que tinha passado um tornado sem exageros... dei uma limonada rápida e já tá bem melhor!",https://twitter.com/leogreque/status/1129781194323910656,2019-05-18,13:10:01
1129722615944437760,Minha psicóloga falou umas coisas que eu comecei a perceber em mim e to tentando parar de fazer... Estou me sentindo a melhor pessoa do mundo!,https://twitter.com/leogreque/status/1129722615944437760,2019-05-18,09:17:15
1129204224674418688,"2014 Acho que Adm ou ⚖️ 2015 Engenharia civil, MEU SONHO TOP 2016 Entrei em engenharia de alimentos (uhuuuul) 2017 Engenharia de alimentos, será? Mas e geografia? 2018 Meu sonho sempre foi geografia  2019 Entrei em Geografia Licenciatura e vou mudar o mundo através da educação 💙  https://twitter.com/anagimenescomg/status/1127491393683959808 …",https://twitter.com/leogreque/status/1129204224674418688,2019-05-16,22:57:21
1128058079361286146,"Nem acredito que em plena segunda, num dia extremamente chuvoso de RG, as 18:30 eu estou deitadinho na minha cama, numa completa escuridão e paz, com a minha bolinha de pelo preta e bagunceira (vulgo gato, vulgo feitiço)... atualizações de gratidão foram atualizadas!",https://twitter.com/leogreque/status/1128058079361286146,2019-05-13,19:02:59
1128057318963318785,"Acho que sou uma planta, não posso ficar muito tempo sem ver o sol que fico todo triste e doente",https://twitter.com/leogreque/status/1128057318963318785,2019-05-13,18:59:57
1127768922592305152,"Estou enchendo os meus amigos com vídeos do meu gato é isto, virei o velho dos gatos... triste constatação",https://twitter.com/leogreque/status/1127768922592305152,2019-05-12,23:53:58
1127328295320682500,Amo um serzinho pro resto da minha vida! ❤️ (Mesmo ela diariamente tentando me aliciar sexualmente)  https://twitter.com/_vigoncalvess/status/1127308632020926465 …,https://twitter.com/leogreque/status/1127328295320682500,2019-05-11,18:43:05
1125230318632480768,O foda de ir em uma eletrônica boa é que tu já fica pensando quando vai ser a próxima,https://twitter.com/leogreque/status/1125230318632480768,2019-05-05,23:46:28
1125192690851897345,"Eu tava tão louco que fiz um stories com a Ester e a Lari, mas marquei a Ester e vi... aham",https://twitter.com/leogreque/status/1125192690851897345,2019-05-05,21:16:57
1125170262369087488,Nem acredito que limpei meu quarto,https://twitter.com/leogreque/status/1125170262369087488,2019-05-05,19:47:49
1124992357844307968,"Que inferno, meu frites não passa 🙄👁",https://twitter.com/leogreque/status/1124992357844307968,2019-05-05,08:00:54
1124709691823669248,Escrevi 5 folhas para responder as perguntas da prova tudo a lápis e não deu tempo de passar a caneta... professora disse que não iria corrigir com a mesma boa vontade 🙄😭,https://twitter.com/leogreque/status/1124709691823669248,2019-05-04,13:17:41
1124461788794359808,General Elaine é foda,https://twitter.com/leogreque/status/1124461788794359808,2019-05-03,20:52:36
1124315750997606401,"Meu Deus, como pode? As pessoas estão cegas para o que está acontecendo no Brasil?",https://twitter.com/leogreque/status/1124315750997606401,2019-05-03,11:12:18
1123415769562472448,O apelido é Merda,https://twitter.com/leogreque/status/1123415769562472448,2019-04-30,23:36:06
1123217176473870338,"Que absurdo esse ministro da educação, que desrespeito, que raiva que eu sinto... o ministro da educação uma pessoa autoritária, mano se fuder!",https://twitter.com/leogreque/status/1123217176473870338,2019-04-30,10:26:57
1123210320170950661,E minha irmã se enchendo de arrogância dizendo que 14:00 não é hora de ir no cinema... Oh idade de merda!,https://twitter.com/leogreque/status/1123210320170950661,2019-04-30,09:59:43
1122905423001026562,"Odeio essa disciplina, odeio essa professora... Muito sem propósito",https://twitter.com/leogreque/status/1122905423001026562,2019-04-29,13:48:10
1122679896415850496,"Gente a palavra do dia era “negligência”, mas acabei de mudar para “iridescência”. B noite",https://twitter.com/leogreque/status/1122679896415850496,2019-04-28,22:52:00
1122225331606364160,"Nossa indignação como militância é que ele está fazendo um desserviço negando a existência e a necessidade de gays afeminados, de lésbicas masculinas, dos transexuais e travestis, afirmando que essas pessoas são assim só para lacrar, que suas expressões são anseios por likes",https://twitter.com/leogreque/status/1122225331606364160,2019-04-27,16:45:43
1122225329937027072,"Mas a questão é: Ele não é obrigado a ser um representante nessa causa. Obviamente que ele teria um grande alcance e seria um grande aliado nessa luta, mas ele já tem a opinião dele formada, que é a mesma opinião de uma pessoa que só apoia o movimento e não sofre do preconceito+",https://twitter.com/leogreque/status/1122225329937027072,2019-04-27,16:45:43
1122225326795390981,"+ Direito e legitimidade que ele não reconhece ter vindo da militância LGBTQ, e que o gay afeminado, a lésbica masculina, os transexuais e travestis que ele crítica, são a linha de frente na luta pelo respeito e igualdade, são essas mesmas pessoas que morrem todos os dias+",https://twitter.com/leogreque/status/1122225326795390981,2019-04-27,16:45:42
1122225324513726464,"Gente, Carlinhos Maia traz representatividade pro Nordeste e para pessoas que vieram da pobreza e conquistaram poder aquisitivo. O espaço que ele tem hoje não veio através do apoio LGBTQ , não! O que a militância LGBTQ trouxe para ele foi o direito e legitimidade de ser gay+",https://twitter.com/leogreque/status/1122225324513726464,2019-04-27,16:45:41
1120861256280416257,"Lemonade é um daqueles álbuns que da vontade de entrar em um relacionamento de merda, que teu namorado te trai só para poder sofrer a dor da traição com propriedade",https://twitter.com/leogreque/status/1120861256280416257,2019-04-23,22:25:22
1120840889813827584,"Desculpa, mas eu não estou disponível para transar contigo 24 horas por dia, 7 dias por semana... aff 😤",https://twitter.com/leogreque/status/1120840889813827584,2019-04-23,21:04:27
1120840272978554880,Hoje é dia de #tbt então lá vai: “Parei uma velha caquética e pedi uma informação inútil” — @goncalvessmari_,https://twitter.com/leogreque/status/1120840272978554880,2019-04-23,21:01:59
1120721645881188353,"Que inferno esse corretor, tá foda*",https://twitter.com/leogreque/status/1120721645881188353,2019-04-23,13:10:37
1120638496115429376,Acordei às 7:00 horas da manhã sem conseguir falar e nem deglutir água... to mal 🤒,https://twitter.com/leogreque/status/1120638496115429376,2019-04-23,07:40:12
1120092891735523329,"Estou cansado, com torcicolo e meu quarto está uma bagunça  Preciso que alguém grite comigo, alguém?",https://twitter.com/leogreque/status/1120092891735523329,2019-04-21,19:32:10
1119443915038449664,Acho que dia 11 vou pra move...,https://twitter.com/leogreque/status/1119443915038449664,2019-04-20,00:33:22
1119443618656325635,"Amigo, como a última prova é dia 5 se 5 é domingo?",https://twitter.com/leogreque/status/1119443618656325635,2019-04-20,00:32:11
1119441056129527808,Procrastinação: resumo do meu dia!,https://twitter.com/leogreque/status/1119441056129527808,2019-04-20,00:22:00
1119440894682390528,"Isso foi um pedido de socorro para todos os meus amigos, mas ninguém se prontificou, estou bem chateado admito",https://twitter.com/leogreque/status/1119440894682390528,2019-04-20,00:21:22
1119360101108809728,Na vdd oh foco de merda!,https://twitter.com/leogreque/status/1119360101108809728,2019-04-19,19:00:19
1119360048633925633,"Me sentei pra estudar mas não saio do tt, o vida de merda",https://twitter.com/leogreque/status/1119360048633925633,2019-04-19,19:00:06
1118733805370707968,Se joga nessa brisa até o dia amanhecer,https://twitter.com/leogreque/status/1118733805370707968,2019-04-18,01:31:38
1118732365872934914,Hoje meu dia foi baseado em peidar e sair,https://twitter.com/leogreque/status/1118732365872934914,2019-04-18,01:25:55
1118731586000826368,"A vitória é melhor pessoa e eu não tenho dúvidas:  — Passei por tal pessoa, olhei e não cumprimentei.   — E a pessoa?  — Não me viu.  🤭😑",https://twitter.com/leogreque/status/1118731586000826368,2019-04-18,01:22:49
1117780886295056384,"Cria uma treta e deixa eles discutindo, nesse momento tu sai sem ninguém perceber...",https://twitter.com/leogreque/status/1117780886295056384,2019-04-15,10:25:05
1117629416442671105,Meu gato poderia ter os meus horários  de sono que os meus... 00:00 eu me preparando para dormir e ele com energia total...,https://twitter.com/leogreque/status/1117629416442671105,2019-04-15,00:23:12
1117450909401767937,"Aparentemente foi uma merda, mas blz",https://twitter.com/leogreque/status/1117450909401767937,2019-04-14,12:33:52
1117450780129337344,Que inferno essa guria!!!! Vontade de matar essa merda !,https://twitter.com/leogreque/status/1117450780129337344,2019-04-14,12:33:21
1116558012355715072,"Para de pensar nisso menina, pensa em tudo de certo que tu fez, olha o quanto evoluiu na tua vida! Tudo é aprendizado, tu só está melhorando!",https://twitter.com/leogreque/status/1116558012355715072,2019-04-12,01:25:49
1116548892475084800,Falta de tempo é teu gato estar fedendo e tu não ter tempo de dar um banho nele,https://twitter.com/leogreque/status/1116548892475084800,2019-04-12,00:49:35
1116547315261513729,Da para eu ir dormir as 0:40 durante 2 horas e acordar as 00:00 de hoje mesmo?   Isso mesmo estou querendo dormir e voltar no tempo,https://twitter.com/leogreque/status/1116547315261513729,2019-04-12,00:43:19
1116473620358991873,Parece que meu professor morreu e estamos na missa de sétimo dia... Oh aulinha chata,https://twitter.com/leogreque/status/1116473620358991873,2019-04-11,19:50:28
1116298174203879424,Só os que irresponsavelmente vão dar um role e esquecem que tinham compromisso de manhã...,https://twitter.com/leogreque/status/1116298174203879424,2019-04-11,08:13:19
1115092902483566593,O pior de tudo é que essa merda de celular só cabe fone com entrada lightning,https://twitter.com/leogreque/status/1115092902483566593,2019-04-08,00:24:00
1114560182393233411,Eu eu bebado só faço/falo merda,https://twitter.com/leogreque/status/1114560182393233411,2019-04-06,13:07:09
1114016939163123712,Cara eu sou a pessoa mais sem noção da vida... fico incomodado com coisas super desnecessárias,https://twitter.com/leogreque/status/1114016939163123712,2019-04-05,01:08:30
1113280505498218496,Amo uma pessoa  https://twitter.com/_vigoncalvess/status/1113105810161364992 …,https://twitter.com/leogreque/status/1113280505498218496,2019-04-03,00:22:10
1113117951199207425,"As vezes as pessoas fingem que você é uma pessoa ruim, pra que elas não precisem sentir culpa pelo oque fizeram contigo... pelotão!",https://twitter.com/leogreque/status/1113117951199207425,2019-04-02,13:36:14
1112926366666764288,Quem faz mais merda?,https://twitter.com/leogreque/status/1112926366666764288,2019-04-02,00:54:57
1112920496016953344,"Mano eu bebado e eu com sono, quem faz merda?",https://twitter.com/leogreque/status/1112920496016953344,2019-04-02,00:31:37
1112041630863892481,O que aconteceu no meu quarto que estava extremamente limpo na quinta-feira e agora tá extremamente podre? (Com ênfase no meu banheiro),https://twitter.com/leogreque/status/1112041630863892481,2019-03-30,14:19:20
1111460199909474304,Bom mesmo é levar a vida da maneira mais leve possível... só plantando o bem e só colhendo o bem...  https://twitter.com/Larrine09/status/1110374783794012160 …,https://twitter.com/leogreque/status/1111460199909474304,2019-03-28,23:48:56
1110965517634936833,"Manooo meu gato dorme umas 20 horas por dia... as outras 4 ele divide entre dormir, faz suas necessidades venéreas e me pentelhar...  Fora que durante as 20 horas de sono dele eu tenho que ficar atento em não esmagar ele... pq ele se camufla no meu cobertor e é muito pequeno...  pic.twitter.com/BpeOkgnPEY",https://twitter.com/leogreque/status/1110965517634936833,2019-03-27,15:03:14
1110657448807989254,"Hoje eu to só a ansiedade...  Descobri uma puta merda que eu fiz, já resolvi... Agora só falta a ansiedade entender...",https://twitter.com/leogreque/status/1110657448807989254,2019-03-26,18:39:05
1110376892547379201,"Bah rasguei toda minha calça, que inferno!",https://twitter.com/leogreque/status/1110376892547379201,2019-03-26,00:04:15
1109665830873251841,"E eu que tenho dois colegas que se chamam Lenon e Layon, e toda vez que eles interagem eu fico chocado pela coincidência dos nomes, e que eles ainda são amigos...",https://twitter.com/leogreque/status/1109665830873251841,2019-03-24,00:58:45
1109560982894985218,"Como pode uma pessoa que tu vivia sempre junto do nada se afastar e não te procura mais...  Terminar um relacionamento romântico até dói, mas “terminar” uma amizade... isso sim é dor, dói e não cura...  Vai doer pra sempre...",https://twitter.com/leogreque/status/1109560982894985218,2019-03-23,18:02:07
1108565515155529728,"“Cama grande é bom pra...”   CALADO, Cama grande é boa pra não dormir sozinho...",https://twitter.com/leogreque/status/1108565515155529728,2019-03-21,00:06:29
1108207873983741952,A gente aprende a priorizar as pessoas de acordo com a prioridade que as pessoas nos dá...,https://twitter.com/leogreque/status/1108207873983741952,2019-03-20,00:25:21
1108152125891203073,To em tantos grupos no WhatsApp que quase tá dando merda...,https://twitter.com/leogreque/status/1108152125891203073,2019-03-19,20:43:49
1107972463546249216,"Bah vitória, era meu sonho...  pic.twitter.com/H47tKKXn0k",https://twitter.com/leogreque/status/1107972463546249216,2019-03-19,08:49:55
1106618929093459968,Aí droga,https://twitter.com/leogreque/status/1106618929093459968,2019-03-15,15:11:27
1106383395691655168,"Mano do céu, a aula hoje estava muito boa... astronomia é muito foda... no final da quarta aula eu já não estava conseguindo absorver nada.. nada",https://twitter.com/leogreque/status/1106383395691655168,2019-03-14,23:35:31
1106382997362827265,"Não, é sério eu tem laudo da minha bipolaridade... Então eu tava bem, aí por uma micro coisa fiquei puto e com muita raiva, a maior parte das vezes eu não percebo quando isso acontece, mas hoje eu percebi e achei muito engraçado e voltei a ficar bem... minha vida é esse looping..",https://twitter.com/leogreque/status/1106382997362827265,2019-03-14,23:33:56
1106293584028930048,"Eu estava começando a desacreditar da humanidade como um todo, mas parece que é só em Rio Grande que 95% das pessoas fazem da falsidade uma ideologia... Quanto mais falso e infantil melhor...",https://twitter.com/leogreque/status/1106293584028930048,2019-03-14,17:38:39
1106291750262460416,Espero que esse cara que tava filmando tenha espancado esse merda!!!!!!,https://twitter.com/leogreque/status/1106291750262460416,2019-03-14,17:31:21
1105344456222359552,"Hoje eu estava analisando minha professora e ela  tem uma baita didática. Aquela mulher é a personificação do professor perfeito... E EU ACHO A AULA DELA UMA CHATICE, o que me deixou um pouco preocupado pq eu estou estudando para ser professor, medo de ser um merda sem didática..",https://twitter.com/leogreque/status/1105344456222359552,2019-03-12,02:47:09
1105342923116228608,"Eu ando tão aquém de mim mesmo, e tá tudo bem... Eu aprendi a me amar independente das minhas autoexpectativas, curtindo cada momento meu, coisinhas que são só minhas... Sempre tive uma relação bem sincera comigo mesmo...",https://twitter.com/leogreque/status/1105342923116228608,2019-03-12,02:41:03
