id,tweet,link,date,time
1103874093651189760,"não é só uma rosa e um chocolate,  apoia a luta das minas  sinta orgulho delas q conseguem se firmar nessa sociedade porca  e faça sua parte tb crlh  feliz dia das mina",https://twitter.com/lukraq/status/1103874093651189760,2019-03-08,01:24:27
1103871003459907585,homens de micro penis unidos desejamos feliz dia das mulheres  para todas   todas lindas sem exceções,https://twitter.com/lukraq/status/1103871003459907585,2019-03-08,01:12:10
1103863139697799168,feliz dia das mina,https://twitter.com/lukraq/status/1103863139697799168,2019-03-08,00:40:55
1102771510610194432,vo faze o q se aquele sorriso mexe comigo caralho,https://twitter.com/lukraq/status/1102771510610194432,2019-03-05,00:23:11
1102693984189714432,quem rir da minha bandana eu vou chorar ta? se nn gostar respeitar,https://twitter.com/lukraq/status/1102693984189714432,2019-03-04,19:15:07
1099491715155664896,quero ver você não chorar 😭😭😭😭😭😭,https://twitter.com/lukraq/status/1099491715155664896,2019-02-23,23:10:27
1099486402285322240,"TODO MUNDO TEM ALGUÉM COM O NOME ""GORDAO"" NO WPP",https://twitter.com/lukraq/status/1099486402285322240,2019-02-23,22:49:20
1099158680757567489,"além de estar comemorando a conquista do felzin, poder falar com geral de boa foi um bglh mt bom pra mim, deixar o q aconteceu pra trás",https://twitter.com/lukraq/status/1099158680757567489,2019-02-23,01:07:05
1099005376694022144,mano eu tenho um serio problema de decorar senha do banco mano se eu perder os dedo não consigo sacar mais dinheiro,https://twitter.com/lukraq/status/1099005376694022144,2019-02-22,14:57:54
1098571480852545537,carnavalzinho amor?,https://twitter.com/lukraq/status/1098571480852545537,2019-02-21,10:13:46
1098243469087309825,amanhã começa minhas aulas,https://twitter.com/lukraq/status/1098243469087309825,2019-02-20,12:30:22
1097970833656561664,foda eu nao consigo tankar aquele sorriso,https://twitter.com/lukraq/status/1097970833656561664,2019-02-19,18:27:00
1097630484803276801,eu ia comprar uns livro da cultura racional pra eu conhecer mais a parada do tim e pq ele ficou vidradao naquilo mas são 21 livros então nem ferrando,https://twitter.com/lukraq/status/1097630484803276801,2019-02-18,19:54:35
1097583431788179456,"td bem tu curtir um tipo de mina, errado é tu desprezar as outras por não te agradar irmao",https://twitter.com/lukraq/status/1097583431788179456,2019-02-18,16:47:36
1097581210749100032,deixe todo seu ódio pra trás,https://twitter.com/lukraq/status/1097581210749100032,2019-02-18,16:38:47
1097303828507037696,to mó feliz pq paguei 10 conto numa camiseta mano,https://twitter.com/lukraq/status/1097303828507037696,2019-02-17,22:16:34
1097301357214744576,prefiro ser enaltecido por ser feio do q ser o cara engraçado audjakdnwkfnnandjwzmakxnanxn,https://twitter.com/lukraq/status/1097301357214744576,2019-02-17,22:06:45
1092221054775373829,PELO O AMOR DE DEUS NÃO TO CONSEGUINDO VER PELO O WATCH E POR INCREÇA QUE PARÍVEL NÃO É MINHA INTERNET ARRUMA AE,https://twitter.com/lukraq/status/1092221054775373829,2019-02-03,22:39:26
1092190003323682816,É SUPERBOWL CARALHO VAI SE FUDER TA CHEGANDO A HORA,https://twitter.com/lukraq/status/1092190003323682816,2019-02-03,20:36:03
1091377709933051904,alguém faz um template disso pelo amor,https://twitter.com/lukraq/status/1091377709933051904,2019-02-01,14:48:17
1091377200207679489,bot sempre falando a verdade,https://twitter.com/lukraq/status/1091377200207679489,2019-02-01,14:46:15
1091109072458395648,O MAIOR HOMEM DO MUNDO,https://twitter.com/lukraq/status/1091109072458395648,2019-01-31,21:00:49
1088608745016434688,"e quem é contra indústria pornô mas fuma um baseado deveria tomar chute no saco e dedada no cu pra largar mão de ser troxa, alô esquerda cirandeira",https://twitter.com/lukraq/status/1088608745016434688,2019-01-24,23:25:24
1085348503482699776,bbb começou e eu vo falar ss se não gosto mama eu,https://twitter.com/lukraq/status/1085348503482699776,2019-01-15,23:30:22
1083639919841632256,de long neck de long neck uma hora a gente esquece,https://twitter.com/lukraq/status/1083639919841632256,2019-01-11,06:21:04
1083477582195163138,"asmr só me deixa de pau duro, nunca me fez dormir essa merda",https://twitter.com/lukraq/status/1083477582195163138,2019-01-10,19:36:00
1082700811392692225,to só esperando as parada sair pra comprar porra,https://twitter.com/lukraq/status/1082700811392692225,2019-01-08,16:09:23
1082293895634001921,"Ser agilizado e questiono o cara pq isso não acontece e ele mete um ""Ah isso ai é problema na hora do pagamento"" PORRA EU SEI QUE É PROBLEMA DE PAGAMENTO SE FUDER EU JA FAÇO ISSO A 7 MESES TODOS OS DIAS CARAI AJEITA SAPORRA DE SISTEMA AI PRA AGILIZAR AQUI",https://twitter.com/lukraq/status/1082293895634001921,2019-01-07,13:12:27
1081745142401372160,"mas tem, não adianta falar q os caras nunca fizeram nada pela cena",https://twitter.com/lukraq/status/1081745142401372160,2019-01-06,00:51:54
1081703236615180288,mano eu tinha um chinelo escrito HAVANA no lugar de HAVAIANAS e os cara insiste em falar que eu não sou esquerda,https://twitter.com/lukraq/status/1081703236615180288,2019-01-05,22:05:23
1079108507096485889,"Firmeza total, mais um ano se passando. Graças a Deus a gente ta com saúde, morô? Muita coletividade na quebrada, dinheiro no bolso, sem miséria e é nóis. Vamo brindar o dia de hoje que amanhã só pertence a Deus.  A vida é loka",https://twitter.com/lukraq/status/1079108507096485889,2018-12-29,18:14:51
1077405366500159488,Feliz N  pic.twitter.com/Haud0TsmU7,https://twitter.com/lukraq/status/1077405366500159488,2018-12-25,01:27:11
1075214930171883523,Aliás mandem coisas na thread aqui,https://twitter.com/lukraq/status/1075214930171883523,2018-12-19,00:23:10
1075214927349080064,"Gente na moral, to precisando muito de textos, indicações de teóricos(as), vídeos (pode em inglês), livros que tratam sobre feminismo, lugar de fala e consciência de classe para juntar conteúdo pra um debate que vou ter. Aceitando todo tipo de material, link ou o caralho que for.",https://twitter.com/lukraq/status/1075214927349080064,2018-12-19,00:23:09
1074458485725761536,"eu sei q fiz várias merda, mas é pq roubou meu coração e não devolveu mais  ai tu me fode",https://twitter.com/lukraq/status/1074458485725761536,2018-12-16,22:17:20
1074458013136769025,"mano foi tanta coisa acontecendo esse ano, vários perrengue, várias treta, várias coisas boas, q ver meus mano hj encerrou meu 2018 com chave de ouro slc",https://twitter.com/lukraq/status/1074458013136769025,2018-12-16,22:15:27
1073316763629223936,Mas quem sou eu pra falar de vocês???,https://twitter.com/lukraq/status/1073316763629223936,2018-12-13,18:40:32
1073312515579437056,Ódio errado? Irmão tu é mais politizado e inteligente que eu e mandou que é errado ter ódio de playboy? Porra..,https://twitter.com/lukraq/status/1073312515579437056,2018-12-13,18:23:39
1069068694767194113,ta de juliet romeu 2 e Double Shock 18 k no pescoço  de ecko e nike Shox,https://twitter.com/lukraq/status/1069068694767194113,2018-12-02,01:20:13
1067526449446481920,"Com a vida eu descobri que só gosto de duas coisas brancas: but e da uma de testa, resto é lixo",https://twitter.com/lukraq/status/1067526449446481920,2018-11-27,19:11:53
1067179479901110274,Sucesso pra todos e pau no cu de quem vem crescer o olho,https://twitter.com/lukraq/status/1067179479901110274,2018-11-26,20:13:09
1067118479164227585,Como alguém pode odiar couve? Couve é amor jn,https://twitter.com/lukraq/status/1067118479164227585,2018-11-26,16:10:46
1066969412828307456,"Ver o Brown sorrindo cantando um som é um dos bglh mais gratificante que existe Só quem é cria sabe do q eu to falando, de você fazer um corre todos os dias, matar um leão sempre esperando chegar a hora que você vai poder fazer o que gosta sem ngm te julgar  pic.twitter.com/cud01ZM2C1",https://twitter.com/lukraq/status/1066969412828307456,2018-11-26,06:18:26
1066966692612456449,Pros meus mano que tão correndo pela Fuvest foi mal não ter postado nada ontem mas to aqui na torcida por vcs  Ceis vão ganhar o mundo ainda truta,https://twitter.com/lukraq/status/1066966692612456449,2018-11-26,06:07:37
1065046709045207040,Rindo pra não chorar pqp vcs são uns lixo,https://twitter.com/lukraq/status/1065046709045207040,2018-11-20,22:58:17
1064296279407304704,"Dinheiro é puta e abre as porta, não existe mais verdade que isso",https://twitter.com/lukraq/status/1064296279407304704,2018-11-18,21:16:21
1038434349753004032,"Ninguém merece morrer pq pensa diferente... Nem a Marielle Nem o Bolsonaro  Além de democracia, é amor ao próximo",https://twitter.com/lukraq/status/1038434349753004032,2018-09-08,11:30:16
1026581066130305024,"Lula pelo o amor de Deus se tu vai se candidatar vai até o fim caralho não fica me iludindo pra no final o Haddad ser o candidato, pq ja pensou se ganha? Esquerda burguesa num da mais não",https://twitter.com/lukraq/status/1026581066130305024,2018-08-06,18:29:33
1023965322490126337,Doente e triste  E trabalhando,https://twitter.com/lukraq/status/1023965322490126337,2018-07-30,13:15:31
1021186692189966336,Não sei pq voltei a usar esta rede social que só desgraça minha cabeça,https://twitter.com/lukraq/status/1021186692189966336,2018-07-22,21:14:14
1016856546167443456,"Se não fosse Deus, poderia ter toda tecnologia do mundo e não teria os resgatado!!!! Deus é maravilhoso",https://twitter.com/lukraq/status/1016856546167443456,2018-07-10,22:27:47
1016117648646725633,Malandragem de verdade é viver,https://twitter.com/lukraq/status/1016117648646725633,2018-07-08,21:31:40
1015425634666008576,Mano faz uns 12/13 anos que eu ouvi Racionais pela primeira vez e eu consegui nesse último mês redescobrir os caras de um jeito nos trampo antigo que só fizeram aumentar o amor e admiração dessas obras,https://twitter.com/lukraq/status/1015425634666008576,2018-07-06,23:41:51
1015424308393512960,"""Há! demorou, mas hoje eu posso compreender Que malandragem de verdade é viver""",https://twitter.com/lukraq/status/1015424308393512960,2018-07-06,23:36:35
1015330479237664768,Bom graças a Deus é sexta feira e amanhã durmo até tarde,https://twitter.com/lukraq/status/1015330479237664768,2018-07-06,17:23:44
1015325815603716096,Neymar jogou nada pelo o amor,https://twitter.com/lukraq/status/1015325815603716096,2018-07-06,17:05:12
1015325511667671041,@gabrieljesus33 e @neymarjr  Se aposentem da seleção pelo o amor,https://twitter.com/lukraq/status/1015325511667671041,2018-07-06,17:04:00
1014991499468201984,Nessa tuiti coloque o  verso de rap que tu acha mais pancada de todos  PELO O AMOR DE DEUS SÓ QUEM CURTE MEMO,https://twitter.com/lukraq/status/1014991499468201984,2018-07-05,18:56:45
1013869465786880001,DE BRAÇO LEVANTADO PRA MANDAR FORÇA PRO JAPÃO,https://twitter.com/lukraq/status/1013869465786880001,2018-07-02,16:38:12
1013865314399014913,HOJE É DIA DE SER OTAKU SEM MEDO DE SER FELIZ,https://twitter.com/lukraq/status/1013865314399014913,2018-07-02,16:21:42
1012277689405902848,Alguém mata a Linha 12 pelo o amor de Deus,https://twitter.com/lukraq/status/1012277689405902848,2018-06-28,07:13:03
1012140448561946624,Falava quando era criança  Uma mistura de ódio frustração e dor  De como era humilhante ir pra escola Usando a roupa dada de esmola 💔,https://twitter.com/lukraq/status/1012140448561946624,2018-06-27,22:07:42
1012139864354148353,"""Lembro que um dia o Guina me falou Que não sabia bem o que era amor""",https://twitter.com/lukraq/status/1012139864354148353,2018-06-27,22:05:22
1012059186950262784,ALGUÉM QUEBRA O NEYMAR PELO O AMOR DE DEUS 😵😵😵😵😵😵😵,https://twitter.com/lukraq/status/1012059186950262784,2018-06-27,16:44:47
1012045298250780677,TIRA O WILLIAM PELO O AMOR DO CU TITI,https://twitter.com/lukraq/status/1012045298250780677,2018-06-27,15:49:36
1010272453514448898,Fagner jogou muito acima do previsto  Pelo o amor né,https://twitter.com/lukraq/status/1010272453514448898,2018-06-22,18:24:57
1010179883341963264,Sonho com isso acordado,https://twitter.com/lukraq/status/1010179883341963264,2018-06-22,12:17:07
1010143893327876097,TIRA O WILLIAM CARALHO VAI TOMAR NO CU TITE SEU FILHO DA PUTA TIRA O NEYMAR TAMBÉM  TIRA O G. JESUS TIRA TODO MUNDO E BOTA O CORINTHIANS PRA JOGAR,https://twitter.com/lukraq/status/1010143893327876097,2018-06-22,09:54:06
1009888209646563328,Agora vo raspar meu saco que amanhã vo transa  E pau no cu da Argentina,https://twitter.com/lukraq/status/1009888209646563328,2018-06-21,16:58:06
1009824514463666176,Porra de sorrir pra criança  Tu tem que meter dois soco na cara  https://twitter.com/blackkwidowx/status/1009578131106168832 …,https://twitter.com/lukraq/status/1009824514463666176,2018-06-21,12:45:00
1009544797089095680,"Se acontece algo com alguém fora do grupo deles meu Deus cagam pra caralho pra isso, mas se é do grupinho puts, vira herói na mesma da hora",https://twitter.com/lukraq/status/1009544797089095680,2018-06-20,18:13:30
1008739805935669248,"O bom das mina querendo dar pra Coreano que agr posso querer comer toda as japinha gostosa sem parecer um tarado, só eu falar que so J-Pop",https://twitter.com/lukraq/status/1008739805935669248,2018-06-18,12:54:45
1008406274604716032,VAI COMEÇAR PORRA  pic.twitter.com/vbIEqluCGM,https://twitter.com/lukraq/status/1008406274604716032,2018-06-17,14:49:25
1008397159224487936,ATÉ O GALVÃO FALOU DOS TROXA QUE FALA DO PÃO E CIRCO TOMAR NO CU DE PAU DURO DMS,https://twitter.com/lukraq/status/1008397159224487936,2018-06-17,14:13:12
1008392818497335296,"BOA TARDE ""FAMÍLIA CANARINHO"" ESTÃO PREPARADOS PRA COMER CU DE SUÍÇO HOJE? EU SIM VAMO SELEÇÃO CARALHO  ""Família Canarinho"" e seu vídeo clipe são direitos de @felipeneto",https://twitter.com/lukraq/status/1008392818497335296,2018-06-17,13:55:57
1007962637018255360,Esperando o episódio do Simpsons na copa do mundo Rússia 2018,https://twitter.com/lukraq/status/1007962637018255360,2018-06-16,09:26:34
1007940476186525698,PORRA LEO NUM PERDEU NADA  ESSE JOGO TA TÃO FRACO Q EU TO QUASE CORTANDO MEU PINTO FORA DE RAIVA POR TER ACORDADO CEDO,https://twitter.com/lukraq/status/1007940476186525698,2018-06-16,07:58:30
1007703633251721216,AGORA SIM PODE-SE DIZER QUE COMEÇOU A COPA DO MUNDO,https://twitter.com/lukraq/status/1007703633251721216,2018-06-15,16:17:23
1007588594196865024,como assim você nao levantou ainda?  LEVANTA LOGO CARALHO JAJA VAI COMEÇAR URUGUAI E EGITO HOJE É DIA DE COPA DO MUNDO RÚSSIA 2018 MENINO SUAREZ CONTRA SALAH SÓ JOGÃO NESSA BUCETA TO MUITO EXCITADO PRA ESSA COPA,https://twitter.com/lukraq/status/1007588594196865024,2018-06-15,08:40:15
1007482594701737985,TEM TBM PORTUGAL E ESPANHA VÁLIDO PELA COPA DO MUNDO 2018 RÚSSIA,https://twitter.com/lukraq/status/1007482594701737985,2018-06-15,01:39:03
1007090166450851840,Acho que chegou na hora de quebrar uns busão e receber no aeroporto pra dar uma motivada no #Corinthians,https://twitter.com/lukraq/status/1007090166450851840,2018-06-13,23:39:41
1006952982905278467,Eu sei que perdi a contagem   MAS É AMANHÃ CARALHO AMANHÃ COMEÇA ESSA PORRA DE COPA DO MUNDO TA SENTINDO ESSE CHEIRINHO DE HEXA HEIN SEU CARALHUDO? SE TU NÃO GOSTA DE COPA VAI TOMAR NO SEU CU PORRA PQ É TDO NOSSO VAI COPA CARALHO COPA É FODA É AMANHÃ RÚSSIA X ARÁBIA SAUDITA 12hrs,https://twitter.com/lukraq/status/1006952982905278467,2018-06-13,14:34:34
1006009031373283328,Bethesda derrubou bundas essa é a verdade  Melhor #e3 #BE3,https://twitter.com/lukraq/status/1006009031373283328,2018-06-11,00:03:38
1006004720945844232,#BE3 VAI TOMAR NO SEU CU E TRAZ UM TES DE VERDADE @bethesda,https://twitter.com/lukraq/status/1006004720945844232,2018-06-10,23:46:30
1005828595070259200,HOJE TEM SELEÇÃO BRASILEIRA E E3   SE EU GANHASSE UM BOQUETE SERIA O DIA MAIS FELIZ DA MINHA VIDA,https://twitter.com/lukraq/status/1005828595070259200,2018-06-10,12:06:39
1005827926481391616,Chegou na hora de queimar uns carros ne pra ver se arruma alguma coisa,https://twitter.com/lukraq/status/1005827926481391616,2018-06-10,12:03:59
1004867844960587776,Sai fora com essas marcas de playboy tipo Palace  Fernvndx Clothing Squad Squad,https://twitter.com/lukraq/status/1004867844960587776,2018-06-07,20:28:58
1002039973749641216,"------AVISO------ Por motivos de feriado de Corpus Tristes, não tera contagem para Copa do Mundo Rússia 2018 entre os dias 31/05 e 01/06, voltamos com a programação normal no dia 02/06. Que todos entendam. Grato, a produção",https://twitter.com/lukraq/status/1002039973749641216,2018-05-31,01:12:01
1001948582457626624,Chegou a hora do #EdieZap todos em silêncio que eu quero ver,https://twitter.com/lukraq/status/1001948582457626624,2018-05-30,19:08:52
999787596363399169,"KKKKKKKKKKKK não me trata assim, eu posso ser o amor da sua vida  Mentira sempre me importei cntg",https://twitter.com/lukraq/status/999787596363399169,2018-05-24,20:01:52
999689868103045121,"Acho mil grau tbm aumentar o valor do nada, mas esse tipo de atitude só ferra quem precisa das cargas",https://twitter.com/lukraq/status/999689868103045121,2018-05-24,13:33:32
999689420092690432,Outra que eles tão poco se fodendo pra gente aqui que vai começar se foder  Pensando só na porra do valor do diesel,https://twitter.com/lukraq/status/999689420092690432,2018-05-24,13:31:45
999282510491201536,Amo ver quem criticava o pai aqui quando comecei a fumar tudo com os cigarro na mão,https://twitter.com/lukraq/status/999282510491201536,2018-05-23,10:34:50
998678882231508998,Todo tipo de animal *GRELHADO* é válido,https://twitter.com/lukraq/status/998678882231508998,2018-05-21,18:36:14
998665260373610496,Toda vez que eu vejo que saiu mais um rap triste de gente que terminou o relacionamento eu sinto que o sabota chora no céu,https://twitter.com/lukraq/status/998665260373610496,2018-05-21,17:42:07
997659657496866816,NO PARQUE DE DIVERSÕES FOI QUE ELA VIROU MULHER DAS FORTE,https://twitter.com/lukraq/status/997659657496866816,2018-05-18,23:06:12
997658982046142465,ME FALA A VERDADE QUANTOS ANOS VOCÊ TEM,https://twitter.com/lukraq/status/997658982046142465,2018-05-18,23:03:31
997658490159104000,MAS SE EU VER NA RUA ELA DE MÃO DADA NÃO VOU NEGAR MORRO DE CIÚME,https://twitter.com/lukraq/status/997658490159104000,2018-05-18,23:01:34
997305610768146434,Amanhã o vídeo da narração do @meninomilgrau vai ser de mais de meia hora  7x2 Corinthians #nadamuda,https://twitter.com/lukraq/status/997305610768146434,2018-05-17,23:39:21
996502264754909184,Bicho não tem alma e nem sentimento vsf,https://twitter.com/lukraq/status/996502264754909184,2018-05-15,18:27:08
994501549492723712,@taviao é mt amor logo ele te responde tbm fel,https://twitter.com/lukraq/status/994501549492723712,2018-05-10,05:57:01
992560213344604177,Problemas no mundo encantado,https://twitter.com/lukraq/status/992560213344604177,2018-05-04,21:22:50
990406026452176897,vou comecar escrever mt erradi pao no seu cu,https://twitter.com/lukraq/status/990406026452176897,2018-04-28,22:42:52
989598167191736322,Puta narcisismo do caralho Só falar que errou que nem o Matheus Hwang  Geral vai cagar pra ela dps,https://twitter.com/lukraq/status/989598167191736322,2018-04-26,17:12:43
988911346887680001,E dps elas querem falar de feminismo,https://twitter.com/lukraq/status/988911346887680001,2018-04-24,19:43:32
987479376148221952,A que termina com final feliz doc,https://twitter.com/lukraq/status/987479376148221952,2018-04-20,20:53:24
987150965844463616,viegas do começo ao fim to esperando o thiago falar que os três q ficaram são merda e que vão dividir o premio com quem saiu,https://twitter.com/lukraq/status/987150965844463616,2018-04-19,23:08:25
986559635212718081,BOOOOOOM DIAAAAA MINHA VIDAAAAA 😍😍😍😍❤❤❤❤💞💞💞💞 VOCÊ NÃO É BBB MAS QUERO ME KAYSAR COM VOCÊ 😘😘😘😘😘💜💜💜💜💜💜💜💜💘💘💘💘💘💘💘💘💟💟💟💟💟💟💟💏💏💏💏💏💏  Compartilhe com o amor da sua vida,https://twitter.com/lukraq/status/986559635212718081,2018-04-18,07:58:41
986559208752545792,Falar no diminutivo é bom sim caralhinho,https://twitter.com/lukraq/status/986559208752545792,2018-04-18,07:56:59
986554532107898880,Cara é isso que eu amo pqp Não tem como meu dia começar ruim,https://twitter.com/lukraq/status/986554532107898880,2018-04-18,07:38:24
986449794292944897,TENHO SIM SEU BABACA Resolver a pendência de vc me fazer feliz com seus tuiti dando bom dia e motivando  EAE VO TE ARREBENTAR NO ABRAÇO,https://twitter.com/lukraq/status/986449794292944897,2018-04-18,00:42:12
986399016526245889,fansuber é a melhor coisa que esse mundo já teve,https://twitter.com/lukraq/status/986399016526245889,2018-04-17,21:20:26
986339461385596928,"Cara eu fiz uma promessa de ficar um ano sem chocolate e pizza, a vida nunca foi tão triste",https://twitter.com/lukraq/status/986339461385596928,2018-04-17,17:23:47
986315455349616640,mas o diu não fode tudo tb?? tipo mais cólica e ciclo tudo errado?,https://twitter.com/lukraq/status/986315455349616640,2018-04-17,15:48:24
985337882054447107,KKKKKKKKKKKKKKKKK  EU IMOBILIZEI MEU DEDO COM POMADA E PAPEL HIGIÊNICO,https://twitter.com/lukraq/status/985337882054447107,2018-04-14,23:03:52
984441102789959680,Triste ver que a esquerda ta tão ruim assim de candidato esse ano pra presida,https://twitter.com/lukraq/status/984441102789959680,2018-04-12,11:40:23
983860800908681216,Eu to com minha Lua em BOLA TRISTE e minha Vênus em BOA MILHAÇA,https://twitter.com/lukraq/status/983860800908681216,2018-04-10,21:14:28
983859032913006592,Qual é o tipo de mulher ideal pra vocês machos machistas?,https://twitter.com/lukraq/status/983859032913006592,2018-04-10,21:07:27
982059164850630656,Lula preso amanhã,https://twitter.com/lukraq/status/982059164850630656,2018-04-05,21:55:25
981556073307009026,"União soviética nunca foi forte em porra nenhuma, eles só usavam a tática de ter uma caralho de pessoas pra limpar as merdas que os outros faziam e por ter um frio do caralho que ngm aguenta essa é a real",https://twitter.com/lukraq/status/981556073307009026,2018-04-04,12:36:18
981253717973331968,Nunca foi amor foi só uma ficadinha,https://twitter.com/lukraq/status/981253717973331968,2018-04-03,16:34:51
981040303623766017,"Engraçado como algumas pessoas gostam de diminuir alguém que reclama que não vai bem na faculdade ou ta se emprego como se a pessoa que reclama tenha passado por alguma dificuldade na vida, já que o maior desafio que ela enfrentou foi escolher a cor do iphone",https://twitter.com/lukraq/status/981040303623766017,2018-04-03,02:26:49
981039429333798912,Foda-se suas teta Se não ve a novela nem ouse falar comigo,https://twitter.com/lukraq/status/981039429333798912,2018-04-03,02:23:21
981039094271827968,Meninas horrorosas e horripilantes tipo o Gengar me add,https://twitter.com/lukraq/status/981039094271827968,2018-04-03,02:22:01
981038526899900418,Meninas tetudas e vacas tipo o Miltank me add,https://twitter.com/lukraq/status/981038526899900418,2018-04-03,02:19:46
981038217666465792,Meninas gordas mas podedoras tipo o Snorlax me add,https://twitter.com/lukraq/status/981038217666465792,2018-04-03,02:18:32
981038088888684544,Meninas feias mas inteligentes tipo o Slowpoke me add,https://twitter.com/lukraq/status/981038088888684544,2018-04-03,02:18:01
980464299339632640,Não sei como o bluezao não deu a bunda ainda pra esse cachorro,https://twitter.com/lukraq/status/980464299339632640,2018-04-01,12:17:59
978387571993653249,Vamo ouvir lo fi hip hop e ser feliz caralho,https://twitter.com/lukraq/status/978387571993653249,2018-03-26,18:45:49
972035352293789696,O engraçado do twitter que eu tenho ele desde 2008/2009 por ai E até hoje não aprendi a mexer,https://twitter.com/lukraq/status/972035352293789696,2018-03-09,06:04:22
971595514205691910,Cuidado que lá vem o senhor zoeiro,https://twitter.com/lukraq/status/971595514205691910,2018-03-08,00:56:36
968355993645207558,"Doc bó dormir, só os fracassados dormem tarde",https://twitter.com/lukraq/status/968355993645207558,2018-02-27,02:23:54
968266718433988608,Froid e Djonga salvaram o som do abacaxi mas é mt triste ver os cara colando com esses lixo,https://twitter.com/lukraq/status/968266718433988608,2018-02-26,20:29:09
968266547641937920,"""Todo mundo odeia acústico"" é a prova que acústico de rap é lixo sim",https://twitter.com/lukraq/status/968266547641937920,2018-02-26,20:28:29
964205049671966720,Vdd uma coisa é ser um panaca e brincar de roleta russa   Outra coisa é ficar desgraçado da cabeça enquanto vc joga Pokémon na hr do intervalo e aparece um White trash com um ar15 e mata geral que tu conhece,https://twitter.com/lukraq/status/964205049671966720,2018-02-15,16:29:32
964203309304250368,Lembrando que o modo easy da roleta russa é tipo morrer,https://twitter.com/lukraq/status/964203309304250368,2018-02-15,16:22:37
963909257228967936,Pra acreditar que evitando ser feliz tu vai pro céu,https://twitter.com/lukraq/status/963909257228967936,2018-02-14,20:54:10
963578219629809664,Fez um caralho de molho por 4 horas mas não coloca um queijinho pra ficar show  Doc essa pizza ta mt triste,https://twitter.com/lukraq/status/963578219629809664,2018-02-13,22:58:44
963547747772256256,Chega de meninas do tipo Matilda  Da nojo já  pic.twitter.com/JRUdm7Q45A,https://twitter.com/lukraq/status/963547747772256256,2018-02-13,20:57:39
