id,tweet,link,date,time
879876138167939072,"Os outros faz filho e vem pedir pra eu ficar de olho. Meu querido em 18 anos eu ainda ñ aprendi a me cuidar, se acha q eu vou cuidar do seu",https://twitter.com/lukraq/status/879876138167939072,2017-06-27,22:36:33
879824305684705280,Existe coisa mais triste que o Marcos Mion velho?,https://twitter.com/lukraq/status/879824305684705280,2017-06-27,19:10:35
879821957293846528,"Se eu pudesse deixar um recado para as futuras gerações seria: ""Não ame, faça amor""",https://twitter.com/lukraq/status/879821957293846528,2017-06-27,19:01:15
879492424766296064,Qual foi o elo perdido que fez o mrpoladoful mudar de um youtuber engraçado de games pra um completo retardado?,https://twitter.com/lukraq/status/879492424766296064,2017-06-26,21:11:48
879489927729336324,Eu me amarrei no seu coração eu me amarrei,https://twitter.com/lukraq/status/879489927729336324,2017-06-26,21:01:53
876969996110495745,"Mano, tem gente que passa muito tempo sem se falar, mas mesmo assim quando volta parece que a amizade não mudou nada",https://twitter.com/lukraq/status/876969996110495745,2017-06-19,22:08:35
871942972778180608,"""SERÁ QUE SOU TÃO FEIO ASSIM?"" PIOR CHAVECO DO MUNDO MEU DEUS DO CÉU",https://twitter.com/lukraq/status/871942972778180608,2017-06-06,01:12:59
871224252762075136,"Vai começar assim ""Primeiramente obrigado por ter colocado a @ na minha vida, segundamente vsf por ter colocado a @ na minha vida""",https://twitter.com/lukraq/status/871224252762075136,2017-06-04,01:37:03
870789940237541376,"Vocês ficam ai reclamando pq brigou com o crush, mas vocês já correram atrás do ônibus e não conseguiu pegar ele? Isso que é triste",https://twitter.com/lukraq/status/870789940237541376,2017-06-02,20:51:14
870789126022475777,"Sexta sozinho, triste, vendo muita série e chorando muito rs",https://twitter.com/lukraq/status/870789126022475777,2017-06-02,20:48:00
866422031348363264,Única pessoa feliz por amanhã ser segunda,https://twitter.com/lukraq/status/866422031348363264,2017-05-21,19:34:44
866322344264048640,Arrombada vem me chamar de boliviano A única pessoa que pode continuar me chamando assim e continuar sendo meu amor é a @_maaruiz,https://twitter.com/lukraq/status/866322344264048640,2017-05-21,12:58:37
863897907359043585,Kkkk amanhã pegar o numero das cat @kahtioro,https://twitter.com/lukraq/status/863897907359043585,2017-05-14,20:24:46
860710497842278401,"Kkkk lembro uma vez q eu e o Nóbrega pegamos tipo umas buzinas e fomos na casa da Thissiane ficar incomodando a família dela, sou muito lixo",https://twitter.com/lukraq/status/860710497842278401,2017-05-06,01:19:08
860706792296394752,Kkkkkkkkk to triste,https://twitter.com/lukraq/status/860706792296394752,2017-05-06,01:04:25
860487709281964034,Café é a coisa mais gostosa do mundo,https://twitter.com/lukraq/status/860487709281964034,2017-05-05,10:33:51
859943126844268545,Odeio essa gente que quer levantar a autoestima de todo mundo,https://twitter.com/lukraq/status/859943126844268545,2017-05-03,22:29:53
859891353781710849,Whats para e ai junta a renca no telegram que é o melhor app de mensagem do mundo,https://twitter.com/lukraq/status/859891353781710849,2017-05-03,19:04:09
859582841860104192,Agora fiquem caladinhos que vai começar o #MasterChefBR @masterchefbr,https://twitter.com/lukraq/status/859582841860104192,2017-05-02,22:38:14
859542010386108416,Coma sua mãe  Mate merda,https://twitter.com/lukraq/status/859542010386108416,2017-05-02,19:55:59
859331173339803648,E aquele sertanejo que faz vc lembrar daquela pessoa,https://twitter.com/lukraq/status/859331173339803648,2017-05-02,05:58:11
859330499789172736,Choram as rosas  Tananana estar aqui Sem seu perfume tananana eu te perdi Nananana coisas Choro por tiiiiii,https://twitter.com/lukraq/status/859330499789172736,2017-05-02,05:55:31
859327458641932288,#confissõesdamadrugada confesso que acho a apresentadora do Hora Um da Globo um pitelzinho,https://twitter.com/lukraq/status/859327458641932288,2017-05-02,05:43:26
859322131460612096,Só que assim né nóis luta pra fazer as pessoa feliz e elas pisa em nóis Porra para de ser cuzao,https://twitter.com/lukraq/status/859322131460612096,2017-05-02,05:22:16
859320750767042560,"Gente vcs lembram quando eu peguei aquela mina, naquele rolê kkkj ? Q q essas pessoa tem na cabeça né",https://twitter.com/lukraq/status/859320750767042560,2017-05-02,05:16:47
857821597431934976,Gaita de fole Instrumento mais bosta do mundo,https://twitter.com/lukraq/status/857821597431934976,2017-04-28,01:59:41
857028497100992518,Desculpa agora de verdade mas eu odeio vocês,https://twitter.com/lukraq/status/857028497100992518,2017-04-25,21:28:11
856178504194547712,BAJANABAJSNAJSJANSNHSJAHABABAHAHABBABANANAMA Ok Eu odeio mt a minha antiga escola Mas tem coisas q eu amo dms lá OBRIGADO DEOS,https://twitter.com/lukraq/status/856178504194547712,2017-04-23,13:10:37
851266343835885573,AH MANO A EMILLY É MUITO CHATA MAS KD O AMOR PRÓPRIO???? #BBB,https://twitter.com/lukraq/status/851266343835885573,2017-04-09,23:51:26
851252357199540225,boabro to super feliz <3,https://twitter.com/lukraq/status/851252357199540225,2017-04-09,22:55:52
850565219462021120,Até o povo q estudou cmg vida toda ficou sla estranho,https://twitter.com/lukraq/status/850565219462021120,2017-04-08,01:25:25
850564881241825282,AMANHÃ NÃO VOU PRO CURSO VO VIRA NO PALADINS,https://twitter.com/lukraq/status/850564881241825282,2017-04-08,01:24:05
850182365213315072,Trump seu cuzao vamo ter q viver no mundo de Fallout,https://twitter.com/lukraq/status/850182365213315072,2017-04-07,00:04:06
833578797114990592,De pau duro e chorando muito,https://twitter.com/lukraq/status/833578797114990592,2017-02-20,04:27:27
833578504994295809,"Puta merda isso é muito viadagem falar ""baguncinha""",https://twitter.com/lukraq/status/833578504994295809,2017-02-20,04:26:17
798779488314081284,PELO O AMOR DE DEUS ESSE FILME DA GLOBO TA MUITO FEELS O SHIPPER NÃO PODE MORRER,https://twitter.com/lukraq/status/798779488314081284,2016-11-16,04:47:25
779078814316060672,OBRIGADO TEMER AGR NÃO PRECISO ASSISTIR AS MERDAS DAS AULAS DE ARTES MAS PAU NO SEU CU POR ADICIONAR MAIS UMA HORA DE AULA,https://twitter.com/lukraq/status/779078814316060672,2016-09-22,19:03:58
778458801150111744,Lula preso amanhã  https://twitter.com/BreHenrique_/status/778456910030708736 …,https://twitter.com/lukraq/status/778458801150111744,2016-09-21,02:00:15
759908484498403329,AH NÃO ESCOLA AMANHÃ NÃO,https://twitter.com/lukraq/status/759908484498403329,2016-07-31,21:27:55
754231070808244224,To triste,https://twitter.com/lukraq/status/754231070808244224,2016-07-16,05:27:54
752250855743688705,E o cartão amarelo pro Eder na mão na bola né Juizão,https://twitter.com/lukraq/status/752250855743688705,2016-07-10,18:19:14
751826668726124545,@tvrecord para de cortar os eps do Chris pelo o amor do seu Deus #ChrisNaRecord,https://twitter.com/lukraq/status/751826668726124545,2016-07-09,14:13:40
751643159885676544,PORRA PEPER NÃO ME FAZ CHORAR KRL,https://twitter.com/lukraq/status/751643159885676544,2016-07-09,02:04:28
751314291010174976,NA HORA QUE EU VOU DORMIR UM FILHO DUMA PUTA TOMA UM TIRO E FICA GRITANDO NA RUA E NÃO ME DEIXA DORMIR (ESSE É O PAÍS DAS OLIMPÍADAS????),https://twitter.com/lukraq/status/751314291010174976,2016-07-08,04:17:40
751278854384160768,To parecendo uma pica com a cabeça raspada,https://twitter.com/lukraq/status/751278854384160768,2016-07-08,01:56:51
750599616773718016,Doc fala a real você não dorme né ? Nem galo acorda essa hora,https://twitter.com/lukraq/status/750599616773718016,2016-07-06,04:57:48
750183990431285252,Dormi e sonhei que voltava pra escola e todo mundo tava lá Que morte horrível...,https://twitter.com/lukraq/status/750183990431285252,2016-07-05,01:26:15
749859226554621952,ALGUÉM ME ENSINA A DORMIR PELO O AMOR DE DEUS,https://twitter.com/lukraq/status/749859226554621952,2016-07-04,03:55:45
749858735288360962,"doc vai dormir essa hora é só os desesperados acordados, isso não faz bem não",https://twitter.com/lukraq/status/749858735288360962,2016-07-04,03:53:48
748753900023345153,Sabia q ia acontecer,https://twitter.com/lukraq/status/748753900023345153,2016-07-01,02:43:35
746706657544179712,Acordado mas só em teorioa,https://twitter.com/lukraq/status/746706657544179712,2016-06-25,11:08:34
746706519778033668,50% acordado  50% dormindo,https://twitter.com/lukraq/status/746706519778033668,2016-06-25,11:08:02
746347526761123840,Eta mundo bosta,https://twitter.com/lukraq/status/746347526761123840,2016-06-24,11:21:31
746346895996489728,PRA QUE MATAR A POUSSEY E DEIXAR TODO MUNDO TRISTE ? #AskOrange,https://twitter.com/lukraq/status/746346895996489728,2016-06-24,11:19:01
745791408301301760,"""Mulheres com coração"" -pesquisar",https://twitter.com/lukraq/status/745791408301301760,2016-06-22,22:31:42
745791173093101570,Meu TT é um reduto de gifs non sense e merdas da minha cabeça,https://twitter.com/lukraq/status/745791173093101570,2016-06-22,22:30:46
745414280892260353,Como me sinto quando a live do @Velberan começa na hora  pic.twitter.com/l0SSbx8BNx,https://twitter.com/lukraq/status/745414280892260353,2016-06-21,21:33:08
745412745105973248,É tanto 5 no meu boletim KKKKKKKKK o mundo é dos Humildes,https://twitter.com/lukraq/status/745412745105973248,2016-06-21,21:27:02
743993055720669185,Ai eu abro snap de uma mina gata e os serumaninhos do lado logo ficam de olho q feio,https://twitter.com/lukraq/status/743993055720669185,2016-06-17,23:25:41
743623968444289024,@NetflixBrasil meu amor solta a s4 meia noite pfvvvvvv minha linda & Season 4 de AHS confirmada pra Julho???,https://twitter.com/lukraq/status/743623968444289024,2016-06-16,22:59:04
743622419164831744,Netflizinha vai atualizar esse amor,https://twitter.com/lukraq/status/743622419164831744,2016-06-16,22:52:55
742970545784901632,VAI LOCUTOR DIZ QUE EU ESTOU COMPLETAMENTE LOUCO APAIXONADO DE AMOR,https://twitter.com/lukraq/status/742970545784901632,2016-06-15,03:42:36
742530681897684992,@Xb0XM1lGr4u cheguei agr perdi alguma coisa? Ou só mais promessa pra criança chorar e filminho q eles chamam de jogo?,https://twitter.com/lukraq/status/742530681897684992,2016-06-13,22:34:44
742214553967185920,AI AI A BETHESDA É TIPO MÃE NÃO TEM COMO NÃO AMAR,https://twitter.com/lukraq/status/742214553967185920,2016-06-13,01:38:34
742017182759063552,"Telltale para de ""novelar"" as coisas puta coisa chata",https://twitter.com/lukraq/status/742017182759063552,2016-06-12,12:34:17
742008340121849856,É hoje que começa a copa do mundo ?,https://twitter.com/lukraq/status/742008340121849856,2016-06-12,11:59:08
741648206304563201,vo falar nada viu,https://twitter.com/lukraq/status/741648206304563201,2016-06-11,12:08:06
740722624012124160,"Chegar na mina que tu ta afim, ir até o ouvidinho dela e falar IAE AQUI É O ZANGADO",https://twitter.com/lukraq/status/740722624012124160,2016-06-08,22:50:10
739195049557250053,"Vo falar catiorineos sim e se reclamar vou falar gatineos, cobrineas, passarineos, ratineos, morceguineos....",https://twitter.com/lukraq/status/739195049557250053,2016-06-04,17:40:08
738967022541897728,Olho puxadinho puta charme,https://twitter.com/lukraq/status/738967022541897728,2016-06-04,02:34:02
738966778018160641,Deus viu todas as vezes que você roubou meus morangos no colheita feliz viu,https://twitter.com/lukraq/status/738966778018160641,2016-06-04,02:33:03
738965800153980928,Krl eu dormi mais de 5 hrs de tarde e já to cm sono,https://twitter.com/lukraq/status/738965800153980928,2016-06-04,02:29:10
738959227499229185,Violet tão amor ❤,https://twitter.com/lukraq/status/738959227499229185,2016-06-04,02:03:03
738724184273092609,QUERO VOLTAR PARA 2004 PELO O AMOR DE DEOS,https://twitter.com/lukraq/status/738724184273092609,2016-06-03,10:29:05
738547683972026368,Mas tipo sas coisa do kokoro a gnt não escolhe,https://twitter.com/lukraq/status/738547683972026368,2016-06-02,22:47:44
738267706525356033,Como eu me sinto qndo ela da um sorriso bobo pra minhas bobeiras  pic.twitter.com/gXnhOCAM7k,https://twitter.com/lukraq/status/738267706525356033,2016-06-02,04:15:12
738267006542217216,Meu padim ciço some da minha cabeça,https://twitter.com/lukraq/status/738267006542217216,2016-06-02,04:12:25
738132611235614722,Tão natural quanto minha mão na sua cara,https://twitter.com/lukraq/status/738132611235614722,2016-06-01,19:18:23
737900648138723330,Trick Your GF é uma das coisas mais bizarras que o ser humano já inventou,https://twitter.com/lukraq/status/737900648138723330,2016-06-01,03:56:38
737895984500510724,So emo memo iae vai encarar e fazer eu chorar????,https://twitter.com/lukraq/status/737895984500510724,2016-06-01,03:38:06
737895286668943361,"E ai vocês ficam retuitano coisas insignificantes como ""frases Onze:20""",https://twitter.com/lukraq/status/737895286668943361,2016-06-01,03:35:20
737895106896859136,Tipo aqui vocês podem falar oq quiser,https://twitter.com/lukraq/status/737895106896859136,2016-06-01,03:34:37
737891207884509184,KRL PROVA DE HIST AMANHÃ FODEU BAHIA  pic.twitter.com/C8Ov9ZctSl,https://twitter.com/lukraq/status/737891207884509184,2016-06-01,03:19:07
737889278429171712,Tipo Mano toda a sorte do mundo,https://twitter.com/lukraq/status/737889278429171712,2016-06-01,03:11:27
737889228303011846,"Mas é meio mancada toda vez q ela posta uma foto com algum mlk, os meus amigos venham falar disso pra mim",https://twitter.com/lukraq/status/737889228303011846,2016-06-01,03:11:16
737889066700660737,Tipo nada contra ex namorada,https://twitter.com/lukraq/status/737889066700660737,2016-06-01,03:10:37
737863013936566272,Amanhã prova de história Que morte horrível,https://twitter.com/lukraq/status/737863013936566272,2016-06-01,01:27:06
737417547499331588,Tem algum perfil aqui que tem tweets sobre romantismo???? É que eu tenho prova amanhã,https://twitter.com/lukraq/status/737417547499331588,2016-05-30,19:56:58
736795390205407232,"Mano o rezendeevil é o Jofrey do GoT da vida real, um mlk rico, retardado e sem um adulto pra dizer a hora de parar",https://twitter.com/lukraq/status/736795390205407232,2016-05-29,02:44:44
736794916110618624,"Ei garota, você deixou cair aqui... Meu coração❤",https://twitter.com/lukraq/status/736794916110618624,2016-05-29,02:42:51
736790886563086336,Quando eu morar sozinho vou usar apenas coisas descartáveis pra não precisar lavar louça,https://twitter.com/lukraq/status/736790886563086336,2016-05-29,02:26:50
736754502347464705,"Tbm quero ser cumprimentado na rua tipo assim ""Na paz de Darwin irmão""",https://twitter.com/lukraq/status/736754502347464705,2016-05-29,00:02:16
736754269047672832,"Aparece no final do ano, da uns presente loko tipo fazer cego enxergar, da comida e cachaça pros parça",https://twitter.com/lukraq/status/736754269047672832,2016-05-29,00:01:20
736272076361850884,Comprar as coisas prontas por preguiça de fazer é a melhor parte de morar sozinho,https://twitter.com/lukraq/status/736272076361850884,2016-05-27,16:05:16
735863549210337281,"Claro que tem, mas são tipo 5 tlgd ?",https://twitter.com/lukraq/status/735863549210337281,2016-05-26,13:01:56
735703287559639041,Hihihi to de pau duro  pic.twitter.com/Q8TwPYPme0,https://twitter.com/lukraq/status/735703287559639041,2016-05-26,02:25:07
735702343606378496,"Ei amor, se cuide Te amodoro",https://twitter.com/lukraq/status/735702343606378496,2016-05-26,02:21:22
735603504279134208,"Sabe, já faz tempo que eu queria te falar... VAI TOMAR NO CU",https://twitter.com/lukraq/status/735603504279134208,2016-05-25,19:48:36
735294633815707648,Ela não gosta da minha roupa  Vive falando do meu cabelo Reclama sempre do meu estranho jeito de falar,https://twitter.com/lukraq/status/735294633815707648,2016-05-24,23:21:16
735285374747041792,Tipo na hora de se cadastrar tinha que mostrar o imposto de renda,https://twitter.com/lukraq/status/735285374747041792,2016-05-24,22:44:28
735270090782998528,AQUELA HORA Q DA UM PUTA ALÍVIO NA ALMA  pic.twitter.com/pAw9V0dDeI,https://twitter.com/lukraq/status/735270090782998528,2016-05-24,21:43:44
718317605686243328,"@canaldomonark só pra terminar, oq pretende fazer cm o canal ? Continuar cm os games ou uma parada nova",https://twitter.com/lukraq/status/718317605686243328,2016-04-08,03:00:37
705580853175459840,"@DavyJonesRJ fico feliz que você tenha voltado com as Lives no Youtube, pra mim que vejo pelo app ds tv é mais vantajoso",https://twitter.com/lukraq/status/705580853175459840,2016-03-03,23:29:19
692905190475825152,#AMafiaChegou @GiioTrassi aquela hora que você percebe que ela postou msm  pic.twitter.com/VEv0CXow0z,https://twitter.com/lukraq/status/692905190475825152,2016-01-29,01:00:45
684468289683218433,"Meninos que falam ""Sou trabalhador Senhor"" na hora do enquadro 😍😍😍",https://twitter.com/lukraq/status/684468289683218433,2016-01-05,18:15:31
682760169814659072,Só a diva Lana pra fazer esse ano começar suave,https://twitter.com/lukraq/status/682760169814659072,2016-01-01,01:08:04
681915094779981824,"Minha cabeça ficou louca, só com aquele beijinho no canto da boca",https://twitter.com/lukraq/status/681915094779981824,2015-12-29,17:10:02
681667058619314177,@izzynobre eu nunca vi SW vc acha que seria melhor começar cm os 3 ep clássico ou esperar os 3 novos ?,https://twitter.com/lukraq/status/681667058619314177,2015-12-29,00:44:26
634202490800599040,AQUELA HORA Q VC SENTE FALTA DA SUA PRIMA DE SEGUNDO GRAU Q TE ODEIA,https://twitter.com/lukraq/status/634202490800599040,2015-08-20,00:17:11
609524492122083330,Mundo horrível gente desprezível como é que eu vou me justificar?,https://twitter.com/lukraq/status/609524492122083330,2015-06-12,21:55:37
607059336754565120,"em 2009 tinhas as melhores banda , todo mundo era emo , melhores musicas de foça adolescente , pqp melhor ano",https://twitter.com/lukraq/status/607059336754565120,2015-06-06,02:39:59
606712868189405184,#DiaDosNamoradosChegandoEEu NÃO VENDO A HORA DE COMEÇAR A TERCEIRA TEMPORADA DE ORANGE IS THE NEW BLACK 💕💕,https://twitter.com/lukraq/status/606712868189405184,2015-06-05,03:43:14
606712701092556800,#DiaDosNamoradosChegandoEEu Solitário e bem triste,https://twitter.com/lukraq/status/606712701092556800,2015-06-05,03:42:34
606706749077397505,"To como fome , sem sono e triste PUTA QUE PARIU",https://twitter.com/lukraq/status/606706749077397505,2015-06-05,03:18:55
606706318523699200,#SeOTwitterAcabar eu vou ter que reclamar e ficar triste na vida real,https://twitter.com/lukraq/status/606706318523699200,2015-06-05,03:17:13
606705959633887232,#NãoMeDêSuaOpiniãoMeDê um abraço pois estou bem triste,https://twitter.com/lukraq/status/606705959633887232,2015-06-05,03:15:47
606631660625510400,Achei q tinha me livrado do twitter mas to aqui dnv bem triste,https://twitter.com/lukraq/status/606631660625510400,2015-06-04,22:20:33
605930630988177408,MEU DEUS DO CU A @CassiaCast SAIU MEU MUNDO CAIU QUE MORTE HORRÍVEL,https://twitter.com/lukraq/status/605930630988177408,2015-06-02,23:54:54
605908957610131457,@CassiaCast NÃO VEJO A HORA DE TE VER NO MASTER CHEF DE HJ,https://twitter.com/lukraq/status/605908957610131457,2015-06-02,22:28:47
605906643327418368,Eu sou meio merda mas faço um puta café gostoso... Mentira nem sei fazer café MAS ME MATA PELO O AMOR DE DEUS,https://twitter.com/lukraq/status/605906643327418368,2015-06-02,22:19:35
605906459101036544,Deus se existe me mata logo pelo o amor do senhor,https://twitter.com/lukraq/status/605906459101036544,2015-06-02,22:18:51
605905454451945478,Já disse que eu to bem triste,https://twitter.com/lukraq/status/605905454451945478,2015-06-02,22:14:52
605905398126673920,Vai começar meu deus do cu,https://twitter.com/lukraq/status/605905398126673920,2015-06-02,22:14:38
605849386782842884,"Com vontade de cagar , com frio , fome , sono , com dor de cabeça... Pqp só falta eu tomar uns tiro",https://twitter.com/lukraq/status/605849386782842884,2015-06-02,18:32:04
605815315247726592,#QuandoEstouTristeGostoDe na vdd gosto de nda pq to triste pra Krl pra gostar de algo,https://twitter.com/lukraq/status/605815315247726592,2015-06-02,16:16:41
605815200470560768,#QuandoEstouTristeGostoDe chorar,https://twitter.com/lukraq/status/605815200470560768,2015-06-02,16:16:13
605731540094566400,Desculpa pai mas não consigo falar com mulher,https://twitter.com/lukraq/status/605731540094566400,2015-06-02,10:43:47
605529415368503296,Para de travar pokemon pelo o amor de deus,https://twitter.com/lukraq/status/605529415368503296,2015-06-01,21:20:37
605525001379397632,Amanha tem master chef não aguento mais esperar pra ver a @CassiaCast,https://twitter.com/lukraq/status/605525001379397632,2015-06-01,21:03:05
605522477004005376,Deprimido ou depressivo ... Foda-se o q importa é que eu to bem triste,https://twitter.com/lukraq/status/605522477004005376,2015-06-01,20:53:03
605522145083555840,Twitter onde QM é triste fica mais triste e QM é feliz pisa em quem é triste,https://twitter.com/lukraq/status/605522145083555840,2015-06-01,20:51:44
605507142704082944,Eu to bem triste,https://twitter.com/lukraq/status/605507142704082944,2015-06-01,19:52:07
605247176999084032,@executamos MEU JESUS ME MATA PELO O AMOR DE DEUS NÃO AGUENTO MAIS OS 7X1 QUE A VIDA ME DA TODOS OS DIAS,https://twitter.com/lukraq/status/605247176999084032,2015-06-01,02:39:06
605243844012216320,"Eu sou triste , sozinho , estou deprimido e a porra toda",https://twitter.com/lukraq/status/605243844012216320,2015-06-01,02:25:51
605243565497823232,"Meu Deus do cu , essa hora da madrugada e eu participando dessas tags #FavQTeSdvNessaSegundaCruel",https://twitter.com/lukraq/status/605243565497823232,2015-06-01,02:24:45
605234573216256000,Twitter é maravilhoso,https://twitter.com/lukraq/status/605234573216256000,2015-06-01,01:49:01
605210654509830144,@BreHenrique_ se viesse uma continha do netflix seria perfeito,https://twitter.com/lukraq/status/605210654509830144,2015-06-01,00:13:58
605204277074763776,Pqp só de pensar q vou acordar 6:20 amanha,https://twitter.com/lukraq/status/605204277074763776,2015-05-31,23:48:38
605193153742811136,#PraNamorarComigoTemQue ser uma pessoa de verdade,https://twitter.com/lukraq/status/605193153742811136,2015-05-31,23:04:26
605192715039612930,#PraNamorarComigoTemQue ser triste e depressivo igual a mim,https://twitter.com/lukraq/status/605192715039612930,2015-05-31,23:02:41
605192063538315264,"Cansado , fiz vários nada hoje , mas amanhã é segunda que morte horrível",https://twitter.com/lukraq/status/605192063538315264,2015-05-31,23:00:06
605149980278562816,Triste e perto de 1k de tweets,https://twitter.com/lukraq/status/605149980278562816,2015-05-31,20:12:53
605148933271261184,Amanha é segunda... Que morte horrível,https://twitter.com/lukraq/status/605148933271261184,2015-05-31,20:08:43
605147023130652672,"Algumas pessoas acham que isso é um personagem , me desculpa mas não ia gastar meu tempo fingindo ser triste",https://twitter.com/lukraq/status/605147023130652672,2015-05-31,20:01:08
605146696033681409,"Acho engraçado essas pessoas que reclamam pq uma outra pessoa demorou pra responder, comigo isso não acontece... Ngm me manda mensagem",https://twitter.com/lukraq/status/605146696033681409,2015-05-31,19:59:50
605145792391860224,Não sei falar que nem mano,https://twitter.com/lukraq/status/605145792391860224,2015-05-31,19:56:14
605144952176275458,Tenho um certo receio de seguir gente que eu conheço não quero que eles saibam o quanto eu sou fracassado e triste,https://twitter.com/lukraq/status/605144952176275458,2015-05-31,19:52:54
605142030721925120,"Porra não me coloquem em grupos do wpp já odeio falar cm as pessoas nessa merda , imagina cm um monte de uma só vez",https://twitter.com/lukraq/status/605142030721925120,2015-05-31,19:41:17
605141747409276928,Eu to bem triste,https://twitter.com/lukraq/status/605141747409276928,2015-05-31,19:40:10
605139181619290113,@jorgelordello cuidado cm os salgadoces,https://twitter.com/lukraq/status/605139181619290113,2015-05-31,19:29:58
605094206596624384,Pqp amanha começa as minhas aulas q merda,https://twitter.com/lukraq/status/605094206596624384,2015-05-31,16:31:15
604116703673344001,"@daecaua foi bom enquanto durou , pelo menos não precisei falar cm o Charlie Charlie , falar cm um ser humano é bom as vezes",https://twitter.com/lukraq/status/604116703673344001,2015-05-28,23:47:00
604113166092603393,FODA-SE O QUEBRA QUEBRA BOTA UM BIQUÍNI NESSAS MINAS PELO O AMOR DE DEUS,https://twitter.com/lukraq/status/604113166092603393,2015-05-28,23:32:57
603559297625300992,Pq não esqueço ela logo pelo o amor de deus,https://twitter.com/lukraq/status/603559297625300992,2015-05-27,10:52:04
603559164967833600,Lembrando da ex e ficando muito triste,https://twitter.com/lukraq/status/603559164967833600,2015-05-27,10:51:33
603396938797551616,Ó o preconceito tirou a sem mão,https://twitter.com/lukraq/status/603396938797551616,2015-05-27,00:06:55
603394786842845184,Alá só pq não tem mão,https://twitter.com/lukraq/status/603394786842845184,2015-05-26,23:58:22
603378070238691328,@biatells sem canela pelo o amor de deus,https://twitter.com/lukraq/status/603378070238691328,2015-05-26,22:51:56
603376462402551808,Qndo o fogaça vai cantar um minuto para o fim do mundo ?,https://twitter.com/lukraq/status/603376462402551808,2015-05-26,22:45:33
602846965085446146,Triste demais por ser o espermatozóide vencedor,https://twitter.com/lukraq/status/602846965085446146,2015-05-25,11:41:31
602688402127986688,"Ngm lê meus posta ,nem da RT nem curte nada q eu posto , sou sozinho até na rede social mais triste de todas",https://twitter.com/lukraq/status/602688402127986688,2015-05-25,01:11:27
