id,tweet,link,date,time
976765799959597056,"Indo trabalhar como sempre vou, me fazendo de louco",https://twitter.com/otaacosta/status/976765799959597056,2018-03-22,07:21:28
976620825469218816,Nus hoje é dia de ser julgado? Pq não teve um momento hoje que alguém me julgou com o olhar ou com palavras por eu estar sendo quem eu sou. Chateado com isso!,https://twitter.com/otaacosta/status/976620825469218816,2018-03-21,21:45:24
976274921365168129,"Cheguei a conclusão que só tenho pequenos flashs do que rola, e o quanto sou quanto deixo o meu ID assumir o controle",https://twitter.com/otaacosta/status/976274921365168129,2018-03-20,22:50:54
976274614555787264,Quase 23:00 o @LucasRMorais  e eu na cozinha analisando o quanto sou fico fora de controle quando bebo,https://twitter.com/otaacosta/status/976274614555787264,2018-03-20,22:49:41
976142425898012672,Hoje tá foda,https://twitter.com/otaacosta/status/976142425898012672,2018-03-20,14:04:24
975557567798829057,Outra doidera da minha cabeça é que as pessoas tão se cansando de mim e cv só por boa convivência,https://twitter.com/otaacosta/status/975557567798829057,2018-03-18,23:20:23
975140045664505856,Minha barba podia crescer rápido pq não tenho paciência pra esse bigode,https://twitter.com/otaacosta/status/975140045664505856,2018-03-17,19:41:18
974469547221798912,"Mas infelizmente sou assim não consigo ficar de mal, mesmo a pessoa vacilando comigo e a atitude ter me feito muito mal",https://twitter.com/otaacosta/status/974469547221798912,2018-03-15,23:16:59
974128865969917952,"O que me traria um pouco de paz, é foda mas fazer o que né",https://twitter.com/otaacosta/status/974128865969917952,2018-03-15,00:43:14
974128610029309952,"O que poderia ser resolvido em uma conversa, porém não dá pra fingir que tá ok e fingir que nada aconteceu",https://twitter.com/otaacosta/status/974128610029309952,2018-03-15,00:42:13
974125859765354496,Faculdade cada semestre que passa tá ficando mais complicado pros que trabalham ou moram em outra cidade,https://twitter.com/otaacosta/status/974125859765354496,2018-03-15,00:31:18
973383566276071424,Pessoas desempregadas me add,https://twitter.com/otaacosta/status/973383566276071424,2018-03-12,23:21:41
972821623035367424,"Principalmente quando atitude de outras pessoas que não compreende a situação não nos ajuda, ok sou falho, erro, mas infelizmente assim fica difícil, pensei que acordaria alegre depois do show de ontem ( foi maravilhoso) mas hoje acordei só com vontade de acabar com tudo",https://twitter.com/otaacosta/status/972821623035367424,2018-03-11,10:08:43
971941665144438785,Banco o cara que socializa com todos mas na verdade tô disfarçando pra poder aguentar firme o tempo que não tô deitado na bad,https://twitter.com/otaacosta/status/971941665144438785,2018-03-08,23:52:05
971352648812294145,Sinceramente não sei o que estou fazendo com minha vida,https://twitter.com/otaacosta/status/971352648812294145,2018-03-07,08:51:32
970607376893120513,30 min de aula e eu já tô com vontade de andar pela faculdade,https://twitter.com/otaacosta/status/970607376893120513,2018-03-05,07:30:06
970152743200526336,No momento aguardando o Rafa fazer um feijão,https://twitter.com/otaacosta/status/970152743200526336,2018-03-04,01:23:33
969046846202052608,Pessoa usou mais de 3 hashtag no Instagram merece apanhar de toalha molhada,https://twitter.com/otaacosta/status/969046846202052608,2018-03-01,00:09:06
968993658853908480,Faculdade só segunda feira e não vou me preocupar com nada por enquanto,https://twitter.com/otaacosta/status/968993658853908480,2018-02-28,20:37:45
968993432604639232,Tá rolando uns textao no grupo da sala da noite pra votar nao sei no que pro estágio e eu tô bem pleno curtindo os 45 min do segundo tempo de minhas férias,https://twitter.com/otaacosta/status/968993432604639232,2018-02-28,20:36:52
968489989473492992,Ouvindo MC Créu logo de manhã,https://twitter.com/otaacosta/status/968489989473492992,2018-02-27,11:16:21
968295751892787201,A quantidade de gente louca é de cair o cu da bunda,https://twitter.com/otaacosta/status/968295751892787201,2018-02-26,22:24:31
968295380730466308,No momento estou puto com umas coisas que eu inventei na minha cabeça,https://twitter.com/otaacosta/status/968295380730466308,2018-02-26,22:23:03
968098380495933446,Como se em 1 dia depois tô fazendo a mesma burrada  https://twitter.com/365DiasOficial/status/967958649002893313 …,https://twitter.com/otaacosta/status/968098380495933446,2018-02-26,09:20:14
967902570038652928,"Pra espantar a monotonia e evitar que eu fique de mente vazia, eu e minha irmã colocamos umas músicas do carnaval e dançamos que nem loucos",https://twitter.com/otaacosta/status/967902570038652928,2018-02-25,20:22:10
967810676369645568,Eu e minha paranóia que fiz algo e a pessoa tá com raiva de mim,https://twitter.com/otaacosta/status/967810676369645568,2018-02-25,14:17:00
967809562416951302,"Podia ter um modo de voltar no tempo e evitar que certas atitudes fosse cometidas, minha vida seria top",https://twitter.com/otaacosta/status/967809562416951302,2018-02-25,14:12:35
967213462890917888,"Maioria dos meus amigos de Abaeté tão namorando, preciso começar a namorar também",https://twitter.com/otaacosta/status/967213462890917888,2018-02-23,22:43:54
967210416677052417,Eu tô tão no tédio que eu já briguei mentalmente com umas 5 pessoas e já as perdoei. Mente vazia é realmente oficina do diabo,https://twitter.com/otaacosta/status/967210416677052417,2018-02-23,22:31:47
966851306756419585,"Fico olhando o cabelo da minha mãe, da minha irmã, pelo que me lembro o cabelo do meu pai tbm não era ruim visto pelo os outros filhos dele, e penso porque diabos fui puxar o lado ruim da genética e sair com cabelo ruim",https://twitter.com/otaacosta/status/966851306756419585,2018-02-22,22:44:49
966660938882527232,"Acordei, meus afazeres de hoje são os mesmo de todo o dia, comer e ficar deitado o dia todo",https://twitter.com/otaacosta/status/966660938882527232,2018-02-22,10:08:22
966479548882747392,Tô de férias volto dia 4,https://twitter.com/otaacosta/status/966479548882747392,2018-02-21,22:07:35
966475842787344384,Sem falar quando sempre a conversa rendia independente do assunto por mais besta q fosse e do nada já não prolonga mais e as respostas passam a ser curtas e diretas,https://twitter.com/otaacosta/status/966475842787344384,2018-02-21,21:52:51
966475474976243713,"Acabo de me pegar pensando que no decorrer do tempo a gente deixa de ter certa prioridade pra algumas pessoas, e em que exato momento você passa de ser respondido com rapidez pra ser deixado no vácuo",https://twitter.com/otaacosta/status/966475474976243713,2018-02-21,21:51:24
966458494500171776,"Hoje deu saudade dos amigos de divinopolis, só dos amigos",https://twitter.com/otaacosta/status/966458494500171776,2018-02-21,20:43:55
965795418897637376,"Nus é cada roubada que me meto, fui ameaçado, mas já tomei minhas providências, qualquer coisa que acontecer comigo a pessoa está ferrada",https://twitter.com/otaacosta/status/965795418897637376,2018-02-20,00:49:06
965795030396014592,Festas com muita gente também não consigo ficar por muito tempo,https://twitter.com/otaacosta/status/965795030396014592,2018-02-20,00:47:33
965794924162674688,"Uma das coisas que eu amava fazer era ouvir música, tem tempos que não pego uma tarde ou noite pra ficar ouvindo, ouço 2 no máximo e já paro",https://twitter.com/otaacosta/status/965794924162674688,2018-02-20,00:47:08
965753854687154177,Parabéns @jesuisls muita luz na sua vida! Te adoro,https://twitter.com/otaacosta/status/965753854687154177,2018-02-19,22:03:56
964254549602177025,"Abaeté não tem nada, nenhum lugar pra sair, meus amigos já voltaram pras suas cidades pq as aulas deles vao começar, sol tá quente demais pra poder sair de casa, mas pelo menos tô com minha família e é o q importa",https://twitter.com/otaacosta/status/964254549602177025,2018-02-15,19:46:14
964254201282027521,"Prometi ficar um tempo fora das redes sociais, mas o tédio tá me obrigando a não cumprir essa promessa",https://twitter.com/otaacosta/status/964254201282027521,2018-02-15,19:44:51
960949866166915074,Tava Louco aquela hora,https://twitter.com/otaacosta/status/960949866166915074,2018-02-06,16:54:36
960683628832452609,Louco pra ver família e amigos de Abaeté!,https://twitter.com/otaacosta/status/960683628832452609,2018-02-05,23:16:40
960658666033700866,Primeiro dia de férias e eu morguei o dia todo,https://twitter.com/otaacosta/status/960658666033700866,2018-02-05,21:37:28
960580943013695489,Ficar louco,https://twitter.com/otaacosta/status/960580943013695489,2018-02-05,16:28:38
960096060889882624,Quando eu saio de casa com os amigos  https://twitter.com/lisboasthiago/status/959136158956638208 …,https://twitter.com/otaacosta/status/960096060889882624,2018-02-04,08:21:53
960094982253236225,Dormi no sofá na casa do Tonaco essa noite e tô todo torto,https://twitter.com/otaacosta/status/960094982253236225,2018-02-04,08:17:36
959719146039726080,Finalmente último dia de trabalho antes das férias,https://twitter.com/otaacosta/status/959719146039726080,2018-02-03,07:24:09
959561513827733508,"A pessoa te causa desequilíbrio emocional com piadas de mal gosto, só fala mal de vc e ainda vem puxar assunto pedindo favor,na vdd do jeito q falou nem é favor. Ah vai a Pqp",https://twitter.com/otaacosta/status/959561513827733508,2018-02-02,20:57:47
959448156273553408,Férias chegando e finalmente vou ter tempo de matar saudades de todos em Abaeté,https://twitter.com/otaacosta/status/959448156273553408,2018-02-02,13:27:20
959034690819837953,Mulher tu quer me derrubar logo de manhã?,https://twitter.com/otaacosta/status/959034690819837953,2018-02-01,10:04:22
957601447406919685,Eu toda manhã  https://twitter.com/falarafha/status/957004073580064768 …,https://twitter.com/otaacosta/status/957601447406919685,2018-01-28,11:09:11
956356828836835328,Minha vida se resume a esse site e Instagram. Facebook virou um lugar que vou só pra ver quem tá fazendo aniversário,https://twitter.com/otaacosta/status/956356828836835328,2018-01-25,00:43:30
955987480695713793,"Oi bad, quanto tempo você não dá as caras",https://twitter.com/otaacosta/status/955987480695713793,2018-01-24,00:15:51
955638375163355137,"2018 tá sendo suave pois tô sabendo a não me culpar pelas coisas, tô me permitindo sentir mais, e curtir mais",https://twitter.com/otaacosta/status/955638375163355137,2018-01-23,01:08:38
955637646256111616,"Nada a reclamar do dia q passou, fiquei pleno o dia todo, até limpei o quarto as 22:00, só não jantei mas segue o baile",https://twitter.com/otaacosta/status/955637646256111616,2018-01-23,01:05:44
954713106982277120,"Acho q devia ter deixado essa folga pra outro dia, escolhi errado",https://twitter.com/otaacosta/status/954713106982277120,2018-01-20,11:51:57
954386082757578752,"Hoje tô tão de boas, nada vai estragar meu dia",https://twitter.com/otaacosta/status/954386082757578752,2018-01-19,14:12:28
954320328129437697,Agora q parei pra pensar que tem 4 dias q não tomo café de manhã,https://twitter.com/otaacosta/status/954320328129437697,2018-01-19,09:51:11
953960801991348225,Acordei com o braço dormente pq a Ariana não sabe dividir cama,https://twitter.com/otaacosta/status/953960801991348225,2018-01-18,10:02:33
953253329081192448,Pessoas q corre vergonhosamente e mesmo assim perde o busão  me add,https://twitter.com/otaacosta/status/953253329081192448,2018-01-16,11:11:18
953090465657651201,Odeio morar de lado de um para raio por isso,https://twitter.com/otaacosta/status/953090465657651201,2018-01-16,00:24:09
953090409835782144,"Tá rolando uns relâmpagos fora do normal, tá doendo as vistas de olhar pra eles, pior q mesmo com a cortina tão clareando o quarto",https://twitter.com/otaacosta/status/953090409835782144,2018-01-16,00:23:55
953061335008456705,Momento bad por odiar ser magro demais,https://twitter.com/otaacosta/status/953061335008456705,2018-01-15,22:28:23
953056856632676353,"Meu sonho ser mais forte pra poder partir pra ignorância com certa pessoa, nas atuais circunstâncias físicas finjo não ligar",https://twitter.com/otaacosta/status/953056856632676353,2018-01-15,22:10:36
952350670207832064,"Venho para Abaeté e parece q meu sono regula, mas tenho que ficar atento a minha vó essa noite",https://twitter.com/otaacosta/status/952350670207832064,2018-01-13,23:24:28
951802980310900736,Vi as atrações do rodeio desse ano e foda-se se vou ter q trabalhar no outro dia de manhã. Já tô preparando pra comprar todos os dias,https://twitter.com/otaacosta/status/951802980310900736,2018-01-12,11:08:08
951802639368556544,"Como posso tá bem um dia a noite e acordo bem, e do nada começo a ter crise de ansiedade?",https://twitter.com/otaacosta/status/951802639368556544,2018-01-12,11:06:47
951070829638488064,Preciso regular meu sono aaaaaaaaaa,https://twitter.com/otaacosta/status/951070829638488064,2018-01-10,10:38:50
950924557094973443,"Pra piorar preciso de alguém pra poder conversar, falar como foi o dia, pra não ficar focado só nas preocupações, não aguento mais ficar ""sozinho"" nesse apt",https://twitter.com/otaacosta/status/950924557094973443,2018-01-10,00:57:36
950922952543031296,"Vou pra lá esse fds, ela precisa de mim nesse momento",https://twitter.com/otaacosta/status/950922952543031296,2018-01-10,00:51:13
950902224108113925,Eu só emagreci e fiquei mais feio é doido mas segue a vida,https://twitter.com/otaacosta/status/950902224108113925,2018-01-09,23:28:51
950901904854396928,"Eu também não sei gostar das pessoas, pq quando eu gosto eu gosto demais a ponto de sufocar",https://twitter.com/otaacosta/status/950901904854396928,2018-01-09,23:27:35
950130662362763265,"Mano o cara tava muito louco, fizemos um B.O",https://twitter.com/otaacosta/status/950130662362763265,2018-01-07,20:22:57
950098199150321664,"2018 tá indo super bem, primeiro fds do ano e eu já fui em um rolê em um sítio que do nada o vizinho louco de lá começou a dar tiro de espingarda pro alto reclamando do som",https://twitter.com/otaacosta/status/950098199150321664,2018-01-07,18:13:57
949755514556207104,Aquele momento que vc percebe que tá lavando a louça e tem uma pessoa na janela do prédio da rua de cima de observando a tempos,https://twitter.com/otaacosta/status/949755514556207104,2018-01-06,19:32:14
949580017834569728,Bom dia pra qm tá muito atrasado,https://twitter.com/otaacosta/status/949580017834569728,2018-01-06,07:54:53
949115485718765569,Amanhã pego mais cedo no trabalho e eu tô com zero sono,https://twitter.com/otaacosta/status/949115485718765569,2018-01-05,01:09:00
949114346172448768,"Hoje na terapia falei: "" tenho vontade de matar tal pessoa!"" espero que a psicóloga tenha entendido que foi força de expressão",https://twitter.com/otaacosta/status/949114346172448768,2018-01-05,01:04:28
947983350031159297,"Primeiro dia do ano foi maravilhoso, nada a reclamar",https://twitter.com/otaacosta/status/947983350031159297,2018-01-01,22:10:17
947851855761170432,7:00 e os que viraram a noite batendo panela pra acordar os coitados como eu que pegaram no sono,https://twitter.com/otaacosta/status/947851855761170432,2018-01-01,13:27:47
947851403602558981,"Nunca comecei um ano tão loucamente como foi esse, eternamente agradecido por esse momento",https://twitter.com/otaacosta/status/947851403602558981,2018-01-01,13:25:59
947210972741226498,Não é possível que no penúltimo dia do ano eu vou ter crise,https://twitter.com/otaacosta/status/947210972741226498,2017-12-30,19:01:08
946538270925651970,Pessoas que pagam terapia mas não coloca em prática o que é recomendado é depois chora me add,https://twitter.com/otaacosta/status/946538270925651970,2017-12-28,22:28:04
946174457063923712,"Desânimo das pessoas, desânimo da vida, desanimo dessa cidade, desânimo de sair e ir pra Abaeté, mas fico desanimado lá também, desanimo de usar redes sociais, desânimo até de reclamar",https://twitter.com/otaacosta/status/946174457063923712,2017-12-27,22:22:24
945366892239351808,Melhores amigos e Otávio,https://twitter.com/otaacosta/status/945366892239351808,2017-12-25,16:53:25
944992971291791360,Por algum motivo não explicado a Ceia de Natal virou almoço do dia 25,https://twitter.com/otaacosta/status/944992971291791360,2017-12-24,16:07:36
944612020955082753,"Meu deus eu não sei se tô chorando de felicidade de poder ir pra casa, ou pq vou ficar pouco tempo lá",https://twitter.com/otaacosta/status/944612020955082753,2017-12-23,14:53:50
944396309821362177,Tanto tempo sem ir pra casa que nem sei como é ir,https://twitter.com/otaacosta/status/944396309821362177,2017-12-23,00:36:40
943928352343195653,"Vei nem lembre daquele dia, agora tá normal só que ficou mais ressecado q tava",https://twitter.com/otaacosta/status/943928352343195653,2017-12-21,17:37:11
943648829919899648,Amiga tô assim a muito tempo,https://twitter.com/otaacosta/status/943648829919899648,2017-12-20,23:06:27
943628337674686464,"Eu não aguento mais essa vida, essa cidade, eu, tô perto de explodir",https://twitter.com/otaacosta/status/943628337674686464,2017-12-20,21:45:02
942734672127197184,"Bom dia, comendo um requeijão de gosto duvidoso",https://twitter.com/otaacosta/status/942734672127197184,2017-12-18,10:33:55
942556021968588800,"Ok primeira noite sozinho em casa, até agora tá tudo bem",https://twitter.com/otaacosta/status/942556021968588800,2017-12-17,22:44:02
942504812171726849,Sem falar em mudar a alimentação e ter uma vida saudável,https://twitter.com/otaacosta/status/942504812171726849,2017-12-17,19:20:32
942504301422837761,Se não tivesse a @sousalsss pra me atualizar dos funks eu seria uma pessoa bem triste,https://twitter.com/otaacosta/status/942504301422837761,2017-12-17,19:18:30
942402458604703745,Pensando em decorar meu quarto com alguns quadros,https://twitter.com/otaacosta/status/942402458604703745,2017-12-17,12:33:49
941830793898246144,Nessas férias quero colocar todos os filmes e séries em dia,https://twitter.com/otaacosta/status/941830793898246144,2017-12-15,22:42:14
941827662795780096,Mas fico feliz que em março retomamos juntos mais uma temporada dessa vida acadêmica,https://twitter.com/otaacosta/status/941827662795780096,2017-12-15,22:29:47
941827495908687873,"Sei que vou daqui uns dias sentir saudades dos meninos e começar a chorar, agora a noite já senti falta na hora de fazer janta",https://twitter.com/otaacosta/status/941827495908687873,2017-12-15,22:29:07
941415012786110466,"Hoje fiquei mal o dia todo, nao consegui ir trabalhar, falei coisas na impulsividade, chorei no meio da praça, mas aparentemente tudo já está se resolvendo, que final de season meus amigos",https://twitter.com/otaacosta/status/941415012786110466,2017-12-14,19:10:04
941333635046739969,Inferno de vida,https://twitter.com/otaacosta/status/941333635046739969,2017-12-14,13:46:42
941139498758533120,Nesse momento comendo uma fatia de pão chorando no quarto,https://twitter.com/otaacosta/status/941139498758533120,2017-12-14,00:55:16
941136786532786177,Noite vai ser longa,https://twitter.com/otaacosta/status/941136786532786177,2017-12-14,00:44:30
941079434299367425,"De novo essa sensação ruim, mas vou fingir que tá bem pra ver se ela vai embora, preciso aguentar até semana que vem",https://twitter.com/otaacosta/status/941079434299367425,2017-12-13,20:56:36
940754450679033856,"É normal sentir dor, vc sentir é um sinal que você está vivo, então não desista",https://twitter.com/otaacosta/status/940754450679033856,2017-12-12,23:25:14
940562004716244992,"Tô com uma palpitação de desespero por medo de chegar atrasado na terapia, isso pq tô aguardando pra cortar o cabelo, ainda bem se der ruim eu vou direto pra lá",https://twitter.com/otaacosta/status/940562004716244992,2017-12-12,10:40:31
940561741355847685,Me pergunto isso todo dia,https://twitter.com/otaacosta/status/940561741355847685,2017-12-12,10:39:28
940026734996525056,Melhor dia,https://twitter.com/otaacosta/status/940026734996525056,2017-12-10,23:13:33
940016929896615937,Que dia louco meus amigos,https://twitter.com/otaacosta/status/940016929896615937,2017-12-10,22:34:35
939549351281680384,Tempo ajudou muito,https://twitter.com/otaacosta/status/939549351281680384,2017-12-09,15:36:35
939549020195819520,Usando no dia a dia o que a psicóloga disse na última sessão,https://twitter.com/otaacosta/status/939549020195819520,2017-12-09,15:35:17
939310935315046405,Arrependo horrores de deixar algumas pessoas preocupadas,https://twitter.com/otaacosta/status/939310935315046405,2017-12-08,23:49:13
938563579372081152,"Quando umas coisas que já estavam resolvidas voltam pra só atiçar a mente e causar desgraçamento mental, e vontade de largar tudo",https://twitter.com/otaacosta/status/938563579372081152,2017-12-06,22:19:29
937889027591757824,Meu deus passei um dia sem chorar ou ter crise. Dia 03/12/2017 eu fui mais forte!,https://twitter.com/otaacosta/status/937889027591757824,2017-12-05,01:39:03
937841962908114944,"Vei esse povo votando pra ter prova dia 14 no lugar do dia 7, meu deus isso que é gostar dessa faculdade",https://twitter.com/otaacosta/status/937841962908114944,2017-12-04,22:32:02
937680634771894272,Vai ter um dia que eu vou conseguir acordar de boas?,https://twitter.com/otaacosta/status/937680634771894272,2017-12-04,11:50:59
937491074314047488,@LucasRMorais o garoto que dá um show por causa de uma bombinha,https://twitter.com/otaacosta/status/937491074314047488,2017-12-03,23:17:44
937417366207713280,"Meu computador é um lixo, só serve pra me fazer raiva",https://twitter.com/otaacosta/status/937417366207713280,2017-12-03,18:24:51
936731229675753472,Ooooooooooooo inferno,https://twitter.com/otaacosta/status/936731229675753472,2017-12-01,20:58:23
936577968536801280,Meninas que apresentam trabalho e fazem prova com muito sono me add,https://twitter.com/otaacosta/status/936577968536801280,2017-12-01,10:49:23
936577800462635008,"Acabou pra você né gata, ainda tenho até dia 15",https://twitter.com/otaacosta/status/936577800462635008,2017-12-01,10:48:43
936371174107475968,O que me salvou hoje foi a viagem com a turma da Faculdade,https://twitter.com/otaacosta/status/936371174107475968,2017-11-30,21:07:39
935328133812715525,Se acordar ruim de novo eu apago minha existência desse plano,https://twitter.com/otaacosta/status/935328133812715525,2017-11-28,00:02:59
935327866807554048,Se já passou da meia noite já posso surtar?,https://twitter.com/otaacosta/status/935327866807554048,2017-11-28,00:01:55
935300886175342592,"Meu tt é um declínio de um pessoa que era de boas, ficou louca no stress, raclamou e acabou depressivo",https://twitter.com/otaacosta/status/935300886175342592,2017-11-27,22:14:42
935289498228940805,"Hoje acho q vai ser o dia que nao vou reclamar de nada no tt, ou postar algo depressivo",https://twitter.com/otaacosta/status/935289498228940805,2017-11-27,21:29:27
935072540564877312,Se eu não aparecer até 22:00 da noite hoje é pq desisti de tudo,https://twitter.com/otaacosta/status/935072540564877312,2017-11-27,07:07:21
935070350043435008,Bermuda e chinelo é o melhor look pra ir pra faculdade sim,https://twitter.com/otaacosta/status/935070350043435008,2017-11-27,06:58:38
935066515623247872,"Tive um sonho ruim em que todo mundo ia mudar de casa e eu ia ficar sozinho, nunca chorei tanto em um sonho, agora acordei bad",https://twitter.com/otaacosta/status/935066515623247872,2017-11-27,06:43:24
934475903228416000,Ontem tive o pior episódio de crise da minha vida,https://twitter.com/otaacosta/status/934475903228416000,2017-11-25,15:36:31
933670481147908097,Episódio do dia: Eu e Bianca rindo (sem ser pejorativo) de um trabalho sobre drogas e sendo julgados por um ser aleatório que disse pra sermos discretos,https://twitter.com/otaacosta/status/933670481147908097,2017-11-23,10:16:04
933357140152025090,Hoje deu vontade de chorar de desespero de tanta coisa pra fazer da faculdade,https://twitter.com/otaacosta/status/933357140152025090,2017-11-22,13:30:57
933356981951311877,Nunca comi tão rápido na vida para não perder um ônibus,https://twitter.com/otaacosta/status/933356981951311877,2017-11-22,13:30:20
932423870333837317,"Totalizando 3 crises no dia de hoje, cada dia me supero mais",https://twitter.com/otaacosta/status/932423870333837317,2017-11-19,23:42:28
932423755833466881,Sei que essa insônia vai afetar meu dia amanhã,https://twitter.com/otaacosta/status/932423755833466881,2017-11-19,23:42:01
932408239454597121,A vista da cidade pelo terraço do prédio a noite é uma imagem maravilhosa,https://twitter.com/otaacosta/status/932408239454597121,2017-11-19,22:40:22
932405117260877824,"To em casa quando me surge a Parraê do nada, melhor pessoa que existe",https://twitter.com/otaacosta/status/932405117260877824,2017-11-19,22:27:57
932355579300913152,Do que adianta ir em uma festa foda se no outro dia você se sente um bosta?,https://twitter.com/otaacosta/status/932355579300913152,2017-11-19,19:11:07
931881165287550976,Era 8 da manhã tomando cafe da manhã com a Maria e fazendo análise de 2017,https://twitter.com/otaacosta/status/931881165287550976,2017-11-18,11:45:57
931706902949621760,Amanhã poderei curtir sem ficar pensando em trabalho/faculdade/paranóias sociais,https://twitter.com/otaacosta/status/931706902949621760,2017-11-18,00:13:30
931705839592923136,Espero que essa festa amanhã seja maravilhosa pq se der ruim eu me mato,https://twitter.com/otaacosta/status/931705839592923136,2017-11-18,00:09:17
931651650565148672,Basicamente vou passar a noite chorando,https://twitter.com/otaacosta/status/931651650565148672,2017-11-17,20:33:57
