id,tweet,link,date,time
752923394195255296,"Minha mãe querendo fazer bolo e chamar umas pessoas pro meu niver, e eu querendo só que ela faça uma feijoada e chamar apenas meus padrinhos",https://twitter.com/otaacosta/status/752923394195255296,2016-07-12,14:51:40
752922411352326145,"Chegou parente da minha vó que nunca vi na vida, só dei um oi e me fechei no quarto!",https://twitter.com/otaacosta/status/752922411352326145,2016-07-12,14:47:46
752493503364665344,"To a cada ano que passa ficando aquele amigo solteiro, que vai casando os amigos!",https://twitter.com/otaacosta/status/752493503364665344,2016-07-11,10:23:26
752152627425804288,Desde que cheguei em Abaeté não tive tempo pra deitar no sofá e ficar sem fazer nada,https://twitter.com/otaacosta/status/752152627425804288,2016-07-10,11:48:55
751256352215928832,"Quando mandamos pra pessoa,""como que vc está?"" é pq nos preocupamos e esperamos uma simples resposta de ""estou bem"", só pra avisar mesmo",https://twitter.com/otaacosta/status/751256352215928832,2016-07-08,00:27:26
751214457360187392,Como proceder quando você quer pegar a pessoa mas tem vergonha??,https://twitter.com/otaacosta/status/751214457360187392,2016-07-07,21:40:58
751158936674402304,"Sem perspectivas sobre essa vida, só vou deixar rolar!",https://twitter.com/otaacosta/status/751158936674402304,2016-07-07,18:00:21
751108924540121088,A pessoa pra namorar comigo tem que entender que mudo de humor de 15 em 15 min,https://twitter.com/otaacosta/status/751108924540121088,2016-07-07,14:41:37
751075973534212096,"um rostinho tao bonito, pena que só fala merda",https://twitter.com/otaacosta/status/751075973534212096,2016-07-07,12:30:41
750832949457805312,"para essa noite temos: Coxinha, coca-cola, e maratona de Glee! como é lindo ser solteiro",https://twitter.com/otaacosta/status/750832949457805312,2016-07-06,20:24:59
750727621747630080,"A pessoa pra querer ficar comigo tem que ser bem direta, sou muito lerdo pra entender indiretas",https://twitter.com/otaacosta/status/750727621747630080,2016-07-06,13:26:27
750345671442567170,"Não sei o que dizer, apenas sentir!",https://twitter.com/otaacosta/status/750345671442567170,2016-07-05,12:08:43
750131072239886336,só queria agradecer aos deuses por ter conhecido esse ano essas pessoas lindas,https://twitter.com/otaacosta/status/750131072239886336,2016-07-04,21:55:59
748343035059142658,"Faculdade consiste em 99% do tempo vc querendo matar seus colegas de classe, mas 1% é aquele tempo que vc percebe que até gosta deles",https://twitter.com/otaacosta/status/748343035059142658,2016-06-29,23:30:57
748156857978589184,"Perdi a chave de casa, e pra piorar os meninos trancaram as portas, to preso até meio dia. Só pq to cheio de coisa pra fazer!",https://twitter.com/otaacosta/status/748156857978589184,2016-06-29,11:11:09
747997176710725632,"Meia noite e meia eu cozinhando ovo, quero minha vida de volta Jesus!",https://twitter.com/otaacosta/status/747997176710725632,2016-06-29,00:36:38
747995363034923009,"Depois de encerrar o dia olhando as notas no web giz, só me resta deitar e chorar",https://twitter.com/otaacosta/status/747995363034923009,2016-06-29,00:29:26
747976678819889153,"Nos 45 do segundo tempo do fim do período a panela de pressão explodiu, me julguem, mas aprendi a nunca levar desaforo pra casa!",https://twitter.com/otaacosta/status/747976678819889153,2016-06-28,23:15:11
747793584515080192,já acordo mandando um MALANDRAMENTE que já é pra deixar o dia mais top,https://twitter.com/otaacosta/status/747793584515080192,2016-06-28,11:07:38
747621566167531520,"As pessoas acham que a gente é só um poço de amargura e desprezo, mas nao imagina o quanto a gente é amorzinho",https://twitter.com/otaacosta/status/747621566167531520,2016-06-27,23:44:06
743595523840557061,aí chego em casa e o sono vai embora,https://twitter.com/otaacosta/status/743595523840557061,2016-06-16,21:06:02
743284414772305920,"Andando com as mãos pra cima pra ver se algum ser me puxa, não aguento mais esse planeta e essas pessoas",https://twitter.com/otaacosta/status/743284414772305920,2016-06-16,00:29:48
743253537669455872,E olha que é muito tempo pela frente ainda,https://twitter.com/otaacosta/status/743253537669455872,2016-06-15,22:27:07
742921499678478336,"Devia ta lendo o roteiro do psicodrama, mas nao to aqui postando merda",https://twitter.com/otaacosta/status/742921499678478336,2016-06-15,00:27:42
742819099563134976,vou chegar metendo o louco naquela Uemg hj!,https://twitter.com/otaacosta/status/742819099563134976,2016-06-14,17:40:48
742815044937879554,Por um mundo onde as pessoas nao cagam regras ortográficas em redes sociais,https://twitter.com/otaacosta/status/742815044937879554,2016-06-14,17:24:42
742814670571098112,"As pessoas nao entende que a gente não é misterioso, as vezes a gente só quer observar calado no canto da gente",https://twitter.com/otaacosta/status/742814670571098112,2016-06-14,17:23:12
742734396218834945,"Estudos de hj vai ser ao som da saudosa Amy Winehouse, automaticamente dá vontade de tomar um vinho barato e pensar na vida.",https://twitter.com/otaacosta/status/742734396218834945,2016-06-14,12:04:14
742724770240860161,"Bora lá enfrentar mais um dia, altas coisas pra fazer",https://twitter.com/otaacosta/status/742724770240860161,2016-06-14,11:25:59
742551173253746688,PQP que música foda,https://twitter.com/otaacosta/status/742551173253746688,2016-06-13,23:56:10
742549192585908224,"Se vc quiser socializar com um grupo nessa temperatura tem que chegar com as velhas frases de elevador ""E esse tempo en?!"" ""Que frio""",https://twitter.com/otaacosta/status/742549192585908224,2016-06-13,23:48:18
742381873117200385,Bronn melhor pessoa kkkkkkkkkkk,https://twitter.com/otaacosta/status/742381873117200385,2016-06-13,12:43:25
742049678120910850,Hoje é dia de clássico e GoT e eu nao tenho tv pra assistir,https://twitter.com/otaacosta/status/742049678120910850,2016-06-12,14:43:24
742006726011027456,"Com o passar do tempo, vc percebe que a melhor companhia é vc mesmo",https://twitter.com/otaacosta/status/742006726011027456,2016-06-12,11:52:43
741798000763228160,Percebo que a situação ta ruim quando fico olhando os moleque de 15 anos perder o BV e eu aqui sem ninguém! A que ponto chegamos meus amigos,https://twitter.com/otaacosta/status/741798000763228160,2016-06-11,22:03:19
741652225831886848,e a ultima coisa que eu quero hj é comer comida ruim,https://twitter.com/otaacosta/status/741652225831886848,2016-06-11,12:24:04
741643996632649728,"vc pensa que vai ser um dia tranquilo e tal, mas a pessoa faz o possível pra te irritar",https://twitter.com/otaacosta/status/741643996632649728,2016-06-11,11:51:22
741643705484988417,Nem é meio dia e eu já to puto com umas coisas,https://twitter.com/otaacosta/status/741643705484988417,2016-06-11,11:50:13
741334246149771264,fico indignado com a falta de educação das pessoas nas redes sociais,https://twitter.com/otaacosta/status/741334246149771264,2016-06-10,15:20:32
741333546112012289,não faço a menor idéia do que to fazendo com a minha vida,https://twitter.com/otaacosta/status/741333546112012289,2016-06-10,15:17:45
741304537244434434,"sou o tipo de pessoa que batalha pra pessoa dar atenção e depois q ta rolando o flerte perco o interesse em 2 min, preciso melhorar isso",https://twitter.com/otaacosta/status/741304537244434434,2016-06-10,13:22:29
740618928125313024,QUE TAL A SERIE DE DECISÕES PRA TOMAR UM RUMO NA VIDA,https://twitter.com/otaacosta/status/740618928125313024,2016-06-08,15:58:07
740610393672982528,"Queria saber como é a vida de quem tem talento bacana como cantar e tocar instrumentos, o unico talento q tenho é mexer as narinas sozinhas",https://twitter.com/otaacosta/status/740610393672982528,2016-06-08,15:24:12
740584853306015744,"se ta achando q vc ta na fase ruim, imagina o biel q só faz cagada atras da outra",https://twitter.com/otaacosta/status/740584853306015744,2016-06-08,13:42:43
740563154321715204,que belo dia pra sair nu na rua,https://twitter.com/otaacosta/status/740563154321715204,2016-06-08,12:16:29
740504655755640832,Nada melhor que dia dublado,https://twitter.com/otaacosta/status/740504655755640832,2016-06-08,08:24:02
740390295624396800,"depois dessa noite, é bom rezar um mantra e pedir pras energias ruins irem embora",https://twitter.com/otaacosta/status/740390295624396800,2016-06-08,00:49:36
740376580942376964,"sai de casa em uma jornada pra comprar um caldo e só encontro tiros, correria e B.O,ou seja mais um dia normal em Divinópolis",https://twitter.com/otaacosta/status/740376580942376964,2016-06-07,23:55:07
740322822153768962,"tao bonito o rosto, pena que fala tanta merda",https://twitter.com/otaacosta/status/740322822153768962,2016-06-07,20:21:29
740266998882439168,estudos indicam grande porcentagem de nao dar minhas caras na facul hoje a noite,https://twitter.com/otaacosta/status/740266998882439168,2016-06-07,16:39:40
739651067777056772,jovens de hoje em dia só pensam em signos e esquecem de estudar,https://twitter.com/otaacosta/status/739651067777056772,2016-06-05,23:52:11
739564997211197440,"o cara consegue bater o carro no muro um dia antes da gente ir embora, pqp, deixasse pra acertar depois que eu chegasse em casa",https://twitter.com/otaacosta/status/739564997211197440,2016-06-05,18:10:10
739449927642841089,"festinha meia boca ontem, e pra encerrar a noite atravessamos a cidade a pé e corremos de cachorros",https://twitter.com/otaacosta/status/739449927642841089,2016-06-05,10:32:55
1143297846722093056,Apesar da quantidade de trabalhos pra fazer e ter que fazer mudança eu tô super bem e sabendo lidar com as coisas,https://twitter.com/otaacosta/status/1143297846722093056,2019-06-24,20:20:22
1136739343148752909,Com quase 25 anos nas costas e tendo que passar por coisas que não passei quando tinha 13 anos,https://twitter.com/otaacosta/status/1136739343148752909,2019-06-06,17:59:13
1136684141012013057,Tá rolando CSI no grupo do prédio porque alguém bateu forte o portão e quebrou o vidro.,https://twitter.com/otaacosta/status/1136684141012013057,2019-06-06,14:19:52
1136090747206344707,Até quando a gente tá super de boas a Psicóloga joga umas coisas na cara da gente pra derrubar,https://twitter.com/otaacosta/status/1136090747206344707,2019-06-04,23:01:56
1135647785188024322,"Eu que vou me dar a festa, odeio ser o último a saber das coisas",https://twitter.com/otaacosta/status/1135647785188024322,2019-06-03,17:41:45
1135356717578014720,Essas músicas do Edson e Hudson me faz lembrar quando eu tinha 13/14 anos sofrendo porque a menina da minha sala que eu era apaixonado não me correspondia,https://twitter.com/otaacosta/status/1135356717578014720,2019-06-02,22:25:10
1135352776861634560,Eu pedi um hoje de 200 ml com 4 adicionais e demorou 1 hora,https://twitter.com/otaacosta/status/1135352776861634560,2019-06-02,22:09:30
1135282441286017025,"Ontem tentaram roubar meu celular colocando a mão no meu bolso, sorte que fui mais esperto e consegui evitar, não vou perder outro celular pra vagabundo  pic.twitter.com/m51lA0o8LV",https://twitter.com/otaacosta/status/1135282441286017025,2019-06-02,17:30:01
1135276513937506304,Gustavo Lima fala umas bostas mas não dá pra não falar que o cara canta bem e as músicas dói na alma,https://twitter.com/otaacosta/status/1135276513937506304,2019-06-02,17:06:27
1135211047059644417,Meu deus do céu morrendo de dor de cabeça e gripe,https://twitter.com/otaacosta/status/1135211047059644417,2019-06-02,12:46:19
1134359915450044416,"""De quem é a culpa"" é a música que eu posso ouvir sempre que vou chorar",https://twitter.com/otaacosta/status/1134359915450044416,2019-05-31,04:24:13
1134359672482344960,@MariliaMReal Deusa! Que show maravilhoso.,https://twitter.com/otaacosta/status/1134359672482344960,2019-05-31,04:23:15
1134072760995655680,"Segunda a quinta pego 10:00 no trabalho, e só sexta que pego 9:00, e eu vim 1 hora mais cedo porquê achei que hoje era sexta! AAAAAA",https://twitter.com/otaacosta/status/1134072760995655680,2019-05-30,09:23:10
1133931864564088832,"Eu na verdade tô tentando dormir, mas já acostumei com tantas festas que rola ali que nem incomoda mais",https://twitter.com/otaacosta/status/1133931864564088832,2019-05-30,00:03:18
1133913517382406144,"Lembrando que sexta eu trabalho faço atendimento no estágio e tô fazendo um trabalho da faculdade, e eu vou mesmo assim chorar no show da Marília",https://twitter.com/otaacosta/status/1133913517382406144,2019-05-29,22:50:24
1133883231785443328,Segura Marília Mendonça que vou chorar até no seu show,https://twitter.com/otaacosta/status/1133883231785443328,2019-05-29,20:50:03
1133883057340080130,"Não tô acreditando que ganhei o sorteio de um camarote para amanhã do rodeio!!!! Nunca ganhei nada na vida, primeira vez",https://twitter.com/otaacosta/status/1133883057340080130,2019-05-29,20:49:22
1133436894954557440,"Acabo de lembrar que deixei as anotações do estágio lá em casa, hoje na orientação vou ter que falar o que eu lembro de cabeça",https://twitter.com/otaacosta/status/1133436894954557440,2019-05-28,15:16:28
1133183463568412672,"Marquei terapia amanhã, e por incrível que pareça não tenho nada demais pra falar. E é aí que tá o problema",https://twitter.com/otaacosta/status/1133183463568412672,2019-05-27,22:29:25
1132993536834625536,"Garganta inflamada, sinusite atacando, nariz entupido, dor de cabeça, hoje eu dou uma voadora no primeiro que me encher o saco",https://twitter.com/otaacosta/status/1132993536834625536,2019-05-27,09:54:43
1132383978336530432,Tenho festa de criança pra ir hoje e tô muito feliz porque vou tirar a barriga da miséria,https://twitter.com/otaacosta/status/1132383978336530432,2019-05-25,17:32:33
1132241159701635072,Não vejo a hora de acabar o expediente pra poder voltar pra cama,https://twitter.com/otaacosta/status/1132241159701635072,2019-05-25,08:05:03
1131719994776195077,A que ponto cheguei de falar pro wpp do Texas que tô bad,https://twitter.com/otaacosta/status/1131719994776195077,2019-05-23,21:34:07
1131022202801938433,"Passou fio dental forte? Esses dias meu dente sangrou por 3 dias aí parou pensei que fosse gengivite ou fio dental que cortou, mas aí parou e eu nem preocupei mais",https://twitter.com/otaacosta/status/1131022202801938433,2019-05-21,23:21:21
1130476642588082176,E desde quando tá frio essa hora?  pic.twitter.com/Hu1eH2XwMm,https://twitter.com/otaacosta/status/1130476642588082176,2019-05-20,11:13:29
1130301647505317888,"Pelo menos não teve favoritismo dos produtores pra colocar alguém do trono, tipo não vai ser Daenerys nem Jon, vai ser esse cara aqui aí todo mundo reclama igual",https://twitter.com/otaacosta/status/1130301647505317888,2019-05-19,23:38:07
1130281158774841344,Tyrion não é só você que tá triste!,https://twitter.com/otaacosta/status/1130281158774841344,2019-05-19,22:16:42
1130198019977162753,"Nossa amanhã já é segunda, puta que pariu, só queria dormir uns 3 dias direto",https://twitter.com/otaacosta/status/1130198019977162753,2019-05-19,16:46:20
1129217273661726720,Falar em raiva duas coisas que eu odeio igualmente: militante do PT e bolsominion.,https://twitter.com/otaacosta/status/1129217273661726720,2019-05-16,23:49:12
1129213301932666880,Uma das últimas coisas que quero manter é o grupo da sala ahahahaha,https://twitter.com/otaacosta/status/1129213301932666880,2019-05-16,23:33:25
1129212905822576640,"Comecei a dormir e do nada comecei a pensar que ano que vem minha jornada na UEMG acaba, aí é aquela hora de despedir de todos e cada um seguir o rumo e nunca mais se ver!",https://twitter.com/otaacosta/status/1129212905822576640,2019-05-16,23:31:51
1128806068262461440,O episódio do irmão do jorel que a Lara vai embora pro Japão me fez chorar! Meu deus tá escorrendo lágrimas,https://twitter.com/otaacosta/status/1128806068262461440,2019-05-15,20:35:13
1128382225916018690,Um parabéns pro fotógrafo que colocou um filtro bosta nas fotos da festa da tcheca que deixou todo mundo parecendo que passou batom vermelho,https://twitter.com/otaacosta/status/1128382225916018690,2019-05-14,16:31:01
1128026177677950977,Sempre tive facilidade para falar e decorar as coisas e hoje no trabalho eu simplesmente deu branco e eu não sabia pronunciar uma palavra corretamente,https://twitter.com/otaacosta/status/1128026177677950977,2019-05-13,16:56:13
1127783848631308288,"@borntosofrer tá feliz com a sua ""rainha""?",https://twitter.com/otaacosta/status/1127783848631308288,2019-05-13,00:53:17
1127783547635417088,Se a Arya matar a Daenerys (o que deve rolar) eu vou ficar muito feliz,https://twitter.com/otaacosta/status/1127783547635417088,2019-05-13,00:52:05
1127187512265445376,"Puta que pariu fui obrigado a abrir mão de certas coisas ontem e fiz papel de ridículo, nunca mais eu ouço os conselhos de alguém",https://twitter.com/otaacosta/status/1127187512265445376,2019-05-11,09:23:39
1126853051116150784,Tenho que ir pra casa amanhã e nem carona arrumei,https://twitter.com/otaacosta/status/1126853051116150784,2019-05-10,11:14:37
1126816014820421638,Acordei feliz e confiante! Fé em Deus irmão que o dia vai ser bom.,https://twitter.com/otaacosta/status/1126816014820421638,2019-05-10,08:47:27
1126517904516833282,Contei só verdade,https://twitter.com/otaacosta/status/1126517904516833282,2019-05-09,13:02:52
1125603007239020544,"E fico feliz da série mostrar ela como a mais preparada pra governar, se ela ficar no trono eu fico feliz, Daenerys e Jon podem morrer.",https://twitter.com/otaacosta/status/1125603007239020544,2019-05-07,00:27:24
1125395215072808960,"Meses atrás certas situações me deixaria muito mal, angustiado ou triste. Agora eu tô cagando e andando e fico feliz por não me sentir incomodado",https://twitter.com/otaacosta/status/1125395215072808960,2019-05-06,10:41:42
1124412559027838976,A burocracia me obriga a abrir mão do meu silêncio pra resolver coisas,https://twitter.com/otaacosta/status/1124412559027838976,2019-05-03,17:36:59
1124124707987558400,"Ok não sou a pessoa com o mais perfeito psicológico que existe, não sou fácil eu admito, mas dessa vez eu estou certo",https://twitter.com/otaacosta/status/1124124707987558400,2019-05-02,22:33:10
1124090944725422081,Energia do amor,https://twitter.com/otaacosta/status/1124090944725422081,2019-05-02,20:19:00
1123683329436471298,Se a vida for uma série sendo assistida por ETs eu to naquela parte que meu personagem fica pensativo decidido nas decisões que tomei tocando uma musica triste de fundo,https://twitter.com/otaacosta/status/1123683329436471298,2019-05-01,17:19:17
1122878362148646918,É pra amanhã?,https://twitter.com/otaacosta/status/1122878362148646918,2019-04-29,12:00:38
1122188805958774784,Verdade eu era a mãe,https://twitter.com/otaacosta/status/1122188805958774784,2019-04-27,14:20:35
1122089471204298753,Não vejo a hora de ir na Psicologa pra poder despejar o ódio acumulado dessa semana,https://twitter.com/otaacosta/status/1122089471204298753,2019-04-27,07:45:52
1121941303514808320,"Gosto de morte, se eu não aparecer amanhã é porque morri",https://twitter.com/otaacosta/status/1121941303514808320,2019-04-26,21:57:06
1121581748180193282,Eu estou andando tão triste esses dias que nem comer eu tô conseguindo mais,https://twitter.com/otaacosta/status/1121581748180193282,2019-04-25,22:08:21
1121238025214808064,"Se tem uma coisa que me faz bem é as coisas darem certo pros meus amigos, eu fico muito na torcida que dê certo!",https://twitter.com/otaacosta/status/1121238025214808064,2019-04-24,23:22:31
1120503146705498112,"Sim, não tinha nenhum sentimento nem de amor e nem de ódio, sempre foi indiferente",https://twitter.com/otaacosta/status/1120503146705498112,2019-04-22,22:42:22
1120482323022131201,"Obrigado! Só tô mal pensando nisso, podia não ser a melhor pessoa do mundo mas era meu pai né",https://twitter.com/otaacosta/status/1120482323022131201,2019-04-22,21:19:38
1120480329561792512,"É muito estranho não conseguir se sentir mal pela perda de alguém, ainda mais quando essa pessoa tem um laço sanguíneo com você",https://twitter.com/otaacosta/status/1120480329561792512,2019-04-22,21:11:42
1119730758346788869,"Fiquei tipo, q?",https://twitter.com/otaacosta/status/1119730758346788869,2019-04-20,19:33:11
1119336784792563714,Liguei ontem pra minha mãe e ela disse que vai fazer pudim assim que eu chegar lá! Eu tô muito feliz,https://twitter.com/otaacosta/status/1119336784792563714,2019-04-19,17:27:40
1119336357258833920,Empolguei dançando sozinho e acho que dei jeito no pescoço.,https://twitter.com/otaacosta/status/1119336357258833920,2019-04-19,17:25:58
1118096539052851201,"22:15 eu pra minha psicóloga: Não vou poder ir na terapia amanhã, deixa pra próxima semana, eu tô bem tranquilo...  22:58: Na verdade deixa marcado porque já passei raiva e vou bater em alguém.",https://twitter.com/otaacosta/status/1118096539052851201,2019-04-16,07:19:22
1117553768898400261,"A gente tem que aprender a virar sozinho, porque quando mais se precisa poucos estende a mão pra ajudar, e nessas horas a gente vê quem realmente se importa com a gente.",https://twitter.com/otaacosta/status/1117553768898400261,2019-04-14,19:22:36
1117214015514710016,"A maior hipocrisia do aluno de psicologia é falar que tem que ter empatia e saber ouvir o próximo, quando na verdade não põe em prática e só olha pro próprio umbigo",https://twitter.com/otaacosta/status/1117214015514710016,2019-04-13,20:52:32
1116824916437938176,Eu vendo a professora falar que quem chegar após as 19:15 vai levar  falta  pic.twitter.com/dvQ8t7qXjc,https://twitter.com/otaacosta/status/1116824916437938176,2019-04-12,19:06:24
1115377373950640128,Hoje consegui ficar 10/10 até agora. Estou com medo de comemorar e mais tarde dar ruim,https://twitter.com/otaacosta/status/1115377373950640128,2019-04-08,19:14:23
1112193966068375552,Odeio que pegam minhas coisas sem pedir,https://twitter.com/otaacosta/status/1112193966068375552,2019-03-31,00:24:39
1112192654664744966,Muito feliz com o rolê de hoje comi demais e bebi demais. Tô muito feliz,https://twitter.com/otaacosta/status/1112192654664744966,2019-03-31,00:19:27
1112123845887041536,"Até quando eu tô pronto a 1 hora, eu consigo atrasar",https://twitter.com/otaacosta/status/1112123845887041536,2019-03-30,19:46:01
1112050925181505541,Prevejo eu indo trabalhar de ressaca de sono na sexta porque quinta é show da Marília Mendonça e não abro mão por nada.,https://twitter.com/otaacosta/status/1112050925181505541,2019-03-30,14:56:16
1111958532121858050,"Como diz aquele Gif da Vani : ""eu vou entrar pro mundo do entretenimento e vou encher meu cu de dinheiro""",https://twitter.com/otaacosta/status/1111958532121858050,2019-03-30,08:49:07
1111808021490003968,Mensagens de dor e sofrimento: [29/3 20:16] Vitim: Ele num tá nem aí pra vc [29/3 20:17] Vitim: Pra falar vrdd,https://twitter.com/otaacosta/status/1111808021490003968,2019-03-29,22:51:03
1111112974389964800,Minha cabeça não para de rodar socorro,https://twitter.com/otaacosta/status/1111112974389964800,2019-03-28,00:49:11
1110507059500453888,"Eu: vou ser mais discreto, guardar as coisas pra mim... Eu também: Com 5 dias que estou na empresa estou abrindo toda minha vida com a tia do café.",https://twitter.com/otaacosta/status/1110507059500453888,2019-03-26,08:41:29
1110346616358223872,Impossível não chorar!,https://twitter.com/otaacosta/status/1110346616358223872,2019-03-25,22:03:57
1110207919977648128,Verdade eu era o banco do Uber  https://twitter.com/lubrasil/status/1109951294138187776 …,https://twitter.com/otaacosta/status/1110207919977648128,2019-03-25,12:52:49
1109634589914513408,Acendendo um incenso amanhã pra tirar a energia ruim que certas pessoas traz pra essa casa (detalhe não é meu convidado),https://twitter.com/otaacosta/status/1109634589914513408,2019-03-23,22:54:36
1109227162744303622,"Nao posso falar que tô feliz que já aparece algo pra me chatear, tomar no cu",https://twitter.com/otaacosta/status/1109227162744303622,2019-03-22,19:55:38
1109226865141653505,Feliz demais! Nem parece aquele surtado de um tempo atrás,https://twitter.com/otaacosta/status/1109226865141653505,2019-03-22,19:54:27
1108927640126124036,"Que orgulho de você, fico muito feliz ❤️❤️❤️❤️",https://twitter.com/otaacosta/status/1108927640126124036,2019-03-22,00:05:26
1108871226532024326,Eu tava super feliz cantando Sandy e Junior enquanto hidratava meu cabelo e questão de minutos eu já tô puto e triste,https://twitter.com/otaacosta/status/1108871226532024326,2019-03-21,20:21:16
1108869176687513604,Não conversa comigo porque tô bolado com umas coisas que inventei na minha cabeça,https://twitter.com/otaacosta/status/1108869176687513604,2019-03-21,20:13:08
1107777280644968448,Bebi 2 copos de café e agora que o efeito passou tô custando manter o olho aberto,https://twitter.com/otaacosta/status/1107777280644968448,2019-03-18,19:54:19
1107703486588862464,"Vou fazer minha vitamina e ir pra academia, se eu não der sinal de vida dentro de 1 hora é pq morri",https://twitter.com/otaacosta/status/1107703486588862464,2019-03-18,15:01:05
1107008881593585664,Muito feliz com o dinheirinho que faturei hoje,https://twitter.com/otaacosta/status/1107008881593585664,2019-03-16,17:00:59
1106688130772549632,Amanhã vou trampar preciso levantar 7 da manhã,https://twitter.com/otaacosta/status/1106688130772549632,2019-03-15,19:46:26
1106383267404632065,"As coisas lá na minha casa de Abaeté não estão legais, espero que meu avô recupere logo e que minha mãe tenha força pra conseguir cuidar dos meus avós",https://twitter.com/otaacosta/status/1106383267404632065,2019-03-14,23:35:01
