id,tweet,link,date,time
922820785303105537,"Fico bad no máximo 2 dias e depois sigo o baile, mundo é cheio de pessoas não precisamos ficar presos em embustes",https://twitter.com/otaacosta/status/922820785303105537,2017-10-24,11:43:15
922277016669446144,ainda bem que adiaram a prova de amanha pq se não eu ja teria pulado de cima do terraço a tempos,https://twitter.com/otaacosta/status/922277016669446144,2017-10-22,23:42:30
922260346823462915,As coisas que eu sou obrigado a ler é de cair o cu da bunda,https://twitter.com/otaacosta/status/922260346823462915,2017-10-22,22:36:16
922260254204801024,"Cheguei a conclusão que não fico puto com as coisas mais, fico só chateado",https://twitter.com/otaacosta/status/922260254204801024,2017-10-22,22:35:54
920809193765969920,Miguel me atualizando as coisas pra entregar pra semana q vem e eu começando a chorar de desespero,https://twitter.com/otaacosta/status/920809193765969920,2017-10-18,22:29:54
920078819389837312,Nem preciso falar como eu tô agora,https://twitter.com/otaacosta/status/920078819389837312,2017-10-16,22:07:39
918668887889149952,Tarde demais,https://twitter.com/otaacosta/status/918668887889149952,2017-10-12,23:45:05
918653308990033921,Tipo isso  https://twitter.com/allanlac/status/918646462480777216 …,https://twitter.com/otaacosta/status/918653308990033921,2017-10-12,22:43:11
917934791395119104,Será que é sentimento recíproco ou só fogo no rabo mesmo?,https://twitter.com/otaacosta/status/917934791395119104,2017-10-10,23:08:03
917933176940572672,Acho que 2017 parte 2 tá tenso pra todo mundo,https://twitter.com/otaacosta/status/917933176940572672,2017-10-10,23:01:38
917372698195628033,"O plano era levantar cedo pra fazer várias coisas, mas acordei tarde e vou fazer nada",https://twitter.com/otaacosta/status/917372698195628033,2017-10-09,09:54:29
917235016014364672,"Essa saída com o pessoal foi muito bom, ajudou tirar as idéias ruins da cabeça,grato por ter pessoas especiais junto a mim!",https://twitter.com/otaacosta/status/917235016014364672,2017-10-09,00:47:23
916620266180173824,Oi meninas tudo bom? Hoje vou ensinar a chorar no banho pra disfarçar as lágrimas,https://twitter.com/otaacosta/status/916620266180173824,2017-10-07,08:04:36
915972588970676224,Feliz demais,https://twitter.com/otaacosta/status/915972588970676224,2017-10-05,13:10:57
915567674582761472,Tô rindo do pessoal surtado pós prova e eu rindo pq você não fica triste por errar uma questão se você não fizer a questão,https://twitter.com/otaacosta/status/915567674582761472,2017-10-04,10:21:58
915406425425350657,Espero que o professor considere as manchas de lágrimas no papel na hora de corrigir a prova,https://twitter.com/otaacosta/status/915406425425350657,2017-10-03,23:41:13
915406247150653440,Prova valendo 25 pts amanhã às 7:00 e o pessoal da sala falando em festa quando o período acabar,https://twitter.com/otaacosta/status/915406247150653440,2017-10-03,23:40:31
915200153325375488,Cheirinho de quem vai super mal na prova amanha,https://twitter.com/otaacosta/status/915200153325375488,2017-10-03,10:01:34
914672202951397383,"Meu grupo apresenta amanhã e sou o primeiro a falar, 4 períodos de faculdade e eu odeio apresentar trabalho",https://twitter.com/otaacosta/status/914672202951397383,2017-10-01,23:03:41
914457115305136128,Segura na mão de Deus e vá,https://twitter.com/otaacosta/status/914457115305136128,2017-10-01,08:49:00
913822437518831616,Trabalhei de 7 as 14:00 tô com a tarde livreeeee,https://twitter.com/otaacosta/status/913822437518831616,2017-09-29,14:47:01
913606529668063232,"Mas isso são coisas pra se pensar em outra hora, hoje o foco é não me matar",https://twitter.com/otaacosta/status/913606529668063232,2017-09-29,00:29:05
913581096666836992,Às vezes esqueço que o @LucasRMorais tá aqui nessa rede social de olho no que eu posto,https://twitter.com/otaacosta/status/913581096666836992,2017-09-28,22:48:01
913580747969241089,"Eu sei, mas são tipo de coisa que eu tenho que me virar sozinho kkkk",https://twitter.com/otaacosta/status/913580747969241089,2017-09-28,22:46:38
913579956956991488,Tão engraçado estar sempre rodeado de pessoas e mesmo assim se sentir sem porto seguro,https://twitter.com/otaacosta/status/913579956956991488,2017-09-28,22:43:29
912087439489028098,"cachorro e prédio nao dá certo, por isso vou comprar um peixe",https://twitter.com/otaacosta/status/912087439489028098,2017-09-24,19:52:45
912069192018464769,"Esse web giz também ta um lixo, vou meter o pé naquela secretaria amanha, putaria é essa que esse servidor da UEMG que nunca funciona",https://twitter.com/otaacosta/status/912069192018464769,2017-09-24,18:40:15
911978116335235078,"eu acordei tipo 2 horas atrasado, e nao sei como vou vencer esse dia",https://twitter.com/otaacosta/status/911978116335235078,2017-09-24,12:38:21
911756605699575808,"A mão pra cima, cintura solta, dá meia volta dança kuduru!",https://twitter.com/otaacosta/status/911756605699575808,2017-09-23,21:58:09
911442964773208064,menina vc não viu que vai ser o fim do mundo,https://twitter.com/otaacosta/status/911442964773208064,2017-09-23,01:11:51
911050533796040705,sem maturidades para falar sobre coisas sobrenaturais,https://twitter.com/otaacosta/status/911050533796040705,2017-09-21,23:12:28
911037337878122496,"Nessa rep também é cultura e debates dos acontecimentos atuais, tipo o momento na cozinha com o Lucas e o Davi",https://twitter.com/otaacosta/status/911037337878122496,2017-09-21,22:20:02
910887533919252480,"Nem feliz e nem com bad, to suave hoje",https://twitter.com/otaacosta/status/910887533919252480,2017-09-21,12:24:46
910881252546359296,tem tanta coisa passando nessa minha cabeça desmiolada que só jesus na causa,https://twitter.com/otaacosta/status/910881252546359296,2017-09-21,11:59:48
910704909254840320,Prova amanha e eu simplesmente nao estudei,https://twitter.com/otaacosta/status/910704909254840320,2017-09-21,00:19:05
910698458553765889,"Hoje foi é niver do Paulinho, teve bolo, cachorro quente e fotos do Dr Rey e de tatus para de decoração",https://twitter.com/otaacosta/status/910698458553765889,2017-09-20,23:53:27
909972394734911489,Como conversar com as pessoas por msg sem todo mundo achar que esta com raiva- Pesquisar,https://twitter.com/otaacosta/status/909972394734911489,2017-09-18,23:48:20
909963795119800321,"Já vou começar meu cursinho de inglês pra vazar desse país, vou viver recluso no Tibet",https://twitter.com/otaacosta/status/909963795119800321,2017-09-18,23:14:09
909202683638222848,"Festa ontem foi tipo: QUE BOSTA, GASTEI DINHEIRO ATOA...CALMA QUE VAI COMEÇAR FUNK E EU VOU BEBER PRA ANIMAR...CARAAAI EU TO LOUCO QUE FESTA",https://twitter.com/otaacosta/status/909202683638222848,2017-09-16,20:49:46
908341397358608384,"Apaguei uma das melhores fotos do meu instagram sem querer, to bem triste",https://twitter.com/otaacosta/status/908341397358608384,2017-09-14,11:47:19
907990163695050755,Esse estudo dirigido de politicas basicas de saude ta fudendo comigo,https://twitter.com/otaacosta/status/907990163695050755,2017-09-13,12:31:39
907013582256263168,"To estudando pra prova amanha e adiantando os trabalhos da semana, nem ta parecendo comigo",https://twitter.com/otaacosta/status/907013582256263168,2017-09-10,19:51:04
906641420131414016,"Oi meninas vou passar hoje a minha dieta balanceada em gordura, carboidratos e coisas q fazem mal",https://twitter.com/otaacosta/status/906641420131414016,2017-09-09,19:12:13
906615214032003073,Oh as coisas q eu fico pensando enquanto tomo sorvete vei,https://twitter.com/otaacosta/status/906615214032003073,2017-09-09,17:28:05
904906753304907777,Simplesmente caguei pra atividade avaliativa de amanha,https://twitter.com/otaacosta/status/904906753304907777,2017-09-05,00:19:16
904889918316580864,Sem falar q panela de pressao nao saiu toda pressao e fomos pro quarto com medo dela explodir,https://twitter.com/otaacosta/status/904889918316580864,2017-09-04,23:12:23
904738052320493573,To bem tipo sei lá,https://twitter.com/otaacosta/status/904738052320493573,2017-09-04,13:08:55
904426809537724417,Hoje teve reunião para resolver o trabalho pra apresentar amanha e de quebra teve lasanha e a Parraê fazendo massagem nas costas,https://twitter.com/otaacosta/status/904426809537724417,2017-09-03,16:32:09
903435180043579392,e a materia pra amanha ta em dia?,https://twitter.com/otaacosta/status/903435180043579392,2017-08-31,22:51:46
903433183592632320,PQP ALGUEM MEXEU COM OS CACHORROS E ELES VOLTARAM A CHORAR,https://twitter.com/otaacosta/status/903433183592632320,2017-08-31,22:43:50
903415065491238915,Caralho esses cachorros nao param de chorar,https://twitter.com/otaacosta/status/903415065491238915,2017-08-31,21:31:50
903277879789805568,"Maria achou dois filhotinhos de cachorro abandonados, agora estamos na missão de achar um lar para eles",https://twitter.com/otaacosta/status/903277879789805568,2017-08-31,12:26:43
903082151033393152,Trabalho pra apresentar amanha e eu to bem cansado,https://twitter.com/otaacosta/status/903082151033393152,2017-08-30,23:28:57
903082047979257856,"Minha relação com a galera da rep é de quase pai, se um fica doente eu me preocupo, agora to acordando todo mundo pra ir na aula...",https://twitter.com/otaacosta/status/903082047979257856,2017-08-30,23:28:33
902559501999636481,"coração ta gelado, a maldade na mente, varios falam a verdade, mas tu gosta de quem mente🎶",https://twitter.com/otaacosta/status/902559501999636481,2017-08-29,12:52:08
901957300339998727,"To puto ainda com relação algumas coisas, mas sou assim, preciso de um tempao pra poder pensar em voltar o q era",https://twitter.com/otaacosta/status/901957300339998727,2017-08-27,20:59:12
901939750034132992,compartilho do mesmo sentimento,https://twitter.com/otaacosta/status/901939750034132992,2017-08-27,19:49:28
901761295518707712,sempre feliz,https://twitter.com/otaacosta/status/901761295518707712,2017-08-27,08:00:21
901605432082489344,completamente perdido nas coisas pra fazer semana que vem,https://twitter.com/otaacosta/status/901605432082489344,2017-08-26,21:41:00
901604559042351104,"Uma vida baseada em apagar algumas coisas que postei, quando tt com raiva/estressado",https://twitter.com/otaacosta/status/901604559042351104,2017-08-26,21:37:32
901059119771258880,Acordei me sentindo a pior pessoa do mundo,https://twitter.com/otaacosta/status/901059119771258880,2017-08-25,09:30:09
901050242497474561,me sentindo a pior pessoa do mundo,https://twitter.com/otaacosta/status/901050242497474561,2017-08-25,08:54:53
900894459226988546,Não estava em meu perfeito estado quando tt isso,https://twitter.com/otaacosta/status/900894459226988546,2017-08-24,22:35:51
900892191970799616,"To feliz, me disseram que sou bonito, e olha q me compararam com uma pessoa 10/10, e ainda me acharam mais bonito que ela",https://twitter.com/otaacosta/status/900892191970799616,2017-08-24,22:26:50
900881778931621888,"Hoje é você amanhã será quem for, for Serei um bom perdedor E meu mundo não vai mudar Até que alguém ocupe seu lugar🎶",https://twitter.com/otaacosta/status/900881778931621888,2017-08-24,21:45:28
900192768823361536,"Esse momento que to passando de me conhecer melhor, tirar mais tempo pra mim, ta so me trazendo coisas boas",https://twitter.com/otaacosta/status/900192768823361536,2017-08-23,00:07:35
900192619011219461,Lá no trabalho as coisas vao se ajeitando também,https://twitter.com/otaacosta/status/900192619011219461,2017-08-23,00:06:59
899819579840573440,"ta meio gay essa foto, ainda bem que no twitter todo mundo é viado",https://twitter.com/otaacosta/status/899819579840573440,2017-08-21,23:24:40
899638024774070273,"Tão triste quando as pessoas criam ideias erradas, problema que só vão perdendo pontos comigo, fiz o possivel para nao afrouxar os laços",https://twitter.com/otaacosta/status/899638024774070273,2017-08-21,11:23:14
899457700161089536,"Sobreviveu gente demais nesse ep, muito estranho isso",https://twitter.com/otaacosta/status/899457700161089536,2017-08-20,23:26:41
899277636626776065,pessoas que são julgadas por coisas que nem fez e mesmo assim fica de boas para nao tretar me add,https://twitter.com/otaacosta/status/899277636626776065,2017-08-20,11:31:10
899257645651111936,voce merece todo carinho do mundo,https://twitter.com/otaacosta/status/899257645651111936,2017-08-20,10:11:44
899109046715854848,"Não é q o role tava ruim, tava otimo, pena q coisas pessoais acabou nao deixando eu curtir a festa",https://twitter.com/otaacosta/status/899109046715854848,2017-08-20,00:21:16
899107539106836480,to só aquele twitter agradecendo a deus por ter as palpebras pra pode fechar e nao ver certas coisas,https://twitter.com/otaacosta/status/899107539106836480,2017-08-20,00:15:16
898700144778018818,amanha teremos o grande encontro,https://twitter.com/otaacosta/status/898700144778018818,2017-08-18,21:16:26
898541734715641856,"É tanto grupo no wpp q nao ta dando pra ser feliz com tanta msg, vou deixar só os de extrema importancia",https://twitter.com/otaacosta/status/898541734715641856,2017-08-18,10:46:58
897268005842898945,"se quiser beijar, opa vamo, mas se começar a ficar enrolando já sigo o baile",https://twitter.com/otaacosta/status/897268005842898945,2017-08-14,22:25:37
896868099357626369,To estressado mas to feliz que minha mae vai me dar um celular novo,https://twitter.com/otaacosta/status/896868099357626369,2017-08-13,19:56:32
895293651517100032,passou 1 hora e eu ja tava triste,https://twitter.com/otaacosta/status/895293651517100032,2017-08-09,11:40:14
894750509319442435,"vai dormir,oh a hora",https://twitter.com/otaacosta/status/894750509319442435,2017-08-07,23:41:59
894740871400357893,Um olho no twitter e outro nos textos para a aula de amanha,https://twitter.com/otaacosta/status/894740871400357893,2017-08-07,23:03:41
894281390103179266,Fé no pai q até amanha eu melhoro,https://twitter.com/otaacosta/status/894281390103179266,2017-08-06,16:37:53
893126192253087744,Congela o teu olhar no meu Esconde que já percebeu Que todo meu amor é teu amor Então vem cá...🎶🎶,https://twitter.com/otaacosta/status/893126192253087744,2017-08-03,12:07:32
892228974331482112,"ai quando abrimos mão e já nem sente mais nada a infeliz surge falando q sentia algo, mas já é tarde demais",https://twitter.com/otaacosta/status/892228974331482112,2017-08-01,00:42:18
892228748833161216,engraçado que quando vc se entrega pra pessoa ela meio que caga pra vc,https://twitter.com/otaacosta/status/892228748833161216,2017-08-01,00:41:25
891853972662890496,to com fome e nao to afim de fazer macarrao essa hora,https://twitter.com/otaacosta/status/891853972662890496,2017-07-30,23:52:11
891842983372484608,proximo ep Daenerys queimando todo mundo,https://twitter.com/otaacosta/status/891842983372484608,2017-07-30,23:08:31
891094322795380736,Hoje to como? Simone & Simaria - Amor Mal Resolvido ft. Jorge & Mateus  https://youtu.be/M6mPU3zFM_k  via @YouTube,https://twitter.com/otaacosta/status/891094322795380736,2017-07-28,21:33:36
890401293986131969,"Preguiça quando eu to conversando de boas e a pessoa começa a falar putaria do nada, pelo amor de deus ne me respeite",https://twitter.com/otaacosta/status/890401293986131969,2017-07-26,23:39:45
889141859951489024,Na hora que me escutar vai ver que isso não é drama 🎶🎶,https://twitter.com/otaacosta/status/889141859951489024,2017-07-23,12:15:13
888893097291239424,Aproveita amor,https://twitter.com/otaacosta/status/888893097291239424,2017-07-22,19:46:43
888885578397347840,"Projeto academia e comer só coisa saudável  foi pro buraco pela milésima vez, vou pedir sanduiche e ficar dormindo ate tarde nas férias",https://twitter.com/otaacosta/status/888885578397347840,2017-07-22,19:16:51
888234103853776897,tava sem net amor,https://twitter.com/otaacosta/status/888234103853776897,2017-07-21,00:08:07
888042620131389441,"Acordei 8 horas pra ter tempo de fazer minhas coisas, voltei pra cochilar mais 15 min e acordei 11 horas, não sei administrar minha vidaaa",https://twitter.com/otaacosta/status/888042620131389441,2017-07-20,11:27:14
887660921841225728,"É tão estranho o predio ta quase vazio, o silencio reina",https://twitter.com/otaacosta/status/887660921841225728,2017-07-19,10:10:30
887317161164894208,Galera pega no pé do Rodrigo Hilbert  por fazer um monte de coisas que seria o basico que geral devia saber fazer,https://twitter.com/otaacosta/status/887317161164894208,2017-07-18,11:24:31
886074533568012288,"Feliz demais por saber que a galera sente tanto carinho por mim, obrigado a todos que deram um jeito de parabenizar estao todos em meu core",https://twitter.com/otaacosta/status/886074533568012288,2017-07-15,01:06:45
886073786499575809,Vou ter que pegar estrada as 06:00 e to aqui acordado ainda,https://twitter.com/otaacosta/status/886073786499575809,2017-07-15,01:03:47
885688671470571520,"Sim chu, eu to muito felizao, sabado de manha to partindo, só nao consegui carona pra amanha, mas tenho q resolvr umas coisas tbm",https://twitter.com/otaacosta/status/885688671470571520,2017-07-13,23:33:29
885674230393786368,"Amanha será um aniversario bem adulto, o dia todo pagando boletos, fazendo faxina, e comprando brusinha (porque eu mereço)",https://twitter.com/otaacosta/status/885674230393786368,2017-07-13,22:36:06
885674012155793408,Só de saber q sábado de manha to chegando em casa já me deixa feliz demais!!!!!!!,https://twitter.com/otaacosta/status/885674012155793408,2017-07-13,22:35:14
885673900222369792,"Feliz por ganhar folga amanha e sábado, pena q não consegui carona pra amanha pra poder passar o aniversario com a família",https://twitter.com/otaacosta/status/885673900222369792,2017-07-13,22:34:47
884968387763474432,"Pode vir 4º periodo, mas nao agora pode esperar mais um pouco tipo 1 mes pra aparecer",https://twitter.com/otaacosta/status/884968387763474432,2017-07-11,23:51:20
883798822895452160,"Mano deitei ainda era de tarde, acordei e ja ta tudo escuro, to muito perdido",https://twitter.com/otaacosta/status/883798822895452160,2017-07-08,18:23:54
883435860070473729,"Fiquei 5 horas na UPA pra ser atendido e mais 1 hora tomando soro na veia, to muito cansado",https://twitter.com/otaacosta/status/883435860070473729,2017-07-07,18:21:37
883113983028449280,"garganta fudida, dor de cabeça, e tenho q ler um texto pra aula de amanha, eu to bem triste",https://twitter.com/otaacosta/status/883113983028449280,2017-07-06,21:02:35
882417806897184768,"Na minha cabeça sei tudo decorado, mas na hora que abro a boca pra falar sai: NVOBJSKJADSDOAHS",https://twitter.com/otaacosta/status/882417806897184768,2017-07-04,22:56:14
882417648570650624,Meu sonho  ter a facilidade pra expor pra fora o q tenho q falar na apresentação de trabalho,https://twitter.com/otaacosta/status/882417648570650624,2017-07-04,22:55:36
881619587611209730,Amanha tem prova de toda a matéria do período e eu nem to preocupado,https://twitter.com/otaacosta/status/881619587611209730,2017-07-02,18:04:24
881619280521031680,"E na hora que eu te beijei, foi melhooor q eu imagineeeeei...",https://twitter.com/otaacosta/status/881619280521031680,2017-07-02,18:03:10
881575087727681536,Dou muita pala das coisas que a @sousalsss me conta,https://twitter.com/otaacosta/status/881575087727681536,2017-07-02,15:07:34
880813517611380737,"pedi um marmitex a 1 hora atras, to morrendo de fome",https://twitter.com/otaacosta/status/880813517611380737,2017-06-30,12:41:21
880504937138049025,"Pessoas perguntando pq to online nas redes sociais essa hora, em vez de estar no trabalho: DESCUBRA",https://twitter.com/otaacosta/status/880504937138049025,2017-06-29,16:15:10
879527133634285568,Odeio ser o primeiro a falar do primeiro grupo a se apresentar,https://twitter.com/otaacosta/status/879527133634285568,2017-06-26,23:29:44
879527020073496576,23:28 e eu tentando fazer esquema pra apresentação de amanha,https://twitter.com/otaacosta/status/879527020073496576,2017-06-26,23:29:17
879323950379151361,Bora lá começar mais uma semana,https://twitter.com/otaacosta/status/879323950379151361,2017-06-26,10:02:21
879010102124195840,Boa tarde querida,https://twitter.com/otaacosta/status/879010102124195840,2017-06-25,13:15:14
877348622613991424,Twittando com um olho aberto e outro fechado enquanto descanso,https://twitter.com/otaacosta/status/877348622613991424,2017-06-20,23:13:06
877348474265763841,desculpa ser assim amor,https://twitter.com/otaacosta/status/877348474265763841,2017-06-20,23:12:31
876617414447960067,Descobri que tenho exercício avaliativo amanha e eu to assistindo Silvio Santos,https://twitter.com/otaacosta/status/876617414447960067,2017-06-18,22:47:33
875878909774049282,"KKKKKKKKKK sou muito iludido, chega ate ser engraçado",https://twitter.com/otaacosta/status/875878909774049282,2017-06-16,21:52:59
875376603538370560,A gente faz umas coisas e depois para e pensa ne: Meu Deus o que foi que eu fiz,https://twitter.com/otaacosta/status/875376603538370560,2017-06-15,12:37:00
874705515829489664,Amanha tem prova oral e eu to o que? Dançando quadrilha na facul,https://twitter.com/otaacosta/status/874705515829489664,2017-06-13,16:10:20
871100060146257921,Se vou chorar no show da Marilia Mendonça? Sim ou Claro?,https://twitter.com/otaacosta/status/871100060146257921,2017-06-03,17:23:33
868900360630521856,to sofrendo com as coisas da semana,https://twitter.com/otaacosta/status/868900360630521856,2017-05-28,15:42:44
868665220851544066,Eu posto umas coisas e depois vou reler fico tipo: q?,https://twitter.com/otaacosta/status/868665220851544066,2017-05-28,00:08:22
866405351104684033,NÃO CONVERSA COMIGO AGORA PQ TO BRAVO COM UMAS COISAS Q INVENTEI NA CABEÇA,https://twitter.com/otaacosta/status/866405351104684033,2017-05-21,18:28:27
864276126729895936,Já passou da hora de mozão aparecer na minha vida,https://twitter.com/otaacosta/status/864276126729895936,2017-05-15,21:27:40
860326807010201600,amanha tem festa e eu quero perder o famigerado controle,https://twitter.com/otaacosta/status/860326807010201600,2017-05-04,23:54:29
860130240387059712,Bom dia e vai todo mundo se foder,https://twitter.com/otaacosta/status/860130240387059712,2017-05-04,10:53:24
859951394966695936,"Deus abençoe que eu consiga levantar amanha cedo pra ir na aula, to sem celular, vou acordar pelo instinto.",https://twitter.com/otaacosta/status/859951394966695936,2017-05-03,23:02:44
859948907031351296,"As vezes paro olho pro nada, penso na vida e só falo: Deus toma conta",https://twitter.com/otaacosta/status/859948907031351296,2017-05-03,22:52:51
859103690992615424,se tem uma coisa que to hoje; É triste.,https://twitter.com/otaacosta/status/859103690992615424,2017-05-01,14:54:15
856312368309121025,eu levantando pra ir pra aula amanha as 7:00  https://twitter.com/veraholtzirreal/status/856312164583342081 …,https://twitter.com/otaacosta/status/856312368309121025,2017-04-23,22:02:32
856311300204396545,eu que te amo amor,https://twitter.com/otaacosta/status/856311300204396545,2017-04-23,21:58:18
856301071001636864,famoso pescoço de piroca,https://twitter.com/otaacosta/status/856301071001636864,2017-04-23,21:17:39
856293628741857280,impressionado com o tamanho do meu pescoço,https://twitter.com/otaacosta/status/856293628741857280,2017-04-23,20:48:04
856277548535361537,inclusive tem atividade avaliativa amanha e eu não aguento mais ler,https://twitter.com/otaacosta/status/856277548535361537,2017-04-23,19:44:11
856276329947439104,Tem hora que eu tenho umas ideias de jerico que só Deus pra ajudar,https://twitter.com/otaacosta/status/856276329947439104,2017-04-23,19:39:20
856135884453937152,"Domingo dia de estudar né, e nem sei por onde começar com tanta matéria acumulada",https://twitter.com/otaacosta/status/856135884453937152,2017-04-23,10:21:15
853790170122002432,feliz demais,https://twitter.com/otaacosta/status/853790170122002432,2017-04-16,23:00:13
853790096507760640,Eu to triste por estar feliz,https://twitter.com/otaacosta/status/853790096507760640,2017-04-16,22:59:56
851215821351288832,como eu vou tirar nota boa se estou com olhos marejados pensando em certas pessoas enquanto estudo,https://twitter.com/otaacosta/status/851215821351288832,2017-04-09,20:30:41
851157310449889286,Prova amanha e 2 trabalhos mais uma prova pra terça e eu nao sei o que faço da minha vida,https://twitter.com/otaacosta/status/851157310449889286,2017-04-09,16:38:11
851097180706394112,to triste,https://twitter.com/otaacosta/status/851097180706394112,2017-04-09,12:39:15
851097147936317446,Feliz demais,https://twitter.com/otaacosta/status/851097147936317446,2017-04-09,12:39:07
847880180949553154,sdds de falar isso no café com vcs,https://twitter.com/otaacosta/status/847880180949553154,2017-03-31,15:36:02
846529422127706112,vou chorar de emoçao,https://twitter.com/otaacosta/status/846529422127706112,2017-03-27,22:08:36
842545348056944644,Ouvindo AnaVitoria pq eu to com o coraçãozinho machucado,https://twitter.com/otaacosta/status/842545348056944644,2017-03-16,22:17:19
842545065289531392,"To no desafio de ficar a 21 dias sem reclamar, meia hora depois ja tava reclamando, mas bora fazendo que vai q da certo",https://twitter.com/otaacosta/status/842545065289531392,2017-03-16,22:16:11
839678897881026565,to triste mas to feliz,https://twitter.com/otaacosta/status/839678897881026565,2017-03-09,00:27:04
839465422575517696,Sempre que to triste ouço a musica com os tweets antigos do Neymar,https://twitter.com/otaacosta/status/839465422575517696,2017-03-08,10:18:47
837680662878564353,"deixa o cabelo do jeito q tá, pelo amor de deus n deixa ele grande",https://twitter.com/otaacosta/status/837680662878564353,2017-03-03,12:06:48
