id,tweet,link,date,time
1144041844491390976,Sua feição está abatida. Como estão suas noites de sono?,https://twitter.com/samusrt/status/1144041844491390976,2019-06-26,21:36:45
1137907230722990081,South Park da vida real.  https://twitter.com/Crazzyintheusa/status/1137777598354862080 …,https://twitter.com/samusrt/status/1137907230722990081,2019-06-09,23:19:59
1135361700788690944,"Um “artista” descobre que a amante está grávida, a espanca até desfigurar o rosto da mulher. Envia msg pra a esposa ajudar a criar o filho da amante, caso ela sobreviva. Depois se suicida e políticos do PSL estão prestando homenagem a esse monstro... fiquem longe dessas pessoas.",https://twitter.com/samusrt/status/1135361700788690944,2019-06-02,22:44:58
1134517109604716544,@netflix nunca te pedi nada e pago minha mensalidade rigorosamente em dia. Caso Evandro com roteiro do @mizanzuk já!,https://twitter.com/samusrt/status/1134517109604716544,2019-05-31,14:48:51
1131221732101115904,As feições de Abel Braga e @joicehasselmann fazem eles parecem que explodirão a qualquer momento.,https://twitter.com/samusrt/status/1131221732101115904,2019-05-22,12:34:12
1126675356339957760,"Minha experiência de ir ao Couto por 30 anos (1º jogos foi em 1989 contra o Matsubara), me faz parecer um vidente. Esse Coritiba não vai nem no grito da torcida!",https://twitter.com/samusrt/status/1126675356339957760,2019-05-09,23:28:32
1121452472944304129,"Minhas condolências ao maior jogador a vestir a camisa do @coritiba, Dirceu Krüger. O Flecha Loira foi rápido dentro dos campos, mas fora deles sua simpatia e calma faziam o tempo…  https://www.instagram.com/samusrt/p/Bwr3Zq5HZqz/?utm_source=ig_twitter_share&igshid=x8xh5iepz1f0 …",https://twitter.com/samusrt/status/1121452472944304129,2019-04-25,13:34:39
1121020061643345921,"Ainda não acabou, espera... no caminho do meu escritório para casa, passo ao lado do centro de distribuição da Livrarias Curitiba. Num dia lá estou no semáforo e quem atravessa na faixa de pedestre, com aquele uniforme cinza do pessoal da expedição? O cara que me deu o soco👊Fim!",https://twitter.com/samusrt/status/1121020061643345921,2019-04-24,08:56:24
1121020057537138688,"Foi assim que entrei para o mundo da tecnologia, nesse estágio aprendi inclusive a programar. Hoje sou criador de um app que proporciona economia compartilhada para milhares de pessoas e tenho uma vida financeira até que bem tranquila/privilegiada.",https://twitter.com/samusrt/status/1121020057537138688,2019-04-24,08:56:23
1121020055976841217,"Passei a noite toda lendo os livros e na manhã seguinte fui pra entrevista. O técnico que conversou comigo, anos mais tarde, confessou que nesse dia deu pra ver que eu não sabia trocar uma fonte de computador, mas resolver me dar uma chance.",https://twitter.com/samusrt/status/1121020055976841217,2019-04-24,08:56:23
1121020052566884353,"No dia da demissão, voltando pra casa, com o rosto machucado e chorando, vi uma escola técnica com uma vaga de estágio para informática. Não fazia um mês que eu estava fazendo curso Técnico de Informática, ferrado, entrei no local pra pedir informações.",https://twitter.com/samusrt/status/1121020052566884353,2019-04-24,08:56:22
1121020046845804545,"Um dia a pilha de papel sulfite caiu e quase atingiu um brother, na hora, um colega na brincadeira apontou e disse: “Foi o Samu que derrubou hahaha”... esse colaborador que quase foi atingido desferiu um soco na minha cara. Que humilhante!",https://twitter.com/samusrt/status/1121020046845804545,2019-04-24,08:56:21
1121020044333469696,"Sim, acreditem, só pessoas bonitas eram selecionadas para ficarem nas lojas. Como não fui contemplado com beleza na vida, independentemente da minha competência, os recrutadores me colocaram num lugar que minha feiúra não importava, ou seja, carregando cargas.",https://twitter.com/samusrt/status/1121020044333469696,2019-04-24,08:56:20
1121020028806148102,"Nesses dias foquei nas artes, as psicólogas até me fizeram cantar, já que eu gostava tanto de música. Cheguei no último dia da integração sendo aprovado em todos desafios, até uma redação tivemos que escrever e o ovo da nossa equipe continuava estava intacto.",https://twitter.com/samusrt/status/1121020028806148102,2019-04-24,08:56:17
1121020022330220545,"Entre as dinâmicas, separaram grupos, deram um copo de plástico, barbante, fita adesiva, bexiga e um ovo. A intenção era cada grupo jogar o ovo do 2º andar, chegando ao solo sem quebrá-lo. As equipes que salvassem a “vida” do ovo estavam aprovadas para a próxima fase.",https://twitter.com/samusrt/status/1121020022330220545,2019-04-24,08:56:15
1121020020648304641,"Na semana seguinte, formaram uma turma de 50 pessoas para dinâmica de grupo e integração. Ao final desse período de 5 dias, as “psicólogas” iriam selecionar os aprovados e conduzi-los aos respectivos setores que teriam mais aptidão.",https://twitter.com/samusrt/status/1121020020648304641,2019-04-24,08:56:15
1121020012419010560,Essa matéria mostra os abusos sofridos pelos “colaboradores” (assim que eles gostam de chamar os funcionários) da Livraria Cultura. No passado (por volta de 2001) trabalhei na Livrarias Curitiba e foi foda. Se liga nessa thread...  https://twitter.com/Andreizilla/status/1120826715817820161 …,https://twitter.com/samusrt/status/1121020012419010560,2019-04-24,08:56:13
1119938722311622656,No App @GoleiroAluguel inicia recebendo R$18/hora pra jogar “peladinha” entre os amigos. Tá bom?,https://twitter.com/samusrt/status/1119938722311622656,2019-04-21,09:19:33
1118929817129426947,"Engraçado, ele processou varias pessoas por se sentir ofendido. Hipocrisia que chama né?",https://twitter.com/samusrt/status/1118929817129426947,2019-04-18,14:30:31
1118927221031415808,Agora comenta aí quantas pessoas a polícia já mantou no Rio de Janeiro neste primeiro trimestre. Consegue?,https://twitter.com/samusrt/status/1118927221031415808,2019-04-18,14:20:12
1117609486682923009,Será que tá precisando de grana? Diz a lenda que ele deu casa pra todos amigos de infância.,https://twitter.com/samusrt/status/1117609486682923009,2019-04-14,23:04:00
1117378282020847616,Ele falhou. Agora pode ser contratado por uma startup maior ou virar palestrante pra contar como foi bom pra vida dele falhar.,https://twitter.com/samusrt/status/1117378282020847616,2019-04-14,07:45:16
1115583934627241984,"Minhas humildes aplicações renderam quase 13% em 45 dias desde 1º de janeiro, depois do Golden Shower estão em queda livre. Imagine como estão as noites de sono dos grandes investidores e seus milhões aplicados.",https://twitter.com/samusrt/status/1115583934627241984,2019-04-09,08:55:11
1115576659074220033,"Mano do Céu, é só vasculhar um pouco a vida de qualquer político filiado ao PSL, que descobrem sandices.",https://twitter.com/samusrt/status/1115576659074220033,2019-04-09,08:26:16
1114114700072169472,Esse partido só junta pessoas violentas e retrógradas.,https://twitter.com/samusrt/status/1114114700072169472,2019-04-05,07:36:58
1112672851646128128,"Parabéns @jairbolsonaro, hoje é um dia especial pra vc!",https://twitter.com/samusrt/status/1112672851646128128,2019-04-01,08:07:34
1108357581116968961,"Acho que o Marcos não tá acostumado a organizar a pelada, é uma dor de cabeça real não conseguir goleiro, já é tradição o guapo nem pagar os custos do campo e mesmo assim é difícil achar alguém disposto a ficar debaixo da trave.",https://twitter.com/samusrt/status/1108357581116968961,2019-03-20,10:20:14
1107294542276055041,"Os Bolsoranistas dizem que Bannon e Trump continuam bons amigos nos bastidores, tudo é estratégia 😁",https://twitter.com/samusrt/status/1107294542276055041,2019-03-17,11:56:06
1104067783057383428,"Percebi que algumas Starbucks retiraram as tomadas, por reclamações dos clientes que queriam consumir, mas os lugares estavam ocupados por pessoas que tomam apenas um copo de café e ficam no espaço por horas.",https://twitter.com/samusrt/status/1104067783057383428,2019-03-08,14:14:06
1102932103447097345,"@NetflixBrasil Losers me fez sorrir e chorar, na infância sonhei em ser goleiro, a vida tomou outro rumo e depois dos 30 anos realizei esse sonho, virando um jogador de futebol “profissional”, entre aspas mesmo, pois sou um Goleiro de Aluguel.",https://twitter.com/samusrt/status/1102932103447097345,2019-03-05,11:01:19
1099705830599995392,"A galerinha do Namur acha que é só ter campanhas bonitinhas nas redes sociais, que a torcida vai voltar a sentir orgulhoso. É inocência, falta de bagagem ou burrice mesmo?",https://twitter.com/samusrt/status/1099705830599995392,2019-02-24,13:21:16
1098749160524840960,“As fitas VHS” tá foda @AntiCast @mizanzuk,https://twitter.com/samusrt/status/1098749160524840960,2019-02-21,21:59:48
1098733858265157632,A missão do reinado do Príncipe Louco Namur é entregar o Coritiba na série C em 2021.,https://twitter.com/samusrt/status/1098733858265157632,2019-02-21,20:58:59
1098733181178658816,"Porra @Coritiba, corta logo à cabeça do príncipe Louco Namur.",https://twitter.com/samusrt/status/1098733181178658816,2019-02-21,20:56:18
1093532734398570498,"Não existe UM salvador, é necessário gestões com pessoas capacitadas e planejamento de 9 anos. Nossa atual gestão, implantou uma administração de empresas que funcionaria muito bem numa pizzaria, não em uma instituição do porte do Coritiba.",https://twitter.com/samusrt/status/1093532734398570498,2019-02-07,13:31:35
1089690123447484416,"Eu uso o Nubank e através do programa de pontos, consigo “apagar” todos os meses meu Netflix, Spotify e algumas corridas da Uber. Para seres humanos normais, que não conseguem um cartão diamante ou Black, acho que tá louco de bom!",https://twitter.com/samusrt/status/1089690123447484416,2019-01-27,23:02:25
1089628182368710662,"Está bem complicado essa influência de bilionário, conduzindo pessoas com discursos absurdamente mal intencionados.",https://twitter.com/samusrt/status/1089628182368710662,2019-01-27,18:56:17
1088537130434023424,Você elegeram esse tipo de pessoas e acham normal. São otários e burros!  https://twitter.com/jpcharleaux/status/1088503713155764230 …,https://twitter.com/samusrt/status/1088537130434023424,2019-01-24,18:40:50
1085822578931904517,"O homicídio é um crime democrático, qualquer um pode cometer. O pai de família cumpridor de seus deveres com a pátria, a criança curiosa, a tiazinha do Rivotril. Basta um momento de extremo estresse e ter o azar de encontrar uma arma de fogo ao alcance. Não precisa nem fazer mira  https://twitter.com/TheInterceptBr/status/1085633153350492160 …",https://twitter.com/samusrt/status/1085822578931904517,2019-01-17,06:54:11
1081526148008427522,4º dia do ano e já temos o candidato de comentário mais imbecil #goleirodealuguel pic.twitter.com/8T3Dmw895g,https://twitter.com/samusrt/status/1081526148008427522,2019-01-05,10:21:42
1081211267468218369,"Trabalhei na expedição da Livrarias Curitiba, uma pilha caixa de folhas de papel por acidente caiu próximo a um funcionário que com anos de casa. Ele ficou nervoso e do nada me deu um soco no cara. Fui demitido no dia seguinte, mesmo mostrando que eu nem passei perto do acidente.",https://twitter.com/samusrt/status/1081211267468218369,2019-01-04,13:30:28
1079748303800147968,- Todo ser humano é formado por 70% de água. - E 30% de droga! CHOQUE DA VIRADA: 2º Prêmio Carburador de Prata  https://youtu.be/ktCv18nQ2j8 ,https://twitter.com/samusrt/status/1079748303800147968,2018-12-31,12:37:11
1078840791613796352,@NetflixBrasil fiquei sexta à noite em casa. Me ajuda aí né... #BlackMirror pic.twitter.com/ljIMA7XKzu,https://twitter.com/samusrt/status/1078840791613796352,2018-12-29,00:31:03
1078231138974527488,"Conheço pelo menos 3 pessoas que tentam/tentaram fazer ""dinheiro"" com carros usados. Passam qualquer um pra trás na primeira oportunidade e amam dinheiro fácil. Se vc engoliu a história do Queiroz, é Gado D+.",https://twitter.com/samusrt/status/1078231138974527488,2018-12-27,08:08:30
1077909124174745600,"Não tem erro, tudo que é ruim ficou deste lado!",https://twitter.com/samusrt/status/1077909124174745600,2018-12-26,10:48:56
1073516587070705664,"2018 minha vida emocional foi difícil, já na política e esporte (futebol) foi horrível e na profissional foi meu melhor período. Nunca podemos ter tudo né!",https://twitter.com/samusrt/status/1073516587070705664,2018-12-14,07:54:33
1068998942262784000,"Um dos meus melhores amigos foi passar as férias no EUA e não me contou. O time de futebol que eu jogava e pedi pra sair no começo do ano, chegou na final do campeonato da vila e também não me contaram. Será que estão achando que sou zica ou invejoso? 😐",https://twitter.com/samusrt/status/1068998942262784000,2018-12-01,20:43:03
1067913078485000192,"Em 1987 fui vítima de uma tentativa de sequestro numa festa no bairro de Santa Felicidade chamada “4 Giorni”. Minha família com ajuda de amigos, conseguiu me achar após 3 horas, longe do local do evento, nos braços de uma mulher que anos depois foi acusada de tráfico de crianças.",https://twitter.com/samusrt/status/1067913078485000192,2018-11-28,20:48:13
1064503834150608897,"Mas a startup está em fase de expansão, o Brasil é gigante e tudo que é novo, leva tempo pra sem implantando. Pode me responder o que acha uma renda extra de R$18,00/hora? Um profissional com essa mesma remuneração e 44 horas semanais, tá acima da média brasileira, não!?",https://twitter.com/samusrt/status/1064503834150608897,2018-11-19,11:01:06
1063117703316205569,"Sua sugestão é imigração e cidadania para médicos cubanos, que pode demandar tempo para ser efetivada. Eu continuo achando que o caminho correto seria renegociar a porcentagem das remunerações dos voluntários. Estamos falando da saúde de milhares de pessoas, não de produtos.",https://twitter.com/samusrt/status/1063117703316205569,2018-11-15,15:13:06
1063108205285441537,"Não estou confundido. Um gestor deveria renegociar as remunerações junto à empresa que contrata os médicos, não utilizar discurso de direitos humanos, que acabará prejudicando o atendimento de milhares de pessoas. @marcogomes postou sobre o assunto, divergindo com sua posição.",https://twitter.com/samusrt/status/1063108205285441537,2018-11-15,14:35:22
1059984997959036929,"Recomendo o livro ""A Noite dos Mortos Vivos - Edição Especial 50 Anos"" de John Russo. Ler e lembrar das cenas é horripilante.",https://twitter.com/samusrt/status/1059984997959036929,2018-11-06,23:44:51
1058872337997684739,"Dizem que o Samir Namur trabalha todos os dias até de madrugada no Couto Pereira. Isso prova a incompetência, muitas horas de trabalho, para poucos acertos. Um competente trabalharia apenas 5 horas por dia! #Coritiba",https://twitter.com/samusrt/status/1058872337997684739,2018-11-03,21:03:32
1053839369289785344,"Não é possível, não tem uma lei para coagir esses tipo de pessoa que espalhar mentiras na maior cara de pau?",https://twitter.com/samusrt/status/1053839369289785344,2018-10-20,23:44:19
1053227894825205760,"Meu pai, Imério Toaldo, começou fumar por volta de 1954 (idade: 16 anos). Fumou palheiro, cachimbo, charuto e no final de 1994 fumava 4 maços de Malboro por dia. Infelizmente faleceu em 1995 com 3 tipos de câncer.",https://twitter.com/samusrt/status/1053227894825205760,2018-10-19,07:14:32
1051845381003317248,“A erosão da democracia para muitas pessoas é imperceptível.”,https://twitter.com/samusrt/status/1051845381003317248,2018-10-15,11:40:55
1051599311950237696,Sexta me abordaram no Instagram exatamente sobre esse assunto. Confessei que não tinha informações suficiente e fui conversar com 4 jornalistas sobre a proposta. Respondi o cidadão com toda educação do mundo e no final ele mandou: “Seus amigos estão cegos e tendenciosos.” PQP,https://twitter.com/samusrt/status/1051599311950237696,2018-10-14,19:23:08
1051443834964647936,"Ele falou num NerdCast que fizeram um brainstorming, um dos mais fracos diga-se de passagem, que se tivesse “tempo” apostaria suas fichas no homeschooling. Usou como desculpa os school shooting recorrentes no EUA.",https://twitter.com/samusrt/status/1051443834964647936,2018-10-14,09:05:19
1051286136730132480,"Um dono de um certo time de futebol, gravou um podcast a pouco tempo atrás dizendo que apostaria no homeschooling. Agora esse empresário em suas redes, fica com joguinho psicológico, tentando captar votos para o candidato que propõem ensino a distância. 🤔",https://twitter.com/samusrt/status/1051286136730132480,2018-10-13,22:38:41
1050352627735781378,"Eles mentem, mentem e mentem... e se dizem pessoas de bem!",https://twitter.com/samusrt/status/1050352627735781378,2018-10-11,08:49:15
1050348898445873152,"Já dizia minha mãe: “O caráter de uma pessoa é construído até seus 15 anos, depois pode até enganar, mas não muda”",https://twitter.com/samusrt/status/1050348898445873152,2018-10-11,08:34:26
1046988455937478656,Eu quero que se foda!,https://twitter.com/samusrt/status/1046988455937478656,2018-10-02,02:01:14
1044364755564138497,"Nossa filhinha Sara completou 2 aninhos, ela queria toda a turma do Mickey no seu aniversário, mas só deu pra fazer um bolinho, com muito amor e carinho! Quem sabe um dia nós vamos pra…  https://www.instagram.com/p/BoIH89dhnqT/?utm_source=ig_twitter_share&igshid=k0qu41z07fft …",https://twitter.com/samusrt/status/1044364755564138497,2018-09-24,20:15:35
1042412146360025089,Que foda ❤️,https://twitter.com/samusrt/status/1042412146360025089,2018-09-19,10:56:37
1040074638666153985,Um morto muito louco!!!  pic.twitter.com/M0gd6zGGS0,https://twitter.com/samusrt/status/1040074638666153985,2018-09-13,00:08:12
1039184211335434241,"Sim, em 2015 através do meu hobby descobri um mercado que não estava sendo explorado, fechei minha empresa de informática, passei por dificuldades até conseguir transformar essa ideia em uma empresa que dá lucro. Dia 13 completo 35 anos e sou o criador do App Goleiro de Aluguel!",https://twitter.com/samusrt/status/1039184211335434241,2018-09-10,13:09:57
1038988510768910336,"Há sim, candidato babaca, no laudo diz que os 2 tiros forem desferidos num grupo de 6 pessoas, o azarado do rapaz recebeu as duas balas... que azar né? Conta outra!",https://twitter.com/samusrt/status/1038988510768910336,2018-09-10,00:12:19
1038985283914682369,"Vai com esse discursos enganar o povo da sua região, moralista de merda!",https://twitter.com/samusrt/status/1038985283914682369,2018-09-09,23:59:29
1038983659053899776,"O candidato a deputado estadual Renato Almeida Freitas foi atingindo por 2 tiros de bala de borracha, desferidos pela Guarda Municipal de Curitiba. Laudo diz que os disparos foram contra um grupo de 6 pessoas, que partiam para cima dos azuis. Conta outra @Curitiba_PMC, ridículo!",https://twitter.com/samusrt/status/1038983659053899776,2018-09-09,23:53:02
1033901131473334274,"Não recomendo assistir Heriditary sozinho no domingo à noite, enquanto o resto da família dorme no andar de cima! #Hereditary #medo @getrocombr",https://twitter.com/samusrt/status/1033901131473334274,2018-08-26,23:16:53
1032070399780167680,"Não tenho vergonha: se existisse acesso fácil a armas de fogo, com certeza teria comedido suicídio em 2013. Neste período fui diagnosticado com depressão, depois de uma longa jornada, venci a doença, hoje sou casado, pai de 2 filhos e ajudo muitas pessoas com meu trabalho.",https://twitter.com/samusrt/status/1032070399780167680,2018-08-21,22:02:12
1030632508638019585,"Hoje estreiou a 3ª temporada do Shark Tank Brasil... mano, esse programa mudou a minha vida! #SharkTankBR pic.twitter.com/GudmOk47NQ",https://twitter.com/samusrt/status/1030632508638019585,2018-08-17,22:48:32
1028101630212952064,"O @Coritiba vem piorando ano a ano desde 2011. Nesta nova gestão é perceptível o carinho com que o clube é tratado, mas dentro de campo o desempenho é muito ruim! A estratégia das contratações foi péssima e a permanência na série B já deve ser assimilada. #Coritiba",https://twitter.com/samusrt/status/1028101630212952064,2018-08-10,23:11:44
1026198929958948864,Inspiração para a vida. Classifiquei Uma Lição de Vida (2010) 7/10  #IMDb http://www.imdb.com/title/tt0790663 ,https://twitter.com/samusrt/status/1026198929958948864,2018-08-05,17:11:05
1024316539405774848,"Poxa vida, está mandando essa resposta padrão pra todos. Como pensar e usar a lógica, apoiando um candidato que tem como livro de cabeceira “A verdade sufocada”?",https://twitter.com/samusrt/status/1024316539405774848,2018-07-31,12:31:08
1023702462576947202,"Tá foda, tá foda, tá foda...  https://twitter.com/Iexandre/status/1023680778088185857 …",https://twitter.com/samusrt/status/1023702462576947202,2018-07-29,19:51:01
1022608991346667520,"@Astro_Pontes não faz isso meu velho, o cara apoiou forte a fosfoetanolamina no Brasil, pula fora dessa enquanto tem tempo!!!",https://twitter.com/samusrt/status/1022608991346667520,2018-07-26,19:25:57
1020988422863884289,"O livro de Sócrates escrito por Tom Cardoso, mostra que a Democracia funciona por períodos, depois é mascarada pra beneficiar uma cúpula. A narrativa é intensa do início da carreira do jogador, até a Copa de 1982. Os capítulos finais da vida do craque, mereciam mais páginas.",https://twitter.com/samusrt/status/1020988422863884289,2018-07-22,08:06:23
1020780210818568192,Desde os 30 do 1º tempo já era previsto o empate. Ninguém fez absolutamente nada pra tentar reverter o quadro 🤷‍♂️,https://twitter.com/samusrt/status/1020780210818568192,2018-07-21,18:19:02
1018962648547954688,"@marcogomes vc também deve ter opinião sobre os ""investidores"" que oferecem sua ""agenda"" por troca de equity. Quem sabe sobra um tempo e vc lê meu texto: CARAS LEGAIS - Eles existem  https://www.linkedin.com/pulse/caras-legais-eles-existem-samuel-toaldo/ …",https://twitter.com/samusrt/status/1018962648547954688,2018-07-16,17:56:41
1018807788989042689,Giroud é aquele brother que chega no dia de entregar o trabalho da escola diz: “Coloca meu nome aí mano!!!”,https://twitter.com/samusrt/status/1018807788989042689,2018-07-16,07:41:20
1018806621936418816,"Na fanpage da @TopperBrasil observei um comentário pra tentar tirar a famosa “casquinha” da empresa. Juro que tentei não responder, aguentei durante o dia todo, mas foi mais forte e mandei a real...  pic.twitter.com/GL5raaOtXj",https://twitter.com/samusrt/status/1018806621936418816,2018-07-16,07:36:41
1015419051881959425,"Na bola na trave do Thiago Silva e no chute errado do Paulinho dentro da área no 1º tempo, pensei: “Hoje não vai dar!”",https://twitter.com/samusrt/status/1015419051881959425,2018-07-06,23:15:42
1011559473301872640,Os adeptos do microondas só pensam no tempo e esquecem de alterar a potência. Coloca 60 segundos com potência de 50% ou 60% pra ver como fica “comestível”.,https://twitter.com/samusrt/status/1011559473301872640,2018-06-26,07:39:06
1010193929952727041,"Discordo, o número de usuários do meu aplicativo deve aumentar com uma boa campanha da seleção, logo, a MINHA vida vai mudar!",https://twitter.com/samusrt/status/1010193929952727041,2018-06-22,13:12:56
1007275587839373312,"Brasil pode superar 8 bi de downloads de apps até 2022. O país como campeão mundial em uso de apps por dia (doze por usuário a cada 24 horas). Os últimos dados do IBGE mostram que 92,4% dos 116,1 milhões de brasileiros que acessam a internet o fazem por meio de aplicativos.",https://twitter.com/samusrt/status/1007275587839373312,2018-06-14,11:56:29
1003652547297660928,"Já que o negócio foi fechado, da tempo de corta-lo e convocar alguém mais produtivo?",https://twitter.com/samusrt/status/1003652547297660928,2018-06-04,11:59:48
1002890581079740416,O que fazem com o Navas no Real Madrid é foda!,https://twitter.com/samusrt/status/1002890581079740416,2018-06-02,09:32:01
1000682817418866688,“Patrocinadores da Seleção Brasileira comemoram 22 anos de apoio ao time e está dando gratis camisetas oficiais da copa do mundo por tempo limitado. Acabei de ganhar a minha:” NÃO É POSSÍVEL QUE O POVO ACREDITA QUE A NIKE ESTÁ DISTRIBUINDO CAMISAS GRÁTIS!,https://twitter.com/samusrt/status/1000682817418866688,2018-05-27,07:19:10
1000479150333988867,Vida de Goleiro é muito triste!!! #goleiro #goalkepeer,https://twitter.com/samusrt/status/1000479150333988867,2018-05-26,17:49:52
996706932936380416,"86 não lembro 90 lembro, início do nosso amor 94 perdidamente apaixonado 98 decepcionado, mas ainda amando 02 perdão, reconquista e juras de amor 06 apagado, acostumado e sem tesão 10 respeito, sem paixão, se tornamos bons amigos 14 depressão e isolamento 18 coração batendo",https://twitter.com/samusrt/status/996706932936380416,2018-05-16,08:00:25
991449454329958401,Pq diabos as pessoas precisam conversar dentro do cinema? #silencio,https://twitter.com/samusrt/status/991449454329958401,2018-05-01,19:49:04
985502456732930048,"A velhice é confortável como um domingo de manhã, debaixo das cobertas.   #domingo #cobertas…  https://www.instagram.com/p/Bhl4fU3nzcH/ ",https://twitter.com/samusrt/status/985502456732930048,2018-04-15,09:57:50
985303590700011520,Frequento o Couto Pereira desde 1989 e nunca vi um time tão ruim.,https://twitter.com/samusrt/status/985303590700011520,2018-04-14,20:47:36
