id,tweet,link,date,time
78465498228068352,"@papodecraquecw Muito obrigado sr Vilson, por esse dia maravilhoso que estamos vivendo!",https://twitter.com/samusrt/status/78465498228068352,2011-06-08,11:16:47
76289849732243456,@PapodeCraqueCW Qual a possibilidade do Marcos Aurélio voltar para a decisão da Copa do Brasil?,https://twitter.com/samusrt/status/76289849732243456,2011-06-02,11:11:32
76067050874875904,I liked a @YouTube videofrom @coxavideos  http://youtu.be/-sgNrixhRtk?a COXA VÍDEOS HD - Se um dia...,https://twitter.com/samusrt/status/76067050874875904,2011-06-01,20:26:12
75940105956769793,@papodecraquecw Essa chamada da @TEsportes sobre a Copa do Brasil é foda... parabéns!!!,https://twitter.com/samusrt/status/75940105956769793,2011-06-01,12:01:46
75937883688681472,@papodecraquecw Eu participo todo dia... tá na hora de eu ganhar um sortei... ihullll,https://twitter.com/samusrt/status/75937883688681472,2011-06-01,11:52:56
75937523003703296,"@papodecraquecw O Coxa tem um base administrativa sólida e honesta com a torcida, o futuro aguarda vôos altos no Alto da Glória!",https://twitter.com/samusrt/status/75937523003703296,2011-06-01,11:51:30
75746045291794432,I liked a @YouTube videofrom @coxavideos  http://youtu.be/-sgNrixhRtk?a COXA VÍDEOS HD - Se um dia...,https://twitter.com/samusrt/status/75746045291794432,2011-05-31,23:10:39
73760847138275328,@papodecraquecw Essa euforia do Paraná Clube acaba no próximo 5° dia útil de junho... hahahaha,https://twitter.com/samusrt/status/73760847138275328,2011-05-26,11:42:11
68686289645481985,"@papodecraquecw Irapitan... o Coxa teve uma chance clara de gol no 2° tempo, com um chute colocado do Marcos Paulo... o cara nem assistiu!",https://twitter.com/samusrt/status/68686289645481985,2011-05-12,11:37:42
68321782591008768,"@papodecraquecw O1° tempo vou ouvir a Transamérica no fone de ouvido durante a aula de física, depois vou ouvir no carro até chegar em casa",https://twitter.com/samusrt/status/68321782591008768,2011-05-11,11:29:16
66237711165554689,@asilviasanta Então vou ver se tem dia no Pepper's.... dai aviso vcs... abraço!,https://twitter.com/samusrt/status/66237711165554689,2011-05-05,17:27:55
63772236477239296,Coxa tá foda esse ano... #coritiba22wins,https://twitter.com/samusrt/status/63772236477239296,2011-04-28,22:11:00
60865869781274624,"@sheep_tinho #filminho da vida do Kepler, lindo",https://twitter.com/samusrt/status/60865869781274624,2011-04-20,21:42:08
56051163988115456,"Hoje tem ""Amigos do Paraná 'contra' Amigos do Japão""... valeu a intenção mas o nome não ficou muito convidativo!",https://twitter.com/samusrt/status/56051163988115456,2011-04-07,14:50:13
38969032325607424,"Completamente com o quadril travado, devido ao treino de boxe... quero ver tocar no Hermes hoje a noite...",https://twitter.com/samusrt/status/38969032325607424,2011-02-19,12:31:55
37244830270623744,"Notebook estragado e o cara não manda a peça, e agora meu PC também não liga, é muito azar para o primeiro dia de férias...",https://twitter.com/samusrt/status/37244830270623744,2011-02-14,18:20:34
37131661393010688,1º dia de férias e ainda estou de cueca...,https://twitter.com/samusrt/status/37131661393010688,2011-02-14,10:50:52
32127376338984960,@coritibaoficial E por quanto tempo nós vamos ter que aguentar essa retranca do sr Marcelo Oliveira???,https://twitter.com/samusrt/status/32127376338984960,2011-01-31,15:25:38
27068880362934272,Eu gostei de um vídeo do YouTube -- A Vida é Um Stand-Up  http://youtu.be/ktz7OzLPaV0?a,https://twitter.com/samusrt/status/27068880362934272,2011-01-17,16:24:58
22676769748287489,"A cada dia fico assustado com tamanha ignorância das pessoas... tenso, muito muito tenso!",https://twitter.com/samusrt/status/22676769748287489,2011-01-05,13:32:17
22003249208889344,"Para começar o primeiro dia de trabalho em 2011, chuva na hora de ir embora... eeee Curitiba!",https://twitter.com/samusrt/status/22003249208889344,2011-01-03,16:55:58
21983794097557504,"Eu gostei de um vídeo do YouTube -- Optical ilusion""Tou a sentir o teu dedo""  http://youtu.be/cTgIQpGqB9k?a",https://twitter.com/samusrt/status/21983794097557504,2011-01-03,15:38:39
19741181713850368,"Só os links do @tensoblog para salvar meu dia de ""trabalho"" ocioso... vlw!",https://twitter.com/samusrt/status/19741181713850368,2010-12-28,11:07:19
18005011585826816,Eu gostei de um vídeo do YouTube -- COXA VÍDEOS HD - Se um dia...  http://youtu.be/-sgNrixhRtk?a,https://twitter.com/samusrt/status/18005011585826816,2010-12-23,16:08:23
17249090211414016,"Pra fechar o dia que já estava uma merda, chuva!",https://twitter.com/samusrt/status/17249090211414016,2010-12-21,14:04:38
17228970114158592,"@Vandamoraes Oi, é dia 23 de dezembro às 21:30 no Hermes Bar, a entrada é R$5 mangos... aparece lá!",https://twitter.com/samusrt/status/17228970114158592,2010-12-21,12:44:41
17228720062337024,Definitivamente o dia está chata pra caral$%¨&,https://twitter.com/samusrt/status/17228720062337024,2010-12-21,12:43:41
9323967995183104,"Eu gostei de um vídeo do YouTube -- Nokia N8 apresenta ""Como juntar seis amigos num ro...  http://youtu.be/Gws6LgO7R60?a",https://twitter.com/samusrt/status/9323967995183104,2010-11-29,17:13:01
8229901119266816,"A Band tirou #CinePrivê da programação... eu tinha que assistir no mudo pra minha mãe não ouvir, era só punheta e coca-cola... vida boa!",https://twitter.com/samusrt/status/8229901119266816,2010-11-26,16:45:35
2176823446212609,"@TEsportes Qual a possibilidade da CBF mudar o horário do jogo Coritiba do próximo sábado para às 21:00hs, mesmo horário do jogo do Bahia",https://twitter.com/samusrt/status/2176823446212609,2010-11-09,23:52:49
2073208261967872,"Parabéns #Itaú, por tratarem seus clientes como saco de batata, e diga-se de passagem, o gerente de merda #Diego aprendeu a lição certinho!",https://twitter.com/samusrt/status/2073208261967872,2010-11-09,17:01:06
544311187869696,@papodecraquecw Sr. Vilson... Existe possibilidade de show's internacionais no Couto Pereira para aumentar a renda do clube?,https://twitter.com/samusrt/status/544311187869696,2010-11-05,11:45:48
29696857978,"@Vandamoraes ""Não há nada que seja maior evidência de insanidade do que fazer a mesma coisa dia após dias e esperar resultados diferentes""..",https://twitter.com/samusrt/status/29696857978,2010-11-04,18:04:39
29098207220,@sheep_tinho Jogue pela janela do seu apto e comprove na prática a experiência do Galileu Galilei!,https://twitter.com/samusrt/status/29098207220,2010-10-29,13:28:22
26549068617,Vou para o SWU dia 9 com a @KaiserCuritiba,https://twitter.com/samusrt/status/26549068617,2010-10-06,10:05:02
25401389781,@Vandamoraes Eu odeio feijoada :( huahuahuah,https://twitter.com/samusrt/status/25401389781,2010-09-24,10:00:14
17864110517,"Graças aos evangélicos, e sua prioridade diante a Deus, o sonho do Hexa foi por água a baixo!",https://twitter.com/samusrt/status/17864110517,2010-07-06,09:35:46
13219675612,"Nusss... faz uma cara que não entrou no twitter... hj a noite vai ser longa, relatório de experimental III... damn it",https://twitter.com/samusrt/status/13219675612,2010-05-01,22:42:53
11550689623,Ahh esse feriado me deixou morto... sono o dia todo!,https://twitter.com/samusrt/status/11550689623,2010-04-03,16:59:23
8855459889,@programaupload Puxa... eu preferia quando era a noite!,https://twitter.com/samusrt/status/8855459889,2010-02-09,12:03:43
8854018557,"Férias... e a mente fervendo de idéias... então, vamos colocar me pratica!",https://twitter.com/samusrt/status/8854018557,2010-02-09,11:21:18
8631364502,"Por que as pessoas apertam os botões do controle remoto com mais força, quando as pilhas estão fracas?",https://twitter.com/samusrt/status/8631364502,2010-02-04,11:13:24
8363077547,"Quando eu crescer, quero ser igual ao Apóstolo Valdemiro Santiago!!! :-D",https://twitter.com/samusrt/status/8363077547,2010-01-29,08:40:19
8123575051,"""Não existe trabalho ruim, ruim é ter que trabalhar!"" by Seu Madruga",https://twitter.com/samusrt/status/8123575051,2010-01-23,18:57:35
7694851540,boa noite!,https://twitter.com/samusrt/status/7694851540,2010-01-13,01:07:23
7364189123,1° dia de trabalho no ano... fffffffffffffffffffffffuuuuuuuuuuuuu,https://twitter.com/samusrt/status/7364189123,2010-01-04,09:27:11
6964580519,"Ano novo, vida nova e Netbook novo... digo LENOVO! #FnacLenovo",https://twitter.com/samusrt/status/6964580519,2009-12-23,11:49:04
6738563513,"Atividade Paranormal (Paranormal Activity) me deixou meio ""assim"" de dormir com a porta do quarto aberta!",https://twitter.com/samusrt/status/6738563513,2009-12-16,16:52:55
6308576934,"@leandrorequena Leandro, mas trocar merda por bosta não adianta, não existem ninguém para salvar a pátria...",https://twitter.com/samusrt/status/6308576934,2009-12-03,14:58:08
6021702120,"Dia 6 de dezembro será lembrado para sempre como a ""Batalha do Alto da Glória"", onde os guerreiros serão os torcedores do #Coritiba...",https://twitter.com/samusrt/status/6021702120,2009-11-24,20:41:09
5687548495,"RT @leandrorequena Pensamento do dia: ""Confiar em gente que não merece confiança é pior do que namorar com puta"". hHhHUAUHAUahauhauhUH",https://twitter.com/samusrt/status/5687548495,2009-11-13,16:54:27
5351154983,Poxa Zina... como vc foi cair nessa...,https://twitter.com/samusrt/status/5351154983,2009-11-01,23:05:31
5293712252,"8)Grupo de amigos todos morrerão menos o casal principal:Em um grupo de amigos,todos morrem, exceto o casal da trama.",https://twitter.com/samusrt/status/5293712252,2009-10-30,16:06:50
5042173774,"#Movie: ""Arraste-me para o Inferno"" (Drag Me to Hell) deu pra pular da cadeira e reviver o clássico ""Uma Noite Alucinte"" (Evil Dead I e II)",https://twitter.com/samusrt/status/5042173774,2009-10-21,09:50:23
4919317159,Que dia lindo em Curitiba.. huahuahuuaha,https://twitter.com/samusrt/status/4919317159,2009-10-16,13:15:08
4479051586,"Descontrole total... quinta, dia 1°, começa a venda de ingressos para o show do AC DC.",https://twitter.com/samusrt/status/4479051586,2009-09-29,17:27:03
4396645316,Poxa Rubinho... largar em 10º vai ser foda...,https://twitter.com/samusrt/status/4396645316,2009-09-26,13:34:47
4373244450,"""As pessoas boas devem amar seus inimigos!"" by Seu Madruga",https://twitter.com/samusrt/status/4373244450,2009-09-25,14:20:19
4086696562,Hoje é a noite do jazz com Philip Catherine Trio... \o/,https://twitter.com/samusrt/status/4086696562,2009-09-18,17:02:46
4005710288,Um bom dia para ficar trancado dentro de casa... está tudo errado!,https://twitter.com/samusrt/status/4005710288,2009-09-15,11:47:46
3448895801,"@programaupload E faz tempo que a MTV deixou de ser uma televisão ""alternativa""... vide a opinião pública do Lobão!",https://twitter.com/samusrt/status/3448895801,2009-08-21,09:44:57
3276803735,"Ensaiando trilhas do novo compacto e o vizinho reclama do barulho, disse q no final d semana agüenta, mas dia de semana ele que ver a novela",https://twitter.com/samusrt/status/3276803735,2009-08-12,22:04:26
3271333206,"Duro é agüentar a pegação no pé da guria do RH. Era operadora de caixa, fez uma faculdade Uniesquina... agora já viu como é, né!",https://twitter.com/samusrt/status/3271333206,2009-08-12,16:36:26
3127795054,"Seu time vai mal, o muro do vizinho cai na chuva, festival falcatrua, cancelam as aulas devido a gripe suína. Isso se chama ""Vida do Samuca""",https://twitter.com/samusrt/status/3127795054,2009-08-04,14:16:00
2281345493,"Motherfuck, perdi o sono pensando que a prova de Física Experimental era hoje, pra chegar correndo na aula e o prof. mudar pra semana q vem.",https://twitter.com/samusrt/status/2281345493,2009-06-22,13:59:18
2227049698,"@heitorlobo Poxa, muito foda isso, sua banda é a Demo D? Estão na categoria cover?",https://twitter.com/samusrt/status/2227049698,2009-06-18,16:42:49
1142221761213345792,"O comentário que o Marreco saiu gigante, só mostra que ele se acha o reizinho engana trouxa e pior ele consegue. Sabe o que é o mais triste? Não vai dar em nada esses crimes vazados e o povo continua aplaudindo.",https://twitter.com/samusrt/status/1142221761213345792,2019-06-21,21:04:23
1141758247155560448,"Tá bem difícil, é uma postagem promovida pelo @McDonalds_BR para uma promoção. Olha os comentários recheados de preconceitos e ódio, TODOS apoiadores de quem? Adivinha? Se toquem, parem com isso!  https://twitter.com/McDonalds_BR/status/1141482350741794823 …",https://twitter.com/samusrt/status/1141758247155560448,2019-06-20,14:22:33
1138935465216749568,"Pra que fazer Sitcom de Startup... é só acompanhar nossa história, que tem coisas inacreditáveis.  https://twitter.com/startupdareal/status/1138933836807643139 …",https://twitter.com/samusrt/status/1138935465216749568,2019-06-12,19:25:49
1133781387373436928,"Primeira vez que me param após detector de metal no aeroporto pra fazer revista de segurança. O procedimento tinha opção da revista ser publica ou em local reservado, escolhi a segunda e na caminhada até a sala, todo mundo me julgando com seus olhares. Sei lá, mas me senti mal!",https://twitter.com/samusrt/status/1133781387373436928,2019-05-29,14:05:22
1129400634657136640,@Easynvest e vcs fazendo live empolgados com o novo presidente hein? Como que está o fundo Alaska Black agora? Lindo e maravilhoso?,https://twitter.com/samusrt/status/1129400634657136640,2019-05-17,11:57:49
1129399528275234819,"@startupdareal vc está bloqueando os aliados? Até agora nenhum comentário tentando defender o presidente, que estranho né",https://twitter.com/samusrt/status/1129399528275234819,2019-05-17,11:53:25
1127770365265154048,"Cuidado, talvez o Olavo de Carvalho e os filhos ainda não tiveram acesso a trilogia.",https://twitter.com/samusrt/status/1127770365265154048,2019-05-12,23:59:42
1127728471747309572,"Ele já terminou os estudo, logo, foda-se os outros e a namorada também, pq ela é esquerdista.",https://twitter.com/samusrt/status/1127728471747309572,2019-05-12,21:13:14
1127718842128576512,"Hahahahahahaha... mas que burro! Achando que o presida só não vai cortar a bolsa da namorada dele, pq ela “estuda” de verdade.",https://twitter.com/samusrt/status/1127718842128576512,2019-05-12,20:34:58
1126899515007676416,Aí eu ri de verdade 😁,https://twitter.com/samusrt/status/1126899515007676416,2019-05-10,14:19:15
1125228088797822976,"Aqui em Curitiba já existe, eles passam o calote geral na entrega do projeto e usam estatística de mortalidade de startup no primeiro ano pra justificar. A estratégia é enrolar pra entregar, até a startup morrer! Tá ligado que não precisa de muitos meses pra isso acontecer né!?",https://twitter.com/samusrt/status/1125228088797822976,2019-05-05,23:37:36
1125027870856839169,O governo e seus súditos são melhores que à Praça é Nossa!  Obs.: Os personagem da Praça na década de 90 até que conseguiam nos fazer rir de verdade.,https://twitter.com/samusrt/status/1125027870856839169,2019-05-05,10:22:01
1124679453559480320,Que braço hein  pic.twitter.com/HMThDIeF1B,https://twitter.com/samusrt/status/1124679453559480320,2019-05-04,11:17:31
1124055344106418181,"@AzureSupport em menos de 1 ano, é a terceira vez que vcs me deixam na mão... 🔥 CAOS",https://twitter.com/samusrt/status/1124055344106418181,2019-05-02,17:57:32
1122090767068160000,"Eu: Lula está preso, nem sei mais oq dizer, acho que ele é culpado mesmo, não quero mais falar sobre isso, segue o jogo.   Lula: a  Eu:  pic.twitter.com/Dtdbvi0mWL",https://twitter.com/samusrt/status/1122090767068160000,2019-04-27,07:51:00
1121821652378169344,Já está definido que Neymar nunca será reconhecido como melhor do mundo.,https://twitter.com/samusrt/status/1121821652378169344,2019-04-26,14:01:39
1121020060045279232,"Agora é a hora do Plot Twist: Lembram do bonitão que foi o líder do grupo para salvar o ovo 🥚? No Natal fui numa Livrarias Curitiba para comprar livros para meus filhos, acreditem, ele ainda está lá como vendedor, mas agora ele não é mais bonito e forte, está careca e gordo.",https://twitter.com/samusrt/status/1121020060045279232,2019-04-24,08:56:24
1121020057537138688,"Foi assim que entrei para o mundo da tecnologia, nesse estágio aprendi inclusive a programar. Hoje sou criador de um app que proporciona economia compartilhada para milhares de pessoas e tenho uma vida financeira até que bem tranquila/privilegiada.",https://twitter.com/samusrt/status/1121020057537138688,2019-04-24,08:56:23
1121020055976841217,"Passei a noite toda lendo os livros e na manhã seguinte fui pra entrevista. O técnico que conversou comigo, anos mais tarde, confessou que nesse dia deu pra ver que eu não sabia trocar uma fonte de computador, mas resolver me dar uma chance.",https://twitter.com/samusrt/status/1121020055976841217,2019-04-24,08:56:23
1121020052566884353,"No dia da demissão, voltando pra casa, com o rosto machucado e chorando, vi uma escola técnica com uma vaga de estágio para informática. Não fazia um mês que eu estava fazendo curso Técnico de Informática, ferrado, entrei no local pra pedir informações.",https://twitter.com/samusrt/status/1121020052566884353,2019-04-24,08:56:22
1121020046845804545,"Um dia a pilha de papel sulfite caiu e quase atingiu um brother, na hora, um colega na brincadeira apontou e disse: “Foi o Samu que derrubou hahaha”... esse colaborador que quase foi atingido desferiu um soco na minha cara. Que humilhante!",https://twitter.com/samusrt/status/1121020046845804545,2019-04-24,08:56:21
1121020040776753155,"Toda semana perguntava para as “psicólogas” se tinha uma vaga de vendedor de CDs nas lojas, elas sorriam e diziam que uma hora minha estrela iria brilhar. Até que um colega de trabalho, me contou um segredo que eu não tinha percebido:",https://twitter.com/samusrt/status/1121020040776753155,2019-04-24,08:56:19
1121020030572027905,"Certeza que a vaga de vendedor de CDs era minha, não havia ninguém naquela turma que soubesse mais de música que eu, tipo... eu tinha um Shazam (app que descobre a música que está tocando) embutindo no meu cérebro.",https://twitter.com/samusrt/status/1121020030572027905,2019-04-24,08:56:17
1121020026654527489,"Ufa... deixamos a gravidade agir em nosso ovo e ele chegou ao chão sem nenhuma rachadura. Na próxima fase, os aprovados se apresentavam dizendo qual sua melhor qualidade e seu pior defeito. Todo mundo dizia: “Meu pior defeito é trabalhar demais!”",https://twitter.com/samusrt/status/1121020026654527489,2019-04-24,08:56:16
1121020024414769152,"É impressionante como sempre o homem branco, alto, fortinho e hétero se sente no direito de ser o líder da equipe. Um cara com esse perfil definiu a estratégia e todo mundo precisando do trampo, foi na onda, obedecendo tudo que o bonitão ordenava.",https://twitter.com/samusrt/status/1121020024414769152,2019-04-24,08:56:16
1121020018127511552,"Fui selecionado para entrevista individual, com uma suposta psicóloga, mais tarde descobri que todas que se apresentavam como psicólogas eram apenas estudantes do 2º ou 3º período.",https://twitter.com/samusrt/status/1121020018127511552,2019-04-24,08:56:14
1119938722311622656,No App @GoleiroAluguel inicia recebendo R$18/hora pra jogar “peladinha” entre os amigos. Tá bom?,https://twitter.com/samusrt/status/1119938722311622656,2019-04-21,09:19:33
1119933810093830144,"E tem cara que acha injusto o aplicativo @GoleiroAluguel oferecer R$18,00 por hora no início + prêmios.  https://twitter.com/mottamarcos/status/1119774061498777602 …",https://twitter.com/samusrt/status/1119933810093830144,2019-04-21,09:00:02
1118929817129426947,"Engraçado, ele processou varias pessoas por se sentir ofendido. Hipocrisia que chama né?",https://twitter.com/samusrt/status/1118929817129426947,2019-04-18,14:30:31
1118728789914206210,"Romário, Ronaldo, Ronaldinho e Zico esperaram a aposentadoria dos campos pra mostrarem como são idiotas politicamente. Menino Ney não aguentou e mostrou que é babaca dentro e fora de campo. Duro torcer pra seleção que tem um 10 como ele.  https://twitter.com/Estadao/status/1118670477185224705 …",https://twitter.com/samusrt/status/1118728789914206210,2019-04-18,01:11:43
1116522272628588545,"Claramente o jogador do time vermelho e branco, projeta a cabeça na altura da perna do adversário, para cavar uma falta.",https://twitter.com/samusrt/status/1116522272628588545,2019-04-11,23:03:48
1115260573191737345,É muito estranho vc ter QI elevado.,https://twitter.com/samusrt/status/1115260573191737345,2019-04-08,11:30:15
1109639118634536960,"É engraçado ver esses pedidos de desculpas pautados, seguidos de exclusão de contas e finalizando se fazendo de vítimas, que estão sendo ameaçados.",https://twitter.com/samusrt/status/1109639118634536960,2019-03-23,23:12:36
1108533473386602497,"Pronto, a previsão é que o @Coritiba vai deixar o aspirante do rival levar o estadual 2019. Óbvio que o discurso da diretoria e parte da torcida será que nosso foco é subir pra primeira divisão do Brasileirão. É triste!",https://twitter.com/samusrt/status/1108533473386602497,2019-03-20,21:59:10
1108357581116968961,"Acho que o Marcos não tá acostumado a organizar a pelada, é uma dor de cabeça real não conseguir goleiro, já é tradição o guapo nem pagar os custos do campo e mesmo assim é difícil achar alguém disposto a ficar debaixo da trave.",https://twitter.com/samusrt/status/1108357581116968961,2019-03-20,10:20:14
1108355833799344129,"Abre o coração meu velho, um Goleiro de Aluguel saiu muito mais barato que a cervejinha no final da partida. O jogo fica mais competitivo, fora que é uma economia compartilhada.",https://twitter.com/samusrt/status/1108355833799344129,2019-03-20,10:13:17
1108154095494488064,Goleiro de graça pra todo mundo!!!  https://twitter.com/GoleiroAluguel/status/1108153791138971649 …,https://twitter.com/samusrt/status/1108154095494488064,2019-03-19,20:51:39
1102963207206027264,"O Carluxo faz a alegria da galera, na verdade ele é um sarro.",https://twitter.com/samusrt/status/1102963207206027264,2019-03-05,13:04:55
1102932103447097345,"@NetflixBrasil Losers me fez sorrir e chorar, na infância sonhei em ser goleiro, a vida tomou outro rumo e depois dos 30 anos realizei esse sonho, virando um jogador de futebol “profissional”, entre aspas mesmo, pois sou um Goleiro de Aluguel.",https://twitter.com/samusrt/status/1102932103447097345,2019-03-05,11:01:19
1098733181178658816,"Porra @Coritiba, corta logo à cabeça do príncipe Louco Namur.",https://twitter.com/samusrt/status/1098733181178658816,2019-02-21,20:56:18
1098527561959854081,"O que impressiona é como o G5 continua firme e forte, nenhum deles tem vergonha na cara de renunciar.",https://twitter.com/samusrt/status/1098527561959854081,2019-02-21,07:19:15
1094594255442583552,"Ele apagou agora, mas desde ontem estava com um discurso diferente, do tipo: “Me enganei, mas continuo de olho na doutrinação e blábláblá...”",https://twitter.com/samusrt/status/1094594255442583552,2019-02-10,11:49:41
1094569788683272193,"Ele foi corrigido por um amigo, ele reconhece mas não se retrata. Também tem alguns comentários acreditando na doutrinação e ele simplesmente não fala: “galera, foi mancada”, ou seja, deixa a Fake News acontecer.",https://twitter.com/samusrt/status/1094569788683272193,2019-02-10,10:12:28
1094558863305723904,Não é só o Queiroz que deve estar fazendo dancinha e sapateando na cabeça do povo.,https://twitter.com/samusrt/status/1094558863305723904,2019-02-10,09:29:03
1091848835914235906,Engraçado o cara colocar na descrição que não tem político de estimação e estar gralhando nos comentários hahahahaha,https://twitter.com/samusrt/status/1091848835914235906,2019-02-02,22:00:22
1088537130434023424,Você elegeram esse tipo de pessoas e acham normal. São otários e burros!  https://twitter.com/jpcharleaux/status/1088503713155764230 …,https://twitter.com/samusrt/status/1088537130434023424,2019-01-24,18:40:50
1086951097078566913,"É massa que ele desmaia com a mão no bolso, muito estiloso!",https://twitter.com/samusrt/status/1086951097078566913,2019-01-20,09:38:30
1082962345020850177,"Nossa cara, que triste. Força meu velho!❤️",https://twitter.com/samusrt/status/1082962345020850177,2019-01-09,09:28:38
1082718414781800450,"Mano, na postagem do Twitter com a matéria é muito triste ver os comentários racistas.",https://twitter.com/samusrt/status/1082718414781800450,2019-01-08,17:19:20
1082626133282164747,Vai ficar bonito esse braço fechado de tatuagem hein!,https://twitter.com/samusrt/status/1082626133282164747,2019-01-08,11:12:39
1082602271861559296,"Da pra fechar o braço com tatuagem @onyxlorenzoni, fica a dica e o Moro vai curtir!!! https://twitter.com/giovanigrizotti/status/1082576549528961030 …",https://twitter.com/samusrt/status/1082602271861559296,2019-01-08,09:37:50
1077280813581025282,Feliz Natal porcos!  https://twitter.com/ivoneuman/status/1077218146384310272 …,https://twitter.com/samusrt/status/1077280813581025282,2018-12-24,17:12:15
1076814018583642117,"Acredito que não, mas foi engraçado.",https://twitter.com/samusrt/status/1076814018583642117,2018-12-23,10:17:22
1076437800407441416,Ctz que faz arminha com a mão.,https://twitter.com/samusrt/status/1076437800407441416,2018-12-22,09:22:25
1068797256852226049,Dedo no cu e gritaria!,https://twitter.com/samusrt/status/1068797256852226049,2018-12-01,07:21:37
1067353550320295937,"É estranho a galera nos comentários, não querendo acreditar nesses dados.",https://twitter.com/samusrt/status/1067353550320295937,2018-11-27,07:44:51
