id,tweet,link,date,time
621286892026339328,Gostei de um vídeo @YouTube de @fecastanhari  http://youtu.be/9fdPHKJgD6c?a  13 coisas que farão você se sentir VELHO 2,https://twitter.com/samusrt/status/621286892026339328,2015-07-15,08:55:12
620693344956583936,@ETtransamerica @TEsportes Posso ir no programa falar sobre o projeto Goleiro de Aluguel?,https://twitter.com/samusrt/status/620693344956583936,2015-07-13,17:36:40
618411299936927745,Gostei de um vídeo @YouTube de @fecastanhari  http://youtu.be/ecy6jOEx2Ko?a  11 coisas que você não sabia sobre o WALT DISNEY,https://twitter.com/samusrt/status/618411299936927745,2015-07-07,10:28:38
616931159537262593,Gostei de um vídeo @YouTube de @fecastanhari  http://youtu.be/n8YbuYDv3QA?a  12 coisas que você não sabia sobre a INTERNET,https://twitter.com/samusrt/status/616931159537262593,2015-07-03,08:27:05
598461445123244032,Gostei de um vídeo @YouTube  http://youtu.be/pEONpXkrxEE?aTodo … mundo no elenco de Capitão América: Guerra Civil | Breaking Nerd News,https://twitter.com/samusrt/status/598461445123244032,2015-05-13,09:15:02
596891352517967873,Gostei de um vídeo @YouTube de @hallorinojr  http://youtu.be/wTpaEvuyYzk?a  10 COISAS QUE POBRE FALA ANTES DE DORMIR,https://twitter.com/samusrt/status/596891352517967873,2015-05-09,01:16:02
595239832890249217,Gostei de um vídeo @YouTube de @fecastanhari  http://youtu.be/qVJVRCzB2RM?a  11 coisas que você não sabia sobre OS VINGADORES,https://twitter.com/samusrt/status/595239832890249217,2015-05-04,11:53:29
592423088052113409,Feliz dia do Goleiro.  https://instagram.com/p/184sbRiqif/ ,https://twitter.com/samusrt/status/592423088052113409,2015-04-26,17:20:45
590914439475552258,Gostei de um vídeo @YouTube  http://youtu.be/Od-Use-eB94?a9  mentiras e 1 verdade | NerdOffice S06E13,https://twitter.com/samusrt/status/590914439475552258,2015-04-22,13:25:55
590561912880046081,Gostei de um vídeo @YouTube  http://youtu.be/qftE24TmPs4?aGaveta … Show #02 - Coisas que Ninguém Repara,https://twitter.com/samusrt/status/590561912880046081,2015-04-21,14:05:06
586140875815682048,Gostei de um vídeo @YouTube  http://youtu.be/dc0D_Pffuoc?aTreino … de fundamentos para goleiro - Corrigindo posicionamento da mão e braço na,https://twitter.com/samusrt/status/586140875815682048,2015-04-09,09:17:29
585884885451145219,Larga meu dedo Morgana 😬  https://instagram.com/p/1ObdqdCqnt/ ,https://twitter.com/samusrt/status/585884885451145219,2015-04-08,16:20:16
574934621110059008,Para começar bem a semana.  https://instagram.com/p/0An3EaCqnf/ ,https://twitter.com/samusrt/status/574934621110059008,2015-03-09,11:07:50
561145987935526912,Essa look resolve falar só quando eu estou sozinho... Depois ninguém acredita.  http://instagram.com/p/yephB_Cqj8/ ,https://twitter.com/samusrt/status/561145987935526912,2015-01-30,10:56:43
557740477362216960,"Não adianta mudar seu jeito de caminhar pelas ruas,  hora ou outra algo vai bater em vc, trazendo para…  http://instagram.com/p/yGc3nhCqgL/ ",https://twitter.com/samusrt/status/557740477362216960,2015-01-21,01:24:26
544887165021589504,Sabe aquela lambida no seu rosto!? Isso é ser feliz. 😊  http://instagram.com/p/wrH2_ziqrH/ ,https://twitter.com/samusrt/status/544887165021589504,2014-12-16,14:09:58
514584084178153473,"Gostei de um vídeo @YouTube  http://youtu.be/dFKsN9J0hTM?aEu  tinha um cachorro preto, seu nome era depressão. [LEGENDADO]",https://twitter.com/samusrt/status/514584084178153473,2014-09-23,22:16:20
490106960641933313,Gostei de um vídeo @YouTube  http://youtu.be/T41NeYJRePg?aDesimpedidos … FX - Copa do Mundo 2014 - World Cup 2014 FX,https://twitter.com/samusrt/status/490106960641933313,2014-07-18,09:12:59
489734917203296256,Gostei de um vídeo @YouTube  http://youtu.be/mcXrCJNoQew?a6  coisas vergonhosas que todos nós fazemos,https://twitter.com/samusrt/status/489734917203296256,2014-07-17,08:34:37
486956442671251456,Gostei de um vídeo @YouTube de @desimpedidos  http://youtu.be/yVlvhT-IrWU?a  GOLS DA ZUEIRA - COPA DO MUNDO #22,https://twitter.com/samusrt/status/486956442671251456,2014-07-09,16:33:57
485870915633164288,Gostei de um vídeo @YouTube de @desimpedidos  http://youtu.be/fEi8Lr9jCEA?a  GOLS DA ZUEIRA - COPA DO MUNDO #21,https://twitter.com/samusrt/status/485870915633164288,2014-07-06,16:40:27
483983205045772288,Gostei de um vídeo @YouTube de @desimpedidos  http://youtu.be/GeDY9X-WTOE?a  GOLS DA ZUEIRA - COPA DO MUNDO #17,https://twitter.com/samusrt/status/483983205045772288,2014-07-01,11:39:22
483611766165737475,Gostei de um vídeo @YouTube  http://youtu.be/Isy99ARz2to?aO  CHUTE PERFEITO | Nerdologia 38,https://twitter.com/samusrt/status/483611766165737475,2014-06-30,11:03:24
481414860555558912,Gostei de um vídeo @YouTube de @desimpedidos  http://youtu.be/0wMwiQk4ZAs?a  GOLS DA ZUEIRA - COPA DO MUNDO #11,https://twitter.com/samusrt/status/481414860555558912,2014-06-24,09:33:41
472362389824733184,Gostei de um vídeo @YouTube  http://youtu.be/GgSWEJ39UsE?aO  Diário MEU AMOR da Sra. Jovem Nerd - 01 - FanMixCon,https://twitter.com/samusrt/status/472362389824733184,2014-05-30,10:02:24
468507724259393536,Gostei de um vídeo @YouTube  http://youtu.be/IRMTCO4SPYk?avoluntarios … da copa do mundo 2014,https://twitter.com/samusrt/status/468507724259393536,2014-05-19,18:45:20
282455892627189760,I liked a @YouTube video  http://youtu.be/abVNWgeonOY?a  Carmen Miranda - E o mundo não se acabou.wmv,https://twitter.com/samusrt/status/282455892627189760,2012-12-22,10:01:47
220367307258609667,I liked a @YouTube video  http://youtu.be/DX3D3SabAj4?a  Boa Tarde Paraná 02/07/2012 - Menino José diz que está cagado d,https://twitter.com/samusrt/status/220367307258609667,2012-07-04,01:03:54
197003743655497731,"@MundoLivreFM Boa tarde, seria possível colocar a lista de músicas que tocaram hj entre 13:10 às 13:25?",https://twitter.com/samusrt/status/197003743655497731,2012-04-30,13:45:27
136632139188944896,I liked a @YouTube video  http://youtu.be/k6O9BhEYucM?a  Queen - Las Palabras De Amor,https://twitter.com/samusrt/status/136632139188944896,2011-11-16,00:30:15
92188135110352898,"A cabeça tá a mil, cheia de ideias, naum consigo nem dormir.",https://twitter.com/samusrt/status/92188135110352898,2011-07-16,08:05:38
81196216091807744,"Sacanagem colocar o Léo Gago pra falar... hauhuauahuha, mas se for pra ajudar tá(@YouTube  http://youtu.be/R5ukzAzoJKM?a)",https://twitter.com/samusrt/status/81196216091807744,2011-06-16,00:07:41
78475131344789507,"Que agonia para a hora do jogo, bem que @papodecraquecw  poderia durar o dia inteiro...",https://twitter.com/samusrt/status/78475131344789507,2011-06-08,11:55:03
78465498228068352,"@papodecraquecw Muito obrigado sr Vilson, por esse dia maravilhoso que estamos vivendo!",https://twitter.com/samusrt/status/78465498228068352,2011-06-08,11:16:47
78464180075761664,@papodecraquecw O @Alex10combr como vc conseguiu ingresso pra final chegando em cima da hora... kkkkkkk,https://twitter.com/samusrt/status/78464180075761664,2011-06-08,11:11:32
78110183741603840,"@papodecraquecw Façam uma campanha, para todos cantarem o hino do estado do Paraná, amanhã na decisão da Copa do Brasil.",https://twitter.com/samusrt/status/78110183741603840,2011-06-07,11:44:53
75937883688681472,@papodecraquecw Eu participo todo dia... tá na hora de eu ganhar um sortei... ihullll,https://twitter.com/samusrt/status/75937883688681472,2011-06-01,11:52:56
75210412597059584,"@papodecraquecw O Cleiton foi mal  no jogo, mas deveria estar com a cabeça a mil com essa saída... força Cleiton.",https://twitter.com/samusrt/status/75210412597059584,2011-05-30,11:42:14
75207906194235392,@papodecraquecw O Paulinho do Corinthians não matou a bola no braço no primeiro gol?,https://twitter.com/samusrt/status/75207906194235392,2011-05-30,11:32:16
74119969570430976,"@papodecraquecw Este tal de Ibiapina está no time certo, adora falar, falar, mas futebol que é bom nada!!!",https://twitter.com/samusrt/status/74119969570430976,2011-05-27,11:29:12
71219323930296320,"@papodecraquecw Fernando Henrique é mão de pau, da altos rebotes, é só o Coxa ganhar a segunda bola que faz gol!",https://twitter.com/samusrt/status/71219323930296320,2011-05-19,11:23:04
68327675206451201,"@papodecraquecw Todo mundo sabe que o Paraná Clube só está contratando pseudo jogadores,só o Irapitan acredita que vai dar certo,cara chato!",https://twitter.com/samusrt/status/68327675206451201,2011-05-11,11:52:41
68324607047905281,"@papodecraquecw Se o Vasco anular a bola parada e alçada na área, diminuem 90% das chances de gol do Cap",https://twitter.com/samusrt/status/68324607047905281,2011-05-11,11:40:30
66504996161716224,@papodecraquecw Manda o Irapitan cuidar do paranazinho dele e parar de falar besteira sobre o Coxa...,https://twitter.com/samusrt/status/66504996161716224,2011-05-06,11:10:01
62530463423672320,@papodecraquecw O Jairo Silva tá muito engraçado... huahuahauhauahuah,https://twitter.com/samusrt/status/62530463423672320,2011-04-25,11:56:38
62303159598592000,"Coxa bicampeão invicto, recorde nacional com 21 vitórias seguidas... O melhor time do mundo",https://twitter.com/samusrt/status/62303159598592000,2011-04-24,20:53:25
61672576170201088,@TaraLynnFoxx  Este é o tipo de mulher q não existe não Brasil...,https://twitter.com/samusrt/status/61672576170201088,2011-04-23,03:07:42
60718084918484992,"@papodecraquecw O comandante da PM acabou de falar: ""A nossa recomendação é que os jogadores do Coxa não comemorem os GOLS."" VERGONHA",https://twitter.com/samusrt/status/60718084918484992,2011-04-20,11:54:54
60718084788469760,"@papodecraquecw O comandante da PM acabou de falar: ""A nossa recomendação é que os jogadores do Coxa não comemorem os GOLS."" VERGONHA",https://twitter.com/samusrt/status/60718084788469760,2011-04-20,11:54:54
60716214929981440,"@papodecraquecw Coloca eu pra participar desses sorteios também. Samuel Toaldo, 9654-2383, Time do Coração: Coritiba",https://twitter.com/samusrt/status/60716214929981440,2011-04-20,11:47:28
60350395238719488,@papodecraquecw O cap NÃO passa do Bahia amanhã!,https://twitter.com/samusrt/status/60350395238719488,2011-04-19,11:33:50
60116828256612352,1 hora de atraso na aula de história da física ffffuuuuuu,https://twitter.com/samusrt/status/60116828256612352,2011-04-18,20:05:43
55295817141059584,Agora: Sem nada pra fazer; Amanhã: se ferrar na prova de clássica. #FATO,https://twitter.com/samusrt/status/55295817141059584,2011-04-05,12:48:44
54680435883655168,Eu gostei de um vídeo do YouTube -- Lacres por uma cadeira de rodas? @guarana_oficial  http://youtu.be/SIxh1JRjthk?a,https://twitter.com/samusrt/status/54680435883655168,2011-04-03,20:03:26
50295232532725760,"@TEsportes Coritiba apresenta mais um patrocínio amanhã, Branco Motores.",https://twitter.com/samusrt/status/50295232532725760,2011-03-22,17:38:12
46383794613272576,"Bem loco... parada chata das antigas... hahahahaha, muito bom!(YouTube  http://youtu.be/721u7MrOF1E?a)",https://twitter.com/samusrt/status/46383794613272576,2011-03-11,22:35:33
39806695857197056,"@TEsportes tá na hora de mudar o nome da rádio para ""Transatlético Esportes""",https://twitter.com/samusrt/status/39806695857197056,2011-02-21,19:00:30
39806300091056129,"@TEsportes é brincadeira... vc conseguiram só falar do cap hoje, decepcionado com essa rádio, e sobre o baile do Coxa, NADA!",https://twitter.com/samusrt/status/39806300091056129,2011-02-21,18:58:56
38273365999357952,Eu gostei de um vídeo do YouTube -- Que cachorro o que! Eu não sou cachorro não! (Marc...  http://youtu.be/wblQEjEpx6o?a,https://twitter.com/samusrt/status/38273365999357952,2011-02-17,14:27:36
35502302664069120,"@rafaelportocwb Melhor transmissão do ano... tava muito engraçado, hauhauhauha",https://twitter.com/samusrt/status/35502302664069120,2011-02-09,22:56:23
35487988746162176,"@rafaelportocwb O Paraná Clube tem as mesmas cores do palhaço Bozo, só que o Bozo não é tão engraçado... huahuahuaha",https://twitter.com/samusrt/status/35487988746162176,2011-02-09,21:59:30
35486444608962560,"@ETtransamerica O Paraná Clube tem as mesmas cores do palhaço Bozo, só que o Bozo não é tão engraçado... huahuahuaha",https://twitter.com/samusrt/status/35486444608962560,2011-02-09,21:53:22
27393350042648576,"Eu não minto para as mulheres, protejo-as da verdade!",https://twitter.com/samusrt/status/27393350042648576,2011-01-18,13:54:18
25906228110561280,Amanhã tem @spirax3 no Hermes Bar a partir das 21:30...,https://twitter.com/samusrt/status/25906228110561280,2011-01-14,11:25:00
24895716342112256,"Sábado o lance vai ser tipo ""beatles""... hauhauuaha",https://twitter.com/samusrt/status/24895716342112256,2011-01-11,16:29:35
22003249208889344,"Para começar o primeiro dia de trabalho em 2011, chuva na hora de ir embora... eeee Curitiba!",https://twitter.com/samusrt/status/22003249208889344,2011-01-03,16:55:58
21983794097557504,"Eu gostei de um vídeo do YouTube -- Optical ilusion""Tou a sentir o teu dedo""  http://youtu.be/cTgIQpGqB9k?a",https://twitter.com/samusrt/status/21983794097557504,2011-01-03,15:38:39
20558293562822656,Feliz Ano novo... Happy New Year!,https://twitter.com/samusrt/status/20558293562822656,2010-12-30,17:14:13
20553861630529536,"Desculpem, sou leigo nesse tipo de assunto, mas quem é o ""pai da mentira&...(YouTube  http://youtu.be/gUaKCu2AAf4?a)",https://twitter.com/samusrt/status/20553861630529536,2010-12-30,16:56:37
18376378562904064,Feliz Natal povo do meu planeta...,https://twitter.com/samusrt/status/18376378562904064,2010-12-24,16:44:04
14742060905005056,"""Inter do meu coração..."" - GOL DO MAZEMBE.... ""Não, não, não...""",https://twitter.com/samusrt/status/14742060905005056,2010-12-14,16:02:35
14742060896616448,"""Inter do meu coração..."" - GOL DO MAZEMBE.... ""Não, não, não...""",https://twitter.com/samusrt/status/14742060896616448,2010-12-14,16:02:35
12545069282238464,CERN dá mais um passo no estudo da antimatéria  http://www.inovacaotecnologica.com.br/noticias/noticia.php?artigo=cern-antimateria&id=010175101207 …,https://twitter.com/samusrt/status/12545069282238464,2010-12-08,14:32:32
12519702823706626,"""Eu to matando todo mundo?""",https://twitter.com/samusrt/status/12519702823706626,2010-12-08,12:51:44
2173080864559105,"@sheep_tinho Está feliz, pois #ocoritibavoltou",https://twitter.com/samusrt/status/2173080864559105,2010-11-09,23:37:57
625319740448769,Sexta... chuva na hora de ir embora do trampo #putaquepariu,https://twitter.com/samusrt/status/625319740448769,2010-11-05,17:07:42
29583902111,"@MundoLivreFm Qual a opinião da Mundo Livre, sobre o cenário de Curitiba, segundo oq diz o vídeo  http://www.youtube.com/watch?v=XSaXY0W1OHc",https://twitter.com/samusrt/status/29583902111,2010-11-03,13:57:36
29411439230,Eu gostei de um vídeo do YouTube -- A Laranja Irritante: Feliz Aniversário  http://youtu.be/ebC9bQ9dqfQ?a,https://twitter.com/samusrt/status/29411439230,2010-11-01,20:20:57
28052154012,"@TEsportes ET + Samuel Toaldo, São Braz, 9654-2383, Time do Coração: Coxa",https://twitter.com/samusrt/status/28052154012,2010-10-21,17:00:56
27241802624,"Eu quero um par de ingressos! @91Rock É amanhã, Nazareth em CURITIBA:  http://tinyurl.com/3azp2vo",https://twitter.com/samusrt/status/27241802624,2010-10-13,10:39:55
26548404261,"@sheep_tinho #NobuoUematsu nossa que fodastico é essa banda... enche até um Morumbi ou Maracanã, tipo o #Rush...",https://twitter.com/samusrt/status/26548404261,2010-10-06,09:56:24
25400703957,"Acordei atrasado, perdi minha consulta no oftalmo, esqueci minha carteira, meu combustível tá acabando e tem feijoada na hora do almoço*___*",https://twitter.com/samusrt/status/25400703957,2010-09-24,09:51:00
16196579029,É amanhã... Brasil!,https://twitter.com/samusrt/status/16196579029,2010-06-14,23:57:27
6088306921,@programaupload Amanhã não da Alexandre... já comprei ingresso p show do AC DC... senão... huahauhuahuaha,https://twitter.com/samusrt/status/6088306921,2009-11-26,16:12:31
6058044899,Amanhã só é preciso tirar 6.0 na prova de Física IV... duro é conseguir!,https://twitter.com/samusrt/status/6058044899,2009-11-25,17:05:30
5993835627,"@leandrorequena Poxa Leandro, duro é aguentar os jogadores pedirem mobilização da torcida, mais uma vez vamos ter que ganhar no grito!",https://twitter.com/samusrt/status/5993835627,2009-11-23,23:04:32
5752218660,"E o Coxa infelizmente tirou o título do Galo... triste mas em primeiro lugar, sempre o Coritiba!!!",https://twitter.com/samusrt/status/5752218660,2009-11-15,23:24:52
5684485364, http://twitpic.com/pd2fi - Cachorro Abajur... nauuuuummmmm,https://twitter.com/samusrt/status/5684485364,2009-11-13,14:58:27
5651219737,"Ontem assisti Jogos Mortais VI,fiquei pensando na grana q eu gastei no cinema com esse filme...imagina no mundo...ai se explica o pq do ""VI""",https://twitter.com/samusrt/status/5651219737,2009-11-12,13:17:03
5574764176,"@leandrorequena Leandro, faz um RT falando sobre o filme ""Coração Verde Branco""... muito bom!",https://twitter.com/samusrt/status/5574764176,2009-11-09,22:49:26
5574487877,"Hoje estive presentre na estréia do filme ""Coração Verde Branco - O Filme"", produzido por Gilson de Paula.",https://twitter.com/samusrt/status/5574487877,2009-11-09,22:38:52
5336142954,@leandrorequena Será que a derrota no atleTIBA gerou uma crise para os lados baixos da cidade? Engraçado que a imprensa não comenta nada!!!,https://twitter.com/samusrt/status/5336142954,2009-11-01,10:00:54
5293634883,"6)Alguém chegará no escuro,sem avisar:Nunca tive um amigo q entrou em minha casa sem avisar,no escuro e colocou a mão em meu ombro.",https://twitter.com/samusrt/status/5293634883,2009-10-30,16:03:34
5293432385,"2)Verificar barulho estranho:A coragem dos personagens de terror é algo impressionante!Qualquer garota indefesa q escutar barulho,vai atrás.",https://twitter.com/samusrt/status/5293432385,2009-10-30,15:55:05
5209013789,Eu adoro esse clima de Curitiba... verdade!,https://twitter.com/samusrt/status/5209013789,2009-10-27,17:44:17
5042173774,"#Movie: ""Arraste-me para o Inferno"" (Drag Me to Hell) deu pra pular da cadeira e reviver o clássico ""Uma Noite Alucinte"" (Evil Dead I e II)",https://twitter.com/samusrt/status/5042173774,2009-10-21,09:50:23
4841240529,Carro 0 km é uma porcaria.. parece que todo mundo tenta bater nele de propósito... PQP,https://twitter.com/samusrt/status/4841240529,2009-10-13,15:33:33
4636386179,"Após a vitória contra o Inter, o Coritiba mostrou o potencial dessa equipe, pena que é tarde, mas 2010 promete...",https://twitter.com/samusrt/status/4636386179,2009-10-05,17:09:12
3431278120,"@herreraXVIII Observei alguns post's seus na comunidade do Gremio, onde fala que a torcida do Coritiba só canta na hora do gol...",https://twitter.com/samusrt/status/3431278120,2009-08-20,14:26:08
3308440083,Ver jogadores descompromissados com as cores do seu time do coração é muito triste.,https://twitter.com/samusrt/status/3308440083,2009-08-14,11:38:03
3271333206,"Duro é agüentar a pegação no pé da guria do RH. Era operadora de caixa, fez uma faculdade Uniesquina... agora já viu como é, né!",https://twitter.com/samusrt/status/3271333206,2009-08-12,16:36:26
3145160453,"A epidemia está aumentando, não a do H1N1, mas sim a dos piás de prédio que querem a cabeça do Renè... acorda torcida Coxa Branca",https://twitter.com/samusrt/status/3145160453,2009-08-05,10:36:09
2316290777,"Amanhã prova de Física... será que estou preparado, nada que papel e uma tesoura não resolvam...",https://twitter.com/samusrt/status/2316290777,2009-06-24,18:05:38
1142221761213345792,"O comentário que o Marreco saiu gigante, só mostra que ele se acha o reizinho engana trouxa e pior ele consegue. Sabe o que é o mais triste? Não vai dar em nada esses crimes vazados e o povo continua aplaudindo.",https://twitter.com/samusrt/status/1142221761213345792,2019-06-21,21:04:23
1141758247155560448,"Tá bem difícil, é uma postagem promovida pelo @McDonalds_BR para uma promoção. Olha os comentários recheados de preconceitos e ódio, TODOS apoiadores de quem? Adivinha? Se toquem, parem com isso! https://twitter.com/McDonalds_BR/status/1141482350741794823 …",https://twitter.com/samusrt/status/1141758247155560448,2019-06-20,14:22:33
1141161645122736129,"Eu coloco todo mês, mas existem muitas empresas que não entendem as estratégias e estão queimando dinheiro. Pior que o Face dá o que promete, é um dos canais publicitários mais baratos e com resultado comprovado.",https://twitter.com/samusrt/status/1141161645122736129,2019-06-18,22:51:52
1138068434711982080,"Galerinha, ter bilionário de estimação não vai deixar vcs ricos.",https://twitter.com/samusrt/status/1138068434711982080,2019-06-10,10:00:33
1137871482921652224,"O Marcos (ex goleiro do Paraná) publicou uma carta relatando como era difícil trabalhar com o Pastana. Buscar referências sempre foi a melhor forma de encontrar bons profissionais, mas parece que essa opção simples e que não custa nada, passa longe nas contratações da diretoria.",https://twitter.com/samusrt/status/1137871482921652224,2019-06-09,20:57:56
1133781387373436928,"Primeira vez que me param após detector de metal no aeroporto pra fazer revista de segurança. O procedimento tinha opção da revista ser publica ou em local reservado, escolhi a segunda e na caminhada até a sala, todo mundo me julgando com seus olhares. Sei lá, mas me senti mal!",https://twitter.com/samusrt/status/1133781387373436928,2019-05-29,14:05:22
1132802135865876481,"Cale a boca, sair na rua pra pedir fechamento do congresso e apoiar presidente é exatamente oq aconteceu na Venezuela, seu mal caráter do caralho. Burro!",https://twitter.com/samusrt/status/1132802135865876481,2019-05-26,21:14:10
1131257312805625863,"Se vc for goleiro, também pode denunciar no menu Ajuda (?) canto direito superior do App em Denúncia. Se não sobre o nome do goleiro, coloque detalhes do local, data e horário, que o suporte cruza as informações e descobre quem é o goleiro.",https://twitter.com/samusrt/status/1131257312805625863,2019-05-22,14:55:35
1130811691745402881,"Há 20 anos atrás, minha mãe foi “abraçada” pela Igreja Universal. Período difícil, ela achava que tudo à sua volta era do mal. Boa parte da renda familiar era para votos de prosperidade. Até que nossa única refeição por dias era uma panela de sopa de feijão, pra dividir em dois.",https://twitter.com/samusrt/status/1130811691745402881,2019-05-21,09:24:51
1128843214566375435,Sabe qualé o pior? Que se jogar a fórmula H2O na frente do @jairbolsonaro ele não vai saber responder o que significa.,https://twitter.com/samusrt/status/1128843214566375435,2019-05-15,23:02:49
1128465705970667520,"Sei bem como é difícil desenvolver um app e fazer ele embalar. Criei o app Goleiro de Aluguel e participei do Shark Tank, se quiser, fala pra seu pai trocar uma ideia comigo, conversar é a forma mais de solucionar os problemas dos nossos negócios e não custa nada, blz.",https://twitter.com/samusrt/status/1128465705970667520,2019-05-14,22:02:44
1122090767068160000,"Eu: Lula está preso, nem sei mais oq dizer, acho que ele é culpado mesmo, não quero mais falar sobre isso, segue o jogo.   Lula: a  Eu:  pic.twitter.com/Dtdbvi0mWL",https://twitter.com/samusrt/status/1122090767068160000,2019-04-27,07:51:00
1121531708074070017,Está sendo um período difícil para o Coxa Branca 😕,https://twitter.com/samusrt/status/1121531708074070017,2019-04-25,18:49:30
1121020052566884353,"No dia da demissão, voltando pra casa, com o rosto machucado e chorando, vi uma escola técnica com uma vaga de estágio para informática. Não fazia um mês que eu estava fazendo curso Técnico de Informática, ferrado, entrei no local pra pedir informações.",https://twitter.com/samusrt/status/1121020052566884353,2019-04-24,08:56:22
1121020026654527489,"Ufa... deixamos a gravidade agir em nosso ovo e ele chegou ao chão sem nenhuma rachadura. Na próxima fase, os aprovados se apresentavam dizendo qual sua melhor qualidade e seu pior defeito. Todo mundo dizia: “Meu pior defeito é trabalhar demais!”",https://twitter.com/samusrt/status/1121020026654527489,2019-04-24,08:56:16
1120126460449165314,35 anos 13 casas 1 cidade 1 escola 1 universidade 2 países  https://twitter.com/_dani_era/status/1120096115515428866 …,https://twitter.com/samusrt/status/1120126460449165314,2019-04-21,21:45:33
1117380351775707136,"Tenta escrever difícil pra parecer intelectual, mas no final, parece um retardado!",https://twitter.com/samusrt/status/1117380351775707136,2019-04-14,07:53:30
1114997194745163776,"É aquela risadinha de nervoso, saca!?",https://twitter.com/samusrt/status/1114997194745163776,2019-04-07,18:03:41
1108535335041028101,A atual diretoria anda a passos largos para se tornar a pior gestão desde 1909. Parabéns aos envolvidos e apoiadores!,https://twitter.com/samusrt/status/1108535335041028101,2019-03-20,22:06:34
1108533473386602497,"Pronto, a previsão é que o @Coritiba vai deixar o aspirante do rival levar o estadual 2019. Óbvio que o discurso da diretoria e parte da torcida será que nosso foco é subir pra primeira divisão do Brasileirão. É triste!",https://twitter.com/samusrt/status/1108533473386602497,2019-03-20,21:59:10
1108357581116968961,"Acho que o Marcos não tá acostumado a organizar a pelada, é uma dor de cabeça real não conseguir goleiro, já é tradição o guapo nem pagar os custos do campo e mesmo assim é difícil achar alguém disposto a ficar debaixo da trave.",https://twitter.com/samusrt/status/1108357581116968961,2019-03-20,10:20:14
