id,tweet,link,date,time
977921599570575360,"Em Minas nosso crescimento vem sendo orgânico, confio que assim que as ações de marketing sejam voltadas pra região, o número de convocações vai crescer!   http://www.soubh.com.br/noticias/tecnologia-2/goleiro-para-pelada-em-bh/ …",https://twitter.com/samusrt/status/977921599570575360,2018-03-25,11:54:12
977907163011182593,"Neste horário o “Verdão” é lotado de trabalhadores, até que um dia um cidadão foi passar na catraca, sua bolsa enroscou e a marmita acabou caindo, numa sequência de azar, o recipiente abriu e o bife saltou para o chão emborrachado do bonde...",https://twitter.com/samusrt/status/977907163011182593,2018-03-25,10:56:50
976814552384987136,"“Fala” baixo, senão essa será a nova desculpa da diretoria pra manter o Forner, dizendo que ele pode ser o futuro Scolari.",https://twitter.com/samusrt/status/976814552384987136,2018-03-22,10:35:12
974612204090806272,"Convido todos para o Webinar da Startup Village dia 20 de março às 19:00. Vamos conversar sobre a validação do negócio, faturamento e outros detalhes.   A participação é online. Faça sua inscrição gratuita em   https://events.genndi.com/register/169105139238469200/e7fac154e6 … pic.twitter.com/psZsHhBmc5",https://twitter.com/samusrt/status/974612204090806272,2018-03-16,08:43:51
967890004524617730,"Hoje foi dia de valorizar meu livro do @Coritiba, com os autógrafos de Cláudio Marques e Reginaldo Nascimento. #coxa pic.twitter.com/w4jP7xj2FM – em Estádio Couto Pereira",https://twitter.com/samusrt/status/967890004524617730,2018-02-25,19:32:14
966865135557136384,Seu futuro será brilhante no Coritiba!,https://twitter.com/samusrt/status/966865135557136384,2018-02-22,23:39:46
966268977587671040,"A reestruturação se faz necessária, é dolorosa para os torcedores e muitos não conseguem assimilar questões econômicas, é nesse exato momento que os sócios precisam aguentar firme essas mudanças e continuar frequentando o Couto!",https://twitter.com/samusrt/status/966268977587671040,2018-02-21,08:10:51
962520765198491648,"Fazia tempo que não comemorava um gol com tanta emoção, fiquei muito feliz por ser você cobrando aquela falta! Vai pra cima deles Rusch 👊",https://twitter.com/samusrt/status/962520765198491648,2018-02-11,00:56:47
956846156025417728,"Hoje é um grande dia, ansioso para o 1º Workshop do Goleiro de Aluguel!",https://twitter.com/samusrt/status/956846156025417728,2018-01-26,09:07:55
956297954477920257,"Marcão estará nesta sexta (26/01) no Workshop do Goleiro de Aluguel, com a palestra “Vida de Goleiro” às 18:00.",https://twitter.com/samusrt/status/956297954477920257,2018-01-24,20:49:34
954457558164606976,Assim começa uma nova vida!   #casamento #familia  https://www.instagram.com/p/BeJS5r9BMyy/ ,https://twitter.com/samusrt/status/954457558164606976,2018-01-19,18:56:29
952857880906096640,"Deixei de seguir dezenas de fanpages, usei e abusei do filtro/bloqueio de conteúdo, assim ajudou um pouco na experiência de uso!",https://twitter.com/samusrt/status/952857880906096640,2018-01-15,08:59:56
951634137093496832,Fotografia e trilha sonora de #BladeRunner2049 é foda pra c@&$lho!!!,https://twitter.com/samusrt/status/951634137093496832,2018-01-11,23:57:13
951406309374615552,"50% das novas ideias e soluções de problemas para minha startup, surgem durante o banho. Aproveitem esse momento!!!",https://twitter.com/samusrt/status/951406309374615552,2018-01-11,08:51:55
950704364431212545,"Dia 26 de janeiro será o 1º Workshop Goleiro de Aluguel, com palestras, novidades, premiações para os melhores de 2017 e sorteios de prêmios. Vc está convidada @Nadjapm",https://twitter.com/samusrt/status/950704364431212545,2018-01-09,10:22:38
948453398659108865,"Sem piscar o olho essa noite, será que o cachorro preto está voltado? #blackdog #depression",https://twitter.com/samusrt/status/948453398659108865,2018-01-03,05:18:06
948162331682443264,"@SandroMagaldi e @GeracaodeValor desde 2015 acompanho o Nerdcast Empreendedorismo. Com essa mentoria criei um aplicativo, ofereci um opção de complemento de renda para milhares de pessoas, recebi investimento do João Appolinário e Carlos Wizard e faturei 500 mil no ano. Obrigado!",https://twitter.com/samusrt/status/948162331682443264,2018-01-02,10:01:30
948004955201425408,"U.S.S. Callister foi OK, mas Arkangel (2º episódio da 4ª temporada) foi foda! #BlackMirror4",https://twitter.com/samusrt/status/948004955201425408,2018-01-01,23:36:09
945201248671854592,Entreguem os presentes dos seus filhos no dia 25 de manhã... dar presentes dia 24 à noite deixa a criançada eufórica e com insônia! Feliz Natal 🎄,https://twitter.com/samusrt/status/945201248671854592,2017-12-25,05:55:13
926822745442152449,Jogar ao lado do seu ídolo de infância: Ademir Alcântara. Experiência que só o goleirodealuguel…  https://www.instagram.com/p/BbE8CZ9BtWL/ ,https://twitter.com/samusrt/status/926822745442152449,2017-11-04,12:45:36
923665952344068097,“Muitos jovens pensam que o sonho acontece de uma hora para outra e não é bem assim. Sonhos são…  https://www.instagram.com/p/Baugf35BylA/ ,https://twitter.com/samusrt/status/923665952344068097,2017-10-26,19:41:38
923238393953349632,"Hoje é o Dia da Inovação no sebraepr, foi muito legal contar a aventura do goleirodealuguel para…  https://www.instagram.com/p/BareCRshSXd/ ",https://twitter.com/samusrt/status/923238393953349632,2017-10-25,15:22:40
918575155365937152,"Da minha carrocinha, só queria dizer: Feliz Dia das Crianças.   #diadascriancas #crianças #children  https://www.instagram.com/p/BaKVeIQBoEz/ ",https://twitter.com/samusrt/status/918575155365937152,2017-10-12,17:32:37
917501375025524737,"Isso transforma, motiva a encarar qualquer desafio. Um grande abraço aos meus amigos de Mali 🇲🇱…  https://www.instagram.com/p/BaCtK9Mh6J4/ ",https://twitter.com/samusrt/status/917501375025524737,2017-10-09,18:25:48
908369176091389952,Foi de quebrar a cabeça... no dia seguinte!  #friends #amigos #aniversario #bday #cerveja  https://www.instagram.com/p/BZB0VIaHSS9/ ,https://twitter.com/samusrt/status/908369176091389952,2017-09-14,13:37:42
907561326951747584,Energizando a vida!  #dormir #abraço #love #sono #sonhar  https://www.instagram.com/p/BY8E90jnNQf/ ,https://twitter.com/samusrt/status/907561326951747584,2017-09-12,08:07:36
904486458727178241,"Fechando a noite com meu ídolos ""internéticos"" @azaghal e @jovemnerd 🖖 #nerdpower #nerds…  https://www.instagram.com/p/BYmOrVUHE98/ ",https://twitter.com/samusrt/status/904486458727178241,2017-09-03,20:29:10
900301390270091270,Gostei de um vídeo @YouTube  http://youtu.be/bWH3KsxtCNI?aSamuel … Toaldo e o aplicativo que melhora a vida de goleiros e fãs de futebol,https://twitter.com/samusrt/status/900301390270091270,2017-08-23,07:19:12
895109050953863169,Na literal alegria e na tristeza!  #amigos #socios #cerveja @ Hop'n Roll Brewpub  https://www.instagram.com/p/BXjmU6_lC3Q/ ,https://twitter.com/samusrt/status/895109050953863169,2017-08-08,23:26:42
881630008518881285,Inspiração para a vida!  #Mali #liçãodevida #porummundomelhor  https://www.instagram.com/p/BWD0xTqlkom/ ,https://twitter.com/samusrt/status/881630008518881285,2017-07-02,18:45:48
877669138461859841,"Hoje o dia foi massa, gravamos com o programa PE&GN  @peqempresas…  https://www.instagram.com/p/BVnrjdXl97S/ ",https://twitter.com/samusrt/status/877669138461859841,2017-06-21,20:26:43
869598191766974465,Gostei de um vídeo @YouTube  http://youtu.be/6UEUAdKo6Hc?a6  PRÁTICAS PARA ORGANIZAR A SUA VIDA - Ricardo Dória,https://twitter.com/samusrt/status/869598191766974465,2017-05-30,13:55:39
866378906122596352,"Gostei de um vídeo @YouTube  http://youtu.be/_FGjwySFb5A?a7  momentos ""VAI DAR RUIM"" do cinema!",https://twitter.com/samusrt/status/866378906122596352,2017-05-21,16:43:22
866045297725628416,Gostei de um vídeo @YouTube  http://youtu.be/uZZk67WjsEM?aDeterminismo … - O futuro já está escrito? | Nerdologia 233,https://twitter.com/samusrt/status/866045297725628416,2017-05-20,18:37:43
859030269629739009,Gostei de um vídeo @YouTube  http://youtu.be/ze0qDsJGOBM?aA  Programação e a Vida | Nerdologia Tech 08,https://twitter.com/samusrt/status/859030269629739009,2017-05-01,10:02:30
859015196165144576,Gostei de um vídeo @YouTube  http://youtu.be/dY8QHXqbdtk?aOS  4 COMPROMISSOS: METÁFORAS QUE EXPLICAM A VIDA - Ricardo Dória,https://twitter.com/samusrt/status/859015196165144576,2017-05-01,09:02:37
857405279473979393,"O que posso falar no dia do goleiro!? Uma paixão e hobby que virou minha profissão, mudou minha…  https://www.instagram.com/p/BTXso8wF93-/ ",https://twitter.com/samusrt/status/857405279473979393,2017-04-26,22:25:23
850422009637089283,Gostei de um vídeo @YouTube  http://youtu.be/XrvoPFPGR5A?aUM  DIA A CASA CAI | NC Stories 13,https://twitter.com/samusrt/status/850422009637089283,2017-04-07,15:56:21
847797518805065728,Duas paixões: futebol e música. E hoje à noite é dia de curtir eltonjohn   #eltonjohn #pedreira…  https://www.instagram.com/p/BSTbiRohWm7/ ,https://twitter.com/samusrt/status/847797518805065728,2017-03-31,10:07:34
844290154869112832,"Pode ser que falte pouco tempo pra vc ir embora, mas agora você estará sempre comigo,…  https://www.instagram.com/p/BR6gkrYhR34/ ",https://twitter.com/samusrt/status/844290154869112832,2017-03-21,17:50:33
841004131196133376,"1. Adversário forte e organizado 2. Noite mal dormida, sonhando com a derrota 3. Jogo as 11:00…  https://www.instagram.com/p/BRjKQ4RBRmm/ ",https://twitter.com/samusrt/status/841004131196133376,2017-03-12,16:13:04
839557257767444480,1 mãe + 1 filha + 1 esposa + 5 irmãs + 5 sobrinhas + 2 sobrinhas netas + 1 cachorra = acho que…  https://www.instagram.com/p/BRY4TR0hYL6/ ,https://twitter.com/samusrt/status/839557257767444480,2017-03-08,16:23:43
837462256350720000,Nossos amigos do @qgfoodtruck pescaram 2 tubarões (robinsonshiba  e joaoappolinario) usando com…  https://www.instagram.com/p/BRJ_mfzhBJf/ ,https://twitter.com/samusrt/status/837462256350720000,2017-03-02,21:38:55
834871979085701121,O filho da Dona Circe e Seu Imério nunca imaginou que um dia seria sócio desses tubarões.  Muito…  https://www.instagram.com/p/BQ3lrk_Bf8W/ ,https://twitter.com/samusrt/status/834871979085701121,2017-02-23,18:06:05
833643449043738624,Gostei de um vídeo @YouTube  http://youtu.be/kpdIxm-yDp8?aVR  e tecnologias do futuro | NerdOffice S08E07,https://twitter.com/samusrt/status/833643449043738624,2017-02-20,08:44:21
826956384365326336,Gostei de um vídeo @YouTube  http://youtu.be/LAFk7MPpCZ8?aPilotinho … Gabrie realizando o sonho ganhando uma motinha de motocross,https://twitter.com/samusrt/status/826956384365326336,2017-02-01,22:52:20
820096162065567745,Se essa rua fosse minha... eu investia R$um milhão!  #amigos #empreender @ Armazém Garagem Bar  https://www.instagram.com/p/BPOmak9BP02/ ,https://twitter.com/samusrt/status/820096162065567745,2017-01-14,00:32:16
817683962789138432,Gostei de um vídeo @YouTube de @fecastanhari  http://youtu.be/RlJrkUBqMc4?a  Por que fazer aniversário perto do natal é ruim?,https://twitter.com/samusrt/status/817683962789138432,2017-01-07,08:47:03
817036492216434690,Gostei de um vídeo @YouTube  http://youtu.be/330iPIXV9Rg?aComo … construir influência para conquistar pessoas e viabilizar projetos.,https://twitter.com/samusrt/status/817036492216434690,2017-01-05,13:54:14
816443050528505856,Gostei de um vídeo @YouTube  http://youtu.be/uuUT0pCWh5w?aComo … pessoas legais ganham confiança? Aprenda a conquistar as pessoas à sua,https://twitter.com/samusrt/status/816443050528505856,2017-01-03,22:36:06
814422660293754881,Häagen-Dazs é foda... Temer eu entendo vc,https://twitter.com/samusrt/status/814422660293754881,2016-12-29,08:47:48
813003402137387008,"Hoje é dia de acordar cedinho e correr para a árvore de natal, abrir os presentes.   #feliznatal…  https://www.instagram.com/p/BOcNAXQhDJo/ ",https://twitter.com/samusrt/status/813003402137387008,2016-12-25,10:48:10
812651059898236928,Gostei de um vídeo @YouTube de @nerdologia  http://youtu.be/bekl2o1s6oA?a  O sono e os sonhos | Nerdologia 195,https://twitter.com/samusrt/status/812651059898236928,2016-12-24,11:28:05
809500724505628672,Dia 14 de janeiro de 2015 foi a primeira vez que entrei em campo como Goleiro de Aluguel. Estava…  https://www.instagram.com/p/BODUK9bB1cR/ ,https://twitter.com/samusrt/status/809500724505628672,2016-12-15,18:49:47
798643649261158400,"O tempo passa e as marcas aparecem, sejam elas de tristezas ou felicidades.  #estamosvelhos…  https://www.instagram.com/p/BM2K8lVBqBu/ ",https://twitter.com/samusrt/status/798643649261158400,2016-11-15,19:47:38
795656285408534529,Hoje à manhã foi nossa! #deitadonosofa #minhafilhameuamor  https://www.instagram.com/p/BMg8cybBg33/ ,https://twitter.com/samusrt/status/795656285408534529,2016-11-07,13:56:55
790684340376043521,E nossa alegria completou seu primeiro mês de vida 🎉🎉🎉 kattybrandao #bday #1mesdevida  https://www.instagram.com/p/BL9ndxfhnko/ ,https://twitter.com/samusrt/status/790684340376043521,2016-10-24,20:40:11
786368167903830016,"Durante 10 anos da minha vida minha relação entre pai e filha era com essa grandona, agora…  https://www.instagram.com/p/BLe8tDxBtNa/ ",https://twitter.com/samusrt/status/786368167903830016,2016-10-12,21:49:15
784464186923298816,Gostei de um vídeo @YouTube  http://youtu.be/GJd-lvGCc6Y?a@twittezao … ARETUZA : Um belo dia no parque,https://twitter.com/samusrt/status/784464186923298816,2016-10-07,15:43:31
784359209999732736,Gostei de um vídeo @YouTube  http://youtu.be/pv5w-ueGHbY?aOkay … Pessoal!!! (24/08/16) - Quarta - Otávio se emociona em conversa com Faustão,https://twitter.com/samusrt/status/784359209999732736,2016-10-07,08:46:23
783791708077191168,Gostei de um vídeo @YouTube  http://youtu.be/Gp-bIv8fXzk?aThe … Noite (04/10/16) - Entrevista com elenco do Shark Tank Brasil,https://twitter.com/samusrt/status/783791708077191168,2016-10-05,19:11:20
783670705149714432,Preciosas em minha vida! #pokerdesdecriança #goalkeeper  https://www.instagram.com/p/BLLyCdfBRFF/ ,https://twitter.com/samusrt/status/783670705149714432,2016-10-05,11:10:30
782407721643409408,Dançar sábado à noite é muito bom.  #theblackkeys #lonelyboy  https://www.instagram.com/p/BLCzs1ahzaf/ ,https://twitter.com/samusrt/status/782407721643409408,2016-10-01,23:31:51
775669578353508352,"O decreto está aberto... Hoje é dia da maldade, vou aplicar a filosofia do ""mim acher"" e travar…  https://www.instagram.com/p/BKS7jLPAAj1/ ",https://twitter.com/samusrt/status/775669578353508352,2016-09-13,09:16:53
768978648661651456,"Chegar em casa e essa grandona morrendo de saudade, coisa boa da vida 😍 #filabrasileiro  https://www.instagram.com/p/BJjY3fEjAq1/ ",https://twitter.com/samusrt/status/768978648661651456,2016-08-25,22:09:31
764980867886419968,Gostei de um vídeo @YouTube  http://youtu.be/NrMerPxAXuk?aBRAAAP … DO DIA #3 - Entrevista com o pilotinho Gabriel Toaldo em Curitiba-PR (,https://twitter.com/samusrt/status/764980867886419968,2016-08-14,21:23:46
764805644918677504,Eu nem tinha me tocado que hoje era dia dos pais... O meu primeiro! ☺️ #felizdiadospais #papai  https://www.instagram.com/p/BJFvNFcAsYi/ ,https://twitter.com/samusrt/status/764805644918677504,2016-08-14,09:47:29
761543416064970752,Gostei de um vídeo @YouTube de @fecastanhari  http://youtu.be/C_xDa_QqwL0?a  Aprenda a jogar POKÉMON GO - Nostalgia,https://twitter.com/samusrt/status/761543416064970752,2016-08-05,09:44:33
758722277181710337,"O goleirodealuguel me proporciona muitas surpresas em minha vida, acredito que isso é fruto de…  https://www.instagram.com/p/BIagzxPAdCb/ ",https://twitter.com/samusrt/status/758722277181710337,2016-07-28,14:54:21
756163605960286210,Gostei de um vídeo @YouTube  http://youtu.be/0JgItjQFqI4?aQual … é o tamanho do seu sonho? ACE Tips #3: Tamanho de Mercado,https://twitter.com/samusrt/status/756163605960286210,2016-07-21,13:27:07
755409384226844672,"The ""SAMUEL"" is magic!   alexandremasiero   Tem uns amigos que advinham quando eu estou meio pra…  https://www.instagram.com/p/BIC-Ra0gm0o/ ",https://twitter.com/samusrt/status/755409384226844672,2016-07-19,11:30:06
755408940880527361,"The ""SAMUEL"" is magic!  Tem uns amigos que advinham quando eu estou meio pra baixo e me fazem…  https://www.instagram.com/p/BIC-FBuAA2H/ ",https://twitter.com/samusrt/status/755408940880527361,2016-07-19,11:28:20
748906947622137858,Gostei de um vídeo @YouTube de @desimpedidos  http://youtu.be/34iimFK3V5w?a  ZLATAN DA VIDA REAL - ZLATAN IN REAL LIFE,https://twitter.com/samusrt/status/748906947622137858,2016-07-01,12:51:44
747235259180269568,Saltando obstáculos da vida. #goleiros #goleirodealuguel luvaspoker @ Parque Barigui  https://www.instagram.com/p/BHI5G5qgBc6/ ,https://twitter.com/samusrt/status/747235259180269568,2016-06-26,22:09:03
747044537349083136,Uma cachorra faminta #filabrasileiro  https://www.instagram.com/p/BHHiYeigPbj/ ,https://twitter.com/samusrt/status/747044537349083136,2016-06-26,09:31:11
744973638173069312,Gostei de um vídeo @YouTube  http://youtu.be/BY--nh8vsBE?aAplicativo … Oferece Aluguel de Goleiros para Futebol com os Amigos - Jornal do SBT,https://twitter.com/samusrt/status/744973638173069312,2016-06-20,16:22:10
742053500188827652,Gostei de um vídeo @YouTube  http://youtu.be/Dlp7aGhsSCM?aRenato … Gaúcho e Luiz Andreoli - Dia dos Namorados em 1985.,https://twitter.com/samusrt/status/742053500188827652,2016-06-12,14:58:35
728534283208527872,Gostei de um vídeo @YouTube de @nerdologia  http://youtu.be/rnMYZnY3uLA?a  A Origem da Vida | Nerdologia 132,https://twitter.com/samusrt/status/728534283208527872,2016-05-06,07:38:03
718883741339369472,"Mulheres mudando a minha vida... Uma vida de arquibancada, tive que me render ao futebol…  https://www.instagram.com/p/BD_cVviCqh6/ ",https://twitter.com/samusrt/status/718883741339369472,2016-04-09,16:30:14
718025973111898112,"Oi filha vc tem somente uns 8cm, mas já está causando mudanças enormes em minha vida.  https://www.instagram.com/p/BD5WRa0Cqt9/ ",https://twitter.com/samusrt/status/718025973111898112,2016-04-07,07:41:46
713325049432903680,Gostei de um vídeo @YouTube  http://youtu.be/X6hOiuyAWgM?aR ÉQUIEM PARA UM SONHO: Os Filmes Mais Perturbadores do Planeta #24,https://twitter.com/samusrt/status/713325049432903680,2016-03-25,08:21:59
659320462728495104,Gostei de um vídeo @YouTube de @nerdologia  http://youtu.be/Zd3jWFpw3NE?a  Viagem no tempo | Nerdologia 104,https://twitter.com/samusrt/status/659320462728495104,2015-10-28,08:47:02
657135115357687808,Gostei de um vídeo @YouTube  http://youtu.be/dK-duazvR-0?aDE  VOLTA PARA O FUTURO! - TUDO SOBRE,https://twitter.com/samusrt/status/657135115357687808,2015-10-22,08:03:15
643763680711155712,Gostei de um vídeo @YouTube  http://youtu.be/Rql3bnNe6rk?aPrecisando … de um Goleiro para seu futebol entre amigos?,https://twitter.com/samusrt/status/643763680711155712,2015-09-15,09:29:56
621286892026339328,Gostei de um vídeo @YouTube de @fecastanhari  http://youtu.be/9fdPHKJgD6c?a  13 coisas que farão você se sentir VELHO 2,https://twitter.com/samusrt/status/621286892026339328,2015-07-15,08:55:12
621270325913911296,"Gostei de um vídeo @YouTube  http://youtu.be/1Ngn3fZIK2E?aTi ê ""A Noite"" - Clipe Oficial",https://twitter.com/samusrt/status/621270325913911296,2015-07-15,07:49:22
615307561278009344,"Gostei de um vídeo @YouTube  http://youtu.be/Q_rTbIKqvyQ?aSabia … Não (Que merda, heim) - Samba",https://twitter.com/samusrt/status/615307561278009344,2015-06-28,20:55:29
592731995156959233,Um dia de fúria!?  https://instagram.com/p/1_FKzTiqmj/ ,https://twitter.com/samusrt/status/592731995156959233,2015-04-27,13:48:14
592423088052113409,Feliz dia do Goleiro.  https://instagram.com/p/184sbRiqif/ ,https://twitter.com/samusrt/status/592423088052113409,2015-04-26,17:20:45
586627374558683136,"Ah como é bom ter vc em minha vida... Doce e carinhosa, simplesmente Morgana!  https://instagram.com/p/1TtG9oiqq4/ ",https://twitter.com/samusrt/status/586627374558683136,2015-04-10,17:30:39
586560937634701312,Gostei de um vídeo @YouTube de @desimpedidos  http://youtu.be/g-GtwOYv6Pw?a  CR7 DA VIDA REAL - CR7 IN REAL LIFE,https://twitter.com/samusrt/status/586560937634701312,2015-04-10,13:06:39
586491259591745536,Gostei de um vídeo @YouTube  http://youtu.be/BZLOetNFZ_Q?aThe … Noite (08/04/15) - Entrevista com o canal Desimpedidos,https://twitter.com/samusrt/status/586491259591745536,2015-04-10,08:29:47
584917083915333632,"Gostei de um vídeo @YouTube  http://youtu.be/SrimudpUfE8?a13  fatos bizarros que vão ""bugar"" sua mente",https://twitter.com/samusrt/status/584917083915333632,2015-04-06,00:14:34
583434026951675904,"Gostei de um vídeo @YouTube de @desimpedidos  http://youtu.be/Lv8vhhWKPxE?a  DESIMPEDIDOS NA EUROPA, DIA 6/DIA 7 - CAÇA AO TESOURO E BRASIL",https://twitter.com/samusrt/status/583434026951675904,2015-04-01,22:01:26
582335257061429248,"Gostei de um vídeo @YouTube de @desimpedidos  http://youtu.be/KkL4VB15JZE?a  DESIMPEDIDOS NA EUROPA, DIA 4/DIA 5 - DESINFORMADOS NA RUA E",https://twitter.com/samusrt/status/582335257061429248,2015-03-29,21:15:19
577490602209718272,Meia típica para esse dia chuvoso.  https://instagram.com/p/0SyL6Ciqm_/ ,https://twitter.com/samusrt/status/577490602209718272,2015-03-16,12:24:23
573828035058626561,Gostei de um vídeo @YouTube  http://youtu.be/Cq-Bwm6efsE?aMilion …ário e José Rico - Estrada da Vida - Album Completo,https://twitter.com/samusrt/status/573828035058626561,2015-03-06,09:50:39
565145375062110208,A arte da zueira sempre fez parte da minha vida!  http://instagram.com/p/y7EOhFCqia/ ,https://twitter.com/samusrt/status/565145375062110208,2015-02-10,11:48:51
565098568923361281,Gostei de um vídeo @YouTube de @danilovieiradvc  http://youtu.be/8s6KsM0HfXI?a  TESTANDO A BONDADE DAS PESSOAS,https://twitter.com/samusrt/status/565098568923361281,2015-02-10,08:42:52
562920953731350529,Gostei de um vídeo @YouTube  http://youtu.be/xr_eJkEkJ34?aPrevis …ões De Volta Para o Futuro | NerdOffice S06E04,https://twitter.com/samusrt/status/562920953731350529,2015-02-04,08:29:48
523821532196270081,"Gostei de um vídeo @YouTube  http://youtu.be/zb9_4yRJsvY?aEm  dia de debate, sutileza zero nas ruas de SP",https://twitter.com/samusrt/status/523821532196270081,2014-10-19,11:02:40
415614837847113728,Gabriel Toaldo muito louco off road:  http://youtu.be/PFnDdm8stlE?a  via @YouTube,https://twitter.com/samusrt/status/415614837847113728,2013-12-24,20:47:53
356819766536704001,"Gostei de um vídeo @YouTube  http://youtu.be/lHjcWcSCo1s?aDiogo … Portugal - Stand up ""Dia do Homem""",https://twitter.com/samusrt/status/356819766536704001,2013-07-15,13:57:16
326157135824171009,Gostei de um vídeo @YouTube  http://youtu.be/hDZFUXbzRPM?aUma … Noite Alucinante 2 Filme Completo Dublado (Terror),https://twitter.com/samusrt/status/326157135824171009,2013-04-21,23:14:55
251302948347449344,Bom dia... segui suas dicas para RAID 1 e a instalação ocorreu perfeitamente. O RAID 1 (@YouTube  http://youtu.be/mcAPdgrLOOo?a ),https://twitter.com/samusrt/status/251302948347449344,2012-09-27,09:51:06
251302006273228801,Bom dia... segui suas dicas para RAID 1 e a instalação ocorreu perfeitamente. O RAID 1 (@YouTube  http://youtu.be/X9VW6UEkWOs?a ),https://twitter.com/samusrt/status/251302006273228801,2012-09-27,09:47:21
215809866760069120,@papodecraquecw Bom dia... O presidente Vilson poderia responder como anda o contrato com a comissão técnica?,https://twitter.com/samusrt/status/215809866760069120,2012-06-21,11:14:16
188686340643233793,I liked a @YouTube video  http://youtu.be/DjipwSQheNc?a  Marcelinho lendo contos eróticos 2 - Experiência bizarra maravi,https://twitter.com/samusrt/status/188686340643233793,2012-04-07,14:55:03
124586815696015360,"Cara, que foda o final do vídeo que o Vader fica olhando para o cara em silêncio(@YouTube  http://youtu.be/0oH7tRN_0sc?a )",https://twitter.com/samusrt/status/124586815696015360,2011-10-13,17:46:26
123507718005854208,@TEsportes a loja q mais agita o dia da criança é Ghi-Ghi brinquedos,https://twitter.com/samusrt/status/123507718005854208,2011-10-10,18:18:29
115777667487383552,"@rafaelportocwb Empates: Bom para o Coritiba, Normal para o Paraná, Ruim para o Cap",https://twitter.com/samusrt/status/115777667487383552,2011-09-19,10:22:01
108219279484256256,O final com a galera rodando é foda... hahaha (@YouTube  http://youtu.be/3HidG9MBQC8?a ),https://twitter.com/samusrt/status/108219279484256256,2011-08-29,13:47:41
103495236470317056,"Isso, isso, isso... coisa boa da vida é assistir Chaves!(@YouTube  http://youtu.be/W_rlwKoXpCo?a )",https://twitter.com/samusrt/status/103495236470317056,2011-08-16,12:56:01
100164401084116992,"Dia lindo, daq a pouco futebol com os amigos",https://twitter.com/samusrt/status/100164401084116992,2011-08-07,08:20:28
93751284087259136,"E não paramos de trabalhar nem quando estamos dormindo, nesta noite sonhei com soluções para alguns problemas... hahahaha",https://twitter.com/samusrt/status/93751284087259136,2011-07-20,15:37:02
78475131344789507,"Que agonia para a hora do jogo, bem que @papodecraquecw  poderia durar o dia inteiro...",https://twitter.com/samusrt/status/78475131344789507,2011-06-08,11:55:03
78466423290208256,"@jairosilvajr @papodecraquecw Que dia lindo está em Curitiba hj, sol, aquele friozinho... to sentindo que vamos ser campeões!",https://twitter.com/samusrt/status/78466423290208256,2011-06-08,11:20:27
