id,tweet,link,date,time
1143044143360462854,"Mete uma stream explicativa de TFT rakin vai ser top, coisas de posicionamento e tals",https://twitter.com/UmSerAiQualquer/status/1143044143360462854,2019-06-24,03:32:15
1142885414476439556,É triste pq a gente qeria ter também kk,https://twitter.com/UmSerAiQualquer/status/1142885414476439556,2019-06-23,17:01:31
1141034673994440706,"Autoestima, ele sempre quis ter barbao, só q não tinha folículos na região, aí tirou da cabeça pra por na região da barba e gg",https://twitter.com/UmSerAiQualquer/status/1141034673994440706,2019-06-18,14:27:20
1141033433650610181,"Galera diz que gosta do Damiani mas só vejo zoarem e falar mal, tá cicatrizando ainda bando de chimpanzé é óbvio que não está do jeito ideal ainda, quando cicatrizar Damiani vai parecer o Thor gordo em ultimato com um barbao insano",https://twitter.com/UmSerAiQualquer/status/1141033433650610181,2019-06-18,14:22:24
1139916404415770624,"É só um dedo a mais, n atrapalha em nada na vida de ngn",https://twitter.com/UmSerAiQualquer/status/1139916404415770624,2019-06-15,12:23:44
1137048919957999616,"Cômica no sentido de ser ""ridícula"", não que o anime seja, mas a cena em si, o anime é maravilhoso tenho até tatuagem, mas a cena é cômica",https://twitter.com/UmSerAiQualquer/status/1137048919957999616,2019-06-07,14:29:22
1136866440932483072,"E no fim é até um pouco cômica, pq era bem óbvio oq ele tinha feito e faria dnv, é q nego no mundo dos animes é tudo burro",https://twitter.com/UmSerAiQualquer/status/1136866440932483072,2019-06-07,02:24:16
1136742604584968193,SHOT COM REVOLTA E TOCKERS PELO AMOR,https://twitter.com/UmSerAiQualquer/status/1136742604584968193,2019-06-06,18:12:11
1134817945778081792,"Pior que não errou, maioria dos jogos do Fla o xurimpe dava vantagem pro tt, se anularem o xurimpe é praticamente 3x2 na bot Lane toda hora",https://twitter.com/UmSerAiQualquer/status/1134817945778081792,2019-06-01,10:44:16
1134550559657213952,"Eu não consigo acreditar que existem pessoas que realmente seguem oq esse @opropriolavo fala, pelo amor de Deus, nunca vi tão burro.",https://twitter.com/UmSerAiQualquer/status/1134550559657213952,2019-05-31,17:01:47
1134536083478331393,"Concordo, mas a palavra mérito passa longe do nosso cenário desde a época da INTZ, oq é triste pq tavam vindo na crescente, Kabum 2014, pain 2015, intz 2016 só melhora, pra chegar 3 anos dps e ficar pior doq tava antes :/",https://twitter.com/UmSerAiQualquer/status/1134536083478331393,2019-05-31,16:04:15
1131397209684140032,"A atualização é meme, porém as pessoas levam um livro de 2000 anos atrás como verdade, sendo que, a bíblia original tá no Vaticano escrita em hebraico antigo, que não tem ninguém vivo q saiba traduzir, e fora que se tiver a igreja também não qer traduzir porque vai revelar a [1]",https://twitter.com/UmSerAiQualquer/status/1131397209684140032,2019-05-23,00:11:29
1130023701712429057,Eu tô com tanto sono que a toalha atrás eu jurava que era algum tipo de asa ahsahha,https://twitter.com/UmSerAiQualquer/status/1130023701712429057,2019-05-19,05:13:39
1129594774816792577,"A campeã só vai prestar no competitivo, tipo Aurelion sol, e ainda assim vao ter coisas melhores",https://twitter.com/UmSerAiQualquer/status/1129594774816792577,2019-05-18,00:49:15
1127824094605598720,"Cara, é uma shotgun, é pra matar insta na cabeça sim, isso é choro de quem não tem mira suficiente pra fazer o mesmo, não é justo cm quem joga bem transformar o troço em um lixo pra quem joga mal se sentir menos lixo",https://twitter.com/UmSerAiQualquer/status/1127824094605598720,2019-05-13,03:33:12
1127807391972700160,"Cara, é uma fodendo shotgun, um tiro na cabeça é pra dar insta kill sim wtfff",https://twitter.com/UmSerAiQualquer/status/1127807391972700160,2019-05-13,02:26:50
1127322950141718528,"Pede pro HW castar caju, só cuidado q pode ser meteor storm ou lord of vermillion",https://twitter.com/UmSerAiQualquer/status/1127322950141718528,2019-05-11,18:21:50
1126315793384394752,"É maravilhoso, mas dá uma estranhada ao andar kkkk",https://twitter.com/UmSerAiQualquer/status/1126315793384394752,2019-05-08,23:39:45
1126267531310792710,"Eu comprei uma jogger nesse estilo, só que é muito fina e fica estranho usar ela, parece que tô usando pijama kkkk",https://twitter.com/UmSerAiQualquer/status/1126267531310792710,2019-05-08,20:27:59
1126253881007255553,Fora que é uma ponte de acesso pra pessoas que não tiveram acesso ao estudo e são analfabetas.,https://twitter.com/UmSerAiQualquer/status/1126253881007255553,2019-05-08,19:33:44
1123391541513474050,Que horas shield hero vai estar up amanhã? ;-;,https://twitter.com/UmSerAiQualquer/status/1123391541513474050,2019-04-30,21:59:49
1122313207731970048,Vai chorar pacaralho,https://twitter.com/UmSerAiQualquer/status/1122313207731970048,2019-04-27,22:34:54
1121513224510242828,"Caju, uma dica pro microfone, usa um braço articulável e coloca em cima de vcs, capta o som melhor e vocês ficam livres pra poder se mexer e tals sem prejudicar o áudio",https://twitter.com/UmSerAiQualquer/status/1121513224510242828,2019-04-25,17:36:04
1121367274001260545,Cuidado com os 4head no chat q vao dar spoiler de vingadores ultimato,https://twitter.com/UmSerAiQualquer/status/1121367274001260545,2019-04-25,07:56:06
1111504558432362497,"Ah sim, é q eu já vi o pulga em live falando q se tivesse um 240hz ele tinha acertado ou coisas do tipo",https://twitter.com/UmSerAiQualquer/status/1111504558432362497,2019-03-29,02:45:12
1111500787094556672,"Coe pra QM manja mais dessas parada de monitor e tals, tem diferença um 144hz pra uma 240hz, NA QUESTÃO DA MIRA E DE FICAR MAIS FACIL PRA ACERTAR OS TIROS?",https://twitter.com/UmSerAiQualquer/status/1111500787094556672,2019-03-29,02:30:12
1111436726851887109,"O problema de estabilidade é q ele não parava na mão dos players, de tão lixo q era",https://twitter.com/UmSerAiQualquer/status/1111436726851887109,2019-03-28,22:15:39
1110933049741623298,"Então né... Ele é da Malásia, q é do outro lado do mundo",https://twitter.com/UmSerAiQualquer/status/1110933049741623298,2019-03-27,12:54:13
1108152129691238400,"Isso é menosprezar todo teu trabalho duro, suor e lágrimas, essa gente não tem noção wtf",https://twitter.com/UmSerAiQualquer/status/1108152129691238400,2019-03-19,20:43:50
1106599515174432768,"Coe rakin faz amanhã, hj é trotos ;-;",https://twitter.com/UmSerAiQualquer/status/1106599515174432768,2019-03-15,13:54:18
1106518781646569473,"Acho q é melhor de tank doq de rengar, q leu as skills na hora do campeonato",https://twitter.com/UmSerAiQualquer/status/1106518781646569473,2019-03-15,08:33:30
1105556532178182144,"Mas tipo, ele pickava nunu quando caia Sup, deixava o adc solo, e saia invadindo a JG inimiga, e o JG inimigo ficava lvl 7 aos 20 min de jogo, Full atrás sem Farm, e o teu time tinha 2 JG e gankavam o adc, só q ele tomava Full pressão (em resumo)",https://twitter.com/UmSerAiQualquer/status/1105556532178182144,2019-03-12,16:49:52
1105495263848861696,"""Stream amanhã ao meio dia sem kappa"" Papão PATO, 11 de março de 2019",https://twitter.com/UmSerAiQualquer/status/1105495263848861696,2019-03-12,12:46:24
1103414125768650753,"Chegar em casa e passar raiva com o lol e dizer que nunca mais vou jogar essa merda de jogo, e repetir o mesmo amanhã",https://twitter.com/UmSerAiQualquer/status/1103414125768650753,2019-03-06,18:56:42
1100188110170869762,"Nem foi um goleiro q ela deve se lembrar muito bem de um time aí q esquartejou uma mulher e dps deu pros cachorros comerem... Isso aconteceu no lol, nem foi o tal goleiro né @marionkaplan ?",https://twitter.com/UmSerAiQualquer/status/1100188110170869762,2019-02-25,21:17:40
1099175597480267776,"Obrigadoo kk, foi mais por precaução pq sintoma ou coisa do tipo n tinha, mas ocorreu tudo bem e tamo aí né kkk",https://twitter.com/UmSerAiQualquer/status/1099175597480267776,2019-02-23,02:14:18
1098032865365970945,"Acompanhamento com psicólogo, remédios, e claro o mais importante é tu querer melhorar também (sei que não e fácil), mas isso de forma BEEEEEEM resumida, tem mais coisas tbm mas no básico é isso",https://twitter.com/UmSerAiQualquer/status/1098032865365970945,2019-02-19,22:33:30
1098032595428954112,"Sim mano, e eu tava com visita em casa ainda, acordei todo mundo AHAHAUHAUA",https://twitter.com/UmSerAiQualquer/status/1098032595428954112,2019-02-19,22:32:25
1097243159275417601,"Sim, é só os retardados querendo pagar de engraçado",https://twitter.com/UmSerAiQualquer/status/1097243159275417601,2019-02-17,18:15:29
1096409817936220161,A parte mais engraçada de tudo isso é que ele pagou uma matéria do @TheInterceptBr e usou como fonte de verdade AHSHAHHDHAHSHAAHDBSH,https://twitter.com/UmSerAiQualquer/status/1096409817936220161,2019-02-15,12:04:05
1095651807693545475,"Falar sobre a velocidade não é racismo, racista é a pessoa que associou arrastão com afrodescendente",https://twitter.com/UmSerAiQualquer/status/1095651807693545475,2019-02-13,09:52:01
1095646399272759296,"Mas não foi exatamente isso que ele fez com o @cocielo ? Usou prints de tweets antigos e apontou o dedo, mas qdo fizeram o mesmo com ele, ele só falou que as pessoas mudam e todo mundo passou o pano",https://twitter.com/UmSerAiQualquer/status/1095646399272759296,2019-02-13,09:30:32
1093925969621143553,"""Amor que horas tu termina de dar aula de defesa pessoal hj?""",https://twitter.com/UmSerAiQualquer/status/1093925969621143553,2019-02-08,15:34:09
1093617351172505600,"Interessante, mas não vejo a hora do meme ""Para de criar skin pra lux e arruma o client"" morrer",https://twitter.com/UmSerAiQualquer/status/1093617351172505600,2019-02-07,19:07:49
1093128571223265280,"Eu sei, tu q não soube falar algo conexo, tu tá julgando um velho de 72 anos, q não fez nd por apenas achismo, de ""medo""",https://twitter.com/UmSerAiQualquer/status/1093128571223265280,2019-02-06,10:45:35
1092795545599569922,"O que mais me surpreende nisso, são veterinários confundirem uma ratazana com um cachorro, TIPO?????????  https://twitter.com/rafapsoares/status/1092745024671047680 …",https://twitter.com/UmSerAiQualquer/status/1092795545599569922,2019-02-05,12:42:15
1084494354968989698,"Vale lembrar que a vingança do término no natal, somou +4 anos de noivado, casamento da mãe e do pai só em 2023",https://twitter.com/UmSerAiQualquer/status/1084494354968989698,2019-01-13,14:56:17
1083071377660354561,"Perfeito é pouco, esse nível de realismo nem Manet e Rousseau atingem",https://twitter.com/UmSerAiQualquer/status/1083071377660354561,2019-01-09,16:41:53
1082630953686712326,"Esse cara é o típico maluco q tem a fala ""bonita"" q faz parecer q é verdade",https://twitter.com/UmSerAiQualquer/status/1082630953686712326,2019-01-08,11:31:48
1082091063660216320,Teu dedo vai gangrenar e cair,https://twitter.com/UmSerAiQualquer/status/1082091063660216320,2019-01-06,23:46:28
1081678183106252801,"Entao foram 6x, é tão estranho qdo tu para pensar nos privilégios q tem (digo isso por mim) pq é algo que já tá tão na rotina é estranho kk",https://twitter.com/UmSerAiQualquer/status/1081678183106252801,2019-01-05,20:25:50
1081675449414180864,"Seria tipo, nasci homem e me identifico como homem?",https://twitter.com/UmSerAiQualquer/status/1081675449414180864,2019-01-05,20:14:58
1080717580799758336,Ele é tão inseguro q tá com a foto do The rock (tdbmm q n posso falar mto pq a minha é do InuYasha mas...),https://twitter.com/UmSerAiQualquer/status/1080717580799758336,2019-01-03,04:48:44
1080715826804736000,"Moça, tu chegou a ler sobre a metade das coisas que tu escreveu? Ele NÃO removeu os Lgbtq+ dos direitos humanos, ele só modificou pra q sejam englobados como ""HUMANOS"" e não denominados por uma única sigla, e sobre o salário mínimo, se pesquisar bem, vai ver que isso foi (cont)",https://twitter.com/UmSerAiQualquer/status/1080715826804736000,2019-01-03,04:41:46
1080574459424190465,Triste n ser de SP ;-;,https://twitter.com/UmSerAiQualquer/status/1080574459424190465,2019-01-02,19:20:01
1080555596175327232,É tipo skt de 2015 versão 2.0,https://twitter.com/UmSerAiQualquer/status/1080555596175327232,2019-01-02,18:05:04
1080552558949814272,"E meio q n tem itemizacao e os krl a 4 tbm né? Isso deixa o troço mais chato pq tu não sente q tá mais forte, o pouco que conheço do game foi oq vi nos vídeos do pato e sempre achei meio sem graça o jogo",https://twitter.com/UmSerAiQualquer/status/1080552558949814272,2019-01-02,17:53:00
1077738040326586369,Eu tinha medo de ir falar contigo no privado andjsbdjs,https://twitter.com/UmSerAiQualquer/status/1077738040326586369,2018-12-25,23:29:06
1077737369829285888,Ano 2015/2016 todo mundo tinha medo da Flávia pq ela tretava com todo mundo do twitter,https://twitter.com/UmSerAiQualquer/status/1077737369829285888,2018-12-25,23:26:27
1077389766612713472,"Cuidado kami, n vai bater de cabeça no vídeo dnv ein",https://twitter.com/UmSerAiQualquer/status/1077389766612713472,2018-12-25,00:25:11
1076278142669606912,"Ameaçar a família do cara de morte, coisas bobas",https://twitter.com/UmSerAiQualquer/status/1076278142669606912,2018-12-21,22:48:00
1075293565134270465,"Todo mundo quer saber quem o blender é porém só precisamos descobrir com o @macgyverrr_ é, eles são a mesma pessoa",https://twitter.com/UmSerAiQualquer/status/1075293565134270465,2018-12-19,05:35:38
1074908579189190656,"Minha tl n tem essas coisas, aff",https://twitter.com/UmSerAiQualquer/status/1074908579189190656,2018-12-18,04:05:50
1074122325358993409,"Queria falar, mas no momento não posso",https://twitter.com/UmSerAiQualquer/status/1074122325358993409,2018-12-16,00:01:33
1073959842476363781,"""Se vierem falar cmg é mantalking""",https://twitter.com/UmSerAiQualquer/status/1073959842476363781,2018-12-15,13:15:54
1073819570295705600,"N esquece de 2 minutos dps de terminar um vídeo/animação, tem q começar o próximo ;-;",https://twitter.com/UmSerAiQualquer/status/1073819570295705600,2018-12-15,03:58:30
1073630703898759173,"Aí chega na casa da namorada, primeira coisa q ela fala ""Amor, vamos duo bot?""",https://twitter.com/UmSerAiQualquer/status/1073630703898759173,2018-12-14,15:28:01
1073104974509424640,"Nunca ganhou um ouro olímpico, nunca fez gol numa copa do mundo, n sei qm é  https://twitter.com/Rachsfalcao/status/1071851272305807360 …",https://twitter.com/UmSerAiQualquer/status/1073104974509424640,2018-12-13,04:38:57
1071456693643546625,Cblol vai começar as 13h e acabar as 11h da manhã do outro dia :v,https://twitter.com/UmSerAiQualquer/status/1071456693643546625,2018-12-08,15:29:17
1070021347613519872,"Times cm 6 mew2 de 4k de CP, são as únicas coisas que vai ter no pvp",https://twitter.com/UmSerAiQualquer/status/1070021347613519872,2018-12-04,16:25:43
1069710055275147264,Q triste isso :/,https://twitter.com/UmSerAiQualquer/status/1069710055275147264,2018-12-03,19:48:46
1069452333120135169,"Mas começar na mesa direto é prejudicial ou é algo ""menos bom""?",https://twitter.com/UmSerAiQualquer/status/1069452333120135169,2018-12-03,02:44:40
1069448683156992002,"E pra qm n tem nenhuma noção de desenho, compensa começar direto na mesa?",https://twitter.com/UmSerAiQualquer/status/1069448683156992002,2018-12-03,02:30:10
1069099865425289216,"Tomar banho junto é desesperador na hora de lavar o cu, é uma parada mto íntima pra se fazer na frente de alguém",https://twitter.com/UmSerAiQualquer/status/1069099865425289216,2018-12-02,03:24:05
1068838768742932480,O Zeva é muito feliz aushaudha,https://twitter.com/UmSerAiQualquer/status/1068838768742932480,2018-12-01,10:06:35
1068838281834573824,"Pra qm qer ter uma vibe mto maior, assistam de ponta cabeça",https://twitter.com/UmSerAiQualquer/status/1068838281834573824,2018-12-01,10:04:39
1068592121668673537,"Eu entendo vcs, mas é como eu disse, é a minha visão de mundo, sei q ela não é lei pra todo mundo, e espero de vdd q tu melhore Valerie ^-^",https://twitter.com/UmSerAiQualquer/status/1068592121668673537,2018-11-30,17:46:29
1068054217699528709,"Aquela foto dela com um olho aberto e outro fechado, ela parecia uma senhora de idade tentando ser jovem",https://twitter.com/UmSerAiQualquer/status/1068054217699528709,2018-11-29,06:09:03
1067793905926766592,"É tipo imaginar o Leon e a Nilce, não tem como não",https://twitter.com/UmSerAiQualquer/status/1067793905926766592,2018-11-28,12:54:40
1067769050896523264,"""Toma os 2k aí linda, pra comprar a cadeira rs"" 1 semana dps tava na Disney aushsuh",https://twitter.com/UmSerAiQualquer/status/1067769050896523264,2018-11-28,11:15:54
1067762650443075584,"""Comprar"" a cadeira gamer, meteu os 2k no bolso e foi pra Disney (literalmente(",https://twitter.com/UmSerAiQualquer/status/1067762650443075584,2018-11-28,10:50:28
1066066864491692032,Suspeitas q todo mundo já sabia,https://twitter.com/UmSerAiQualquer/status/1066066864491692032,2018-11-23,18:32:01
1064586623030042624,Cada chute é uma dor no coração diferente,https://twitter.com/UmSerAiQualquer/status/1064586623030042624,2018-11-19,16:30:04
1064346649248575488,#apoieoinsider finalmente lembrei de renovar dps de comprar 4 coisas sem renovar ;-;  pic.twitter.com/HFNyCqQszk,https://twitter.com/UmSerAiQualquer/status/1064346649248575488,2018-11-19,00:36:30
1064292330436534273,"E ainda vem uns fdpta me falar que bandido é uma vítima, vai tomar no cu os maluco mataram a velha por causa de TRINTA REAIS, bandido bom é sim bandido morto  https://twitter.com/g1/status/1064259118230355976 …",https://twitter.com/UmSerAiQualquer/status/1064292330436534273,2018-11-18,21:00:39
1063309257272147968,"Bronze só tem parceria, tu fala algo no chat tem nego pra conversar junto e falar merda, nos elos mais altos ngn fala nd é mó chato",https://twitter.com/UmSerAiQualquer/status/1063309257272147968,2018-11-16,03:54:16
1063303198121910272,"N dá pra jogar em nenhum mapa praticamente tá horrível, parece que tu tá jogando um slide do salve o mundo",https://twitter.com/UmSerAiQualquer/status/1063303198121910272,2018-11-16,03:30:12
1063298251636527104,"Eu curtia toque ígneo no Darius, era mto Op ainda mais se tu fosse de ignite, era tipo 3 ignite no cara, a passiva + o toque ígneo + o ignite",https://twitter.com/UmSerAiQualquer/status/1063298251636527104,2018-11-16,03:10:32
1063296816639287297,"Saudades qndo ryze era tipo ryze, Agra só espalha pros q estão na volta e não mais pra wave toda ;---;",https://twitter.com/UmSerAiQualquer/status/1063296816639287297,2018-11-16,03:04:50
1063192319736913920,A escrita da frase no latim é Omni Vincit Amor aí usei um dos tradutores em Quenya (língua dos elfos) criados por Tolkien,https://twitter.com/UmSerAiQualquer/status/1063192319736913920,2018-11-15,20:09:36
1063191504569712641,"Foi a minha primeira tattoo e a q eu mais gosto pelo significado ""o amor vence tudo""",https://twitter.com/UmSerAiQualquer/status/1063191504569712641,2018-11-15,20:06:22
1063101942291988480,Minha primeira frase depois do sexo seria engraçado que eu nunca tinha visto o e-mail que você me avisa qndo vc pode me enviar o comprovante do depósito para o conteúdo da mensagem encaminhada de comando e controle de qualidade e a queda de cabelo Sephora,https://twitter.com/UmSerAiQualquer/status/1063101942291988480,2018-11-15,14:10:29
1062369123303350279,"Sim, tipo, se o cara tem 3 contas lá enqnto ele foca em 1 tem 2 paradas prontas para serem superadas, se o player n consegue ganhar de 2 contas ""afk"" ele n merece o lugar no top do lol",https://twitter.com/UmSerAiQualquer/status/1062369123303350279,2018-11-13,13:38:31
1061059803357814787,Se falar q não é o melhor presidente mentiu  https://twitter.com/elCABRIELinHELL/status/1061058906615619589 …,https://twitter.com/UmSerAiQualquer/status/1061059803357814787,2018-11-09,22:55:45
1060185710441971713,"Eu jogo em média 1h/1h30 de salve o mundo e dá pra pegar um pouco, no início chega a pegar 3k em 1 semana +/-",https://twitter.com/UmSerAiQualquer/status/1060185710441971713,2018-11-07,13:02:25
1060171783687540737,Por isso que compensa comprar o salve o mundo 100 conto = Farm de vbucks,https://twitter.com/UmSerAiQualquer/status/1060171783687540737,2018-11-07,12:07:04
1056662373023580160,Esperando o @JornalOGlobo falar q foi eleitor do Bolsonaro q fez ela ter um enfarte,https://twitter.com/UmSerAiQualquer/status/1056662373023580160,2018-10-28,18:41:56
1049552622653530112,Mas pro pt e companhia a Venezuela não vive em ditadura e o país é o melhor do mundo KKKKKK,https://twitter.com/UmSerAiQualquer/status/1049552622653530112,2018-10-09,03:50:19
1049374219543490560,Entrega em 5 minutos no mundo todo,https://twitter.com/UmSerAiQualquer/status/1049374219543490560,2018-10-08,16:01:25
1047159491672854529,O pesadelo do Brasil é falar igual paulista,https://twitter.com/UmSerAiQualquer/status/1047159491672854529,2018-10-02,13:20:52
1044623289338007552,Diretamente do salve o mundo pro battle Royale '-,https://twitter.com/UmSerAiQualquer/status/1044623289338007552,2018-09-25,13:22:54
1044100451858370560,"Tudo isso pq uns noobs ficavam chorando por tomar 100+ de dano sendo q tipo É UMA FODENDO SHOTGUN é óbvio q teria q dar 100+ de dano, se for HS então é pra ser IK",https://twitter.com/UmSerAiQualquer/status/1044100451858370560,2018-09-24,02:45:20
1044099171354124288,Ainda mais de um mono Braum tipo eu kkk,https://twitter.com/UmSerAiQualquer/status/1044099171354124288,2018-09-24,02:40:15
1041165383347122177,Será q vai vazar + cupons de desconto hj? Se for tem q ser rápido antes q as coisas daqui da cidade fechem,https://twitter.com/UmSerAiQualquer/status/1041165383347122177,2018-09-16,00:22:25
1038871098102894593,"Q ódio do fdpta q fez isso com esse doguinho fofo, se eu fosse de sp eu adotava pra mim",https://twitter.com/UmSerAiQualquer/status/1038871098102894593,2018-09-09,16:25:45
1037071359459905542,"Se eu to triste com a escolha do Henry Cavil como geralt? Eu to pacaralho, NUNCA nem em 1 milhao de anos q ele seria capaz de fazer o geralt, num mundo com Mads Mikkelsen, Zach McGowan colocam 1 personagem q nao tem NADA a ver com geralt, um dia triste pros fãs de witcher",https://twitter.com/UmSerAiQualquer/status/1037071359459905542,2018-09-04,17:14:14
1036334363200430080,"Pra qm gosta de qalqer pessoa/streamer e vê esse tipo de comentário qndo elas postam fotos, façam isso, denunciem os comentários dos retardados q ficam falando merda, n sou mulher mas consigo imaginar o quão horrível deve ser ler esse tipo de coisa :/  pic.twitter.com/ViFylKSzvd",https://twitter.com/UmSerAiQualquer/status/1036334363200430080,2018-09-02,16:25:41
1028706551253676033,"Qer jogar Fortnite no Android? Compra um celular bom, ao invés de comprar qalqer porcaria q é barato, o jogo é pesado, se tu tem 2gb de ram tu mal vai conseguir rodar csr/Asphalt qm dira Fortnite, para de chorar",https://twitter.com/UmSerAiQualquer/status/1028706551253676033,2018-08-12,15:15:28
1024183112237047808,"Ele tinha jogado until dawn mas no final foi igual ao patrick do bob sponja ""E todo mundo morreu""",https://twitter.com/UmSerAiQualquer/status/1024183112237047808,2018-07-31,03:40:57
1024084081892569091,Até q dia vão ir às lhamas de aniversário no salve o mundo?,https://twitter.com/UmSerAiQualquer/status/1024084081892569091,2018-07-30,21:07:26
1021741540543221761,"Na vdd nunca foi dito q ia sair em X data pra Android, e provavelmente q só saia quando tiver 1 ano de battle Royale em setembro por aí (o evento de aniversário q tá tendo é por causa do lançamento do salve o mundo)",https://twitter.com/UmSerAiQualquer/status/1021741540543221761,2018-07-24,09:59:00
1019506588435075072,"Sim, salve o mundo, são alertas de missões q dão recompensas extras, porém antes eram 10 eles diminuiram pra 3 e ainda diminuíram a chance de aparição de vbucks nas missões de alerta",https://twitter.com/UmSerAiQualquer/status/1019506588435075072,2018-07-18,05:58:06
1018981861325004800,Modo normal dói muito o olho tem como nn,https://twitter.com/UmSerAiQualquer/status/1018981861325004800,2018-07-16,19:13:02
1018923395126321153,"Droga, me enquadro em 5 das coisas ao msm tempo ;-;",https://twitter.com/UmSerAiQualquer/status/1018923395126321153,2018-07-16,15:20:42
1018621194545844226,Eu qeria mto ter a paciência do Leon pra aturar gente ignorante na internet pelo amor de Deus... Parece q o pessoal fez cursinho pra passar vergonha,https://twitter.com/UmSerAiQualquer/status/1018621194545844226,2018-07-15,19:19:52
1018620355668258817,E ainda mais quando o Leon já deu o posicionamento político dele q é centro-direita ahhssushsu ela tá tão doida q qer falar q é esquerda pq n tem argumento q preste,https://twitter.com/UmSerAiQualquer/status/1018620355668258817,2018-07-15,19:16:32
1018534664347275266,"Heitir, eu sei q tu tem a asa delta do salve o mundo, tu joga bastante? Já pensou em fazer live?",https://twitter.com/UmSerAiQualquer/status/1018534664347275266,2018-07-15,13:36:02
1017920391057207297,Imagina q droga estudar 4 anos de jornalismo numa faculdade pra ter q virar stalker do Lula e ver qm curte as coisas dele auahuaha,https://twitter.com/UmSerAiQualquer/status/1017920391057207297,2018-07-13,20:55:07
1017494974462611456,"Sim sim, mas também tem aqele fator de q tudo pode acontecer, seria incrível ver eles trazendo o TI8 pro Brasil",https://twitter.com/UmSerAiQualquer/status/1017494974462611456,2018-07-12,16:44:40
1017494411196977153,"Já quero mesmo sem o sorriso, imagina com",https://twitter.com/UmSerAiQualquer/status/1017494411196977153,2018-07-12,16:42:26
1016477563882016769,Colocou quais coisas pra vir?,https://twitter.com/UmSerAiQualquer/status/1016477563882016769,2018-07-09,21:21:51
